A1: INSTANCES | D1: PREV. RESULTS | G1: MCS SEARCH | K1: NEW RESULTS
D2: LB | E2: UB | F2: OPT | G2: LB | H2: UB | I2: IMP | J2: NCL | K2: LB | L2: UB | M2: OPT
A3: 120 | B3: 1 | C3: 1 | D3: 101 | E3: 105 | F3: =IF(D3=E3,"*","") ->  | G3: 103 | I3: =IF(G3>D3,"*","") -> * | J3: =IF(AND(F3="",G3=MIN(E3,H3)),"*","") ->  | K3: =MAX(D3,G3) -> 103 | L3: =MIN(E3,H3) -> 105 | M3: =IF(K3=L3,"*","") -> 
A4: 120 | B4: 1 | C4: 2 | D4: 106 | E4: 110 | F4: =IF(D4=E4,"*","") ->  | G4: 109 | H4: 109 | I4: =IF(G4>D4,"*","") -> * | J4: =IF(AND(F4="",G4=MIN(E4,H4)),"*","") -> * | K4: =MAX(D4,G4) -> 109 | L4: =MIN(E4,H4) -> 109 | M4: =IF(K4=L4,"*","") -> *
A5: 120 | B5: 1 | C5: 3 | D5: 122 | E5: 125 | F5: =IF(D5=E5,"*","") ->  | G5: 119 | I5: =IF(G5>D5,"*","") ->  | J5: =IF(AND(F5="",G5=MIN(E5,H5)),"*","") ->  | K5: =MAX(D5,G5) -> 122 | L5: =MIN(E5,H5) -> 125 | M5: =IF(K5=L5,"*","") -> 
A6: 120 | B6: 1 | C6: 4 | D6: 97 | E6: 97 | F6: =IF(D6=E6,"*","") -> * | G6: 92 | I6: =IF(G6>D6,"*","") ->  | J6: =IF(AND(F6="",G6=MIN(E6,H6)),"*","") ->  | K6: =MAX(D6,G6) -> 97 | L6: =MIN(E6,H6) -> 97 | M6: =IF(K6=L6,"*","") -> *
A7: 120 | B7: 1 | C7: 5 | D7: 108 | E7: 112 | F7: =IF(D7=E7,"*","") ->  | G7: 111 | I7: =IF(G7>D7,"*","") -> * | J7: =IF(AND(F7="",G7=MIN(E7,H7)),"*","") ->  | K7: =MAX(D7,G7) -> 111 | L7: =MIN(E7,H7) -> 112 | M7: =IF(K7=L7,"*","") -> 
A8: 120 | B8: 1 | C8: 6 | D8: 84 | E8: 84 | F8: =IF(D8=E8,"*","") -> * | G8: 84 | H8: 84 | I8: =IF(G8>D8,"*","") ->  | J8: =IF(AND(F8="",G8=MIN(E8,H8)),"*","") ->  | K8: =MAX(D8,G8) -> 84 | L8: =MIN(E8,H8) -> 84 | M8: =IF(K8=L8,"*","") -> *
A9: 120 | B9: 1 | C9: 7 | D9: 109 | E9: 117 | F9: =IF(D9=E9,"*","") ->  | G9: 117 | H9: 117 | I9: =IF(G9>D9,"*","") -> * | J9: =IF(AND(F9="",G9=MIN(E9,H9)),"*","") -> * | K9: =MAX(D9,G9) -> 117 | L9: =MIN(E9,H9) -> 117 | M9: =IF(K9=L9,"*","") -> *
A10: 120 | B10: 1 | C10: 8 | D10: 108 | E10: 109 | F10: =IF(D10=E10,"*","") ->  | G10: 105 | I10: =IF(G10>D10,"*","") ->  | J10: =IF(AND(F10="",G10=MIN(E10,H10)),"*","") ->  | K10: =MAX(D10,G10) -> 108 | L10: =MIN(E10,H10) -> 109 | M10: =IF(K10=L10,"*","") -> 
A11: 120 | B11: 1 | C11: 9 | D11: 109 | E11: 112 | F11: =IF(D11=E11,"*","") ->  | G11: 112 | H11: 112 | I11: =IF(G11>D11,"*","") -> * | J11: =IF(AND(F11="",G11=MIN(E11,H11)),"*","") -> * | K11: =MAX(D11,G11) -> 112 | L11: =MIN(E11,H11) -> 112 | M11: =IF(K11=L11,"*","") -> *
A12: 120 | B12: 1 | C12: 10 | D12: 102 | E12: 108 | F12: =IF(D12=E12,"*","") ->  | G12: 107 | I12: =IF(G12>D12,"*","") -> * | J12: =IF(AND(F12="",G12=MIN(E12,H12)),"*","") ->  | K12: =MAX(D12,G12) -> 107 | L12: =MIN(E12,H12) -> 108 | M12: =IF(K12=L12,"*","") -> 
A13: 120 | B13: 2 | C13: 1 | D13: 86 | E13: 87 | F13: =IF(D13=E13,"*","") ->  | G13: 87 | H13: 87 | I13: =IF(G13>D13,"*","") -> * | J13: =IF(AND(F13="",G13=MIN(E13,H13)),"*","") -> * | K13: =MAX(D13,G13) -> 87 | L13: =MIN(E13,H13) -> 87 | M13: =IF(K13=L13,"*","") -> *
A14: 120 | B14: 2 | C14: 2 | D14: 73 | E14: 75 | F14: =IF(D14=E14,"*","") ->  | G14: 74 | I14: =IF(G14>D14,"*","") -> * | J14: =IF(AND(F14="",G14=MIN(E14,H14)),"*","") ->  | K14: =MAX(D14,G14) -> 74 | L14: =MIN(E14,H14) -> 75 | M14: =IF(K14=L14,"*","") -> 
A15: 120 | B15: 2 | C15: 3 | D15: 90 | E15: 92 | F15: =IF(D15=E15,"*","") ->  | G15: 92 | H15: 92 | I15: =IF(G15>D15,"*","") -> * | J15: =IF(AND(F15="",G15=MIN(E15,H15)),"*","") -> * | K15: =MAX(D15,G15) -> 92 | L15: =MIN(E15,H15) -> 92 | M15: =IF(K15=L15,"*","") -> *
A16: 120 | B16: 2 | C16: 4 | D16: 94 | E16: 95 | F16: =IF(D16=E16,"*","") ->  | G16: 95 | H16: 95 | I16: =IF(G16>D16,"*","") -> * | J16: =IF(AND(F16="",G16=MIN(E16,H16)),"*","") -> * | K16: =MAX(D16,G16) -> 95 | L16: =MIN(E16,H16) -> 95 | M16: =IF(K16=L16,"*","") -> *
A17: 120 | B17: 2 | C17: 5 | D17: 100 | E17: 103 | F17: =IF(D17=E17,"*","") ->  | G17: 103 | H17: 103 | I17: =IF(G17>D17,"*","") -> * | J17: =IF(AND(F17="",G17=MIN(E17,H17)),"*","") -> * | K17: =MAX(D17,G17) -> 103 | L17: =MIN(E17,H17) -> 103 | M17: =IF(K17=L17,"*","") -> *
A18: 120 | B18: 2 | C18: 6 | D18: 90 | E18: 92 | F18: =IF(D18=E18,"*","") ->  | G18: 92 | H18: 92 | I18: =IF(G18>D18,"*","") -> * | J18: =IF(AND(F18="",G18=MIN(E18,H18)),"*","") -> * | K18: =MAX(D18,G18) -> 92 | L18: =MIN(E18,H18) -> 92 | M18: =IF(K18=L18,"*","") -> *
A19: 120 | B19: 2 | C19: 7 | D19: 90 | E19: 90 | F19: =IF(D19=E19,"*","") -> * | G19: 90 | H19: 90 | I19: =IF(G19>D19,"*","") ->  | J19: =IF(AND(F19="",G19=MIN(E19,H19)),"*","") ->  | K19: =MAX(D19,G19) -> 90 | L19: =MIN(E19,H19) -> 90 | M19: =IF(K19=L19,"*","") -> *
A20: 120 | B20: 2 | C20: 8 | D20: 81 | E20: 83 | F20: =IF(D20=E20,"*","") ->  | G20: 83 | H20: 83 | I20: =IF(G20>D20,"*","") -> * | J20: =IF(AND(F20="",G20=MIN(E20,H20)),"*","") -> * | K20: =MAX(D20,G20) -> 83 | L20: =MIN(E20,H20) -> 83 | M20: =IF(K20=L20,"*","") -> *
A21: 120 | B21: 2 | C21: 9 | D21: 92 | E21: 95 | F21: =IF(D21=E21,"*","") ->  | G21: 94 | I21: =IF(G21>D21,"*","") -> * | J21: =IF(AND(F21="",G21=MIN(E21,H21)),"*","") ->  | K21: =MAX(D21,G21) -> 94 | L21: =MIN(E21,H21) -> 95 | M21: =IF(K21=L21,"*","") -> 
A22: 120 | B22: 2 | C22: 10 | D22: 93 | E22: 97 | F22: =IF(D22=E22,"*","") ->  | G22: 96 | H22: 96 | I22: =IF(G22>D22,"*","") -> * | J22: =IF(AND(F22="",G22=MIN(E22,H22)),"*","") -> * | K22: =MAX(D22,G22) -> 96 | L22: =MIN(E22,H22) -> 96 | M22: =IF(K22=L22,"*","") -> *
A23: 120 | B23: 3 | C23: 1 | D23: 79 | E23: 80 | F23: =IF(D23=E23,"*","") ->  | G23: 79 | I23: =IF(G23>D23,"*","") ->  | J23: =IF(AND(F23="",G23=MIN(E23,H23)),"*","") ->  | K23: =MAX(D23,G23) -> 79 | L23: =MIN(E23,H23) -> 80 | M23: =IF(K23=L23,"*","") -> 
A24: 120 | B24: 3 | C24: 2 | D24: 88 | E24: 88 | F24: =IF(D24=E24,"*","") -> * | G24: 88 | H24: 88 | I24: =IF(G24>D24,"*","") ->  | J24: =IF(AND(F24="",G24=MIN(E24,H24)),"*","") ->  | K24: =MAX(D24,G24) -> 88 | L24: =MIN(E24,H24) -> 88 | M24: =IF(K24=L24,"*","") -> *
A25: 120 | B25: 3 | C25: 3 | D25: 100 | E25: 100 | F25: =IF(D25=E25,"*","") -> * | G25: 100 | H25: 100 | I25: =IF(G25>D25,"*","") ->  | J25: =IF(AND(F25="",G25=MIN(E25,H25)),"*","") ->  | K25: =MAX(D25,G25) -> 100 | L25: =MIN(E25,H25) -> 100 | M25: =IF(K25=L25,"*","") -> *
A26: 120 | B26: 3 | C26: 4 | D26: 71 | E26: 71 | F26: =IF(D26=E26,"*","") -> * | G26: 71 | H26: 71 | I26: =IF(G26>D26,"*","") ->  | J26: =IF(AND(F26="",G26=MIN(E26,H26)),"*","") ->  | K26: =MAX(D26,G26) -> 71 | L26: =MIN(E26,H26) -> 71 | M26: =IF(K26=L26,"*","") -> *
A27: 120 | B27: 3 | C27: 5 | D27: 84 | E27: 84 | F27: =IF(D27=E27,"*","") -> * | G27: 84 | H27: 84 | I27: =IF(G27>D27,"*","") ->  | J27: =IF(AND(F27="",G27=MIN(E27,H27)),"*","") ->  | K27: =MAX(D27,G27) -> 84 | L27: =MIN(E27,H27) -> 84 | M27: =IF(K27=L27,"*","") -> *
A28: 120 | B28: 3 | C28: 6 | D28: 102 | E28: 102 | F28: =IF(D28=E28,"*","") -> * | G28: 102 | H28: 102 | I28: =IF(G28>D28,"*","") ->  | J28: =IF(AND(F28="",G28=MIN(E28,H28)),"*","") ->  | K28: =MAX(D28,G28) -> 102 | L28: =MIN(E28,H28) -> 102 | M28: =IF(K28=L28,"*","") -> *
A29: 120 | B29: 3 | C29: 7 | D29: 93 | E29: 93 | F29: =IF(D29=E29,"*","") -> * | G29: 93 | H29: 93 | I29: =IF(G29>D29,"*","") ->  | J29: =IF(AND(F29="",G29=MIN(E29,H29)),"*","") ->  | K29: =MAX(D29,G29) -> 93 | L29: =MIN(E29,H29) -> 93 | M29: =IF(K29=L29,"*","") -> *
A30: 120 | B30: 3 | C30: 8 | D30: 77 | E30: 77 | F30: =IF(D30=E30,"*","") -> * | G30: 77 | I30: =IF(G30>D30,"*","") ->  | J30: =IF(AND(F30="",G30=MIN(E30,H30)),"*","") ->  | K30: =MAX(D30,G30) -> 77 | L30: =MIN(E30,H30) -> 77 | M30: =IF(K30=L30,"*","") -> *
A31: 120 | B31: 3 | C31: 9 | D31: 86 | E31: 86 | F31: =IF(D31=E31,"*","") -> * | G31: 86 | H31: 86 | I31: =IF(G31>D31,"*","") ->  | J31: =IF(AND(F31="",G31=MIN(E31,H31)),"*","") ->  | K31: =MAX(D31,G31) -> 86 | L31: =MIN(E31,H31) -> 86 | M31: =IF(K31=L31,"*","") -> *
A32: 120 | B32: 3 | C32: 10 | D32: 103 | E32: 103 | F32: =IF(D32=E32,"*","") -> * | G32: 103 | H32: 103 | I32: =IF(G32>D32,"*","") ->  | J32: =IF(AND(F32="",G32=MIN(E32,H32)),"*","") ->  | K32: =MAX(D32,G32) -> 103 | L32: =MIN(E32,H32) -> 103 | M32: =IF(K32=L32,"*","") -> *
A33: 120 | B33: 4 | C33: 1 | D33: 74 | E33: 74 | F33: =IF(D33=E33,"*","") -> * | G33: 74 | H33: 74 | I33: =IF(G33>D33,"*","") ->  | J33: =IF(AND(F33="",G33=MIN(E33,H33)),"*","") ->  | K33: =MAX(D33,G33) -> 74 | L33: =MIN(E33,H33) -> 74 | M33: =IF(K33=L33,"*","") -> *
A34: 120 | B34: 4 | C34: 2 | D34: 107 | E34: 107 | F34: =IF(D34=E34,"*","") -> * | G34: 107 | H34: 107 | I34: =IF(G34>D34,"*","") ->  | J34: =IF(AND(F34="",G34=MIN(E34,H34)),"*","") ->  | K34: =MAX(D34,G34) -> 107 | L34: =MIN(E34,H34) -> 107 | M34: =IF(K34=L34,"*","") -> *
A35: 120 | B35: 4 | C35: 3 | D35: 95 | E35: 95 | F35: =IF(D35=E35,"*","") -> * | G35: 95 | H35: 95 | I35: =IF(G35>D35,"*","") ->  | J35: =IF(AND(F35="",G35=MIN(E35,H35)),"*","") ->  | K35: =MAX(D35,G35) -> 95 | L35: =MIN(E35,H35) -> 95 | M35: =IF(K35=L35,"*","") -> *
A36: 120 | B36: 4 | C36: 4 | D36: 75 | E36: 75 | F36: =IF(D36=E36,"*","") -> * | G36: 75 | H36: 75 | I36: =IF(G36>D36,"*","") ->  | J36: =IF(AND(F36="",G36=MIN(E36,H36)),"*","") ->  | K36: =MAX(D36,G36) -> 75 | L36: =MIN(E36,H36) -> 75 | M36: =IF(K36=L36,"*","") -> *
A37: 120 | B37: 4 | C37: 5 | D37: 74 | E37: 74 | F37: =IF(D37=E37,"*","") -> * | G37: 74 | H37: 74 | I37: =IF(G37>D37,"*","") ->  | J37: =IF(AND(F37="",G37=MIN(E37,H37)),"*","") ->  | K37: =MAX(D37,G37) -> 74 | L37: =MIN(E37,H37) -> 74 | M37: =IF(K37=L37,"*","") -> *
A38: 120 | B38: 4 | C38: 6 | D38: 90 | E38: 90 | F38: =IF(D38=E38,"*","") -> * | G38: 90 | H38: 90 | I38: =IF(G38>D38,"*","") ->  | J38: =IF(AND(F38="",G38=MIN(E38,H38)),"*","") ->  | K38: =MAX(D38,G38) -> 90 | L38: =MIN(E38,H38) -> 90 | M38: =IF(K38=L38,"*","") -> *
A39: 120 | B39: 4 | C39: 7 | D39: 81 | E39: 81 | F39: =IF(D39=E39,"*","") -> * | G39: 81 | H39: 81 | I39: =IF(G39>D39,"*","") ->  | J39: =IF(AND(F39="",G39=MIN(E39,H39)),"*","") ->  | K39: =MAX(D39,G39) -> 81 | L39: =MIN(E39,H39) -> 81 | M39: =IF(K39=L39,"*","") -> *
A40: 120 | B40: 4 | C40: 8 | D40: 90 | E40: 90 | F40: =IF(D40=E40,"*","") -> * | G40: 90 | H40: 90 | I40: =IF(G40>D40,"*","") ->  | J40: =IF(AND(F40="",G40=MIN(E40,H40)),"*","") ->  | K40: =MAX(D40,G40) -> 90 | L40: =MIN(E40,H40) -> 90 | M40: =IF(K40=L40,"*","") -> *
A41: 120 | B41: 4 | C41: 9 | D41: 79 | E41: 79 | F41: =IF(D41=E41,"*","") -> * | G41: 79 | H41: 79 | I41: =IF(G41>D41,"*","") ->  | J41: =IF(AND(F41="",G41=MIN(E41,H41)),"*","") ->  | K41: =MAX(D41,G41) -> 79 | L41: =MIN(E41,H41) -> 79 | M41: =IF(K41=L41,"*","") -> *
A42: 120 | B42: 4 | C42: 10 | D42: 77 | E42: 77 | F42: =IF(D42=E42,"*","") -> * | G42: 77 | H42: 77 | I42: =IF(G42>D42,"*","") ->  | J42: =IF(AND(F42="",G42=MIN(E42,H42)),"*","") ->  | K42: =MAX(D42,G42) -> 77 | L42: =MIN(E42,H42) -> 77 | M42: =IF(K42=L42,"*","") -> *
A43: 120 | B43: 5 | C43: 1 | D43: 92 | E43: 92 | F43: =IF(D43=E43,"*","") -> * | G43: 92 | H43: 92 | I43: =IF(G43>D43,"*","") ->  | J43: =IF(AND(F43="",G43=MIN(E43,H43)),"*","") ->  | K43: =MAX(D43,G43) -> 92 | L43: =MIN(E43,H43) -> 92 | M43: =IF(K43=L43,"*","") -> *
A44: 120 | B44: 5 | C44: 2 | D44: 80 | E44: 80 | F44: =IF(D44=E44,"*","") -> * | G44: 80 | H44: 80 | I44: =IF(G44>D44,"*","") ->  | J44: =IF(AND(F44="",G44=MIN(E44,H44)),"*","") ->  | K44: =MAX(D44,G44) -> 80 | L44: =MIN(E44,H44) -> 80 | M44: =IF(K44=L44,"*","") -> *
A45: 120 | B45: 5 | C45: 3 | D45: 72 | E45: 72 | F45: =IF(D45=E45,"*","") -> * | G45: 72 | H45: 72 | I45: =IF(G45>D45,"*","") ->  | J45: =IF(AND(F45="",G45=MIN(E45,H45)),"*","") ->  | K45: =MAX(D45,G45) -> 72 | L45: =MIN(E45,H45) -> 72 | M45: =IF(K45=L45,"*","") -> *
A46: 120 | B46: 5 | C46: 4 | D46: 97 | E46: 97 | F46: =IF(D46=E46,"*","") -> * | G46: 97 | H46: 97 | I46: =IF(G46>D46,"*","") ->  | J46: =IF(AND(F46="",G46=MIN(E46,H46)),"*","") ->  | K46: =MAX(D46,G46) -> 97 | L46: =MIN(E46,H46) -> 97 | M46: =IF(K46=L46,"*","") -> *
A47: 120 | B47: 5 | C47: 5 | D47: 77 | E47: 77 | F47: =IF(D47=E47,"*","") -> * | G47: 77 | H47: 77 | I47: =IF(G47>D47,"*","") ->  | J47: =IF(AND(F47="",G47=MIN(E47,H47)),"*","") ->  | K47: =MAX(D47,G47) -> 77 | L47: =MIN(E47,H47) -> 77 | M47: =IF(K47=L47,"*","") -> *
A48: 120 | B48: 5 | C48: 6 | D48: 88 | E48: 88 | F48: =IF(D48=E48,"*","") -> * | G48: 88 | H48: 88 | I48: =IF(G48>D48,"*","") ->  | J48: =IF(AND(F48="",G48=MIN(E48,H48)),"*","") ->  | K48: =MAX(D48,G48) -> 88 | L48: =MIN(E48,H48) -> 88 | M48: =IF(K48=L48,"*","") -> *
A49: 120 | B49: 5 | C49: 7 | D49: 84 | E49: 84 | F49: =IF(D49=E49,"*","") -> * | G49: 84 | H49: 84 | I49: =IF(G49>D49,"*","") ->  | J49: =IF(AND(F49="",G49=MIN(E49,H49)),"*","") ->  | K49: =MAX(D49,G49) -> 84 | L49: =MIN(E49,H49) -> 84 | M49: =IF(K49=L49,"*","") -> *
A50: 120 | B50: 5 | C50: 8 | D50: 78 | E50: 78 | F50: =IF(D50=E50,"*","") -> * | G50: 78 | H50: 78 | I50: =IF(G50>D50,"*","") ->  | J50: =IF(AND(F50="",G50=MIN(E50,H50)),"*","") ->  | K50: =MAX(D50,G50) -> 78 | L50: =MIN(E50,H50) -> 78 | M50: =IF(K50=L50,"*","") -> *
A51: 120 | B51: 5 | C51: 9 | D51: 106 | E51: 106 | F51: =IF(D51=E51,"*","") -> * | G51: 106 | H51: 106 | I51: =IF(G51>D51,"*","") ->  | J51: =IF(AND(F51="",G51=MIN(E51,H51)),"*","") ->  | K51: =MAX(D51,G51) -> 106 | L51: =MIN(E51,H51) -> 106 | M51: =IF(K51=L51,"*","") -> *
A52: 120 | B52: 5 | C52: 10 | D52: 92 | E52: 92 | F52: =IF(D52=E52,"*","") -> * | G52: 92 | H52: 92 | I52: =IF(G52>D52,"*","") ->  | J52: =IF(AND(F52="",G52=MIN(E52,H52)),"*","") ->  | K52: =MAX(D52,G52) -> 92 | L52: =MIN(E52,H52) -> 92 | M52: =IF(K52=L52,"*","") -> *
A53: 120 | B53: 6 | C53: 1 | D53: 132 | E53: 146 | F53: =IF(D53=E53,"*","") ->  | G53: 132 | I53: =IF(G53>D53,"*","") ->  | J53: =IF(AND(F53="",G53=MIN(E53,H53)),"*","") ->  | K53: =MAX(D53,G53) -> 132 | L53: =MIN(E53,H53) -> 146 | M53: =IF(K53=L53,"*","") -> 
A54: 120 | B54: 6 | C54: 2 | D54: 125 | E54: 136 | F54: =IF(D54=E54,"*","") ->  | G54: 125 | I54: =IF(G54>D54,"*","") ->  | J54: =IF(AND(F54="",G54=MIN(E54,H54)),"*","") ->  | K54: =MAX(D54,G54) -> 125 | L54: =MIN(E54,H54) -> 136 | M54: =IF(K54=L54,"*","") -> 
A55: 120 | B55: 6 | C55: 3 | D55: 135 | E55: 135 | F55: =IF(D55=E55,"*","") -> * | G55: 125 | I55: =IF(G55>D55,"*","") ->  | J55: =IF(AND(F55="",G55=MIN(E55,H55)),"*","") ->  | K55: =MAX(D55,G55) -> 135 | L55: =MIN(E55,H55) -> 135 | M55: =IF(K55=L55,"*","") -> *
A56: 120 | B56: 6 | C56: 4 | D56: 151 | E56: 155 | F56: =IF(D56=E56,"*","") ->  | G56: 143 | I56: =IF(G56>D56,"*","") ->  | J56: =IF(AND(F56="",G56=MIN(E56,H56)),"*","") ->  | K56: =MAX(D56,G56) -> 151 | L56: =MIN(E56,H56) -> 155 | M56: =IF(K56=L56,"*","") -> 
A57: 120 | B57: 6 | C57: 5 | D57: 115 | E57: 128 | F57: =IF(D57=E57,"*","") ->  | G57: 115 | I57: =IF(G57>D57,"*","") ->  | J57: =IF(AND(F57="",G57=MIN(E57,H57)),"*","") ->  | K57: =MAX(D57,G57) -> 115 | L57: =MIN(E57,H57) -> 128 | M57: =IF(K57=L57,"*","") -> 
A58: 120 | B58: 6 | C58: 6 | D58: 140 | E58: 157 | F58: =IF(D58=E58,"*","") ->  | G58: 139 | I58: =IF(G58>D58,"*","") ->  | J58: =IF(AND(F58="",G58=MIN(E58,H58)),"*","") ->  | K58: =MAX(D58,G58) -> 140 | L58: =MIN(E58,H58) -> 157 | M58: =IF(K58=L58,"*","") -> 
A59: 120 | B59: 6 | C59: 7 | D59: 154 | E59: 170 | F59: =IF(D59=E59,"*","") ->  | G59: 149 | I59: =IF(G59>D59,"*","") ->  | J59: =IF(AND(F59="",G59=MIN(E59,H59)),"*","") ->  | K59: =MAX(D59,G59) -> 154 | L59: =MIN(E59,H59) -> 170 | M59: =IF(K59=L59,"*","") -> 
A60: 120 | B60: 6 | C60: 8 | D60: 138 | E60: 150 | F60: =IF(D60=E60,"*","") ->  | G60: 138 | I60: =IF(G60>D60,"*","") ->  | J60: =IF(AND(F60="",G60=MIN(E60,H60)),"*","") ->  | K60: =MAX(D60,G60) -> 138 | L60: =MIN(E60,H60) -> 150 | M60: =IF(K60=L60,"*","") -> 
A61: 120 | B61: 6 | C61: 9 | D61: 144 | E61: 162 | F61: =IF(D61=E61,"*","") ->  | G61: 145 | I61: =IF(G61>D61,"*","") -> * | J61: =IF(AND(F61="",G61=MIN(E61,H61)),"*","") ->  | K61: =MAX(D61,G61) -> 145 | L61: =MIN(E61,H61) -> 162 | M61: =IF(K61=L61,"*","") -> 
A62: 120 | B62: 6 | C62: 10 | D62: 156 | E62: 174 | F62: =IF(D62=E62,"*","") ->  | G62: 156 | I62: =IF(G62>D62,"*","") ->  | J62: =IF(AND(F62="",G62=MIN(E62,H62)),"*","") ->  | K62: =MAX(D62,G62) -> 156 | L62: =MIN(E62,H62) -> 174 | M62: =IF(K62=L62,"*","") -> 
A63: 120 | B63: 7 | C63: 1 | D63: 97 | E63: 102 | F63: =IF(D63=E63,"*","") ->  | G63: 97 | I63: =IF(G63>D63,"*","") ->  | J63: =IF(AND(F63="",G63=MIN(E63,H63)),"*","") ->  | K63: =MAX(D63,G63) -> 97 | L63: =MIN(E63,H63) -> 102 | M63: =IF(K63=L63,"*","") -> 
A64: 120 | B64: 7 | C64: 2 | D64: 105 | E64: 114 | F64: =IF(D64=E64,"*","") ->  | G64: 109 | I64: =IF(G64>D64,"*","") -> * | J64: =IF(AND(F64="",G64=MIN(E64,H64)),"*","") ->  | K64: =MAX(D64,G64) -> 109 | L64: =MIN(E64,H64) -> 114 | M64: =IF(K64=L64,"*","") -> 
A65: 120 | B65: 7 | C65: 3 | D65: 92 | E65: 101 | F65: =IF(D65=E65,"*","") ->  | G65: 93 | I65: =IF(G65>D65,"*","") -> * | J65: =IF(AND(F65="",G65=MIN(E65,H65)),"*","") ->  | K65: =MAX(D65,G65) -> 93 | L65: =MIN(E65,H65) -> 101 | M65: =IF(K65=L65,"*","") -> 
A66: 120 | B66: 7 | C66: 4 | D66: 103 | E66: 113 | F66: =IF(D66=E66,"*","") ->  | G66: 104 | I66: =IF(G66>D66,"*","") -> * | J66: =IF(AND(F66="",G66=MIN(E66,H66)),"*","") ->  | K66: =MAX(D66,G66) -> 104 | L66: =MIN(E66,H66) -> 113 | M66: =IF(K66=L66,"*","") -> 
A67: 120 | B67: 7 | C67: 5 | D67: 123 | E67: 133 | F67: =IF(D67=E67,"*","") ->  | G67: 123 | I67: =IF(G67>D67,"*","") ->  | J67: =IF(AND(F67="",G67=MIN(E67,H67)),"*","") ->  | K67: =MAX(D67,G67) -> 123 | L67: =MIN(E67,H67) -> 133 | M67: =IF(K67=L67,"*","") -> 
A68: 120 | B68: 7 | C68: 6 | D68: 113 | E68: 125 | F68: =IF(D68=E68,"*","") ->  | G68: 114 | I68: =IF(G68>D68,"*","") -> * | J68: =IF(AND(F68="",G68=MIN(E68,H68)),"*","") ->  | K68: =MAX(D68,G68) -> 114 | L68: =MIN(E68,H68) -> 125 | M68: =IF(K68=L68,"*","") -> 
A69: 120 | B69: 7 | C69: 7 | D69: 112 | E69: 119 | F69: =IF(D69=E69,"*","") ->  | G69: 113 | I69: =IF(G69>D69,"*","") -> * | J69: =IF(AND(F69="",G69=MIN(E69,H69)),"*","") ->  | K69: =MAX(D69,G69) -> 113 | L69: =MIN(E69,H69) -> 119 | M69: =IF(K69=L69,"*","") -> 
A70: 120 | B70: 7 | C70: 8 | D70: 90 | E70: 98 | F70: =IF(D70=E70,"*","") ->  | G70: 91 | I70: =IF(G70>D70,"*","") -> * | J70: =IF(AND(F70="",G70=MIN(E70,H70)),"*","") ->  | K70: =MAX(D70,G70) -> 91 | L70: =MIN(E70,H70) -> 98 | M70: =IF(K70=L70,"*","") -> 
A71: 120 | B71: 7 | C71: 9 | D71: 84 | E71: 91 | F71: =IF(D71=E71,"*","") ->  | G71: 85 | I71: =IF(G71>D71,"*","") -> * | J71: =IF(AND(F71="",G71=MIN(E71,H71)),"*","") ->  | K71: =MAX(D71,G71) -> 85 | L71: =MIN(E71,H71) -> 91 | M71: =IF(K71=L71,"*","") -> 
A72: 120 | B72: 7 | C72: 10 | D72: 110 | E72: 119 | F72: =IF(D72=E72,"*","") ->  | G72: 110 | I72: =IF(G72>D72,"*","") ->  | J72: =IF(AND(F72="",G72=MIN(E72,H72)),"*","") ->  | K72: =MAX(D72,G72) -> 110 | L72: =MIN(E72,H72) -> 119 | M72: =IF(K72=L72,"*","") -> 
A73: 120 | B73: 8 | C73: 1 | D73: 95 | E73: 95 | F73: =IF(D73=E73,"*","") -> * | G73: 95 | I73: =IF(G73>D73,"*","") ->  | J73: =IF(AND(F73="",G73=MIN(E73,H73)),"*","") ->  | K73: =MAX(D73,G73) -> 95 | L73: =MIN(E73,H73) -> 95 | M73: =IF(K73=L73,"*","") -> *
A74: 120 | B74: 8 | C74: 2 | D74: 95 | E74: 104 | F74: =IF(D74=E74,"*","") ->  | G74: 96 | I74: =IF(G74>D74,"*","") -> * | J74: =IF(AND(F74="",G74=MIN(E74,H74)),"*","") ->  | K74: =MAX(D74,G74) -> 96 | L74: =MIN(E74,H74) -> 104 | M74: =IF(K74=L74,"*","") -> 
A75: 120 | B75: 8 | C75: 3 | D75: 90 | E75: 96 | F75: =IF(D75=E75,"*","") ->  | G75: 91 | I75: =IF(G75>D75,"*","") -> * | J75: =IF(AND(F75="",G75=MIN(E75,H75)),"*","") ->  | K75: =MAX(D75,G75) -> 91 | L75: =MIN(E75,H75) -> 96 | M75: =IF(K75=L75,"*","") -> 
A76: 120 | B76: 8 | C76: 4 | D76: 89 | E76: 96 | F76: =IF(D76=E76,"*","") ->  | G76: 89 | I76: =IF(G76>D76,"*","") ->  | J76: =IF(AND(F76="",G76=MIN(E76,H76)),"*","") ->  | K76: =MAX(D76,G76) -> 89 | L76: =MIN(E76,H76) -> 96 | M76: =IF(K76=L76,"*","") -> 
A77: 120 | B77: 8 | C77: 5 | D77: 99 | E77: 105 | F77: =IF(D77=E77,"*","") ->  | G77: 99 | I77: =IF(G77>D77,"*","") ->  | J77: =IF(AND(F77="",G77=MIN(E77,H77)),"*","") ->  | K77: =MAX(D77,G77) -> 99 | L77: =MIN(E77,H77) -> 105 | M77: =IF(K77=L77,"*","") -> 
A78: 120 | B78: 8 | C78: 6 | D78: 82 | E78: 85 | F78: =IF(D78=E78,"*","") ->  | G78: 83 | I78: =IF(G78>D78,"*","") -> * | J78: =IF(AND(F78="",G78=MIN(E78,H78)),"*","") ->  | K78: =MAX(D78,G78) -> 83 | L78: =MIN(E78,H78) -> 85 | M78: =IF(K78=L78,"*","") -> 
A79: 120 | B79: 8 | C79: 7 | D79: 87 | E79: 88 | F79: =IF(D79=E79,"*","") ->  | G79: 87 | I79: =IF(G79>D79,"*","") ->  | J79: =IF(AND(F79="",G79=MIN(E79,H79)),"*","") ->  | K79: =MAX(D79,G79) -> 87 | L79: =MIN(E79,H79) -> 88 | M79: =IF(K79=L79,"*","") -> 
A80: 120 | B80: 8 | C80: 8 | D80: 87 | E80: 88 | F80: =IF(D80=E80,"*","") ->  | G80: 87 | I80: =IF(G80>D80,"*","") ->  | J80: =IF(AND(F80="",G80=MIN(E80,H80)),"*","") ->  | K80: =MAX(D80,G80) -> 87 | L80: =MIN(E80,H80) -> 88 | M80: =IF(K80=L80,"*","") -> 
A81: 120 | B81: 8 | C81: 9 | D81: 87 | E81: 95 | F81: =IF(D81=E81,"*","") ->  | G81: 88 | I81: =IF(G81>D81,"*","") -> * | J81: =IF(AND(F81="",G81=MIN(E81,H81)),"*","") ->  | K81: =MAX(D81,G81) -> 88 | L81: =MIN(E81,H81) -> 95 | M81: =IF(K81=L81,"*","") -> 
A82: 120 | B82: 8 | C82: 10 | D82: 91 | E82: 94 | F82: =IF(D82=E82,"*","") ->  | G82: 91 | I82: =IF(G82>D82,"*","") ->  | J82: =IF(AND(F82="",G82=MIN(E82,H82)),"*","") ->  | K82: =MAX(D82,G82) -> 91 | L82: =MIN(E82,H82) -> 94 | M82: =IF(K82=L82,"*","") -> 
A83: 120 | B83: 9 | C83: 1 | D83: 88 | E83: 88 | F83: =IF(D83=E83,"*","") -> * | G83: 88 | H83: 88 | I83: =IF(G83>D83,"*","") ->  | J83: =IF(AND(F83="",G83=MIN(E83,H83)),"*","") ->  | K83: =MAX(D83,G83) -> 88 | L83: =MIN(E83,H83) -> 88 | M83: =IF(K83=L83,"*","") -> *
A84: 120 | B84: 9 | C84: 2 | D84: 94 | E84: 94 | F84: =IF(D84=E84,"*","") -> * | G84: 94 | H84: 94 | I84: =IF(G84>D84,"*","") ->  | J84: =IF(AND(F84="",G84=MIN(E84,H84)),"*","") ->  | K84: =MAX(D84,G84) -> 94 | L84: =MIN(E84,H84) -> 94 | M84: =IF(K84=L84,"*","") -> *
A85: 120 | B85: 9 | C85: 3 | D85: 87 | E85: 87 | F85: =IF(D85=E85,"*","") -> * | G85: 87 | I85: =IF(G85>D85,"*","") ->  | J85: =IF(AND(F85="",G85=MIN(E85,H85)),"*","") ->  | K85: =MAX(D85,G85) -> 87 | L85: =MIN(E85,H85) -> 87 | M85: =IF(K85=L85,"*","") -> *
A86: 120 | B86: 9 | C86: 4 | D86: 83 | E86: 87 | F86: =IF(D86=E86,"*","") ->  | G86: 84 | I86: =IF(G86>D86,"*","") -> * | J86: =IF(AND(F86="",G86=MIN(E86,H86)),"*","") ->  | K86: =MAX(D86,G86) -> 84 | L86: =MIN(E86,H86) -> 87 | M86: =IF(K86=L86,"*","") -> 
A87: 120 | B87: 9 | C87: 5 | D87: 114 | E87: 114 | F87: =IF(D87=E87,"*","") -> * | G87: 114 | H87: 114 | I87: =IF(G87>D87,"*","") ->  | J87: =IF(AND(F87="",G87=MIN(E87,H87)),"*","") ->  | K87: =MAX(D87,G87) -> 114 | L87: =MIN(E87,H87) -> 114 | M87: =IF(K87=L87,"*","") -> *
A88: 120 | B88: 9 | C88: 6 | D88: 98 | E88: 98 | F88: =IF(D88=E88,"*","") -> * | G88: 98 | H88: 98 | I88: =IF(G88>D88,"*","") ->  | J88: =IF(AND(F88="",G88=MIN(E88,H88)),"*","") ->  | K88: =MAX(D88,G88) -> 98 | L88: =MIN(E88,H88) -> 98 | M88: =IF(K88=L88,"*","") -> *
A89: 120 | B89: 9 | C89: 7 | D89: 80 | E89: 80 | F89: =IF(D89=E89,"*","") -> * | G89: 80 | H89: 80 | I89: =IF(G89>D89,"*","") ->  | J89: =IF(AND(F89="",G89=MIN(E89,H89)),"*","") ->  | K89: =MAX(D89,G89) -> 80 | L89: =MIN(E89,H89) -> 80 | M89: =IF(K89=L89,"*","") -> *
A90: 120 | B90: 9 | C90: 8 | D90: 80 | E90: 80 | F90: =IF(D90=E90,"*","") -> * | G90: 80 | H90: 80 | I90: =IF(G90>D90,"*","") ->  | J90: =IF(AND(F90="",G90=MIN(E90,H90)),"*","") ->  | K90: =MAX(D90,G90) -> 80 | L90: =MIN(E90,H90) -> 80 | M90: =IF(K90=L90,"*","") -> *
A91: 120 | B91: 9 | C91: 9 | D91: 87 | E91: 87 | F91: =IF(D91=E91,"*","") -> * | G91: 87 | I91: =IF(G91>D91,"*","") ->  | J91: =IF(AND(F91="",G91=MIN(E91,H91)),"*","") ->  | K91: =MAX(D91,G91) -> 87 | L91: =MIN(E91,H91) -> 87 | M91: =IF(K91=L91,"*","") -> *
A92: 120 | B92: 9 | C92: 10 | D92: 84 | E92: 84 | F92: =IF(D92=E92,"*","") -> * | G92: 84 | I92: =IF(G92>D92,"*","") ->  | J92: =IF(AND(F92="",G92=MIN(E92,H92)),"*","") ->  | K92: =MAX(D92,G92) -> 84 | L92: =MIN(E92,H92) -> 84 | M92: =IF(K92=L92,"*","") -> *
A93: 120 | B93: 10 | C93: 1 | D93: 111 | E93: 111 | F93: =IF(D93=E93,"*","") -> * | G93: 111 | H93: 111 | I93: =IF(G93>D93,"*","") ->  | J93: =IF(AND(F93="",G93=MIN(E93,H93)),"*","") ->  | K93: =MAX(D93,G93) -> 111 | L93: =MIN(E93,H93) -> 111 | M93: =IF(K93=L93,"*","") -> *
A94: 120 | B94: 10 | C94: 2 | D94: 91 | E94: 91 | F94: =IF(D94=E94,"*","") -> * | G94: 91 | I94: =IF(G94>D94,"*","") ->  | J94: =IF(AND(F94="",G94=MIN(E94,H94)),"*","") ->  | K94: =MAX(D94,G94) -> 91 | L94: =MIN(E94,H94) -> 91 | M94: =IF(K94=L94,"*","") -> *
A95: 120 | B95: 10 | C95: 3 | D95: 99 | E95: 99 | F95: =IF(D95=E95,"*","") -> * | G95: 99 | H95: 99 | I95: =IF(G95>D95,"*","") ->  | J95: =IF(AND(F95="",G95=MIN(E95,H95)),"*","") ->  | K95: =MAX(D95,G95) -> 99 | L95: =MIN(E95,H95) -> 99 | M95: =IF(K95=L95,"*","") -> *
A96: 120 | B96: 10 | C96: 4 | D96: 95 | E96: 95 | F96: =IF(D96=E96,"*","") -> * | G96: 95 | H96: 95 | I96: =IF(G96>D96,"*","") ->  | J96: =IF(AND(F96="",G96=MIN(E96,H96)),"*","") ->  | K96: =MAX(D96,G96) -> 95 | L96: =MIN(E96,H96) -> 95 | M96: =IF(K96=L96,"*","") -> *
A97: 120 | B97: 10 | C97: 5 | D97: 97 | E97: 97 | F97: =IF(D97=E97,"*","") -> * | G97: 97 | I97: =IF(G97>D97,"*","") ->  | J97: =IF(AND(F97="",G97=MIN(E97,H97)),"*","") ->  | K97: =MAX(D97,G97) -> 97 | L97: =MIN(E97,H97) -> 97 | M97: =IF(K97=L97,"*","") -> *
A98: 120 | B98: 10 | C98: 6 | D98: 92 | E98: 92 | F98: =IF(D98=E98,"*","") -> * | G98: 92 | I98: =IF(G98>D98,"*","") ->  | J98: =IF(AND(F98="",G98=MIN(E98,H98)),"*","") ->  | K98: =MAX(D98,G98) -> 92 | L98: =MIN(E98,H98) -> 92 | M98: =IF(K98=L98,"*","") -> *
A99: 120 | B99: 10 | C99: 7 | D99: 79 | E99: 79 | F99: =IF(D99=E99,"*","") -> * | G99: 79 | I99: =IF(G99>D99,"*","") ->  | J99: =IF(AND(F99="",G99=MIN(E99,H99)),"*","") ->  | K99: =MAX(D99,G99) -> 79 | L99: =MIN(E99,H99) -> 79 | M99: =IF(K99=L99,"*","") -> *
A100: 120 | B100: 10 | C100: 8 | D100: 114 | E100: 114 | F100: =IF(D100=E100,"*","") -> * | G100: 114 | H100: 114 | I100: =IF(G100>D100,"*","") ->  | J100: =IF(AND(F100="",G100=MIN(E100,H100)),"*","") ->  | K100: =MAX(D100,G100) -> 114 | L100: =MIN(E100,H100) -> 114 | M100: =IF(K100=L100,"*","") -> *
A101: 120 | B101: 10 | C101: 9 | D101: 77 | E101: 77 | F101: =IF(D101=E101,"*","") -> * | G101: 77 | I101: =IF(G101>D101,"*","") ->  | J101: =IF(AND(F101="",G101=MIN(E101,H101)),"*","") ->  | K101: =MAX(D101,G101) -> 77 | L101: =MIN(E101,H101) -> 77 | M101: =IF(K101=L101,"*","") -> *
A102: 120 | B102: 10 | C102: 10 | D102: 66 | E102: 66 | F102: =IF(D102=E102,"*","") -> * | G102: 66 | I102: =IF(G102>D102,"*","") ->  | J102: =IF(AND(F102="",G102=MIN(E102,H102)),"*","") ->  | K102: =MAX(D102,G102) -> 66 | L102: =MIN(E102,H102) -> 66 | M102: =IF(K102=L102,"*","") -> *
A103: 120 | B103: 11 | C103: 1 | D103: 155 | E103: 173 | F103: =IF(D103=E103,"*","") ->  | G103: 154 | I103: =IF(G103>D103,"*","") ->  | J103: =IF(AND(F103="",G103=MIN(E103,H103)),"*","") ->  | K103: =MAX(D103,G103) -> 155 | L103: =MIN(E103,H103) -> 173 | M103: =IF(K103=L103,"*","") -> 
A104: 120 | B104: 11 | C104: 2 | D104: 145 | E104: 160 | F104: =IF(D104=E104,"*","") ->  | G104: 144 | I104: =IF(G104>D104,"*","") ->  | J104: =IF(AND(F104="",G104=MIN(E104,H104)),"*","") ->  | K104: =MAX(D104,G104) -> 145 | L104: =MIN(E104,H104) -> 160 | M104: =IF(K104=L104,"*","") -> 
A105: 120 | B105: 11 | C105: 3 | D105: 186 | E105: 205 | F105: =IF(D105=E105,"*","") ->  | G105: 185 | I105: =IF(G105>D105,"*","") ->  | J105: =IF(AND(F105="",G105=MIN(E105,H105)),"*","") ->  | K105: =MAX(D105,G105) -> 186 | L105: =MIN(E105,H105) -> 205 | M105: =IF(K105=L105,"*","") -> 
A106: 120 | B106: 11 | C106: 4 | D106: 175 | E106: 198 | F106: =IF(D106=E106,"*","") ->  | G106: 177 | I106: =IF(G106>D106,"*","") -> * | J106: =IF(AND(F106="",G106=MIN(E106,H106)),"*","") ->  | K106: =MAX(D106,G106) -> 177 | L106: =MIN(E106,H106) -> 198 | M106: =IF(K106=L106,"*","") -> 
A107: 120 | B107: 11 | C107: 5 | D107: 191 | E107: 213 | F107: =IF(D107=E107,"*","") ->  | G107: 191 | I107: =IF(G107>D107,"*","") ->  | J107: =IF(AND(F107="",G107=MIN(E107,H107)),"*","") ->  | K107: =MAX(D107,G107) -> 191 | L107: =MIN(E107,H107) -> 213 | M107: =IF(K107=L107,"*","") -> 
A108: 120 | B108: 11 | C108: 6 | D108: 189 | E108: 214 | F108: =IF(D108=E108,"*","") ->  | G108: 187 | I108: =IF(G108>D108,"*","") ->  | J108: =IF(AND(F108="",G108=MIN(E108,H108)),"*","") ->  | K108: =MAX(D108,G108) -> 189 | L108: =MIN(E108,H108) -> 214 | M108: =IF(K108=L108,"*","") -> 
A109: 120 | B109: 11 | C109: 7 | D109: 148 | E109: 164 | F109: =IF(D109=E109,"*","") ->  | G109: 147 | I109: =IF(G109>D109,"*","") ->  | J109: =IF(AND(F109="",G109=MIN(E109,H109)),"*","") ->  | K109: =MAX(D109,G109) -> 148 | L109: =MIN(E109,H109) -> 164 | M109: =IF(K109=L109,"*","") -> 
A110: 120 | B110: 11 | C110: 8 | D110: 151 | E110: 165 | F110: =IF(D110=E110,"*","") ->  | G110: 151 | I110: =IF(G110>D110,"*","") ->  | J110: =IF(AND(F110="",G110=MIN(E110,H110)),"*","") ->  | K110: =MAX(D110,G110) -> 151 | L110: =MIN(E110,H110) -> 165 | M110: =IF(K110=L110,"*","") -> 
A111: 120 | B111: 11 | C111: 9 | D111: 167 | E111: 174 | F111: =IF(D111=E111,"*","") ->  | G111: 167 | I111: =IF(G111>D111,"*","") ->  | J111: =IF(AND(F111="",G111=MIN(E111,H111)),"*","") ->  | K111: =MAX(D111,G111) -> 167 | L111: =MIN(E111,H111) -> 174 | M111: =IF(K111=L111,"*","") -> 
A112: 120 | B112: 11 | C112: 10 | D112: 163 | E112: 183 | F112: =IF(D112=E112,"*","") ->  | G112: 162 | I112: =IF(G112>D112,"*","") ->  | J112: =IF(AND(F112="",G112=MIN(E112,H112)),"*","") ->  | K112: =MAX(D112,G112) -> 163 | L112: =MIN(E112,H112) -> 183 | M112: =IF(K112=L112,"*","") -> 
A113: 120 | B113: 12 | C113: 1 | D113: 125 | E113: 138 | F113: =IF(D113=E113,"*","") ->  | G113: 123 | I113: =IF(G113>D113,"*","") ->  | J113: =IF(AND(F113="",G113=MIN(E113,H113)),"*","") ->  | K113: =MAX(D113,G113) -> 125 | L113: =MIN(E113,H113) -> 138 | M113: =IF(K113=L113,"*","") -> 
A114: 120 | B114: 12 | C114: 2 | D114: 110 | E114: 118 | F114: =IF(D114=E114,"*","") ->  | G114: 110 | I114: =IF(G114>D114,"*","") ->  | J114: =IF(AND(F114="",G114=MIN(E114,H114)),"*","") ->  | K114: =MAX(D114,G114) -> 110 | L114: =MIN(E114,H114) -> 118 | M114: =IF(K114=L114,"*","") -> 
A115: 120 | B115: 12 | C115: 3 | D115: 130 | E115: 138 | F115: =IF(D115=E115,"*","") ->  | G115: 131 | I115: =IF(G115>D115,"*","") -> * | J115: =IF(AND(F115="",G115=MIN(E115,H115)),"*","") ->  | K115: =MAX(D115,G115) -> 131 | L115: =MIN(E115,H115) -> 138 | M115: =IF(K115=L115,"*","") -> 
A116: 120 | B116: 12 | C116: 4 | D116: 121 | E116: 127 | F116: =IF(D116=E116,"*","") ->  | G116: 121 | I116: =IF(G116>D116,"*","") ->  | J116: =IF(AND(F116="",G116=MIN(E116,H116)),"*","") ->  | K116: =MAX(D116,G116) -> 121 | L116: =MIN(E116,H116) -> 127 | M116: =IF(K116=L116,"*","") -> 
A117: 120 | B117: 12 | C117: 5 | D117: 153 | E117: 164 | F117: =IF(D117=E117,"*","") ->  | G117: 153 | I117: =IF(G117>D117,"*","") ->  | J117: =IF(AND(F117="",G117=MIN(E117,H117)),"*","") ->  | K117: =MAX(D117,G117) -> 153 | L117: =MIN(E117,H117) -> 164 | M117: =IF(K117=L117,"*","") -> 
A118: 120 | B118: 12 | C118: 6 | D118: 115 | E118: 123 | F118: =IF(D118=E118,"*","") ->  | G118: 114 | I118: =IF(G118>D118,"*","") ->  | J118: =IF(AND(F118="",G118=MIN(E118,H118)),"*","") ->  | K118: =MAX(D118,G118) -> 115 | L118: =MIN(E118,H118) -> 123 | M118: =IF(K118=L118,"*","") -> 
A119: 120 | B119: 12 | C119: 7 | D119: 115 | E119: 122 | F119: =IF(D119=E119,"*","") ->  | G119: 116 | I119: =IF(G119>D119,"*","") -> * | J119: =IF(AND(F119="",G119=MIN(E119,H119)),"*","") ->  | K119: =MAX(D119,G119) -> 116 | L119: =MIN(E119,H119) -> 122 | M119: =IF(K119=L119,"*","") -> 
A120: 120 | B120: 12 | C120: 8 | D120: 109 | E120: 120 | F120: =IF(D120=E120,"*","") ->  | G120: 113 | I120: =IF(G120>D120,"*","") -> * | J120: =IF(AND(F120="",G120=MIN(E120,H120)),"*","") ->  | K120: =MAX(D120,G120) -> 113 | L120: =MIN(E120,H120) -> 120 | M120: =IF(K120=L120,"*","") -> 
A121: 120 | B121: 12 | C121: 9 | D121: 100 | E121: 107 | F121: =IF(D121=E121,"*","") ->  | G121: 101 | I121: =IF(G121>D121,"*","") -> * | J121: =IF(AND(F121="",G121=MIN(E121,H121)),"*","") ->  | K121: =MAX(D121,G121) -> 101 | L121: =MIN(E121,H121) -> 107 | M121: =IF(K121=L121,"*","") -> 
A122: 120 | B122: 12 | C122: 10 | D122: 142 | E122: 144 | F122: =IF(D122=E122,"*","") ->  | G122: 142 | I122: =IF(G122>D122,"*","") ->  | J122: =IF(AND(F122="",G122=MIN(E122,H122)),"*","") ->  | K122: =MAX(D122,G122) -> 142 | L122: =MIN(E122,H122) -> 144 | M122: =IF(K122=L122,"*","") -> 
A123: 120 | B123: 13 | C123: 1 | D123: 121 | E123: 127 | F123: =IF(D123=E123,"*","") ->  | G123: 121 | I123: =IF(G123>D123,"*","") ->  | J123: =IF(AND(F123="",G123=MIN(E123,H123)),"*","") ->  | K123: =MAX(D123,G123) -> 121 | L123: =MIN(E123,H123) -> 127 | M123: =IF(K123=L123,"*","") -> 
A124: 120 | B124: 13 | C124: 2 | D124: 88 | E124: 89 | F124: =IF(D124=E124,"*","") ->  | G124: 88 | I124: =IF(G124>D124,"*","") ->  | J124: =IF(AND(F124="",G124=MIN(E124,H124)),"*","") ->  | K124: =MAX(D124,G124) -> 88 | L124: =MIN(E124,H124) -> 89 | M124: =IF(K124=L124,"*","") -> 
A125: 120 | B125: 13 | C125: 3 | D125: 114 | E125: 119 | F125: =IF(D125=E125,"*","") ->  | G125: 114 | I125: =IF(G125>D125,"*","") ->  | J125: =IF(AND(F125="",G125=MIN(E125,H125)),"*","") ->  | K125: =MAX(D125,G125) -> 114 | L125: =MIN(E125,H125) -> 119 | M125: =IF(K125=L125,"*","") -> 
A126: 120 | B126: 13 | C126: 4 | D126: 107 | E126: 114 | F126: =IF(D126=E126,"*","") ->  | G126: 107 | I126: =IF(G126>D126,"*","") ->  | J126: =IF(AND(F126="",G126=MIN(E126,H126)),"*","") ->  | K126: =MAX(D126,G126) -> 107 | L126: =MIN(E126,H126) -> 114 | M126: =IF(K126=L126,"*","") -> 
A127: 120 | B127: 13 | C127: 5 | D127: 89 | E127: 92 | F127: =IF(D127=E127,"*","") ->  | G127: 90 | I127: =IF(G127>D127,"*","") -> * | J127: =IF(AND(F127="",G127=MIN(E127,H127)),"*","") ->  | K127: =MAX(D127,G127) -> 90 | L127: =MIN(E127,H127) -> 92 | M127: =IF(K127=L127,"*","") -> 
A128: 120 | B128: 13 | C128: 6 | D128: 95 | E128: 100 | F128: =IF(D128=E128,"*","") ->  | G128: 94 | I128: =IF(G128>D128,"*","") ->  | J128: =IF(AND(F128="",G128=MIN(E128,H128)),"*","") ->  | K128: =MAX(D128,G128) -> 95 | L128: =MIN(E128,H128) -> 100 | M128: =IF(K128=L128,"*","") -> 
A129: 120 | B129: 13 | C129: 7 | D129: 107 | E129: 109 | F129: =IF(D129=E129,"*","") ->  | G129: 107 | I129: =IF(G129>D129,"*","") ->  | J129: =IF(AND(F129="",G129=MIN(E129,H129)),"*","") ->  | K129: =MAX(D129,G129) -> 107 | L129: =MIN(E129,H129) -> 109 | M129: =IF(K129=L129,"*","") -> 
A130: 120 | B130: 13 | C130: 8 | D130: 90 | E130: 95 | F130: =IF(D130=E130,"*","") ->  | G130: 90 | I130: =IF(G130>D130,"*","") ->  | J130: =IF(AND(F130="",G130=MIN(E130,H130)),"*","") ->  | K130: =MAX(D130,G130) -> 90 | L130: =MIN(E130,H130) -> 95 | M130: =IF(K130=L130,"*","") -> 
A131: 120 | B131: 13 | C131: 9 | D131: 82 | E131: 86 | F131: =IF(D131=E131,"*","") ->  | G131: 82 | I131: =IF(G131>D131,"*","") ->  | J131: =IF(AND(F131="",G131=MIN(E131,H131)),"*","") ->  | K131: =MAX(D131,G131) -> 82 | L131: =MIN(E131,H131) -> 86 | M131: =IF(K131=L131,"*","") -> 
A132: 120 | B132: 13 | C132: 10 | D132: 84 | E132: 94 | F132: =IF(D132=E132,"*","") ->  | G132: 87 | I132: =IF(G132>D132,"*","") -> * | J132: =IF(AND(F132="",G132=MIN(E132,H132)),"*","") ->  | K132: =MAX(D132,G132) -> 87 | L132: =MIN(E132,H132) -> 94 | M132: =IF(K132=L132,"*","") -> 
A133: 120 | B133: 14 | C133: 1 | D133: 84 | E133: 86 | F133: =IF(D133=E133,"*","") ->  | G133: 84 | I133: =IF(G133>D133,"*","") ->  | J133: =IF(AND(F133="",G133=MIN(E133,H133)),"*","") ->  | K133: =MAX(D133,G133) -> 84 | L133: =MIN(E133,H133) -> 86 | M133: =IF(K133=L133,"*","") -> 
A134: 120 | B134: 14 | C134: 2 | D134: 89 | E134: 94 | F134: =IF(D134=E134,"*","") ->  | G134: 90 | I134: =IF(G134>D134,"*","") -> * | J134: =IF(AND(F134="",G134=MIN(E134,H134)),"*","") ->  | K134: =MAX(D134,G134) -> 90 | L134: =MIN(E134,H134) -> 94 | M134: =IF(K134=L134,"*","") -> 
A135: 120 | B135: 14 | C135: 3 | D135: 88 | E135: 88 | F135: =IF(D135=E135,"*","") -> * | G135: 88 | I135: =IF(G135>D135,"*","") ->  | J135: =IF(AND(F135="",G135=MIN(E135,H135)),"*","") ->  | K135: =MAX(D135,G135) -> 88 | L135: =MIN(E135,H135) -> 88 | M135: =IF(K135=L135,"*","") -> *
A136: 120 | B136: 14 | C136: 4 | D136: 85 | E136: 89 | F136: =IF(D136=E136,"*","") ->  | G136: 85 | I136: =IF(G136>D136,"*","") ->  | J136: =IF(AND(F136="",G136=MIN(E136,H136)),"*","") ->  | K136: =MAX(D136,G136) -> 85 | L136: =MIN(E136,H136) -> 89 | M136: =IF(K136=L136,"*","") -> 
A137: 120 | B137: 14 | C137: 5 | D137: 93 | E137: 98 | F137: =IF(D137=E137,"*","") ->  | G137: 93 | I137: =IF(G137>D137,"*","") ->  | J137: =IF(AND(F137="",G137=MIN(E137,H137)),"*","") ->  | K137: =MAX(D137,G137) -> 93 | L137: =MIN(E137,H137) -> 98 | M137: =IF(K137=L137,"*","") -> 
A138: 120 | B138: 14 | C138: 6 | D138: 91 | E138: 91 | F138: =IF(D138=E138,"*","") -> * | G138: 91 | I138: =IF(G138>D138,"*","") ->  | J138: =IF(AND(F138="",G138=MIN(E138,H138)),"*","") ->  | K138: =MAX(D138,G138) -> 91 | L138: =MIN(E138,H138) -> 91 | M138: =IF(K138=L138,"*","") -> *
A139: 120 | B139: 14 | C139: 7 | D139: 89 | E139: 91 | F139: =IF(D139=E139,"*","") ->  | G139: 89 | I139: =IF(G139>D139,"*","") ->  | J139: =IF(AND(F139="",G139=MIN(E139,H139)),"*","") ->  | K139: =MAX(D139,G139) -> 89 | L139: =MIN(E139,H139) -> 91 | M139: =IF(K139=L139,"*","") -> 
A140: 120 | B140: 14 | C140: 8 | D140: 108 | E140: 113 | F140: =IF(D140=E140,"*","") ->  | G140: 109 | I140: =IF(G140>D140,"*","") -> * | J140: =IF(AND(F140="",G140=MIN(E140,H140)),"*","") ->  | K140: =MAX(D140,G140) -> 109 | L140: =MIN(E140,H140) -> 113 | M140: =IF(K140=L140,"*","") -> 
A141: 120 | B141: 14 | C141: 9 | D141: 101 | E141: 101 | F141: =IF(D141=E141,"*","") -> * | G141: 101 | I141: =IF(G141>D141,"*","") ->  | J141: =IF(AND(F141="",G141=MIN(E141,H141)),"*","") ->  | K141: =MAX(D141,G141) -> 101 | L141: =MIN(E141,H141) -> 101 | M141: =IF(K141=L141,"*","") -> *
A142: 120 | B142: 14 | C142: 10 | D142: 80 | E142: 82 | F142: =IF(D142=E142,"*","") ->  | G142: 80 | I142: =IF(G142>D142,"*","") ->  | J142: =IF(AND(F142="",G142=MIN(E142,H142)),"*","") ->  | K142: =MAX(D142,G142) -> 80 | L142: =MIN(E142,H142) -> 82 | M142: =IF(K142=L142,"*","") -> 
A143: 120 | B143: 15 | C143: 1 | D143: 81 | E143: 81 | F143: =IF(D143=E143,"*","") -> * | G143: 81 | I143: =IF(G143>D143,"*","") ->  | J143: =IF(AND(F143="",G143=MIN(E143,H143)),"*","") ->  | K143: =MAX(D143,G143) -> 81 | L143: =MIN(E143,H143) -> 81 | M143: =IF(K143=L143,"*","") -> *
A144: 120 | B144: 15 | C144: 2 | D144: 75 | E144: 75 | F144: =IF(D144=E144,"*","") -> * | G144: 75 | I144: =IF(G144>D144,"*","") ->  | J144: =IF(AND(F144="",G144=MIN(E144,H144)),"*","") ->  | K144: =MAX(D144,G144) -> 75 | L144: =MIN(E144,H144) -> 75 | M144: =IF(K144=L144,"*","") -> *
A145: 120 | B145: 15 | C145: 3 | D145: 87 | E145: 87 | F145: =IF(D145=E145,"*","") -> * | G145: 87 | I145: =IF(G145>D145,"*","") ->  | J145: =IF(AND(F145="",G145=MIN(E145,H145)),"*","") ->  | K145: =MAX(D145,G145) -> 87 | L145: =MIN(E145,H145) -> 87 | M145: =IF(K145=L145,"*","") -> *
A146: 120 | B146: 15 | C146: 4 | D146: 82 | E146: 82 | F146: =IF(D146=E146,"*","") -> * | G146: 82 | I146: =IF(G146>D146,"*","") ->  | J146: =IF(AND(F146="",G146=MIN(E146,H146)),"*","") ->  | K146: =MAX(D146,G146) -> 82 | L146: =MIN(E146,H146) -> 82 | M146: =IF(K146=L146,"*","") -> *
A147: 120 | B147: 15 | C147: 5 | D147: 87 | E147: 87 | F147: =IF(D147=E147,"*","") -> * | G147: 87 | I147: =IF(G147>D147,"*","") ->  | J147: =IF(AND(F147="",G147=MIN(E147,H147)),"*","") ->  | K147: =MAX(D147,G147) -> 87 | L147: =MIN(E147,H147) -> 87 | M147: =IF(K147=L147,"*","") -> *
A148: 120 | B148: 15 | C148: 6 | D148: 97 | E148: 97 | F148: =IF(D148=E148,"*","") -> * | G148: 97 | I148: =IF(G148>D148,"*","") ->  | J148: =IF(AND(F148="",G148=MIN(E148,H148)),"*","") ->  | K148: =MAX(D148,G148) -> 97 | L148: =MIN(E148,H148) -> 97 | M148: =IF(K148=L148,"*","") -> *
A149: 120 | B149: 15 | C149: 7 | D149: 75 | E149: 75 | F149: =IF(D149=E149,"*","") -> * | G149: 75 | I149: =IF(G149>D149,"*","") ->  | J149: =IF(AND(F149="",G149=MIN(E149,H149)),"*","") ->  | K149: =MAX(D149,G149) -> 75 | L149: =MIN(E149,H149) -> 75 | M149: =IF(K149=L149,"*","") -> *
A150: 120 | B150: 15 | C150: 8 | D150: 126 | E150: 126 | F150: =IF(D150=E150,"*","") -> * | G150: 126 | I150: =IF(G150>D150,"*","") ->  | J150: =IF(AND(F150="",G150=MIN(E150,H150)),"*","") ->  | K150: =MAX(D150,G150) -> 126 | L150: =MIN(E150,H150) -> 126 | M150: =IF(K150=L150,"*","") -> *
A151: 120 | B151: 15 | C151: 9 | D151: 109 | E151: 109 | F151: =IF(D151=E151,"*","") -> * | G151: 109 | I151: =IF(G151>D151,"*","") ->  | J151: =IF(AND(F151="",G151=MIN(E151,H151)),"*","") ->  | K151: =MAX(D151,G151) -> 109 | L151: =MIN(E151,H151) -> 109 | M151: =IF(K151=L151,"*","") -> *
A152: 120 | B152: 15 | C152: 10 | D152: 91 | E152: 91 | F152: =IF(D152=E152,"*","") -> * | G152: 91 | I152: =IF(G152>D152,"*","") ->  | J152: =IF(AND(F152="",G152=MIN(E152,H152)),"*","") ->  | K152: =MAX(D152,G152) -> 91 | L152: =MIN(E152,H152) -> 91 | M152: =IF(K152=L152,"*","") -> *
A153: 120 | B153: 16 | C153: 1 | D153: 179 | E153: 197 | F153: =IF(D153=E153,"*","") ->  | G153: 178 | I153: =IF(G153>D153,"*","") ->  | J153: =IF(AND(F153="",G153=MIN(E153,H153)),"*","") ->  | K153: =MAX(D153,G153) -> 179 | L153: =MIN(E153,H153) -> 197 | M153: =IF(K153=L153,"*","") -> 
A154: 120 | B154: 16 | C154: 2 | D154: 218 | E154: 234 | F154: =IF(D154=E154,"*","") ->  | G154: 217 | I154: =IF(G154>D154,"*","") ->  | J154: =IF(AND(F154="",G154=MIN(E154,H154)),"*","") ->  | K154: =MAX(D154,G154) -> 218 | L154: =MIN(E154,H154) -> 234 | M154: =IF(K154=L154,"*","") -> 
A155: 120 | B155: 16 | C155: 3 | D155: 219 | E155: 237 | F155: =IF(D155=E155,"*","") ->  | G155: 219 | I155: =IF(G155>D155,"*","") ->  | J155: =IF(AND(F155="",G155=MIN(E155,H155)),"*","") ->  | K155: =MAX(D155,G155) -> 219 | L155: =MIN(E155,H155) -> 237 | M155: =IF(K155=L155,"*","") -> 
A156: 120 | B156: 16 | C156: 4 | D156: 189 | E156: 203 | F156: =IF(D156=E156,"*","") ->  | G156: 189 | I156: =IF(G156>D156,"*","") ->  | J156: =IF(AND(F156="",G156=MIN(E156,H156)),"*","") ->  | K156: =MAX(D156,G156) -> 189 | L156: =MIN(E156,H156) -> 203 | M156: =IF(K156=L156,"*","") -> 
A157: 120 | B157: 16 | C157: 5 | D157: 184 | E157: 201 | F157: =IF(D157=E157,"*","") ->  | G157: 182 | I157: =IF(G157>D157,"*","") ->  | J157: =IF(AND(F157="",G157=MIN(E157,H157)),"*","") ->  | K157: =MAX(D157,G157) -> 184 | L157: =MIN(E157,H157) -> 201 | M157: =IF(K157=L157,"*","") -> 
A158: 120 | B158: 16 | C158: 6 | D158: 194 | E158: 208 | F158: =IF(D158=E158,"*","") ->  | G158: 194 | I158: =IF(G158>D158,"*","") ->  | J158: =IF(AND(F158="",G158=MIN(E158,H158)),"*","") ->  | K158: =MAX(D158,G158) -> 194 | L158: =MIN(E158,H158) -> 208 | M158: =IF(K158=L158,"*","") -> 
A159: 120 | B159: 16 | C159: 7 | D159: 174 | E159: 188 | F159: =IF(D159=E159,"*","") ->  | G159: 174 | I159: =IF(G159>D159,"*","") ->  | J159: =IF(AND(F159="",G159=MIN(E159,H159)),"*","") ->  | K159: =MAX(D159,G159) -> 174 | L159: =MIN(E159,H159) -> 188 | M159: =IF(K159=L159,"*","") -> 
A160: 120 | B160: 16 | C160: 8 | D160: 182 | E160: 197 | F160: =IF(D160=E160,"*","") ->  | G160: 181 | I160: =IF(G160>D160,"*","") ->  | J160: =IF(AND(F160="",G160=MIN(E160,H160)),"*","") ->  | K160: =MAX(D160,G160) -> 182 | L160: =MIN(E160,H160) -> 197 | M160: =IF(K160=L160,"*","") -> 
A161: 120 | B161: 16 | C161: 9 | D161: 188 | E161: 208 | F161: =IF(D161=E161,"*","") ->  | G161: 187 | I161: =IF(G161>D161,"*","") ->  | J161: =IF(AND(F161="",G161=MIN(E161,H161)),"*","") ->  | K161: =MAX(D161,G161) -> 188 | L161: =MIN(E161,H161) -> 208 | M161: =IF(K161=L161,"*","") -> 
A162: 120 | B162: 16 | C162: 10 | D162: 202 | E162: 217 | F162: =IF(D162=E162,"*","") ->  | G162: 202 | I162: =IF(G162>D162,"*","") ->  | J162: =IF(AND(F162="",G162=MIN(E162,H162)),"*","") ->  | K162: =MAX(D162,G162) -> 202 | L162: =MIN(E162,H162) -> 217 | M162: =IF(K162=L162,"*","") -> 
A163: 120 | B163: 17 | C163: 1 | D163: 135 | E163: 141 | F163: =IF(D163=E163,"*","") ->  | G163: 135 | I163: =IF(G163>D163,"*","") ->  | J163: =IF(AND(F163="",G163=MIN(E163,H163)),"*","") ->  | K163: =MAX(D163,G163) -> 135 | L163: =MIN(E163,H163) -> 141 | M163: =IF(K163=L163,"*","") -> 
A164: 120 | B164: 17 | C164: 2 | D164: 120 | E164: 125 | F164: =IF(D164=E164,"*","") ->  | G164: 120 | I164: =IF(G164>D164,"*","") ->  | J164: =IF(AND(F164="",G164=MIN(E164,H164)),"*","") ->  | K164: =MAX(D164,G164) -> 120 | L164: =MIN(E164,H164) -> 125 | M164: =IF(K164=L164,"*","") -> 
A165: 120 | B165: 17 | C165: 3 | D165: 106 | E165: 110 | F165: =IF(D165=E165,"*","") ->  | G165: 105 | I165: =IF(G165>D165,"*","") ->  | J165: =IF(AND(F165="",G165=MIN(E165,H165)),"*","") ->  | K165: =MAX(D165,G165) -> 106 | L165: =MIN(E165,H165) -> 110 | M165: =IF(K165=L165,"*","") -> 
A166: 120 | B166: 17 | C166: 4 | D166: 117 | E166: 122 | F166: =IF(D166=E166,"*","") ->  | G166: 117 | I166: =IF(G166>D166,"*","") ->  | J166: =IF(AND(F166="",G166=MIN(E166,H166)),"*","") ->  | K166: =MAX(D166,G166) -> 117 | L166: =MIN(E166,H166) -> 122 | M166: =IF(K166=L166,"*","") -> 
A167: 120 | B167: 17 | C167: 5 | D167: 122 | E167: 130 | F167: =IF(D167=E167,"*","") ->  | G167: 122 | I167: =IF(G167>D167,"*","") ->  | J167: =IF(AND(F167="",G167=MIN(E167,H167)),"*","") ->  | K167: =MAX(D167,G167) -> 122 | L167: =MIN(E167,H167) -> 130 | M167: =IF(K167=L167,"*","") -> 
A168: 120 | B168: 17 | C168: 6 | D168: 133 | E168: 137 | F168: =IF(D168=E168,"*","") ->  | G168: 132 | I168: =IF(G168>D168,"*","") ->  | J168: =IF(AND(F168="",G168=MIN(E168,H168)),"*","") ->  | K168: =MAX(D168,G168) -> 133 | L168: =MIN(E168,H168) -> 137 | M168: =IF(K168=L168,"*","") -> 
A169: 120 | B169: 17 | C169: 7 | D169: 141 | E169: 149 | F169: =IF(D169=E169,"*","") ->  | G169: 141 | I169: =IF(G169>D169,"*","") ->  | J169: =IF(AND(F169="",G169=MIN(E169,H169)),"*","") ->  | K169: =MAX(D169,G169) -> 141 | L169: =MIN(E169,H169) -> 149 | M169: =IF(K169=L169,"*","") -> 
A170: 120 | B170: 17 | C170: 8 | D170: 126 | E170: 128 | F170: =IF(D170=E170,"*","") ->  | G170: 126 | I170: =IF(G170>D170,"*","") ->  | J170: =IF(AND(F170="",G170=MIN(E170,H170)),"*","") ->  | K170: =MAX(D170,G170) -> 126 | L170: =MIN(E170,H170) -> 128 | M170: =IF(K170=L170,"*","") -> 
A171: 120 | B171: 17 | C171: 9 | D171: 128 | E171: 136 | F171: =IF(D171=E171,"*","") ->  | G171: 128 | I171: =IF(G171>D171,"*","") ->  | J171: =IF(AND(F171="",G171=MIN(E171,H171)),"*","") ->  | K171: =MAX(D171,G171) -> 128 | L171: =MIN(E171,H171) -> 136 | M171: =IF(K171=L171,"*","") -> 
A172: 120 | B172: 17 | C172: 10 | D172: 131 | E172: 136 | F172: =IF(D172=E172,"*","") ->  | G172: 131 | I172: =IF(G172>D172,"*","") ->  | J172: =IF(AND(F172="",G172=MIN(E172,H172)),"*","") ->  | K172: =MAX(D172,G172) -> 131 | L172: =MIN(E172,H172) -> 136 | M172: =IF(K172=L172,"*","") -> 
A173: 120 | B173: 18 | C173: 1 | D173: 137 | E173: 139 | F173: =IF(D173=E173,"*","") ->  | G173: 137 | I173: =IF(G173>D173,"*","") ->  | J173: =IF(AND(F173="",G173=MIN(E173,H173)),"*","") ->  | K173: =MAX(D173,G173) -> 137 | L173: =MIN(E173,H173) -> 139 | M173: =IF(K173=L173,"*","") -> 
A174: 120 | B174: 18 | C174: 2 | D174: 111 | E174: 117 | F174: =IF(D174=E174,"*","") ->  | G174: 111 | I174: =IF(G174>D174,"*","") ->  | J174: =IF(AND(F174="",G174=MIN(E174,H174)),"*","") ->  | K174: =MAX(D174,G174) -> 111 | L174: =MIN(E174,H174) -> 117 | M174: =IF(K174=L174,"*","") -> 
A175: 120 | B175: 18 | C175: 3 | D175: 96 | E175: 101 | F175: =IF(D175=E175,"*","") ->  | G175: 100 | I175: =IF(G175>D175,"*","") -> * | J175: =IF(AND(F175="",G175=MIN(E175,H175)),"*","") ->  | K175: =MAX(D175,G175) -> 100 | L175: =MIN(E175,H175) -> 101 | M175: =IF(K175=L175,"*","") -> 
A176: 120 | B176: 18 | C176: 4 | D176: 98 | E176: 102 | F176: =IF(D176=E176,"*","") ->  | G176: 98 | I176: =IF(G176>D176,"*","") ->  | J176: =IF(AND(F176="",G176=MIN(E176,H176)),"*","") ->  | K176: =MAX(D176,G176) -> 98 | L176: =MIN(E176,H176) -> 102 | M176: =IF(K176=L176,"*","") -> 
A177: 120 | B177: 18 | C177: 5 | D177: 117 | E177: 119 | F177: =IF(D177=E177,"*","") ->  | G177: 117 | I177: =IF(G177>D177,"*","") ->  | J177: =IF(AND(F177="",G177=MIN(E177,H177)),"*","") ->  | K177: =MAX(D177,G177) -> 117 | L177: =MIN(E177,H177) -> 119 | M177: =IF(K177=L177,"*","") -> 
A178: 120 | B178: 18 | C178: 6 | D178: 130 | E178: 135 | F178: =IF(D178=E178,"*","") ->  | G178: 130 | I178: =IF(G178>D178,"*","") ->  | J178: =IF(AND(F178="",G178=MIN(E178,H178)),"*","") ->  | K178: =MAX(D178,G178) -> 130 | L178: =MIN(E178,H178) -> 135 | M178: =IF(K178=L178,"*","") -> 
A179: 120 | B179: 18 | C179: 7 | D179: 111 | E179: 119 | F179: =IF(D179=E179,"*","") ->  | G179: 111 | I179: =IF(G179>D179,"*","") ->  | J179: =IF(AND(F179="",G179=MIN(E179,H179)),"*","") ->  | K179: =MAX(D179,G179) -> 111 | L179: =MIN(E179,H179) -> 119 | M179: =IF(K179=L179,"*","") -> 
A180: 120 | B180: 18 | C180: 8 | D180: 101 | E180: 107 | F180: =IF(D180=E180,"*","") ->  | G180: 101 | I180: =IF(G180>D180,"*","") ->  | J180: =IF(AND(F180="",G180=MIN(E180,H180)),"*","") ->  | K180: =MAX(D180,G180) -> 101 | L180: =MIN(E180,H180) -> 107 | M180: =IF(K180=L180,"*","") -> 
A181: 120 | B181: 18 | C181: 9 | D181: 76 | E181: 92 | F181: =IF(D181=E181,"*","") ->  | G181: 88 | I181: =IF(G181>D181,"*","") -> * | J181: =IF(AND(F181="",G181=MIN(E181,H181)),"*","") ->  | K181: =MAX(D181,G181) -> 88 | L181: =MIN(E181,H181) -> 92 | M181: =IF(K181=L181,"*","") -> 
A182: 120 | B182: 18 | C182: 10 | D182: 96 | E182: 99 | F182: =IF(D182=E182,"*","") ->  | G182: 96 | I182: =IF(G182>D182,"*","") ->  | J182: =IF(AND(F182="",G182=MIN(E182,H182)),"*","") ->  | K182: =MAX(D182,G182) -> 96 | L182: =MIN(E182,H182) -> 99 | M182: =IF(K182=L182,"*","") -> 
A183: 120 | B183: 19 | C183: 1 | D183: 88 | E183: 88 | F183: =IF(D183=E183,"*","") -> * | G183: 88 | I183: =IF(G183>D183,"*","") ->  | J183: =IF(AND(F183="",G183=MIN(E183,H183)),"*","") ->  | K183: =MAX(D183,G183) -> 88 | L183: =MIN(E183,H183) -> 88 | M183: =IF(K183=L183,"*","") -> *
A184: 120 | B184: 19 | C184: 2 | D184: 81 | E184: 83 | F184: =IF(D184=E184,"*","") ->  | G184: 81 | I184: =IF(G184>D184,"*","") ->  | J184: =IF(AND(F184="",G184=MIN(E184,H184)),"*","") ->  | K184: =MAX(D184,G184) -> 81 | L184: =MIN(E184,H184) -> 83 | M184: =IF(K184=L184,"*","") -> 
A185: 120 | B185: 19 | C185: 3 | D185: 83 | E185: 86 | F185: =IF(D185=E185,"*","") ->  | G185: 83 | I185: =IF(G185>D185,"*","") ->  | J185: =IF(AND(F185="",G185=MIN(E185,H185)),"*","") ->  | K185: =MAX(D185,G185) -> 83 | L185: =MIN(E185,H185) -> 86 | M185: =IF(K185=L185,"*","") -> 
A186: 120 | B186: 19 | C186: 4 | D186: 97 | E186: 107 | F186: =IF(D186=E186,"*","") ->  | G186: 101 | I186: =IF(G186>D186,"*","") -> * | J186: =IF(AND(F186="",G186=MIN(E186,H186)),"*","") ->  | K186: =MAX(D186,G186) -> 101 | L186: =MIN(E186,H186) -> 107 | M186: =IF(K186=L186,"*","") -> 
A187: 120 | B187: 19 | C187: 5 | D187: 101 | E187: 104 | F187: =IF(D187=E187,"*","") ->  | G187: 101 | I187: =IF(G187>D187,"*","") ->  | J187: =IF(AND(F187="",G187=MIN(E187,H187)),"*","") ->  | K187: =MAX(D187,G187) -> 101 | L187: =MIN(E187,H187) -> 104 | M187: =IF(K187=L187,"*","") -> 
A188: 120 | B188: 19 | C188: 6 | D188: 88 | E188: 90 | F188: =IF(D188=E188,"*","") ->  | G188: 89 | I188: =IF(G188>D188,"*","") -> * | J188: =IF(AND(F188="",G188=MIN(E188,H188)),"*","") ->  | K188: =MAX(D188,G188) -> 89 | L188: =MIN(E188,H188) -> 90 | M188: =IF(K188=L188,"*","") -> 
A189: 120 | B189: 19 | C189: 7 | D189: 93 | E189: 93 | F189: =IF(D189=E189,"*","") -> * | G189: 93 | I189: =IF(G189>D189,"*","") ->  | J189: =IF(AND(F189="",G189=MIN(E189,H189)),"*","") ->  | K189: =MAX(D189,G189) -> 93 | L189: =MIN(E189,H189) -> 93 | M189: =IF(K189=L189,"*","") -> *
A190: 120 | B190: 19 | C190: 8 | D190: 93 | E190: 93 | F190: =IF(D190=E190,"*","") -> * | G190: 93 | I190: =IF(G190>D190,"*","") ->  | J190: =IF(AND(F190="",G190=MIN(E190,H190)),"*","") ->  | K190: =MAX(D190,G190) -> 93 | L190: =MIN(E190,H190) -> 93 | M190: =IF(K190=L190,"*","") -> *
A191: 120 | B191: 19 | C191: 9 | D191: 84 | E191: 89 | F191: =IF(D191=E191,"*","") ->  | G191: 88 | I191: =IF(G191>D191,"*","") -> * | J191: =IF(AND(F191="",G191=MIN(E191,H191)),"*","") ->  | K191: =MAX(D191,G191) -> 88 | L191: =MIN(E191,H191) -> 89 | M191: =IF(K191=L191,"*","") -> 
A192: 120 | B192: 19 | C192: 10 | D192: 88 | E192: 88 | F192: =IF(D192=E192,"*","") -> * | G192: 88 | I192: =IF(G192>D192,"*","") ->  | J192: =IF(AND(F192="",G192=MIN(E192,H192)),"*","") ->  | K192: =MAX(D192,G192) -> 88 | L192: =MIN(E192,H192) -> 88 | M192: =IF(K192=L192,"*","") -> *
A193: 120 | B193: 20 | C193: 1 | D193: 89 | E193: 89 | F193: =IF(D193=E193,"*","") -> * | G193: 89 | I193: =IF(G193>D193,"*","") ->  | J193: =IF(AND(F193="",G193=MIN(E193,H193)),"*","") ->  | K193: =MAX(D193,G193) -> 89 | L193: =MIN(E193,H193) -> 89 | M193: =IF(K193=L193,"*","") -> *
A194: 120 | B194: 20 | C194: 2 | D194: 99 | E194: 99 | F194: =IF(D194=E194,"*","") -> * | G194: 99 | I194: =IF(G194>D194,"*","") ->  | J194: =IF(AND(F194="",G194=MIN(E194,H194)),"*","") ->  | K194: =MAX(D194,G194) -> 99 | L194: =MIN(E194,H194) -> 99 | M194: =IF(K194=L194,"*","") -> *
A195: 120 | B195: 20 | C195: 3 | D195: 74 | E195: 77 | F195: =IF(D195=E195,"*","") ->  | G195: 75 | I195: =IF(G195>D195,"*","") -> * | J195: =IF(AND(F195="",G195=MIN(E195,H195)),"*","") ->  | K195: =MAX(D195,G195) -> 75 | L195: =MIN(E195,H195) -> 77 | M195: =IF(K195=L195,"*","") -> 
A196: 120 | B196: 20 | C196: 4 | D196: 89 | E196: 89 | F196: =IF(D196=E196,"*","") -> * | G196: 89 | I196: =IF(G196>D196,"*","") ->  | J196: =IF(AND(F196="",G196=MIN(E196,H196)),"*","") ->  | K196: =MAX(D196,G196) -> 89 | L196: =MIN(E196,H196) -> 89 | M196: =IF(K196=L196,"*","") -> *
A197: 120 | B197: 20 | C197: 5 | D197: 69 | E197: 69 | F197: =IF(D197=E197,"*","") -> * | G197: 69 | I197: =IF(G197>D197,"*","") ->  | J197: =IF(AND(F197="",G197=MIN(E197,H197)),"*","") ->  | K197: =MAX(D197,G197) -> 69 | L197: =MIN(E197,H197) -> 69 | M197: =IF(K197=L197,"*","") -> *
A198: 120 | B198: 20 | C198: 6 | D198: 80 | E198: 80 | F198: =IF(D198=E198,"*","") -> * | G198: 80 | I198: =IF(G198>D198,"*","") ->  | J198: =IF(AND(F198="",G198=MIN(E198,H198)),"*","") ->  | K198: =MAX(D198,G198) -> 80 | L198: =MIN(E198,H198) -> 80 | M198: =IF(K198=L198,"*","") -> *
A199: 120 | B199: 20 | C199: 7 | D199: 81 | E199: 81 | F199: =IF(D199=E199,"*","") -> * | G199: 81 | I199: =IF(G199>D199,"*","") ->  | J199: =IF(AND(F199="",G199=MIN(E199,H199)),"*","") ->  | K199: =MAX(D199,G199) -> 81 | L199: =MIN(E199,H199) -> 81 | M199: =IF(K199=L199,"*","") -> *
A200: 120 | B200: 20 | C200: 8 | D200: 107 | E200: 107 | F200: =IF(D200=E200,"*","") -> * | G200: 107 | I200: =IF(G200>D200,"*","") ->  | J200: =IF(AND(F200="",G200=MIN(E200,H200)),"*","") ->  | K200: =MAX(D200,G200) -> 107 | L200: =MIN(E200,H200) -> 107 | M200: =IF(K200=L200,"*","") -> *
A201: 120 | B201: 20 | C201: 9 | D201: 80 | E201: 80 | F201: =IF(D201=E201,"*","") -> * | G201: 80 | I201: =IF(G201>D201,"*","") ->  | J201: =IF(AND(F201="",G201=MIN(E201,H201)),"*","") ->  | K201: =MAX(D201,G201) -> 80 | L201: =MIN(E201,H201) -> 80 | M201: =IF(K201=L201,"*","") -> *
A202: 120 | B202: 20 | C202: 10 | D202: 81 | E202: 81 | F202: =IF(D202=E202,"*","") -> * | G202: 81 | I202: =IF(G202>D202,"*","") ->  | J202: =IF(AND(F202="",G202=MIN(E202,H202)),"*","") ->  | K202: =MAX(D202,G202) -> 81 | L202: =MIN(E202,H202) -> 81 | M202: =IF(K202=L202,"*","") -> *
A203: 120 | B203: 21 | C203: 1 | D203: 109 | E203: 114 | F203: =IF(D203=E203,"*","") ->  | G203: 114 | H203: 114 | I203: =IF(G203>D203,"*","") -> * | J203: =IF(AND(F203="",G203=MIN(E203,H203)),"*","") -> * | K203: =MAX(D203,G203) -> 114 | L203: =MIN(E203,H203) -> 114 | M203: =IF(K203=L203,"*","") -> *
A204: 120 | B204: 21 | C204: 2 | D204: 109 | E204: 117 | F204: =IF(D204=E204,"*","") ->  | G204: 113 | I204: =IF(G204>D204,"*","") -> * | J204: =IF(AND(F204="",G204=MIN(E204,H204)),"*","") ->  | K204: =MAX(D204,G204) -> 113 | L204: =MIN(E204,H204) -> 117 | M204: =IF(K204=L204,"*","") -> 
A205: 120 | B205: 21 | C205: 3 | D205: 132 | E205: 143 | F205: =IF(D205=E205,"*","") ->  | G205: 143 | H205: 143 | I205: =IF(G205>D205,"*","") -> * | J205: =IF(AND(F205="",G205=MIN(E205,H205)),"*","") -> * | K205: =MAX(D205,G205) -> 143 | L205: =MIN(E205,H205) -> 143 | M205: =IF(K205=L205,"*","") -> *
A206: 120 | B206: 21 | C206: 4 | D206: 131 | E206: 135 | F206: =IF(D206=E206,"*","") ->  | G206: 127 | I206: =IF(G206>D206,"*","") ->  | J206: =IF(AND(F206="",G206=MIN(E206,H206)),"*","") ->  | K206: =MAX(D206,G206) -> 131 | L206: =MIN(E206,H206) -> 135 | M206: =IF(K206=L206,"*","") -> 
A207: 120 | B207: 21 | C207: 5 | D207: 104 | E207: 110 | F207: =IF(D207=E207,"*","") ->  | G207: 110 | I207: =IF(G207>D207,"*","") -> * | J207: =IF(AND(F207="",G207=MIN(E207,H207)),"*","") -> * | K207: =MAX(D207,G207) -> 110 | L207: =MIN(E207,H207) -> 110 | M207: =IF(K207=L207,"*","") -> *
A208: 120 | B208: 21 | C208: 6 | D208: 107 | E208: 109 | F208: =IF(D208=E208,"*","") ->  | G208: 108 | I208: =IF(G208>D208,"*","") -> * | J208: =IF(AND(F208="",G208=MIN(E208,H208)),"*","") ->  | K208: =MAX(D208,G208) -> 108 | L208: =MIN(E208,H208) -> 109 | M208: =IF(K208=L208,"*","") -> 
A209: 120 | B209: 21 | C209: 7 | D209: 104 | E209: 112 | F209: =IF(D209=E209,"*","") ->  | G209: 104 | I209: =IF(G209>D209,"*","") ->  | J209: =IF(AND(F209="",G209=MIN(E209,H209)),"*","") ->  | K209: =MAX(D209,G209) -> 104 | L209: =MIN(E209,H209) -> 112 | M209: =IF(K209=L209,"*","") -> 
A210: 120 | B210: 21 | C210: 8 | D210: 125 | E210: 127 | F210: =IF(D210=E210,"*","") ->  | G210: 127 | H210: 127 | I210: =IF(G210>D210,"*","") -> * | J210: =IF(AND(F210="",G210=MIN(E210,H210)),"*","") -> * | K210: =MAX(D210,G210) -> 127 | L210: =MIN(E210,H210) -> 127 | M210: =IF(K210=L210,"*","") -> *
A211: 120 | B211: 21 | C211: 9 | D211: 97 | E211: 102 | F211: =IF(D211=E211,"*","") ->  | G211: 102 | H211: 102 | I211: =IF(G211>D211,"*","") -> * | J211: =IF(AND(F211="",G211=MIN(E211,H211)),"*","") -> * | K211: =MAX(D211,G211) -> 102 | L211: =MIN(E211,H211) -> 102 | M211: =IF(K211=L211,"*","") -> *
A212: 120 | B212: 21 | C212: 10 | D212: 96 | E212: 102 | F212: =IF(D212=E212,"*","") ->  | G212: 102 | H212: 102 | I212: =IF(G212>D212,"*","") -> * | J212: =IF(AND(F212="",G212=MIN(E212,H212)),"*","") -> * | K212: =MAX(D212,G212) -> 102 | L212: =MIN(E212,H212) -> 102 | M212: =IF(K212=L212,"*","") -> *
A213: 120 | B213: 22 | C213: 1 | D213: 97 | E213: 101 | F213: =IF(D213=E213,"*","") ->  | G213: 101 | H213: 101 | I213: =IF(G213>D213,"*","") -> * | J213: =IF(AND(F213="",G213=MIN(E213,H213)),"*","") -> * | K213: =MAX(D213,G213) -> 101 | L213: =MIN(E213,H213) -> 101 | M213: =IF(K213=L213,"*","") -> *
A214: 120 | B214: 22 | C214: 2 | D214: 107 | E214: 107 | F214: =IF(D214=E214,"*","") -> * | G214: 107 | H214: 107 | I214: =IF(G214>D214,"*","") ->  | J214: =IF(AND(F214="",G214=MIN(E214,H214)),"*","") ->  | K214: =MAX(D214,G214) -> 107 | L214: =MIN(E214,H214) -> 107 | M214: =IF(K214=L214,"*","") -> *
A215: 120 | B215: 22 | C215: 3 | D215: 94 | E215: 96 | F215: =IF(D215=E215,"*","") ->  | G215: 94 | I215: =IF(G215>D215,"*","") ->  | J215: =IF(AND(F215="",G215=MIN(E215,H215)),"*","") ->  | K215: =MAX(D215,G215) -> 94 | L215: =MIN(E215,H215) -> 96 | M215: =IF(K215=L215,"*","") -> 
A216: 120 | B216: 22 | C216: 4 | D216: 90 | E216: 90 | F216: =IF(D216=E216,"*","") -> * | G216: 90 | H216: 90 | I216: =IF(G216>D216,"*","") ->  | J216: =IF(AND(F216="",G216=MIN(E216,H216)),"*","") ->  | K216: =MAX(D216,G216) -> 90 | L216: =MIN(E216,H216) -> 90 | M216: =IF(K216=L216,"*","") -> *
A217: 120 | B217: 22 | C217: 5 | D217: 93 | E217: 93 | F217: =IF(D217=E217,"*","") -> * | G217: 93 | I217: =IF(G217>D217,"*","") ->  | J217: =IF(AND(F217="",G217=MIN(E217,H217)),"*","") ->  | K217: =MAX(D217,G217) -> 93 | L217: =MIN(E217,H217) -> 93 | M217: =IF(K217=L217,"*","") -> *
A218: 120 | B218: 22 | C218: 6 | D218: 99 | E218: 103 | F218: =IF(D218=E218,"*","") ->  | G218: 103 | H218: 103 | I218: =IF(G218>D218,"*","") -> * | J218: =IF(AND(F218="",G218=MIN(E218,H218)),"*","") -> * | K218: =MAX(D218,G218) -> 103 | L218: =MIN(E218,H218) -> 103 | M218: =IF(K218=L218,"*","") -> *
A219: 120 | B219: 22 | C219: 7 | D219: 133 | E219: 133 | F219: =IF(D219=E219,"*","") -> * | G219: 133 | H219: 133 | I219: =IF(G219>D219,"*","") ->  | J219: =IF(AND(F219="",G219=MIN(E219,H219)),"*","") ->  | K219: =MAX(D219,G219) -> 133 | L219: =MIN(E219,H219) -> 133 | M219: =IF(K219=L219,"*","") -> *
A220: 120 | B220: 22 | C220: 8 | D220: 97 | E220: 103 | F220: =IF(D220=E220,"*","") ->  | G220: 101 | I220: =IF(G220>D220,"*","") -> * | J220: =IF(AND(F220="",G220=MIN(E220,H220)),"*","") ->  | K220: =MAX(D220,G220) -> 101 | L220: =MIN(E220,H220) -> 103 | M220: =IF(K220=L220,"*","") -> 
A221: 120 | B221: 22 | C221: 9 | D221: 107 | E221: 109 | F221: =IF(D221=E221,"*","") ->  | G221: 109 | H221: 109 | I221: =IF(G221>D221,"*","") -> * | J221: =IF(AND(F221="",G221=MIN(E221,H221)),"*","") -> * | K221: =MAX(D221,G221) -> 109 | L221: =MIN(E221,H221) -> 109 | M221: =IF(K221=L221,"*","") -> *
A222: 120 | B222: 22 | C222: 10 | D222: 79 | E222: 79 | F222: =IF(D222=E222,"*","") -> * | G222: 79 | H222: 79 | I222: =IF(G222>D222,"*","") ->  | J222: =IF(AND(F222="",G222=MIN(E222,H222)),"*","") ->  | K222: =MAX(D222,G222) -> 79 | L222: =MIN(E222,H222) -> 79 | M222: =IF(K222=L222,"*","") -> *
A223: 120 | B223: 23 | C223: 1 | D223: 107 | E223: 107 | F223: =IF(D223=E223,"*","") -> * | G223: 107 | H223: 107 | I223: =IF(G223>D223,"*","") ->  | J223: =IF(AND(F223="",G223=MIN(E223,H223)),"*","") ->  | K223: =MAX(D223,G223) -> 107 | L223: =MIN(E223,H223) -> 107 | M223: =IF(K223=L223,"*","") -> *
A224: 120 | B224: 23 | C224: 2 | D224: 116 | E224: 116 | F224: =IF(D224=E224,"*","") -> * | G224: 116 | H224: 116 | I224: =IF(G224>D224,"*","") ->  | J224: =IF(AND(F224="",G224=MIN(E224,H224)),"*","") ->  | K224: =MAX(D224,G224) -> 116 | L224: =MIN(E224,H224) -> 116 | M224: =IF(K224=L224,"*","") -> *
A225: 120 | B225: 23 | C225: 3 | D225: 99 | E225: 99 | F225: =IF(D225=E225,"*","") -> * | G225: 99 | H225: 99 | I225: =IF(G225>D225,"*","") ->  | J225: =IF(AND(F225="",G225=MIN(E225,H225)),"*","") ->  | K225: =MAX(D225,G225) -> 99 | L225: =MIN(E225,H225) -> 99 | M225: =IF(K225=L225,"*","") -> *
A226: 120 | B226: 23 | C226: 4 | D226: 106 | E226: 106 | F226: =IF(D226=E226,"*","") -> * | G226: 106 | H226: 106 | I226: =IF(G226>D226,"*","") ->  | J226: =IF(AND(F226="",G226=MIN(E226,H226)),"*","") ->  | K226: =MAX(D226,G226) -> 106 | L226: =MIN(E226,H226) -> 106 | M226: =IF(K226=L226,"*","") -> *
A227: 120 | B227: 23 | C227: 5 | D227: 99 | E227: 99 | F227: =IF(D227=E227,"*","") -> * | G227: 99 | H227: 99 | I227: =IF(G227>D227,"*","") ->  | J227: =IF(AND(F227="",G227=MIN(E227,H227)),"*","") ->  | K227: =MAX(D227,G227) -> 99 | L227: =MIN(E227,H227) -> 99 | M227: =IF(K227=L227,"*","") -> *
A228: 120 | B228: 23 | C228: 6 | D228: 106 | E228: 106 | F228: =IF(D228=E228,"*","") -> * | G228: 106 | H228: 106 | I228: =IF(G228>D228,"*","") ->  | J228: =IF(AND(F228="",G228=MIN(E228,H228)),"*","") ->  | K228: =MAX(D228,G228) -> 106 | L228: =MIN(E228,H228) -> 106 | M228: =IF(K228=L228,"*","") -> *
A229: 120 | B229: 23 | C229: 7 | D229: 104 | E229: 104 | F229: =IF(D229=E229,"*","") -> * | G229: 104 | H229: 104 | I229: =IF(G229>D229,"*","") ->  | J229: =IF(AND(F229="",G229=MIN(E229,H229)),"*","") ->  | K229: =MAX(D229,G229) -> 104 | L229: =MIN(E229,H229) -> 104 | M229: =IF(K229=L229,"*","") -> *
A230: 120 | B230: 23 | C230: 8 | D230: 101 | E230: 101 | F230: =IF(D230=E230,"*","") -> * | G230: 101 | H230: 101 | I230: =IF(G230>D230,"*","") ->  | J230: =IF(AND(F230="",G230=MIN(E230,H230)),"*","") ->  | K230: =MAX(D230,G230) -> 101 | L230: =MIN(E230,H230) -> 101 | M230: =IF(K230=L230,"*","") -> *
A231: 120 | B231: 23 | C231: 9 | D231: 107 | E231: 107 | F231: =IF(D231=E231,"*","") -> * | G231: 107 | H231: 107 | I231: =IF(G231>D231,"*","") ->  | J231: =IF(AND(F231="",G231=MIN(E231,H231)),"*","") ->  | K231: =MAX(D231,G231) -> 107 | L231: =MIN(E231,H231) -> 107 | M231: =IF(K231=L231,"*","") -> *
A232: 120 | B232: 23 | C232: 10 | D232: 100 | E232: 100 | F232: =IF(D232=E232,"*","") -> * | G232: 100 | H232: 100 | I232: =IF(G232>D232,"*","") ->  | J232: =IF(AND(F232="",G232=MIN(E232,H232)),"*","") ->  | K232: =MAX(D232,G232) -> 100 | L232: =MIN(E232,H232) -> 100 | M232: =IF(K232=L232,"*","") -> *
A233: 120 | B233: 24 | C233: 1 | D233: 93 | E233: 93 | F233: =IF(D233=E233,"*","") -> * | G233: 93 | H233: 93 | I233: =IF(G233>D233,"*","") ->  | J233: =IF(AND(F233="",G233=MIN(E233,H233)),"*","") ->  | K233: =MAX(D233,G233) -> 93 | L233: =MIN(E233,H233) -> 93 | M233: =IF(K233=L233,"*","") -> *
A234: 120 | B234: 24 | C234: 2 | D234: 91 | E234: 91 | F234: =IF(D234=E234,"*","") -> * | G234: 91 | H234: 91 | I234: =IF(G234>D234,"*","") ->  | J234: =IF(AND(F234="",G234=MIN(E234,H234)),"*","") ->  | K234: =MAX(D234,G234) -> 91 | L234: =MIN(E234,H234) -> 91 | M234: =IF(K234=L234,"*","") -> *
A235: 120 | B235: 24 | C235: 3 | D235: 89 | E235: 89 | F235: =IF(D235=E235,"*","") -> * | G235: 89 | H235: 89 | I235: =IF(G235>D235,"*","") ->  | J235: =IF(AND(F235="",G235=MIN(E235,H235)),"*","") ->  | K235: =MAX(D235,G235) -> 89 | L235: =MIN(E235,H235) -> 89 | M235: =IF(K235=L235,"*","") -> *
A236: 120 | B236: 24 | C236: 4 | D236: 101 | E236: 101 | F236: =IF(D236=E236,"*","") -> * | G236: 101 | H236: 101 | I236: =IF(G236>D236,"*","") ->  | J236: =IF(AND(F236="",G236=MIN(E236,H236)),"*","") ->  | K236: =MAX(D236,G236) -> 101 | L236: =MIN(E236,H236) -> 101 | M236: =IF(K236=L236,"*","") -> *
A237: 120 | B237: 24 | C237: 5 | D237: 86 | E237: 86 | F237: =IF(D237=E237,"*","") -> * | G237: 86 | H237: 86 | I237: =IF(G237>D237,"*","") ->  | J237: =IF(AND(F237="",G237=MIN(E237,H237)),"*","") ->  | K237: =MAX(D237,G237) -> 86 | L237: =MIN(E237,H237) -> 86 | M237: =IF(K237=L237,"*","") -> *
A238: 120 | B238: 24 | C238: 6 | D238: 95 | E238: 95 | F238: =IF(D238=E238,"*","") -> * | G238: 95 | H238: 95 | I238: =IF(G238>D238,"*","") ->  | J238: =IF(AND(F238="",G238=MIN(E238,H238)),"*","") ->  | K238: =MAX(D238,G238) -> 95 | L238: =MIN(E238,H238) -> 95 | M238: =IF(K238=L238,"*","") -> *
A239: 120 | B239: 24 | C239: 7 | D239: 110 | E239: 112 | F239: =IF(D239=E239,"*","") ->  | G239: 112 | H239: 112 | I239: =IF(G239>D239,"*","") -> * | J239: =IF(AND(F239="",G239=MIN(E239,H239)),"*","") -> * | K239: =MAX(D239,G239) -> 112 | L239: =MIN(E239,H239) -> 112 | M239: =IF(K239=L239,"*","") -> *
A240: 120 | B240: 24 | C240: 8 | D240: 104 | E240: 104 | F240: =IF(D240=E240,"*","") -> * | G240: 104 | H240: 104 | I240: =IF(G240>D240,"*","") ->  | J240: =IF(AND(F240="",G240=MIN(E240,H240)),"*","") ->  | K240: =MAX(D240,G240) -> 104 | L240: =MIN(E240,H240) -> 104 | M240: =IF(K240=L240,"*","") -> *
A241: 120 | B241: 24 | C241: 9 | D241: 82 | E241: 82 | F241: =IF(D241=E241,"*","") -> * | G241: 82 | H241: 82 | I241: =IF(G241>D241,"*","") ->  | J241: =IF(AND(F241="",G241=MIN(E241,H241)),"*","") ->  | K241: =MAX(D241,G241) -> 82 | L241: =MIN(E241,H241) -> 82 | M241: =IF(K241=L241,"*","") -> *
A242: 120 | B242: 24 | C242: 10 | D242: 91 | E242: 91 | F242: =IF(D242=E242,"*","") -> * | G242: 91 | H242: 91 | I242: =IF(G242>D242,"*","") ->  | J242: =IF(AND(F242="",G242=MIN(E242,H242)),"*","") ->  | K242: =MAX(D242,G242) -> 91 | L242: =MIN(E242,H242) -> 91 | M242: =IF(K242=L242,"*","") -> *
A243: 120 | B243: 25 | C243: 1 | D243: 82 | E243: 82 | F243: =IF(D243=E243,"*","") -> * | G243: 82 | H243: 82 | I243: =IF(G243>D243,"*","") ->  | J243: =IF(AND(F243="",G243=MIN(E243,H243)),"*","") ->  | K243: =MAX(D243,G243) -> 82 | L243: =MIN(E243,H243) -> 82 | M243: =IF(K243=L243,"*","") -> *
A244: 120 | B244: 25 | C244: 2 | D244: 108 | E244: 108 | F244: =IF(D244=E244,"*","") -> * | G244: 108 | H244: 108 | I244: =IF(G244>D244,"*","") ->  | J244: =IF(AND(F244="",G244=MIN(E244,H244)),"*","") ->  | K244: =MAX(D244,G244) -> 108 | L244: =MIN(E244,H244) -> 108 | M244: =IF(K244=L244,"*","") -> *
A245: 120 | B245: 25 | C245: 3 | D245: 100 | E245: 100 | F245: =IF(D245=E245,"*","") -> * | G245: 100 | H245: 100 | I245: =IF(G245>D245,"*","") ->  | J245: =IF(AND(F245="",G245=MIN(E245,H245)),"*","") ->  | K245: =MAX(D245,G245) -> 100 | L245: =MIN(E245,H245) -> 100 | M245: =IF(K245=L245,"*","") -> *
A246: 120 | B246: 25 | C246: 4 | D246: 117 | E246: 117 | F246: =IF(D246=E246,"*","") -> * | G246: 117 | H246: 117 | I246: =IF(G246>D246,"*","") ->  | J246: =IF(AND(F246="",G246=MIN(E246,H246)),"*","") ->  | K246: =MAX(D246,G246) -> 117 | L246: =MIN(E246,H246) -> 117 | M246: =IF(K246=L246,"*","") -> *
A247: 120 | B247: 25 | C247: 5 | D247: 100 | E247: 100 | F247: =IF(D247=E247,"*","") -> * | G247: 100 | H247: 100 | I247: =IF(G247>D247,"*","") ->  | J247: =IF(AND(F247="",G247=MIN(E247,H247)),"*","") ->  | K247: =MAX(D247,G247) -> 100 | L247: =MIN(E247,H247) -> 100 | M247: =IF(K247=L247,"*","") -> *
A248: 120 | B248: 25 | C248: 6 | D248: 91 | E248: 92 | F248: =IF(D248=E248,"*","") ->  | G248: 92 | H248: 92 | I248: =IF(G248>D248,"*","") -> * | J248: =IF(AND(F248="",G248=MIN(E248,H248)),"*","") -> * | K248: =MAX(D248,G248) -> 92 | L248: =MIN(E248,H248) -> 92 | M248: =IF(K248=L248,"*","") -> *
A249: 120 | B249: 25 | C249: 7 | D249: 92 | E249: 92 | F249: =IF(D249=E249,"*","") -> * | G249: 92 | H249: 92 | I249: =IF(G249>D249,"*","") ->  | J249: =IF(AND(F249="",G249=MIN(E249,H249)),"*","") ->  | K249: =MAX(D249,G249) -> 92 | L249: =MIN(E249,H249) -> 92 | M249: =IF(K249=L249,"*","") -> *
A250: 120 | B250: 25 | C250: 8 | D250: 78 | E250: 80 | F250: =IF(D250=E250,"*","") ->  | G250: 80 | H250: 80 | I250: =IF(G250>D250,"*","") -> * | J250: =IF(AND(F250="",G250=MIN(E250,H250)),"*","") -> * | K250: =MAX(D250,G250) -> 80 | L250: =MIN(E250,H250) -> 80 | M250: =IF(K250=L250,"*","") -> *
A251: 120 | B251: 25 | C251: 9 | D251: 94 | E251: 94 | F251: =IF(D251=E251,"*","") -> * | G251: 94 | H251: 94 | I251: =IF(G251>D251,"*","") ->  | J251: =IF(AND(F251="",G251=MIN(E251,H251)),"*","") ->  | K251: =MAX(D251,G251) -> 94 | L251: =MIN(E251,H251) -> 94 | M251: =IF(K251=L251,"*","") -> *
A252: 120 | B252: 25 | C252: 10 | D252: 92 | E252: 92 | F252: =IF(D252=E252,"*","") -> * | G252: 92 | H252: 92 | I252: =IF(G252>D252,"*","") ->  | J252: =IF(AND(F252="",G252=MIN(E252,H252)),"*","") ->  | K252: =MAX(D252,G252) -> 92 | L252: =MIN(E252,H252) -> 92 | M252: =IF(K252=L252,"*","") -> *
A253: 120 | B253: 26 | C253: 1 | D253: 153 | E253: 170 | F253: =IF(D253=E253,"*","") ->  | G253: 148 | I253: =IF(G253>D253,"*","") ->  | J253: =IF(AND(F253="",G253=MIN(E253,H253)),"*","") ->  | K253: =MAX(D253,G253) -> 153 | L253: =MIN(E253,H253) -> 170 | M253: =IF(K253=L253,"*","") -> 
A254: 120 | B254: 26 | C254: 2 | D254: 147 | E254: 171 | F254: =IF(D254=E254,"*","") ->  | G254: 145 | I254: =IF(G254>D254,"*","") ->  | J254: =IF(AND(F254="",G254=MIN(E254,H254)),"*","") ->  | K254: =MAX(D254,G254) -> 147 | L254: =MIN(E254,H254) -> 171 | M254: =IF(K254=L254,"*","") -> 
A255: 120 | B255: 26 | C255: 3 | D255: 153 | E255: 169 | F255: =IF(D255=E255,"*","") ->  | G255: 153 | I255: =IF(G255>D255,"*","") ->  | J255: =IF(AND(F255="",G255=MIN(E255,H255)),"*","") ->  | K255: =MAX(D255,G255) -> 153 | L255: =MIN(E255,H255) -> 169 | M255: =IF(K255=L255,"*","") -> 
A256: 120 | B256: 26 | C256: 4 | D256: 151 | E256: 173 | F256: =IF(D256=E256,"*","") ->  | G256: 151 | I256: =IF(G256>D256,"*","") ->  | J256: =IF(AND(F256="",G256=MIN(E256,H256)),"*","") ->  | K256: =MAX(D256,G256) -> 151 | L256: =MIN(E256,H256) -> 173 | M256: =IF(K256=L256,"*","") -> 
A257: 120 | B257: 26 | C257: 5 | D257: 136 | E257: 156 | F257: =IF(D257=E257,"*","") ->  | G257: 135 | I257: =IF(G257>D257,"*","") ->  | J257: =IF(AND(F257="",G257=MIN(E257,H257)),"*","") ->  | K257: =MAX(D257,G257) -> 136 | L257: =MIN(E257,H257) -> 156 | M257: =IF(K257=L257,"*","") -> 
A258: 120 | B258: 26 | C258: 6 | D258: 167 | E258: 187 | F258: =IF(D258=E258,"*","") ->  | G258: 167 | I258: =IF(G258>D258,"*","") ->  | J258: =IF(AND(F258="",G258=MIN(E258,H258)),"*","") ->  | K258: =MAX(D258,G258) -> 167 | L258: =MIN(E258,H258) -> 187 | M258: =IF(K258=L258,"*","") -> 
A259: 120 | B259: 26 | C259: 7 | D259: 141 | E259: 159 | F259: =IF(D259=E259,"*","") ->  | G259: 143 | I259: =IF(G259>D259,"*","") -> * | J259: =IF(AND(F259="",G259=MIN(E259,H259)),"*","") ->  | K259: =MAX(D259,G259) -> 143 | L259: =MIN(E259,H259) -> 159 | M259: =IF(K259=L259,"*","") -> 
A260: 120 | B260: 26 | C260: 8 | D260: 162 | E260: 179 | F260: =IF(D260=E260,"*","") ->  | G260: 159 | I260: =IF(G260>D260,"*","") ->  | J260: =IF(AND(F260="",G260=MIN(E260,H260)),"*","") ->  | K260: =MAX(D260,G260) -> 162 | L260: =MIN(E260,H260) -> 179 | M260: =IF(K260=L260,"*","") -> 
A261: 120 | B261: 26 | C261: 9 | D261: 158 | E261: 173 | F261: =IF(D261=E261,"*","") ->  | G261: 159 | I261: =IF(G261>D261,"*","") -> * | J261: =IF(AND(F261="",G261=MIN(E261,H261)),"*","") ->  | K261: =MAX(D261,G261) -> 159 | L261: =MIN(E261,H261) -> 173 | M261: =IF(K261=L261,"*","") -> 
A262: 120 | B262: 26 | C262: 10 | D262: 160 | E262: 185 | F262: =IF(D262=E262,"*","") ->  | G262: 165 | I262: =IF(G262>D262,"*","") -> * | J262: =IF(AND(F262="",G262=MIN(E262,H262)),"*","") ->  | K262: =MAX(D262,G262) -> 165 | L262: =MIN(E262,H262) -> 185 | M262: =IF(K262=L262,"*","") -> 
A263: 120 | B263: 27 | C263: 1 | D263: 105 | E263: 108 | F263: =IF(D263=E263,"*","") ->  | G263: 105 | I263: =IF(G263>D263,"*","") ->  | J263: =IF(AND(F263="",G263=MIN(E263,H263)),"*","") ->  | K263: =MAX(D263,G263) -> 105 | L263: =MIN(E263,H263) -> 108 | M263: =IF(K263=L263,"*","") -> 
A264: 120 | B264: 27 | C264: 2 | D264: 105 | E264: 115 | F264: =IF(D264=E264,"*","") ->  | G264: 107 | I264: =IF(G264>D264,"*","") -> * | J264: =IF(AND(F264="",G264=MIN(E264,H264)),"*","") ->  | K264: =MAX(D264,G264) -> 107 | L264: =MIN(E264,H264) -> 115 | M264: =IF(K264=L264,"*","") -> 
A265: 120 | B265: 27 | C265: 3 | D265: 139 | E265: 145 | F265: =IF(D265=E265,"*","") ->  | G265: 140 | I265: =IF(G265>D265,"*","") -> * | J265: =IF(AND(F265="",G265=MIN(E265,H265)),"*","") ->  | K265: =MAX(D265,G265) -> 140 | L265: =MIN(E265,H265) -> 145 | M265: =IF(K265=L265,"*","") -> 
A266: 120 | B266: 27 | C266: 4 | D266: 103 | E266: 109 | F266: =IF(D266=E266,"*","") ->  | G266: 104 | I266: =IF(G266>D266,"*","") -> * | J266: =IF(AND(F266="",G266=MIN(E266,H266)),"*","") ->  | K266: =MAX(D266,G266) -> 104 | L266: =MIN(E266,H266) -> 109 | M266: =IF(K266=L266,"*","") -> 
A267: 120 | B267: 27 | C267: 5 | D267: 101 | E267: 112 | F267: =IF(D267=E267,"*","") ->  | G267: 101 | I267: =IF(G267>D267,"*","") ->  | J267: =IF(AND(F267="",G267=MIN(E267,H267)),"*","") ->  | K267: =MAX(D267,G267) -> 101 | L267: =MIN(E267,H267) -> 112 | M267: =IF(K267=L267,"*","") -> 
A268: 120 | B268: 27 | C268: 6 | D268: 130 | E268: 147 | F268: =IF(D268=E268,"*","") ->  | G268: 131 | I268: =IF(G268>D268,"*","") -> * | J268: =IF(AND(F268="",G268=MIN(E268,H268)),"*","") ->  | K268: =MAX(D268,G268) -> 131 | L268: =MIN(E268,H268) -> 147 | M268: =IF(K268=L268,"*","") -> 
A269: 120 | B269: 27 | C269: 7 | D269: 114 | E269: 127 | F269: =IF(D269=E269,"*","") ->  | G269: 116 | I269: =IF(G269>D269,"*","") -> * | J269: =IF(AND(F269="",G269=MIN(E269,H269)),"*","") ->  | K269: =MAX(D269,G269) -> 116 | L269: =MIN(E269,H269) -> 127 | M269: =IF(K269=L269,"*","") -> 
A270: 120 | B270: 27 | C270: 8 | D270: 135 | E270: 141 | F270: =IF(D270=E270,"*","") ->  | G270: 135 | I270: =IF(G270>D270,"*","") ->  | J270: =IF(AND(F270="",G270=MIN(E270,H270)),"*","") ->  | K270: =MAX(D270,G270) -> 135 | L270: =MIN(E270,H270) -> 141 | M270: =IF(K270=L270,"*","") -> 
A271: 120 | B271: 27 | C271: 9 | D271: 118 | E271: 129 | F271: =IF(D271=E271,"*","") ->  | G271: 119 | I271: =IF(G271>D271,"*","") -> * | J271: =IF(AND(F271="",G271=MIN(E271,H271)),"*","") ->  | K271: =MAX(D271,G271) -> 119 | L271: =MIN(E271,H271) -> 129 | M271: =IF(K271=L271,"*","") -> 
A272: 120 | B272: 27 | C272: 10 | D272: 105 | E272: 116 | F272: =IF(D272=E272,"*","") ->  | G272: 107 | I272: =IF(G272>D272,"*","") -> * | J272: =IF(AND(F272="",G272=MIN(E272,H272)),"*","") ->  | K272: =MAX(D272,G272) -> 107 | L272: =MIN(E272,H272) -> 116 | M272: =IF(K272=L272,"*","") -> 
A273: 120 | B273: 28 | C273: 1 | D273: 104 | E273: 108 | F273: =IF(D273=E273,"*","") ->  | G273: 105 | I273: =IF(G273>D273,"*","") -> * | J273: =IF(AND(F273="",G273=MIN(E273,H273)),"*","") ->  | K273: =MAX(D273,G273) -> 105 | L273: =MIN(E273,H273) -> 108 | M273: =IF(K273=L273,"*","") -> 
A274: 120 | B274: 28 | C274: 2 | D274: 110 | E274: 110 | F274: =IF(D274=E274,"*","") -> * | G274: 110 | I274: =IF(G274>D274,"*","") ->  | J274: =IF(AND(F274="",G274=MIN(E274,H274)),"*","") ->  | K274: =MAX(D274,G274) -> 110 | L274: =MIN(E274,H274) -> 110 | M274: =IF(K274=L274,"*","") -> *
A275: 120 | B275: 28 | C275: 3 | D275: 101 | E275: 101 | F275: =IF(D275=E275,"*","") -> * | G275: 101 | H275: 101 | I275: =IF(G275>D275,"*","") ->  | J275: =IF(AND(F275="",G275=MIN(E275,H275)),"*","") ->  | K275: =MAX(D275,G275) -> 101 | L275: =MIN(E275,H275) -> 101 | M275: =IF(K275=L275,"*","") -> *
A276: 120 | B276: 28 | C276: 4 | D276: 107 | E276: 113 | F276: =IF(D276=E276,"*","") ->  | G276: 111 | I276: =IF(G276>D276,"*","") -> * | J276: =IF(AND(F276="",G276=MIN(E276,H276)),"*","") ->  | K276: =MAX(D276,G276) -> 111 | L276: =MIN(E276,H276) -> 113 | M276: =IF(K276=L276,"*","") -> 
A277: 120 | B277: 28 | C277: 5 | D277: 102 | E277: 102 | F277: =IF(D277=E277,"*","") -> * | G277: 102 | H277: 102 | I277: =IF(G277>D277,"*","") ->  | J277: =IF(AND(F277="",G277=MIN(E277,H277)),"*","") ->  | K277: =MAX(D277,G277) -> 102 | L277: =MIN(E277,H277) -> 102 | M277: =IF(K277=L277,"*","") -> *
A278: 120 | B278: 28 | C278: 6 | D278: 103 | E278: 103 | F278: =IF(D278=E278,"*","") -> * | G278: 103 | I278: =IF(G278>D278,"*","") ->  | J278: =IF(AND(F278="",G278=MIN(E278,H278)),"*","") ->  | K278: =MAX(D278,G278) -> 103 | L278: =MIN(E278,H278) -> 103 | M278: =IF(K278=L278,"*","") -> *
A279: 120 | B279: 28 | C279: 7 | D279: 102 | E279: 110 | F279: =IF(D279=E279,"*","") ->  | G279: 104 | I279: =IF(G279>D279,"*","") -> * | J279: =IF(AND(F279="",G279=MIN(E279,H279)),"*","") ->  | K279: =MAX(D279,G279) -> 104 | L279: =MIN(E279,H279) -> 110 | M279: =IF(K279=L279,"*","") -> 
A280: 120 | B280: 28 | C280: 8 | D280: 96 | E280: 100 | F280: =IF(D280=E280,"*","") ->  | G280: 96 | I280: =IF(G280>D280,"*","") ->  | J280: =IF(AND(F280="",G280=MIN(E280,H280)),"*","") ->  | K280: =MAX(D280,G280) -> 96 | L280: =MIN(E280,H280) -> 100 | M280: =IF(K280=L280,"*","") -> 
A281: 120 | B281: 28 | C281: 9 | D281: 94 | E281: 99 | F281: =IF(D281=E281,"*","") ->  | G281: 96 | I281: =IF(G281>D281,"*","") -> * | J281: =IF(AND(F281="",G281=MIN(E281,H281)),"*","") ->  | K281: =MAX(D281,G281) -> 96 | L281: =MIN(E281,H281) -> 99 | M281: =IF(K281=L281,"*","") -> 
A282: 120 | B282: 28 | C282: 10 | D282: 109 | E282: 117 | F282: =IF(D282=E282,"*","") ->  | G282: 113 | I282: =IF(G282>D282,"*","") -> * | J282: =IF(AND(F282="",G282=MIN(E282,H282)),"*","") ->  | K282: =MAX(D282,G282) -> 113 | L282: =MIN(E282,H282) -> 117 | M282: =IF(K282=L282,"*","") -> 
A283: 120 | B283: 29 | C283: 1 | D283: 104 | E283: 104 | F283: =IF(D283=E283,"*","") -> * | G283: 104 | H283: 104 | I283: =IF(G283>D283,"*","") ->  | J283: =IF(AND(F283="",G283=MIN(E283,H283)),"*","") ->  | K283: =MAX(D283,G283) -> 104 | L283: =MIN(E283,H283) -> 104 | M283: =IF(K283=L283,"*","") -> *
A284: 120 | B284: 29 | C284: 2 | D284: 91 | E284: 91 | F284: =IF(D284=E284,"*","") -> * | G284: 91 | H284: 91 | I284: =IF(G284>D284,"*","") ->  | J284: =IF(AND(F284="",G284=MIN(E284,H284)),"*","") ->  | K284: =MAX(D284,G284) -> 91 | L284: =MIN(E284,H284) -> 91 | M284: =IF(K284=L284,"*","") -> *
A285: 120 | B285: 29 | C285: 3 | D285: 93 | E285: 98 | F285: =IF(D285=E285,"*","") ->  | G285: 93 | I285: =IF(G285>D285,"*","") ->  | J285: =IF(AND(F285="",G285=MIN(E285,H285)),"*","") ->  | K285: =MAX(D285,G285) -> 93 | L285: =MIN(E285,H285) -> 98 | M285: =IF(K285=L285,"*","") -> 
A286: 120 | B286: 29 | C286: 4 | D286: 77 | E286: 80 | F286: =IF(D286=E286,"*","") ->  | G286: 78 | I286: =IF(G286>D286,"*","") -> * | J286: =IF(AND(F286="",G286=MIN(E286,H286)),"*","") ->  | K286: =MAX(D286,G286) -> 78 | L286: =MIN(E286,H286) -> 80 | M286: =IF(K286=L286,"*","") -> 
A287: 120 | B287: 29 | C287: 5 | D287: 102 | E287: 102 | F287: =IF(D287=E287,"*","") -> * | G287: 102 | I287: =IF(G287>D287,"*","") ->  | J287: =IF(AND(F287="",G287=MIN(E287,H287)),"*","") ->  | K287: =MAX(D287,G287) -> 102 | L287: =MIN(E287,H287) -> 102 | M287: =IF(K287=L287,"*","") -> *
A288: 120 | B288: 29 | C288: 6 | D288: 88 | E288: 91 | F288: =IF(D288=E288,"*","") ->  | G288: 88 | I288: =IF(G288>D288,"*","") ->  | J288: =IF(AND(F288="",G288=MIN(E288,H288)),"*","") ->  | K288: =MAX(D288,G288) -> 88 | L288: =MIN(E288,H288) -> 91 | M288: =IF(K288=L288,"*","") -> 
A289: 120 | B289: 29 | C289: 7 | D289: 97 | E289: 97 | F289: =IF(D289=E289,"*","") -> * | G289: 97 | I289: =IF(G289>D289,"*","") ->  | J289: =IF(AND(F289="",G289=MIN(E289,H289)),"*","") ->  | K289: =MAX(D289,G289) -> 97 | L289: =MIN(E289,H289) -> 97 | M289: =IF(K289=L289,"*","") -> *
A290: 120 | B290: 29 | C290: 8 | D290: 80 | E290: 80 | F290: =IF(D290=E290,"*","") -> * | G290: 80 | I290: =IF(G290>D290,"*","") ->  | J290: =IF(AND(F290="",G290=MIN(E290,H290)),"*","") ->  | K290: =MAX(D290,G290) -> 80 | L290: =MIN(E290,H290) -> 80 | M290: =IF(K290=L290,"*","") -> *
A291: 120 | B291: 29 | C291: 9 | D291: 97 | E291: 97 | F291: =IF(D291=E291,"*","") -> * | G291: 97 | H291: 97 | I291: =IF(G291>D291,"*","") ->  | J291: =IF(AND(F291="",G291=MIN(E291,H291)),"*","") ->  | K291: =MAX(D291,G291) -> 97 | L291: =MIN(E291,H291) -> 97 | M291: =IF(K291=L291,"*","") -> *
A292: 120 | B292: 29 | C292: 10 | D292: 96 | E292: 96 | F292: =IF(D292=E292,"*","") -> * | G292: 96 | H292: 96 | I292: =IF(G292>D292,"*","") ->  | J292: =IF(AND(F292="",G292=MIN(E292,H292)),"*","") ->  | K292: =MAX(D292,G292) -> 96 | L292: =MIN(E292,H292) -> 96 | M292: =IF(K292=L292,"*","") -> *
A293: 120 | B293: 30 | C293: 1 | D293: 102 | E293: 102 | F293: =IF(D293=E293,"*","") -> * | G293: 102 | H293: 102 | I293: =IF(G293>D293,"*","") ->  | J293: =IF(AND(F293="",G293=MIN(E293,H293)),"*","") ->  | K293: =MAX(D293,G293) -> 102 | L293: =MIN(E293,H293) -> 102 | M293: =IF(K293=L293,"*","") -> *
A294: 120 | B294: 30 | C294: 2 | D294: 112 | E294: 112 | F294: =IF(D294=E294,"*","") -> * | G294: 112 | H294: 112 | I294: =IF(G294>D294,"*","") ->  | J294: =IF(AND(F294="",G294=MIN(E294,H294)),"*","") ->  | K294: =MAX(D294,G294) -> 112 | L294: =MIN(E294,H294) -> 112 | M294: =IF(K294=L294,"*","") -> *
A295: 120 | B295: 30 | C295: 3 | D295: 108 | E295: 108 | F295: =IF(D295=E295,"*","") -> * | G295: 108 | H295: 108 | I295: =IF(G295>D295,"*","") ->  | J295: =IF(AND(F295="",G295=MIN(E295,H295)),"*","") ->  | K295: =MAX(D295,G295) -> 108 | L295: =MIN(E295,H295) -> 108 | M295: =IF(K295=L295,"*","") -> *
A296: 120 | B296: 30 | C296: 4 | D296: 83 | E296: 83 | F296: =IF(D296=E296,"*","") -> * | G296: 83 | H296: 83 | I296: =IF(G296>D296,"*","") ->  | J296: =IF(AND(F296="",G296=MIN(E296,H296)),"*","") ->  | K296: =MAX(D296,G296) -> 83 | L296: =MIN(E296,H296) -> 83 | M296: =IF(K296=L296,"*","") -> *
A297: 120 | B297: 30 | C297: 5 | D297: 81 | E297: 84 | F297: =IF(D297=E297,"*","") ->  | G297: 83 | I297: =IF(G297>D297,"*","") -> * | J297: =IF(AND(F297="",G297=MIN(E297,H297)),"*","") ->  | K297: =MAX(D297,G297) -> 83 | L297: =MIN(E297,H297) -> 84 | M297: =IF(K297=L297,"*","") -> 
A298: 120 | B298: 30 | C298: 6 | D298: 79 | E298: 79 | F298: =IF(D298=E298,"*","") -> * | G298: 79 | H298: 79 | I298: =IF(G298>D298,"*","") ->  | J298: =IF(AND(F298="",G298=MIN(E298,H298)),"*","") ->  | K298: =MAX(D298,G298) -> 79 | L298: =MIN(E298,H298) -> 79 | M298: =IF(K298=L298,"*","") -> *
A299: 120 | B299: 30 | C299: 7 | D299: 93 | E299: 93 | F299: =IF(D299=E299,"*","") -> * | G299: 93 | I299: =IF(G299>D299,"*","") ->  | J299: =IF(AND(F299="",G299=MIN(E299,H299)),"*","") ->  | K299: =MAX(D299,G299) -> 93 | L299: =MIN(E299,H299) -> 93 | M299: =IF(K299=L299,"*","") -> *
A300: 120 | B300: 30 | C300: 8 | D300: 79 | E300: 79 | F300: =IF(D300=E300,"*","") -> * | G300: 79 | H300: 79 | I300: =IF(G300>D300,"*","") ->  | J300: =IF(AND(F300="",G300=MIN(E300,H300)),"*","") ->  | K300: =MAX(D300,G300) -> 79 | L300: =MIN(E300,H300) -> 79 | M300: =IF(K300=L300,"*","") -> *
A301: 120 | B301: 30 | C301: 9 | D301: 93 | E301: 93 | F301: =IF(D301=E301,"*","") -> * | G301: 93 | H301: 93 | I301: =IF(G301>D301,"*","") ->  | J301: =IF(AND(F301="",G301=MIN(E301,H301)),"*","") ->  | K301: =MAX(D301,G301) -> 93 | L301: =MIN(E301,H301) -> 93 | M301: =IF(K301=L301,"*","") -> *
A302: 120 | B302: 30 | C302: 10 | D302: 86 | E302: 86 | F302: =IF(D302=E302,"*","") -> * | G302: 86 | H302: 86 | I302: =IF(G302>D302,"*","") ->  | J302: =IF(AND(F302="",G302=MIN(E302,H302)),"*","") ->  | K302: =MAX(D302,G302) -> 86 | L302: =MIN(E302,H302) -> 86 | M302: =IF(K302=L302,"*","") -> *
A303: 120 | B303: 31 | C303: 1 | D303: 178 | E303: 200 | F303: =IF(D303=E303,"*","") ->  | G303: 179 | I303: =IF(G303>D303,"*","") -> * | J303: =IF(AND(F303="",G303=MIN(E303,H303)),"*","") ->  | K303: =MAX(D303,G303) -> 179 | L303: =MIN(E303,H303) -> 200 | M303: =IF(K303=L303,"*","") -> 
A304: 120 | B304: 31 | C304: 2 | D304: 174 | E304: 195 | F304: =IF(D304=E304,"*","") ->  | G304: 174 | I304: =IF(G304>D304,"*","") ->  | J304: =IF(AND(F304="",G304=MIN(E304,H304)),"*","") ->  | K304: =MAX(D304,G304) -> 174 | L304: =MIN(E304,H304) -> 195 | M304: =IF(K304=L304,"*","") -> 
A305: 120 | B305: 31 | C305: 3 | D305: 156 | E305: 176 | F305: =IF(D305=E305,"*","") ->  | G305: 157 | I305: =IF(G305>D305,"*","") -> * | J305: =IF(AND(F305="",G305=MIN(E305,H305)),"*","") ->  | K305: =MAX(D305,G305) -> 157 | L305: =MIN(E305,H305) -> 176 | M305: =IF(K305=L305,"*","") -> 
A306: 120 | B306: 31 | C306: 4 | D306: 194 | E306: 222 | F306: =IF(D306=E306,"*","") ->  | G306: 185 | I306: =IF(G306>D306,"*","") ->  | J306: =IF(AND(F306="",G306=MIN(E306,H306)),"*","") ->  | K306: =MAX(D306,G306) -> 194 | L306: =MIN(E306,H306) -> 222 | M306: =IF(K306=L306,"*","") -> 
A307: 120 | B307: 31 | C307: 5 | D307: 184 | E307: 201 | F307: =IF(D307=E307,"*","") ->  | G307: 184 | I307: =IF(G307>D307,"*","") ->  | J307: =IF(AND(F307="",G307=MIN(E307,H307)),"*","") ->  | K307: =MAX(D307,G307) -> 184 | L307: =MIN(E307,H307) -> 201 | M307: =IF(K307=L307,"*","") -> 
A308: 120 | B308: 31 | C308: 6 | D308: 181 | E308: 196 | F308: =IF(D308=E308,"*","") ->  | G308: 181 | I308: =IF(G308>D308,"*","") ->  | J308: =IF(AND(F308="",G308=MIN(E308,H308)),"*","") ->  | K308: =MAX(D308,G308) -> 181 | L308: =MIN(E308,H308) -> 196 | M308: =IF(K308=L308,"*","") -> 
A309: 120 | B309: 31 | C309: 7 | D309: 189 | E309: 208 | F309: =IF(D309=E309,"*","") ->  | G309: 189 | I309: =IF(G309>D309,"*","") ->  | J309: =IF(AND(F309="",G309=MIN(E309,H309)),"*","") ->  | K309: =MAX(D309,G309) -> 189 | L309: =MIN(E309,H309) -> 208 | M309: =IF(K309=L309,"*","") -> 
A310: 120 | B310: 31 | C310: 8 | D310: 172 | E310: 194 | F310: =IF(D310=E310,"*","") ->  | G310: 170 | I310: =IF(G310>D310,"*","") ->  | J310: =IF(AND(F310="",G310=MIN(E310,H310)),"*","") ->  | K310: =MAX(D310,G310) -> 172 | L310: =MIN(E310,H310) -> 194 | M310: =IF(K310=L310,"*","") -> 
A311: 120 | B311: 31 | C311: 9 | D311: 173 | E311: 193 | F311: =IF(D311=E311,"*","") ->  | G311: 172 | I311: =IF(G311>D311,"*","") ->  | J311: =IF(AND(F311="",G311=MIN(E311,H311)),"*","") ->  | K311: =MAX(D311,G311) -> 173 | L311: =MIN(E311,H311) -> 193 | M311: =IF(K311=L311,"*","") -> 
A312: 120 | B312: 31 | C312: 10 | D312: 201 | E312: 232 | F312: =IF(D312=E312,"*","") ->  | G312: 198 | I312: =IF(G312>D312,"*","") ->  | J312: =IF(AND(F312="",G312=MIN(E312,H312)),"*","") ->  | K312: =MAX(D312,G312) -> 201 | L312: =MIN(E312,H312) -> 232 | M312: =IF(K312=L312,"*","") -> 
A313: 120 | B313: 32 | C313: 1 | D313: 142 | E313: 148 | F313: =IF(D313=E313,"*","") ->  | G313: 142 | I313: =IF(G313>D313,"*","") ->  | J313: =IF(AND(F313="",G313=MIN(E313,H313)),"*","") ->  | K313: =MAX(D313,G313) -> 142 | L313: =MIN(E313,H313) -> 148 | M313: =IF(K313=L313,"*","") -> 
A314: 120 | B314: 32 | C314: 2 | D314: 121 | E314: 133 | F314: =IF(D314=E314,"*","") ->  | G314: 121 | I314: =IF(G314>D314,"*","") ->  | J314: =IF(AND(F314="",G314=MIN(E314,H314)),"*","") ->  | K314: =MAX(D314,G314) -> 121 | L314: =MIN(E314,H314) -> 133 | M314: =IF(K314=L314,"*","") -> 
A315: 120 | B315: 32 | C315: 3 | D315: 133 | E315: 147 | F315: =IF(D315=E315,"*","") ->  | G315: 132 | I315: =IF(G315>D315,"*","") ->  | J315: =IF(AND(F315="",G315=MIN(E315,H315)),"*","") ->  | K315: =MAX(D315,G315) -> 133 | L315: =MIN(E315,H315) -> 147 | M315: =IF(K315=L315,"*","") -> 
A316: 120 | B316: 32 | C316: 4 | D316: 125 | E316: 137 | F316: =IF(D316=E316,"*","") ->  | G316: 126 | I316: =IF(G316>D316,"*","") -> * | J316: =IF(AND(F316="",G316=MIN(E316,H316)),"*","") ->  | K316: =MAX(D316,G316) -> 126 | L316: =MIN(E316,H316) -> 137 | M316: =IF(K316=L316,"*","") -> 
A317: 120 | B317: 32 | C317: 5 | D317: 131 | E317: 139 | F317: =IF(D317=E317,"*","") ->  | G317: 131 | I317: =IF(G317>D317,"*","") ->  | J317: =IF(AND(F317="",G317=MIN(E317,H317)),"*","") ->  | K317: =MAX(D317,G317) -> 131 | L317: =MIN(E317,H317) -> 139 | M317: =IF(K317=L317,"*","") -> 
A318: 120 | B318: 32 | C318: 6 | D318: 120 | E318: 130 | F318: =IF(D318=E318,"*","") ->  | G318: 120 | I318: =IF(G318>D318,"*","") ->  | J318: =IF(AND(F318="",G318=MIN(E318,H318)),"*","") ->  | K318: =MAX(D318,G318) -> 120 | L318: =MIN(E318,H318) -> 130 | M318: =IF(K318=L318,"*","") -> 
A319: 120 | B319: 32 | C319: 7 | D319: 117 | E319: 123 | F319: =IF(D319=E319,"*","") ->  | G319: 118 | I319: =IF(G319>D319,"*","") -> * | J319: =IF(AND(F319="",G319=MIN(E319,H319)),"*","") ->  | K319: =MAX(D319,G319) -> 118 | L319: =MIN(E319,H319) -> 123 | M319: =IF(K319=L319,"*","") -> 
A320: 120 | B320: 32 | C320: 8 | D320: 130 | E320: 136 | F320: =IF(D320=E320,"*","") ->  | G320: 131 | I320: =IF(G320>D320,"*","") -> * | J320: =IF(AND(F320="",G320=MIN(E320,H320)),"*","") ->  | K320: =MAX(D320,G320) -> 131 | L320: =MIN(E320,H320) -> 136 | M320: =IF(K320=L320,"*","") -> 
A321: 120 | B321: 32 | C321: 9 | D321: 123 | E321: 128 | F321: =IF(D321=E321,"*","") ->  | G321: 123 | I321: =IF(G321>D321,"*","") ->  | J321: =IF(AND(F321="",G321=MIN(E321,H321)),"*","") ->  | K321: =MAX(D321,G321) -> 123 | L321: =MIN(E321,H321) -> 128 | M321: =IF(K321=L321,"*","") -> 
A322: 120 | B322: 32 | C322: 10 | D322: 125 | E322: 133 | F322: =IF(D322=E322,"*","") ->  | G322: 125 | I322: =IF(G322>D322,"*","") ->  | J322: =IF(AND(F322="",G322=MIN(E322,H322)),"*","") ->  | K322: =MAX(D322,G322) -> 125 | L322: =MIN(E322,H322) -> 133 | M322: =IF(K322=L322,"*","") -> 
A323: 120 | B323: 33 | C323: 1 | D323: 104 | E323: 107 | F323: =IF(D323=E323,"*","") ->  | G323: 104 | I323: =IF(G323>D323,"*","") ->  | J323: =IF(AND(F323="",G323=MIN(E323,H323)),"*","") ->  | K323: =MAX(D323,G323) -> 104 | L323: =MIN(E323,H323) -> 107 | M323: =IF(K323=L323,"*","") -> 
A324: 120 | B324: 33 | C324: 2 | D324: 105 | E324: 114 | F324: =IF(D324=E324,"*","") ->  | G324: 104 | I324: =IF(G324>D324,"*","") ->  | J324: =IF(AND(F324="",G324=MIN(E324,H324)),"*","") ->  | K324: =MAX(D324,G324) -> 105 | L324: =MIN(E324,H324) -> 114 | M324: =IF(K324=L324,"*","") -> 
A325: 120 | B325: 33 | C325: 3 | D325: 100 | E325: 108 | F325: =IF(D325=E325,"*","") ->  | G325: 101 | I325: =IF(G325>D325,"*","") -> * | J325: =IF(AND(F325="",G325=MIN(E325,H325)),"*","") ->  | K325: =MAX(D325,G325) -> 101 | L325: =MIN(E325,H325) -> 108 | M325: =IF(K325=L325,"*","") -> 
A326: 120 | B326: 33 | C326: 4 | D326: 105 | E326: 113 | F326: =IF(D326=E326,"*","") ->  | G326: 105 | I326: =IF(G326>D326,"*","") ->  | J326: =IF(AND(F326="",G326=MIN(E326,H326)),"*","") ->  | K326: =MAX(D326,G326) -> 105 | L326: =MIN(E326,H326) -> 113 | M326: =IF(K326=L326,"*","") -> 
A327: 120 | B327: 33 | C327: 5 | D327: 131 | E327: 143 | F327: =IF(D327=E327,"*","") ->  | G327: 130 | I327: =IF(G327>D327,"*","") ->  | J327: =IF(AND(F327="",G327=MIN(E327,H327)),"*","") ->  | K327: =MAX(D327,G327) -> 131 | L327: =MIN(E327,H327) -> 143 | M327: =IF(K327=L327,"*","") -> 
A328: 120 | B328: 33 | C328: 6 | D328: 115 | E328: 116 | F328: =IF(D328=E328,"*","") ->  | G328: 115 | I328: =IF(G328>D328,"*","") ->  | J328: =IF(AND(F328="",G328=MIN(E328,H328)),"*","") ->  | K328: =MAX(D328,G328) -> 115 | L328: =MIN(E328,H328) -> 116 | M328: =IF(K328=L328,"*","") -> 
A329: 120 | B329: 33 | C329: 7 | D329: 120 | E329: 124 | F329: =IF(D329=E329,"*","") ->  | G329: 120 | I329: =IF(G329>D329,"*","") ->  | J329: =IF(AND(F329="",G329=MIN(E329,H329)),"*","") ->  | K329: =MAX(D329,G329) -> 120 | L329: =MIN(E329,H329) -> 124 | M329: =IF(K329=L329,"*","") -> 
A330: 120 | B330: 33 | C330: 8 | D330: 106 | E330: 112 | F330: =IF(D330=E330,"*","") ->  | G330: 106 | I330: =IF(G330>D330,"*","") ->  | J330: =IF(AND(F330="",G330=MIN(E330,H330)),"*","") ->  | K330: =MAX(D330,G330) -> 106 | L330: =MIN(E330,H330) -> 112 | M330: =IF(K330=L330,"*","") -> 
A331: 120 | B331: 33 | C331: 9 | D331: 108 | E331: 115 | F331: =IF(D331=E331,"*","") ->  | G331: 108 | I331: =IF(G331>D331,"*","") ->  | J331: =IF(AND(F331="",G331=MIN(E331,H331)),"*","") ->  | K331: =MAX(D331,G331) -> 108 | L331: =MIN(E331,H331) -> 115 | M331: =IF(K331=L331,"*","") -> 
A332: 120 | B332: 33 | C332: 10 | D332: 101 | E332: 107 | F332: =IF(D332=E332,"*","") ->  | G332: 101 | I332: =IF(G332>D332,"*","") ->  | J332: =IF(AND(F332="",G332=MIN(E332,H332)),"*","") ->  | K332: =MAX(D332,G332) -> 101 | L332: =MIN(E332,H332) -> 107 | M332: =IF(K332=L332,"*","") -> 
A333: 120 | B333: 34 | C333: 1 | D333: 75 | E333: 78 | F333: =IF(D333=E333,"*","") ->  | G333: 75 | I333: =IF(G333>D333,"*","") ->  | J333: =IF(AND(F333="",G333=MIN(E333,H333)),"*","") ->  | K333: =MAX(D333,G333) -> 75 | L333: =MIN(E333,H333) -> 78 | M333: =IF(K333=L333,"*","") -> 
A334: 120 | B334: 34 | C334: 2 | D334: 102 | E334: 105 | F334: =IF(D334=E334,"*","") ->  | G334: 102 | I334: =IF(G334>D334,"*","") ->  | J334: =IF(AND(F334="",G334=MIN(E334,H334)),"*","") ->  | K334: =MAX(D334,G334) -> 102 | L334: =MIN(E334,H334) -> 105 | M334: =IF(K334=L334,"*","") -> 
A335: 120 | B335: 34 | C335: 3 | D335: 98 | E335: 102 | F335: =IF(D335=E335,"*","") ->  | G335: 98 | I335: =IF(G335>D335,"*","") ->  | J335: =IF(AND(F335="",G335=MIN(E335,H335)),"*","") ->  | K335: =MAX(D335,G335) -> 98 | L335: =MIN(E335,H335) -> 102 | M335: =IF(K335=L335,"*","") -> 
A336: 120 | B336: 34 | C336: 4 | D336: 94 | E336: 95 | F336: =IF(D336=E336,"*","") ->  | G336: 95 | I336: =IF(G336>D336,"*","") -> * | J336: =IF(AND(F336="",G336=MIN(E336,H336)),"*","") -> * | K336: =MAX(D336,G336) -> 95 | L336: =MIN(E336,H336) -> 95 | M336: =IF(K336=L336,"*","") -> *
A337: 120 | B337: 34 | C337: 5 | D337: 100 | E337: 104 | F337: =IF(D337=E337,"*","") ->  | G337: 101 | I337: =IF(G337>D337,"*","") -> * | J337: =IF(AND(F337="",G337=MIN(E337,H337)),"*","") ->  | K337: =MAX(D337,G337) -> 101 | L337: =MIN(E337,H337) -> 104 | M337: =IF(K337=L337,"*","") -> 
A338: 120 | B338: 34 | C338: 6 | D338: 100 | E338: 100 | F338: =IF(D338=E338,"*","") -> * | G338: 100 | H338: 100 | I338: =IF(G338>D338,"*","") ->  | J338: =IF(AND(F338="",G338=MIN(E338,H338)),"*","") ->  | K338: =MAX(D338,G338) -> 100 | L338: =MIN(E338,H338) -> 100 | M338: =IF(K338=L338,"*","") -> *
A339: 120 | B339: 34 | C339: 7 | D339: 105 | E339: 105 | F339: =IF(D339=E339,"*","") -> * | G339: 105 | I339: =IF(G339>D339,"*","") ->  | J339: =IF(AND(F339="",G339=MIN(E339,H339)),"*","") ->  | K339: =MAX(D339,G339) -> 105 | L339: =MIN(E339,H339) -> 105 | M339: =IF(K339=L339,"*","") -> *
A340: 120 | B340: 34 | C340: 8 | D340: 85 | E340: 90 | F340: =IF(D340=E340,"*","") ->  | G340: 85 | I340: =IF(G340>D340,"*","") ->  | J340: =IF(AND(F340="",G340=MIN(E340,H340)),"*","") ->  | K340: =MAX(D340,G340) -> 85 | L340: =MIN(E340,H340) -> 90 | M340: =IF(K340=L340,"*","") -> 
A341: 120 | B341: 34 | C341: 9 | D341: 90 | E341: 95 | F341: =IF(D341=E341,"*","") ->  | G341: 90 | I341: =IF(G341>D341,"*","") ->  | J341: =IF(AND(F341="",G341=MIN(E341,H341)),"*","") ->  | K341: =MAX(D341,G341) -> 90 | L341: =MIN(E341,H341) -> 95 | M341: =IF(K341=L341,"*","") -> 
A342: 120 | B342: 34 | C342: 10 | D342: 101 | E342: 101 | F342: =IF(D342=E342,"*","") -> * | G342: 101 | H342: 101 | I342: =IF(G342>D342,"*","") ->  | J342: =IF(AND(F342="",G342=MIN(E342,H342)),"*","") ->  | K342: =MAX(D342,G342) -> 101 | L342: =MIN(E342,H342) -> 101 | M342: =IF(K342=L342,"*","") -> *
A343: 120 | B343: 35 | C343: 1 | D343: 87 | E343: 87 | F343: =IF(D343=E343,"*","") -> * | G343: 87 | I343: =IF(G343>D343,"*","") ->  | J343: =IF(AND(F343="",G343=MIN(E343,H343)),"*","") ->  | K343: =MAX(D343,G343) -> 87 | L343: =MIN(E343,H343) -> 87 | M343: =IF(K343=L343,"*","") -> *
A344: 120 | B344: 35 | C344: 2 | D344: 111 | E344: 111 | F344: =IF(D344=E344,"*","") -> * | G344: 111 | I344: =IF(G344>D344,"*","") ->  | J344: =IF(AND(F344="",G344=MIN(E344,H344)),"*","") ->  | K344: =MAX(D344,G344) -> 111 | L344: =MIN(E344,H344) -> 111 | M344: =IF(K344=L344,"*","") -> *
A345: 120 | B345: 35 | C345: 3 | D345: 77 | E345: 77 | F345: =IF(D345=E345,"*","") -> * | G345: 77 | I345: =IF(G345>D345,"*","") ->  | J345: =IF(AND(F345="",G345=MIN(E345,H345)),"*","") ->  | K345: =MAX(D345,G345) -> 77 | L345: =MIN(E345,H345) -> 77 | M345: =IF(K345=L345,"*","") -> *
A346: 120 | B346: 35 | C346: 4 | D346: 101 | E346: 101 | F346: =IF(D346=E346,"*","") -> * | G346: 101 | I346: =IF(G346>D346,"*","") ->  | J346: =IF(AND(F346="",G346=MIN(E346,H346)),"*","") ->  | K346: =MAX(D346,G346) -> 101 | L346: =MIN(E346,H346) -> 101 | M346: =IF(K346=L346,"*","") -> *
A347: 120 | B347: 35 | C347: 5 | D347: 92 | E347: 93 | F347: =IF(D347=E347,"*","") ->  | G347: 92 | I347: =IF(G347>D347,"*","") ->  | J347: =IF(AND(F347="",G347=MIN(E347,H347)),"*","") ->  | K347: =MAX(D347,G347) -> 92 | L347: =MIN(E347,H347) -> 93 | M347: =IF(K347=L347,"*","") -> 
A348: 120 | B348: 35 | C348: 6 | D348: 86 | E348: 86 | F348: =IF(D348=E348,"*","") -> * | G348: 86 | I348: =IF(G348>D348,"*","") ->  | J348: =IF(AND(F348="",G348=MIN(E348,H348)),"*","") ->  | K348: =MAX(D348,G348) -> 86 | L348: =MIN(E348,H348) -> 86 | M348: =IF(K348=L348,"*","") -> *
A349: 120 | B349: 35 | C349: 7 | D349: 99 | E349: 99 | F349: =IF(D349=E349,"*","") -> * | G349: 99 | I349: =IF(G349>D349,"*","") ->  | J349: =IF(AND(F349="",G349=MIN(E349,H349)),"*","") ->  | K349: =MAX(D349,G349) -> 99 | L349: =MIN(E349,H349) -> 99 | M349: =IF(K349=L349,"*","") -> *
A350: 120 | B350: 35 | C350: 8 | D350: 101 | E350: 101 | F350: =IF(D350=E350,"*","") -> * | G350: 101 | H350: 101 | I350: =IF(G350>D350,"*","") ->  | J350: =IF(AND(F350="",G350=MIN(E350,H350)),"*","") ->  | K350: =MAX(D350,G350) -> 101 | L350: =MIN(E350,H350) -> 101 | M350: =IF(K350=L350,"*","") -> *
A351: 120 | B351: 35 | C351: 9 | D351: 91 | E351: 91 | F351: =IF(D351=E351,"*","") -> * | G351: 91 | I351: =IF(G351>D351,"*","") ->  | J351: =IF(AND(F351="",G351=MIN(E351,H351)),"*","") ->  | K351: =MAX(D351,G351) -> 91 | L351: =MIN(E351,H351) -> 91 | M351: =IF(K351=L351,"*","") -> *
A352: 120 | B352: 35 | C352: 10 | D352: 86 | E352: 86 | F352: =IF(D352=E352,"*","") -> * | G352: 86 | I352: =IF(G352>D352,"*","") ->  | J352: =IF(AND(F352="",G352=MIN(E352,H352)),"*","") ->  | K352: =MAX(D352,G352) -> 86 | L352: =MIN(E352,H352) -> 86 | M352: =IF(K352=L352,"*","") -> *
A353: 120 | B353: 36 | C353: 1 | D353: 199 | E353: 212 | F353: =IF(D353=E353,"*","") ->  | G353: 199 | I353: =IF(G353>D353,"*","") ->  | J353: =IF(AND(F353="",G353=MIN(E353,H353)),"*","") ->  | K353: =MAX(D353,G353) -> 199 | L353: =MIN(E353,H353) -> 212 | M353: =IF(K353=L353,"*","") -> 
A354: 120 | B354: 36 | C354: 2 | D354: 206 | E354: 226 | F354: =IF(D354=E354,"*","") ->  | G354: 200 | I354: =IF(G354>D354,"*","") ->  | J354: =IF(AND(F354="",G354=MIN(E354,H354)),"*","") ->  | K354: =MAX(D354,G354) -> 206 | L354: =MIN(E354,H354) -> 226 | M354: =IF(K354=L354,"*","") -> 
A355: 120 | B355: 36 | C355: 3 | D355: 217 | E355: 230 | F355: =IF(D355=E355,"*","") ->  | G355: 217 | I355: =IF(G355>D355,"*","") ->  | J355: =IF(AND(F355="",G355=MIN(E355,H355)),"*","") ->  | K355: =MAX(D355,G355) -> 217 | L355: =MIN(E355,H355) -> 230 | M355: =IF(K355=L355,"*","") -> 
A356: 120 | B356: 36 | C356: 4 | D356: 217 | E356: 239 | F356: =IF(D356=E356,"*","") ->  | G356: 215 | I356: =IF(G356>D356,"*","") ->  | J356: =IF(AND(F356="",G356=MIN(E356,H356)),"*","") ->  | K356: =MAX(D356,G356) -> 217 | L356: =MIN(E356,H356) -> 239 | M356: =IF(K356=L356,"*","") -> 
A357: 120 | B357: 36 | C357: 5 | D357: 212 | E357: 232 | F357: =IF(D357=E357,"*","") ->  | G357: 207 | I357: =IF(G357>D357,"*","") ->  | J357: =IF(AND(F357="",G357=MIN(E357,H357)),"*","") ->  | K357: =MAX(D357,G357) -> 212 | L357: =MIN(E357,H357) -> 232 | M357: =IF(K357=L357,"*","") -> 
A358: 120 | B358: 36 | C358: 6 | D358: 207 | E358: 229 | F358: =IF(D358=E358,"*","") ->  | G358: 203 | I358: =IF(G358>D358,"*","") ->  | J358: =IF(AND(F358="",G358=MIN(E358,H358)),"*","") ->  | K358: =MAX(D358,G358) -> 207 | L358: =MIN(E358,H358) -> 229 | M358: =IF(K358=L358,"*","") -> 
A359: 120 | B359: 36 | C359: 7 | D359: 194 | E359: 212 | F359: =IF(D359=E359,"*","") ->  | G359: 193 | I359: =IF(G359>D359,"*","") ->  | J359: =IF(AND(F359="",G359=MIN(E359,H359)),"*","") ->  | K359: =MAX(D359,G359) -> 194 | L359: =MIN(E359,H359) -> 212 | M359: =IF(K359=L359,"*","") -> 
A360: 120 | B360: 36 | C360: 8 | D360: 156 | E360: 174 | F360: =IF(D360=E360,"*","") ->  | G360: 152 | I360: =IF(G360>D360,"*","") ->  | J360: =IF(AND(F360="",G360=MIN(E360,H360)),"*","") ->  | K360: =MAX(D360,G360) -> 156 | L360: =MIN(E360,H360) -> 174 | M360: =IF(K360=L360,"*","") -> 
A361: 120 | B361: 36 | C361: 9 | D361: 202 | E361: 224 | F361: =IF(D361=E361,"*","") ->  | G361: 199 | I361: =IF(G361>D361,"*","") ->  | J361: =IF(AND(F361="",G361=MIN(E361,H361)),"*","") ->  | K361: =MAX(D361,G361) -> 202 | L361: =MIN(E361,H361) -> 224 | M361: =IF(K361=L361,"*","") -> 
A362: 120 | B362: 36 | C362: 10 | D362: 198 | E362: 220 | F362: =IF(D362=E362,"*","") ->  | G362: 196 | I362: =IF(G362>D362,"*","") ->  | J362: =IF(AND(F362="",G362=MIN(E362,H362)),"*","") ->  | K362: =MAX(D362,G362) -> 198 | L362: =MIN(E362,H362) -> 220 | M362: =IF(K362=L362,"*","") -> 
A363: 120 | B363: 37 | C363: 1 | D363: 137 | E363: 146 | F363: =IF(D363=E363,"*","") ->  | G363: 138 | I363: =IF(G363>D363,"*","") -> * | J363: =IF(AND(F363="",G363=MIN(E363,H363)),"*","") ->  | K363: =MAX(D363,G363) -> 138 | L363: =MIN(E363,H363) -> 146 | M363: =IF(K363=L363,"*","") -> 
A364: 120 | B364: 37 | C364: 2 | D364: 140 | E364: 146 | F364: =IF(D364=E364,"*","") ->  | G364: 139 | I364: =IF(G364>D364,"*","") ->  | J364: =IF(AND(F364="",G364=MIN(E364,H364)),"*","") ->  | K364: =MAX(D364,G364) -> 140 | L364: =MIN(E364,H364) -> 146 | M364: =IF(K364=L364,"*","") -> 
A365: 120 | B365: 37 | C365: 3 | D365: 135 | E365: 141 | F365: =IF(D365=E365,"*","") ->  | G365: 135 | I365: =IF(G365>D365,"*","") ->  | J365: =IF(AND(F365="",G365=MIN(E365,H365)),"*","") ->  | K365: =MAX(D365,G365) -> 135 | L365: =MIN(E365,H365) -> 141 | M365: =IF(K365=L365,"*","") -> 
A366: 120 | B366: 37 | C366: 4 | D366: 155 | E366: 165 | F366: =IF(D366=E366,"*","") ->  | G366: 155 | I366: =IF(G366>D366,"*","") ->  | J366: =IF(AND(F366="",G366=MIN(E366,H366)),"*","") ->  | K366: =MAX(D366,G366) -> 155 | L366: =MIN(E366,H366) -> 165 | M366: =IF(K366=L366,"*","") -> 
A367: 120 | B367: 37 | C367: 5 | D367: 191 | E367: 208 | F367: =IF(D367=E367,"*","") ->  | G367: 191 | I367: =IF(G367>D367,"*","") ->  | J367: =IF(AND(F367="",G367=MIN(E367,H367)),"*","") ->  | K367: =MAX(D367,G367) -> 191 | L367: =MIN(E367,H367) -> 208 | M367: =IF(K367=L367,"*","") -> 
A368: 120 | B368: 37 | C368: 6 | D368: 153 | E368: 166 | F368: =IF(D368=E368,"*","") ->  | G368: 153 | I368: =IF(G368>D368,"*","") ->  | J368: =IF(AND(F368="",G368=MIN(E368,H368)),"*","") ->  | K368: =MAX(D368,G368) -> 153 | L368: =MIN(E368,H368) -> 166 | M368: =IF(K368=L368,"*","") -> 
A369: 120 | B369: 37 | C369: 7 | D369: 149 | E369: 163 | F369: =IF(D369=E369,"*","") ->  | G369: 149 | I369: =IF(G369>D369,"*","") ->  | J369: =IF(AND(F369="",G369=MIN(E369,H369)),"*","") ->  | K369: =MAX(D369,G369) -> 149 | L369: =MIN(E369,H369) -> 163 | M369: =IF(K369=L369,"*","") -> 
A370: 120 | B370: 37 | C370: 8 | D370: 168 | E370: 180 | F370: =IF(D370=E370,"*","") ->  | G370: 166 | I370: =IF(G370>D370,"*","") ->  | J370: =IF(AND(F370="",G370=MIN(E370,H370)),"*","") ->  | K370: =MAX(D370,G370) -> 168 | L370: =MIN(E370,H370) -> 180 | M370: =IF(K370=L370,"*","") -> 
A371: 120 | B371: 37 | C371: 9 | D371: 137 | E371: 143 | F371: =IF(D371=E371,"*","") ->  | G371: 137 | I371: =IF(G371>D371,"*","") ->  | J371: =IF(AND(F371="",G371=MIN(E371,H371)),"*","") ->  | K371: =MAX(D371,G371) -> 137 | L371: =MIN(E371,H371) -> 143 | M371: =IF(K371=L371,"*","") -> 
A372: 120 | B372: 37 | C372: 10 | D372: 126 | E372: 134 | F372: =IF(D372=E372,"*","") ->  | G372: 126 | I372: =IF(G372>D372,"*","") ->  | J372: =IF(AND(F372="",G372=MIN(E372,H372)),"*","") ->  | K372: =MAX(D372,G372) -> 126 | L372: =MIN(E372,H372) -> 134 | M372: =IF(K372=L372,"*","") -> 
A373: 120 | B373: 38 | C373: 1 | D373: 104 | E373: 108 | F373: =IF(D373=E373,"*","") ->  | G373: 104 | I373: =IF(G373>D373,"*","") ->  | J373: =IF(AND(F373="",G373=MIN(E373,H373)),"*","") ->  | K373: =MAX(D373,G373) -> 104 | L373: =MIN(E373,H373) -> 108 | M373: =IF(K373=L373,"*","") -> 
A374: 120 | B374: 38 | C374: 2 | D374: 118 | E374: 126 | F374: =IF(D374=E374,"*","") ->  | G374: 118 | I374: =IF(G374>D374,"*","") ->  | J374: =IF(AND(F374="",G374=MIN(E374,H374)),"*","") ->  | K374: =MAX(D374,G374) -> 118 | L374: =MIN(E374,H374) -> 126 | M374: =IF(K374=L374,"*","") -> 
A375: 120 | B375: 38 | C375: 3 | D375: 153 | E375: 157 | F375: =IF(D375=E375,"*","") ->  | G375: 153 | I375: =IF(G375>D375,"*","") ->  | J375: =IF(AND(F375="",G375=MIN(E375,H375)),"*","") ->  | K375: =MAX(D375,G375) -> 153 | L375: =MIN(E375,H375) -> 157 | M375: =IF(K375=L375,"*","") -> 
A376: 120 | B376: 38 | C376: 4 | D376: 137 | E376: 142 | F376: =IF(D376=E376,"*","") ->  | G376: 136 | I376: =IF(G376>D376,"*","") ->  | J376: =IF(AND(F376="",G376=MIN(E376,H376)),"*","") ->  | K376: =MAX(D376,G376) -> 137 | L376: =MIN(E376,H376) -> 142 | M376: =IF(K376=L376,"*","") -> 
A377: 120 | B377: 38 | C377: 5 | D377: 110 | E377: 114 | F377: =IF(D377=E377,"*","") ->  | G377: 109 | I377: =IF(G377>D377,"*","") ->  | J377: =IF(AND(F377="",G377=MIN(E377,H377)),"*","") ->  | K377: =MAX(D377,G377) -> 110 | L377: =MIN(E377,H377) -> 114 | M377: =IF(K377=L377,"*","") -> 
A378: 120 | B378: 38 | C378: 6 | D378: 118 | E378: 124 | F378: =IF(D378=E378,"*","") ->  | G378: 118 | I378: =IF(G378>D378,"*","") ->  | J378: =IF(AND(F378="",G378=MIN(E378,H378)),"*","") ->  | K378: =MAX(D378,G378) -> 118 | L378: =MIN(E378,H378) -> 124 | M378: =IF(K378=L378,"*","") -> 
A379: 120 | B379: 38 | C379: 7 | D379: 102 | E379: 105 | F379: =IF(D379=E379,"*","") ->  | G379: 102 | I379: =IF(G379>D379,"*","") ->  | J379: =IF(AND(F379="",G379=MIN(E379,H379)),"*","") ->  | K379: =MAX(D379,G379) -> 102 | L379: =MIN(E379,H379) -> 105 | M379: =IF(K379=L379,"*","") -> 
A380: 120 | B380: 38 | C380: 8 | D380: 120 | E380: 126 | F380: =IF(D380=E380,"*","") ->  | G380: 120 | I380: =IF(G380>D380,"*","") ->  | J380: =IF(AND(F380="",G380=MIN(E380,H380)),"*","") ->  | K380: =MAX(D380,G380) -> 120 | L380: =MIN(E380,H380) -> 126 | M380: =IF(K380=L380,"*","") -> 
A381: 120 | B381: 38 | C381: 9 | D381: 134 | E381: 135 | F381: =IF(D381=E381,"*","") ->  | G381: 134 | I381: =IF(G381>D381,"*","") ->  | J381: =IF(AND(F381="",G381=MIN(E381,H381)),"*","") ->  | K381: =MAX(D381,G381) -> 134 | L381: =MIN(E381,H381) -> 135 | M381: =IF(K381=L381,"*","") -> 
A382: 120 | B382: 38 | C382: 10 | D382: 136 | E382: 141 | F382: =IF(D382=E382,"*","") ->  | G382: 136 | I382: =IF(G382>D382,"*","") ->  | J382: =IF(AND(F382="",G382=MIN(E382,H382)),"*","") ->  | K382: =MAX(D382,G382) -> 136 | L382: =MIN(E382,H382) -> 141 | M382: =IF(K382=L382,"*","") -> 
A383: 120 | B383: 39 | C383: 1 | D383: 95 | E383: 95 | F383: =IF(D383=E383,"*","") -> * | G383: 95 | I383: =IF(G383>D383,"*","") ->  | J383: =IF(AND(F383="",G383=MIN(E383,H383)),"*","") ->  | K383: =MAX(D383,G383) -> 95 | L383: =MIN(E383,H383) -> 95 | M383: =IF(K383=L383,"*","") -> *
A384: 120 | B384: 39 | C384: 2 | D384: 104 | E384: 110 | F384: =IF(D384=E384,"*","") ->  | G384: 104 | I384: =IF(G384>D384,"*","") ->  | J384: =IF(AND(F384="",G384=MIN(E384,H384)),"*","") ->  | K384: =MAX(D384,G384) -> 104 | L384: =MIN(E384,H384) -> 110 | M384: =IF(K384=L384,"*","") -> 
A385: 120 | B385: 39 | C385: 3 | D385: 109 | E385: 113 | F385: =IF(D385=E385,"*","") ->  | G385: 109 | I385: =IF(G385>D385,"*","") ->  | J385: =IF(AND(F385="",G385=MIN(E385,H385)),"*","") ->  | K385: =MAX(D385,G385) -> 109 | L385: =MIN(E385,H385) -> 113 | M385: =IF(K385=L385,"*","") -> 
A386: 120 | B386: 39 | C386: 4 | D386: 97 | E386: 99 | F386: =IF(D386=E386,"*","") ->  | G386: 97 | I386: =IF(G386>D386,"*","") ->  | J386: =IF(AND(F386="",G386=MIN(E386,H386)),"*","") ->  | K386: =MAX(D386,G386) -> 97 | L386: =MIN(E386,H386) -> 99 | M386: =IF(K386=L386,"*","") -> 
A387: 120 | B387: 39 | C387: 5 | D387: 106 | E387: 106 | F387: =IF(D387=E387,"*","") -> * | G387: 106 | I387: =IF(G387>D387,"*","") ->  | J387: =IF(AND(F387="",G387=MIN(E387,H387)),"*","") ->  | K387: =MAX(D387,G387) -> 106 | L387: =MIN(E387,H387) -> 106 | M387: =IF(K387=L387,"*","") -> *
A388: 120 | B388: 39 | C388: 6 | D388: 95 | E388: 95 | F388: =IF(D388=E388,"*","") -> * | G388: 95 | I388: =IF(G388>D388,"*","") ->  | J388: =IF(AND(F388="",G388=MIN(E388,H388)),"*","") ->  | K388: =MAX(D388,G388) -> 95 | L388: =MIN(E388,H388) -> 95 | M388: =IF(K388=L388,"*","") -> *
A389: 120 | B389: 39 | C389: 7 | D389: 101 | E389: 105 | F389: =IF(D389=E389,"*","") ->  | G389: 101 | I389: =IF(G389>D389,"*","") ->  | J389: =IF(AND(F389="",G389=MIN(E389,H389)),"*","") ->  | K389: =MAX(D389,G389) -> 101 | L389: =MIN(E389,H389) -> 105 | M389: =IF(K389=L389,"*","") -> 
A390: 120 | B390: 39 | C390: 8 | D390: 93 | E390: 97 | F390: =IF(D390=E390,"*","") ->  | G390: 93 | I390: =IF(G390>D390,"*","") ->  | J390: =IF(AND(F390="",G390=MIN(E390,H390)),"*","") ->  | K390: =MAX(D390,G390) -> 93 | L390: =MIN(E390,H390) -> 97 | M390: =IF(K390=L390,"*","") -> 
A391: 120 | B391: 39 | C391: 9 | D391: 89 | E391: 93 | F391: =IF(D391=E391,"*","") ->  | G391: 89 | I391: =IF(G391>D391,"*","") ->  | J391: =IF(AND(F391="",G391=MIN(E391,H391)),"*","") ->  | K391: =MAX(D391,G391) -> 89 | L391: =MIN(E391,H391) -> 93 | M391: =IF(K391=L391,"*","") -> 
A392: 120 | B392: 39 | C392: 10 | D392: 104 | E392: 111 | F392: =IF(D392=E392,"*","") ->  | G392: 104 | I392: =IF(G392>D392,"*","") ->  | J392: =IF(AND(F392="",G392=MIN(E392,H392)),"*","") ->  | K392: =MAX(D392,G392) -> 104 | L392: =MIN(E392,H392) -> 111 | M392: =IF(K392=L392,"*","") -> 
A393: 120 | B393: 40 | C393: 1 | D393: 79 | E393: 81 | F393: =IF(D393=E393,"*","") ->  | G393: 78 | I393: =IF(G393>D393,"*","") ->  | J393: =IF(AND(F393="",G393=MIN(E393,H393)),"*","") ->  | K393: =MAX(D393,G393) -> 79 | L393: =MIN(E393,H393) -> 81 | M393: =IF(K393=L393,"*","") -> 
A394: 120 | B394: 40 | C394: 2 | D394: 90 | E394: 90 | F394: =IF(D394=E394,"*","") -> * | G394: 90 | I394: =IF(G394>D394,"*","") ->  | J394: =IF(AND(F394="",G394=MIN(E394,H394)),"*","") ->  | K394: =MAX(D394,G394) -> 90 | L394: =MIN(E394,H394) -> 90 | M394: =IF(K394=L394,"*","") -> *
A395: 120 | B395: 40 | C395: 3 | D395: 87 | E395: 87 | F395: =IF(D395=E395,"*","") -> * | G395: 87 | I395: =IF(G395>D395,"*","") ->  | J395: =IF(AND(F395="",G395=MIN(E395,H395)),"*","") ->  | K395: =MAX(D395,G395) -> 87 | L395: =MIN(E395,H395) -> 87 | M395: =IF(K395=L395,"*","") -> *
A396: 120 | B396: 40 | C396: 4 | D396: 112 | E396: 112 | F396: =IF(D396=E396,"*","") -> * | G396: 112 | I396: =IF(G396>D396,"*","") ->  | J396: =IF(AND(F396="",G396=MIN(E396,H396)),"*","") ->  | K396: =MAX(D396,G396) -> 112 | L396: =MIN(E396,H396) -> 112 | M396: =IF(K396=L396,"*","") -> *
A397: 120 | B397: 40 | C397: 5 | D397: 101 | E397: 101 | F397: =IF(D397=E397,"*","") -> * | G397: 101 | I397: =IF(G397>D397,"*","") ->  | J397: =IF(AND(F397="",G397=MIN(E397,H397)),"*","") ->  | K397: =MAX(D397,G397) -> 101 | L397: =MIN(E397,H397) -> 101 | M397: =IF(K397=L397,"*","") -> *
A398: 120 | B398: 40 | C398: 6 | D398: 90 | E398: 90 | F398: =IF(D398=E398,"*","") -> * | G398: 90 | I398: =IF(G398>D398,"*","") ->  | J398: =IF(AND(F398="",G398=MIN(E398,H398)),"*","") ->  | K398: =MAX(D398,G398) -> 90 | L398: =MIN(E398,H398) -> 90 | M398: =IF(K398=L398,"*","") -> *
A399: 120 | B399: 40 | C399: 7 | D399: 91 | E399: 91 | F399: =IF(D399=E399,"*","") -> * | G399: 91 | I399: =IF(G399>D399,"*","") ->  | J399: =IF(AND(F399="",G399=MIN(E399,H399)),"*","") ->  | K399: =MAX(D399,G399) -> 91 | L399: =MIN(E399,H399) -> 91 | M399: =IF(K399=L399,"*","") -> *
A400: 120 | B400: 40 | C400: 8 | D400: 97 | E400: 97 | F400: =IF(D400=E400,"*","") -> * | G400: 97 | I400: =IF(G400>D400,"*","") ->  | J400: =IF(AND(F400="",G400=MIN(E400,H400)),"*","") ->  | K400: =MAX(D400,G400) -> 97 | L400: =MIN(E400,H400) -> 97 | M400: =IF(K400=L400,"*","") -> *
A401: 120 | B401: 40 | C401: 9 | D401: 117 | E401: 117 | F401: =IF(D401=E401,"*","") -> * | G401: 117 | I401: =IF(G401>D401,"*","") ->  | J401: =IF(AND(F401="",G401=MIN(E401,H401)),"*","") ->  | K401: =MAX(D401,G401) -> 117 | L401: =MIN(E401,H401) -> 117 | M401: =IF(K401=L401,"*","") -> *
A402: 120 | B402: 40 | C402: 10 | D402: 96 | E402: 96 | F402: =IF(D402=E402,"*","") -> * | G402: 96 | I402: =IF(G402>D402,"*","") ->  | J402: =IF(AND(F402="",G402=MIN(E402,H402)),"*","") ->  | K402: =MAX(D402,G402) -> 96 | L402: =MIN(E402,H402) -> 96 | M402: =IF(K402=L402,"*","") -> *
A403: 120 | B403: 41 | C403: 1 | D403: 125 | E403: 127 | F403: =IF(D403=E403,"*","") ->  | G403: 127 | H403: 127 | I403: =IF(G403>D403,"*","") -> * | J403: =IF(AND(F403="",G403=MIN(E403,H403)),"*","") -> * | K403: =MAX(D403,G403) -> 127 | L403: =MIN(E403,H403) -> 127 | M403: =IF(K403=L403,"*","") -> *
A404: 120 | B404: 41 | C404: 2 | D404: 139 | E404: 141 | F404: =IF(D404=E404,"*","") ->  | G404: 134 | I404: =IF(G404>D404,"*","") ->  | J404: =IF(AND(F404="",G404=MIN(E404,H404)),"*","") ->  | K404: =MAX(D404,G404) -> 139 | L404: =MIN(E404,H404) -> 141 | M404: =IF(K404=L404,"*","") -> 
A405: 120 | B405: 41 | C405: 3 | D405: 132 | E405: 141 | F405: =IF(D405=E405,"*","") ->  | G405: 141 | H405: 141 | I405: =IF(G405>D405,"*","") -> * | J405: =IF(AND(F405="",G405=MIN(E405,H405)),"*","") -> * | K405: =MAX(D405,G405) -> 141 | L405: =MIN(E405,H405) -> 141 | M405: =IF(K405=L405,"*","") -> *
A406: 120 | B406: 41 | C406: 4 | D406: 107 | E406: 116 | F406: =IF(D406=E406,"*","") ->  | G406: 116 | H406: 116 | I406: =IF(G406>D406,"*","") -> * | J406: =IF(AND(F406="",G406=MIN(E406,H406)),"*","") -> * | K406: =MAX(D406,G406) -> 116 | L406: =MIN(E406,H406) -> 116 | M406: =IF(K406=L406,"*","") -> *
A407: 120 | B407: 41 | C407: 5 | D407: 137 | E407: 138 | F407: =IF(D407=E407,"*","") ->  | G407: 138 | H407: 138 | I407: =IF(G407>D407,"*","") -> * | J407: =IF(AND(F407="",G407=MIN(E407,H407)),"*","") -> * | K407: =MAX(D407,G407) -> 138 | L407: =MIN(E407,H407) -> 138 | M407: =IF(K407=L407,"*","") -> *
A408: 120 | B408: 41 | C408: 6 | D408: 103 | E408: 113 | F408: =IF(D408=E408,"*","") ->  | G408: 113 | H408: 113 | I408: =IF(G408>D408,"*","") -> * | J408: =IF(AND(F408="",G408=MIN(E408,H408)),"*","") -> * | K408: =MAX(D408,G408) -> 113 | L408: =MIN(E408,H408) -> 113 | M408: =IF(K408=L408,"*","") -> *
A409: 120 | B409: 41 | C409: 7 | D409: 102 | E409: 110 | F409: =IF(D409=E409,"*","") ->  | G409: 109 | I409: =IF(G409>D409,"*","") -> * | J409: =IF(AND(F409="",G409=MIN(E409,H409)),"*","") ->  | K409: =MAX(D409,G409) -> 109 | L409: =MIN(E409,H409) -> 110 | M409: =IF(K409=L409,"*","") -> 
A410: 120 | B410: 41 | C410: 8 | D410: 135 | E410: 138 | F410: =IF(D410=E410,"*","") ->  | G410: 138 | I410: =IF(G410>D410,"*","") -> * | J410: =IF(AND(F410="",G410=MIN(E410,H410)),"*","") -> * | K410: =MAX(D410,G410) -> 138 | L410: =MIN(E410,H410) -> 138 | M410: =IF(K410=L410,"*","") -> *
A411: 120 | B411: 41 | C411: 9 | D411: 112 | E411: 121 | F411: =IF(D411=E411,"*","") ->  | G411: 120 | I411: =IF(G411>D411,"*","") -> * | J411: =IF(AND(F411="",G411=MIN(E411,H411)),"*","") ->  | K411: =MAX(D411,G411) -> 120 | L411: =MIN(E411,H411) -> 121 | M411: =IF(K411=L411,"*","") -> 
A412: 120 | B412: 41 | C412: 10 | D412: 128 | E412: 136 | F412: =IF(D412=E412,"*","") ->  | G412: 136 | H412: 136 | I412: =IF(G412>D412,"*","") -> * | J412: =IF(AND(F412="",G412=MIN(E412,H412)),"*","") -> * | K412: =MAX(D412,G412) -> 136 | L412: =MIN(E412,H412) -> 136 | M412: =IF(K412=L412,"*","") -> *
A413: 120 | B413: 42 | C413: 1 | D413: 104 | E413: 108 | F413: =IF(D413=E413,"*","") ->  | G413: 104 | I413: =IF(G413>D413,"*","") ->  | J413: =IF(AND(F413="",G413=MIN(E413,H413)),"*","") ->  | K413: =MAX(D413,G413) -> 104 | L413: =MIN(E413,H413) -> 108 | M413: =IF(K413=L413,"*","") -> 
A414: 120 | B414: 42 | C414: 2 | D414: 126 | E414: 126 | F414: =IF(D414=E414,"*","") -> * | G414: 126 | H414: 126 | I414: =IF(G414>D414,"*","") ->  | J414: =IF(AND(F414="",G414=MIN(E414,H414)),"*","") ->  | K414: =MAX(D414,G414) -> 126 | L414: =MIN(E414,H414) -> 126 | M414: =IF(K414=L414,"*","") -> *
A415: 120 | B415: 42 | C415: 3 | D415: 104 | E415: 106 | F415: =IF(D415=E415,"*","") ->  | G415: 106 | H415: 106 | I415: =IF(G415>D415,"*","") -> * | J415: =IF(AND(F415="",G415=MIN(E415,H415)),"*","") -> * | K415: =MAX(D415,G415) -> 106 | L415: =MIN(E415,H415) -> 106 | M415: =IF(K415=L415,"*","") -> *
A416: 120 | B416: 42 | C416: 4 | D416: 104 | E416: 104 | F416: =IF(D416=E416,"*","") -> * | G416: 104 | H416: 104 | I416: =IF(G416>D416,"*","") ->  | J416: =IF(AND(F416="",G416=MIN(E416,H416)),"*","") ->  | K416: =MAX(D416,G416) -> 104 | L416: =MIN(E416,H416) -> 104 | M416: =IF(K416=L416,"*","") -> *
A417: 120 | B417: 42 | C417: 5 | D417: 114 | E417: 120 | F417: =IF(D417=E417,"*","") ->  | G417: 118 | I417: =IF(G417>D417,"*","") -> * | J417: =IF(AND(F417="",G417=MIN(E417,H417)),"*","") ->  | K417: =MAX(D417,G417) -> 118 | L417: =MIN(E417,H417) -> 120 | M417: =IF(K417=L417,"*","") -> 
A418: 120 | B418: 42 | C418: 6 | D418: 106 | E418: 119 | F418: =IF(D418=E418,"*","") ->  | G418: 119 | H418: 119 | I418: =IF(G418>D418,"*","") -> * | J418: =IF(AND(F418="",G418=MIN(E418,H418)),"*","") -> * | K418: =MAX(D418,G418) -> 119 | L418: =MIN(E418,H418) -> 119 | M418: =IF(K418=L418,"*","") -> *
A419: 120 | B419: 42 | C419: 7 | D419: 123 | E419: 123 | F419: =IF(D419=E419,"*","") -> * | G419: 123 | H419: 123 | I419: =IF(G419>D419,"*","") ->  | J419: =IF(AND(F419="",G419=MIN(E419,H419)),"*","") ->  | K419: =MAX(D419,G419) -> 123 | L419: =MIN(E419,H419) -> 123 | M419: =IF(K419=L419,"*","") -> *
A420: 120 | B420: 42 | C420: 8 | D420: 108 | E420: 114 | F420: =IF(D420=E420,"*","") ->  | G420: 112 | I420: =IF(G420>D420,"*","") -> * | J420: =IF(AND(F420="",G420=MIN(E420,H420)),"*","") ->  | K420: =MAX(D420,G420) -> 112 | L420: =MIN(E420,H420) -> 114 | M420: =IF(K420=L420,"*","") -> 
A421: 120 | B421: 42 | C421: 9 | D421: 102 | E421: 104 | F421: =IF(D421=E421,"*","") ->  | G421: 104 | H421: 104 | I421: =IF(G421>D421,"*","") -> * | J421: =IF(AND(F421="",G421=MIN(E421,H421)),"*","") -> * | K421: =MAX(D421,G421) -> 104 | L421: =MIN(E421,H421) -> 104 | M421: =IF(K421=L421,"*","") -> *
A422: 120 | B422: 42 | C422: 10 | D422: 110 | E422: 118 | F422: =IF(D422=E422,"*","") ->  | G422: 118 | H422: 118 | I422: =IF(G422>D422,"*","") -> * | J422: =IF(AND(F422="",G422=MIN(E422,H422)),"*","") -> * | K422: =MAX(D422,G422) -> 118 | L422: =MIN(E422,H422) -> 118 | M422: =IF(K422=L422,"*","") -> *
A423: 120 | B423: 43 | C423: 1 | D423: 105 | E423: 105 | F423: =IF(D423=E423,"*","") -> * | G423: 105 | H423: 105 | I423: =IF(G423>D423,"*","") ->  | J423: =IF(AND(F423="",G423=MIN(E423,H423)),"*","") ->  | K423: =MAX(D423,G423) -> 105 | L423: =MIN(E423,H423) -> 105 | M423: =IF(K423=L423,"*","") -> *
A424: 120 | B424: 43 | C424: 2 | D424: 120 | E424: 120 | F424: =IF(D424=E424,"*","") -> * | G424: 120 | H424: 120 | I424: =IF(G424>D424,"*","") ->  | J424: =IF(AND(F424="",G424=MIN(E424,H424)),"*","") ->  | K424: =MAX(D424,G424) -> 120 | L424: =MIN(E424,H424) -> 120 | M424: =IF(K424=L424,"*","") -> *
A425: 120 | B425: 43 | C425: 3 | D425: 95 | E425: 95 | F425: =IF(D425=E425,"*","") -> * | G425: 95 | H425: 95 | I425: =IF(G425>D425,"*","") ->  | J425: =IF(AND(F425="",G425=MIN(E425,H425)),"*","") ->  | K425: =MAX(D425,G425) -> 95 | L425: =MIN(E425,H425) -> 95 | M425: =IF(K425=L425,"*","") -> *
A426: 120 | B426: 43 | C426: 4 | D426: 101 | E426: 105 | F426: =IF(D426=E426,"*","") ->  | G426: 105 | H426: 105 | I426: =IF(G426>D426,"*","") -> * | J426: =IF(AND(F426="",G426=MIN(E426,H426)),"*","") -> * | K426: =MAX(D426,G426) -> 105 | L426: =MIN(E426,H426) -> 105 | M426: =IF(K426=L426,"*","") -> *
A427: 120 | B427: 43 | C427: 5 | D427: 105 | E427: 105 | F427: =IF(D427=E427,"*","") -> * | G427: 105 | H427: 105 | I427: =IF(G427>D427,"*","") ->  | J427: =IF(AND(F427="",G427=MIN(E427,H427)),"*","") ->  | K427: =MAX(D427,G427) -> 105 | L427: =MIN(E427,H427) -> 105 | M427: =IF(K427=L427,"*","") -> *
A428: 120 | B428: 43 | C428: 6 | D428: 93 | E428: 98 | F428: =IF(D428=E428,"*","") ->  | G428: 98 | H428: 98 | I428: =IF(G428>D428,"*","") -> * | J428: =IF(AND(F428="",G428=MIN(E428,H428)),"*","") -> * | K428: =MAX(D428,G428) -> 98 | L428: =MIN(E428,H428) -> 98 | M428: =IF(K428=L428,"*","") -> *
A429: 120 | B429: 43 | C429: 7 | D429: 121 | E429: 122 | F429: =IF(D429=E429,"*","") ->  | G429: 122 | H429: 122 | I429: =IF(G429>D429,"*","") -> * | J429: =IF(AND(F429="",G429=MIN(E429,H429)),"*","") -> * | K429: =MAX(D429,G429) -> 122 | L429: =MIN(E429,H429) -> 122 | M429: =IF(K429=L429,"*","") -> *
A430: 120 | B430: 43 | C430: 8 | D430: 115 | E430: 115 | F430: =IF(D430=E430,"*","") -> * | G430: 115 | H430: 115 | I430: =IF(G430>D430,"*","") ->  | J430: =IF(AND(F430="",G430=MIN(E430,H430)),"*","") ->  | K430: =MAX(D430,G430) -> 115 | L430: =MIN(E430,H430) -> 115 | M430: =IF(K430=L430,"*","") -> *
A431: 120 | B431: 43 | C431: 9 | D431: 105 | E431: 105 | F431: =IF(D431=E431,"*","") -> * | G431: 105 | H431: 105 | I431: =IF(G431>D431,"*","") ->  | J431: =IF(AND(F431="",G431=MIN(E431,H431)),"*","") ->  | K431: =MAX(D431,G431) -> 105 | L431: =MIN(E431,H431) -> 105 | M431: =IF(K431=L431,"*","") -> *
A432: 120 | B432: 43 | C432: 10 | D432: 113 | E432: 113 | F432: =IF(D432=E432,"*","") -> * | G432: 113 | H432: 113 | I432: =IF(G432>D432,"*","") ->  | J432: =IF(AND(F432="",G432=MIN(E432,H432)),"*","") ->  | K432: =MAX(D432,G432) -> 113 | L432: =MIN(E432,H432) -> 113 | M432: =IF(K432=L432,"*","") -> *
A433: 120 | B433: 44 | C433: 1 | D433: 100 | E433: 100 | F433: =IF(D433=E433,"*","") -> * | G433: 100 | H433: 100 | I433: =IF(G433>D433,"*","") ->  | J433: =IF(AND(F433="",G433=MIN(E433,H433)),"*","") ->  | K433: =MAX(D433,G433) -> 100 | L433: =MIN(E433,H433) -> 100 | M433: =IF(K433=L433,"*","") -> *
A434: 120 | B434: 44 | C434: 2 | D434: 112 | E434: 112 | F434: =IF(D434=E434,"*","") -> * | G434: 112 | H434: 112 | I434: =IF(G434>D434,"*","") ->  | J434: =IF(AND(F434="",G434=MIN(E434,H434)),"*","") ->  | K434: =MAX(D434,G434) -> 112 | L434: =MIN(E434,H434) -> 112 | M434: =IF(K434=L434,"*","") -> *
A435: 120 | B435: 44 | C435: 3 | D435: 107 | E435: 107 | F435: =IF(D435=E435,"*","") -> * | G435: 107 | H435: 107 | I435: =IF(G435>D435,"*","") ->  | J435: =IF(AND(F435="",G435=MIN(E435,H435)),"*","") ->  | K435: =MAX(D435,G435) -> 107 | L435: =MIN(E435,H435) -> 107 | M435: =IF(K435=L435,"*","") -> *
A436: 120 | B436: 44 | C436: 4 | D436: 95 | E436: 95 | F436: =IF(D436=E436,"*","") -> * | G436: 95 | H436: 95 | I436: =IF(G436>D436,"*","") ->  | J436: =IF(AND(F436="",G436=MIN(E436,H436)),"*","") ->  | K436: =MAX(D436,G436) -> 95 | L436: =MIN(E436,H436) -> 95 | M436: =IF(K436=L436,"*","") -> *
A437: 120 | B437: 44 | C437: 5 | D437: 98 | E437: 98 | F437: =IF(D437=E437,"*","") -> * | G437: 98 | H437: 98 | I437: =IF(G437>D437,"*","") ->  | J437: =IF(AND(F437="",G437=MIN(E437,H437)),"*","") ->  | K437: =MAX(D437,G437) -> 98 | L437: =MIN(E437,H437) -> 98 | M437: =IF(K437=L437,"*","") -> *
A438: 120 | B438: 44 | C438: 6 | D438: 106 | E438: 106 | F438: =IF(D438=E438,"*","") -> * | G438: 106 | H438: 106 | I438: =IF(G438>D438,"*","") ->  | J438: =IF(AND(F438="",G438=MIN(E438,H438)),"*","") ->  | K438: =MAX(D438,G438) -> 106 | L438: =MIN(E438,H438) -> 106 | M438: =IF(K438=L438,"*","") -> *
A439: 120 | B439: 44 | C439: 7 | D439: 98 | E439: 98 | F439: =IF(D439=E439,"*","") -> * | G439: 98 | H439: 98 | I439: =IF(G439>D439,"*","") ->  | J439: =IF(AND(F439="",G439=MIN(E439,H439)),"*","") ->  | K439: =MAX(D439,G439) -> 98 | L439: =MIN(E439,H439) -> 98 | M439: =IF(K439=L439,"*","") -> *
A440: 120 | B440: 44 | C440: 8 | D440: 107 | E440: 108 | F440: =IF(D440=E440,"*","") ->  | G440: 108 | H440: 108 | I440: =IF(G440>D440,"*","") -> * | J440: =IF(AND(F440="",G440=MIN(E440,H440)),"*","") -> * | K440: =MAX(D440,G440) -> 108 | L440: =MIN(E440,H440) -> 108 | M440: =IF(K440=L440,"*","") -> *
A441: 120 | B441: 44 | C441: 9 | D441: 91 | E441: 91 | F441: =IF(D441=E441,"*","") -> * | G441: 91 | H441: 91 | I441: =IF(G441>D441,"*","") ->  | J441: =IF(AND(F441="",G441=MIN(E441,H441)),"*","") ->  | K441: =MAX(D441,G441) -> 91 | L441: =MIN(E441,H441) -> 91 | M441: =IF(K441=L441,"*","") -> *
A442: 120 | B442: 44 | C442: 10 | D442: 98 | E442: 98 | F442: =IF(D442=E442,"*","") -> * | G442: 98 | H442: 98 | I442: =IF(G442>D442,"*","") ->  | J442: =IF(AND(F442="",G442=MIN(E442,H442)),"*","") ->  | K442: =MAX(D442,G442) -> 98 | L442: =MIN(E442,H442) -> 98 | M442: =IF(K442=L442,"*","") -> *
A443: 120 | B443: 45 | C443: 1 | D443: 108 | E443: 108 | F443: =IF(D443=E443,"*","") -> * | G443: 108 | H443: 108 | I443: =IF(G443>D443,"*","") ->  | J443: =IF(AND(F443="",G443=MIN(E443,H443)),"*","") ->  | K443: =MAX(D443,G443) -> 108 | L443: =MIN(E443,H443) -> 108 | M443: =IF(K443=L443,"*","") -> *
A444: 120 | B444: 45 | C444: 2 | D444: 91 | E444: 91 | F444: =IF(D444=E444,"*","") -> * | G444: 91 | H444: 91 | I444: =IF(G444>D444,"*","") ->  | J444: =IF(AND(F444="",G444=MIN(E444,H444)),"*","") ->  | K444: =MAX(D444,G444) -> 91 | L444: =MIN(E444,H444) -> 91 | M444: =IF(K444=L444,"*","") -> *
A445: 120 | B445: 45 | C445: 3 | D445: 98 | E445: 98 | F445: =IF(D445=E445,"*","") -> * | G445: 98 | H445: 98 | I445: =IF(G445>D445,"*","") ->  | J445: =IF(AND(F445="",G445=MIN(E445,H445)),"*","") ->  | K445: =MAX(D445,G445) -> 98 | L445: =MIN(E445,H445) -> 98 | M445: =IF(K445=L445,"*","") -> *
A446: 120 | B446: 45 | C446: 4 | D446: 103 | E446: 103 | F446: =IF(D446=E446,"*","") -> * | G446: 103 | H446: 103 | I446: =IF(G446>D446,"*","") ->  | J446: =IF(AND(F446="",G446=MIN(E446,H446)),"*","") ->  | K446: =MAX(D446,G446) -> 103 | L446: =MIN(E446,H446) -> 103 | M446: =IF(K446=L446,"*","") -> *
A447: 120 | B447: 45 | C447: 5 | D447: 114 | E447: 116 | F447: =IF(D447=E447,"*","") ->  | G447: 116 | H447: 116 | I447: =IF(G447>D447,"*","") -> * | J447: =IF(AND(F447="",G447=MIN(E447,H447)),"*","") -> * | K447: =MAX(D447,G447) -> 116 | L447: =MIN(E447,H447) -> 116 | M447: =IF(K447=L447,"*","") -> *
A448: 120 | B448: 45 | C448: 6 | D448: 125 | E448: 125 | F448: =IF(D448=E448,"*","") -> * | G448: 125 | H448: 125 | I448: =IF(G448>D448,"*","") ->  | J448: =IF(AND(F448="",G448=MIN(E448,H448)),"*","") ->  | K448: =MAX(D448,G448) -> 125 | L448: =MIN(E448,H448) -> 125 | M448: =IF(K448=L448,"*","") -> *
A449: 120 | B449: 45 | C449: 7 | D449: 103 | E449: 103 | F449: =IF(D449=E449,"*","") -> * | G449: 103 | H449: 103 | I449: =IF(G449>D449,"*","") ->  | J449: =IF(AND(F449="",G449=MIN(E449,H449)),"*","") ->  | K449: =MAX(D449,G449) -> 103 | L449: =MIN(E449,H449) -> 103 | M449: =IF(K449=L449,"*","") -> *
A450: 120 | B450: 45 | C450: 8 | D450: 103 | E450: 103 | F450: =IF(D450=E450,"*","") -> * | G450: 103 | H450: 103 | I450: =IF(G450>D450,"*","") ->  | J450: =IF(AND(F450="",G450=MIN(E450,H450)),"*","") ->  | K450: =MAX(D450,G450) -> 103 | L450: =MIN(E450,H450) -> 103 | M450: =IF(K450=L450,"*","") -> *
A451: 120 | B451: 45 | C451: 9 | D451: 114 | E451: 114 | F451: =IF(D451=E451,"*","") -> * | G451: 114 | H451: 114 | I451: =IF(G451>D451,"*","") ->  | J451: =IF(AND(F451="",G451=MIN(E451,H451)),"*","") ->  | K451: =MAX(D451,G451) -> 114 | L451: =MIN(E451,H451) -> 114 | M451: =IF(K451=L451,"*","") -> *
A452: 120 | B452: 45 | C452: 10 | D452: 99 | E452: 99 | F452: =IF(D452=E452,"*","") -> * | G452: 99 | H452: 99 | I452: =IF(G452>D452,"*","") ->  | J452: =IF(AND(F452="",G452=MIN(E452,H452)),"*","") ->  | K452: =MAX(D452,G452) -> 99 | L452: =MIN(E452,H452) -> 99 | M452: =IF(K452=L452,"*","") -> *
A453: 120 | B453: 46 | C453: 1 | D453: 160 | E453: 189 | F453: =IF(D453=E453,"*","") ->  | G453: 158 | I453: =IF(G453>D453,"*","") ->  | J453: =IF(AND(F453="",G453=MIN(E453,H453)),"*","") ->  | K453: =MAX(D453,G453) -> 160 | L453: =MIN(E453,H453) -> 189 | M453: =IF(K453=L453,"*","") -> 
A454: 120 | B454: 46 | C454: 2 | D454: 173 | E454: 199 | F454: =IF(D454=E454,"*","") ->  | G454: 172 | I454: =IF(G454>D454,"*","") ->  | J454: =IF(AND(F454="",G454=MIN(E454,H454)),"*","") ->  | K454: =MAX(D454,G454) -> 173 | L454: =MIN(E454,H454) -> 199 | M454: =IF(K454=L454,"*","") -> 
A455: 120 | B455: 46 | C455: 3 | D455: 151 | E455: 177 | F455: =IF(D455=E455,"*","") ->  | G455: 151 | I455: =IF(G455>D455,"*","") ->  | J455: =IF(AND(F455="",G455=MIN(E455,H455)),"*","") ->  | K455: =MAX(D455,G455) -> 151 | L455: =MIN(E455,H455) -> 177 | M455: =IF(K455=L455,"*","") -> 
A456: 120 | B456: 46 | C456: 4 | D456: 160 | E456: 170 | F456: =IF(D456=E456,"*","") ->  | G456: 152 | I456: =IF(G456>D456,"*","") ->  | J456: =IF(AND(F456="",G456=MIN(E456,H456)),"*","") ->  | K456: =MAX(D456,G456) -> 160 | L456: =MIN(E456,H456) -> 170 | M456: =IF(K456=L456,"*","") -> 
A457: 120 | B457: 46 | C457: 5 | D457: 133 | E457: 151 | F457: =IF(D457=E457,"*","") ->  | G457: 134 | I457: =IF(G457>D457,"*","") -> * | J457: =IF(AND(F457="",G457=MIN(E457,H457)),"*","") ->  | K457: =MAX(D457,G457) -> 134 | L457: =MIN(E457,H457) -> 151 | M457: =IF(K457=L457,"*","") -> 
A458: 120 | B458: 46 | C458: 6 | D458: 169 | E458: 180 | F458: =IF(D458=E458,"*","") ->  | G458: 159 | I458: =IF(G458>D458,"*","") ->  | J458: =IF(AND(F458="",G458=MIN(E458,H458)),"*","") ->  | K458: =MAX(D458,G458) -> 169 | L458: =MIN(E458,H458) -> 180 | M458: =IF(K458=L458,"*","") -> 
A459: 120 | B459: 46 | C459: 7 | D459: 150 | E459: 172 | F459: =IF(D459=E459,"*","") ->  | G459: 154 | I459: =IF(G459>D459,"*","") -> * | J459: =IF(AND(F459="",G459=MIN(E459,H459)),"*","") ->  | K459: =MAX(D459,G459) -> 154 | L459: =MIN(E459,H459) -> 172 | M459: =IF(K459=L459,"*","") -> 
A460: 120 | B460: 46 | C460: 8 | D460: 163 | E460: 178 | F460: =IF(D460=E460,"*","") ->  | G460: 156 | I460: =IF(G460>D460,"*","") ->  | J460: =IF(AND(F460="",G460=MIN(E460,H460)),"*","") ->  | K460: =MAX(D460,G460) -> 163 | L460: =MIN(E460,H460) -> 178 | M460: =IF(K460=L460,"*","") -> 
A461: 120 | B461: 46 | C461: 9 | D461: 146 | E461: 168 | F461: =IF(D461=E461,"*","") ->  | G461: 146 | I461: =IF(G461>D461,"*","") ->  | J461: =IF(AND(F461="",G461=MIN(E461,H461)),"*","") ->  | K461: =MAX(D461,G461) -> 146 | L461: =MIN(E461,H461) -> 168 | M461: =IF(K461=L461,"*","") -> 
A462: 120 | B462: 46 | C462: 10 | D462: 165 | E462: 189 | F462: =IF(D462=E462,"*","") ->  | G462: 172 | I462: =IF(G462>D462,"*","") -> * | J462: =IF(AND(F462="",G462=MIN(E462,H462)),"*","") ->  | K462: =MAX(D462,G462) -> 172 | L462: =MIN(E462,H462) -> 189 | M462: =IF(K462=L462,"*","") -> 
A463: 120 | B463: 47 | C463: 1 | D463: 121 | E463: 138 | F463: =IF(D463=E463,"*","") ->  | G463: 124 | I463: =IF(G463>D463,"*","") -> * | J463: =IF(AND(F463="",G463=MIN(E463,H463)),"*","") ->  | K463: =MAX(D463,G463) -> 124 | L463: =MIN(E463,H463) -> 138 | M463: =IF(K463=L463,"*","") -> 
A464: 120 | B464: 47 | C464: 2 | D464: 118 | E464: 133 | F464: =IF(D464=E464,"*","") ->  | G464: 121 | I464: =IF(G464>D464,"*","") -> * | J464: =IF(AND(F464="",G464=MIN(E464,H464)),"*","") ->  | K464: =MAX(D464,G464) -> 121 | L464: =MIN(E464,H464) -> 133 | M464: =IF(K464=L464,"*","") -> 
A465: 120 | B465: 47 | C465: 3 | D465: 118 | E465: 127 | F465: =IF(D465=E465,"*","") ->  | G465: 118 | I465: =IF(G465>D465,"*","") ->  | J465: =IF(AND(F465="",G465=MIN(E465,H465)),"*","") ->  | K465: =MAX(D465,G465) -> 118 | L465: =MIN(E465,H465) -> 127 | M465: =IF(K465=L465,"*","") -> 
A466: 120 | B466: 47 | C466: 4 | D466: 116 | E466: 134 | F466: =IF(D466=E466,"*","") ->  | G466: 118 | I466: =IF(G466>D466,"*","") -> * | J466: =IF(AND(F466="",G466=MIN(E466,H466)),"*","") ->  | K466: =MAX(D466,G466) -> 118 | L466: =MIN(E466,H466) -> 134 | M466: =IF(K466=L466,"*","") -> 
A467: 120 | B467: 47 | C467: 5 | D467: 117 | E467: 129 | F467: =IF(D467=E467,"*","") ->  | G467: 121 | I467: =IF(G467>D467,"*","") -> * | J467: =IF(AND(F467="",G467=MIN(E467,H467)),"*","") ->  | K467: =MAX(D467,G467) -> 121 | L467: =MIN(E467,H467) -> 129 | M467: =IF(K467=L467,"*","") -> 
A468: 120 | B468: 47 | C468: 6 | D468: 126 | E468: 140 | F468: =IF(D468=E468,"*","") ->  | G468: 128 | I468: =IF(G468>D468,"*","") -> * | J468: =IF(AND(F468="",G468=MIN(E468,H468)),"*","") ->  | K468: =MAX(D468,G468) -> 128 | L468: =MIN(E468,H468) -> 140 | M468: =IF(K468=L468,"*","") -> 
A469: 120 | B469: 47 | C469: 7 | D469: 111 | E469: 119 | F469: =IF(D469=E469,"*","") ->  | G469: 112 | I469: =IF(G469>D469,"*","") -> * | J469: =IF(AND(F469="",G469=MIN(E469,H469)),"*","") ->  | K469: =MAX(D469,G469) -> 112 | L469: =MIN(E469,H469) -> 119 | M469: =IF(K469=L469,"*","") -> 
A470: 120 | B470: 47 | C470: 8 | D470: 121 | E470: 134 | F470: =IF(D470=E470,"*","") ->  | G470: 121 | I470: =IF(G470>D470,"*","") ->  | J470: =IF(AND(F470="",G470=MIN(E470,H470)),"*","") ->  | K470: =MAX(D470,G470) -> 121 | L470: =MIN(E470,H470) -> 134 | M470: =IF(K470=L470,"*","") -> 
A471: 120 | B471: 47 | C471: 9 | D471: 135 | E471: 145 | F471: =IF(D471=E471,"*","") ->  | G471: 136 | I471: =IF(G471>D471,"*","") -> * | J471: =IF(AND(F471="",G471=MIN(E471,H471)),"*","") ->  | K471: =MAX(D471,G471) -> 136 | L471: =MIN(E471,H471) -> 145 | M471: =IF(K471=L471,"*","") -> 
A472: 120 | B472: 47 | C472: 10 | D472: 126 | E472: 134 | F472: =IF(D472=E472,"*","") ->  | G472: 127 | I472: =IF(G472>D472,"*","") -> * | J472: =IF(AND(F472="",G472=MIN(E472,H472)),"*","") ->  | K472: =MAX(D472,G472) -> 127 | L472: =MIN(E472,H472) -> 134 | M472: =IF(K472=L472,"*","") -> 
A473: 120 | B473: 48 | C473: 1 | D473: 95 | E473: 100 | F473: =IF(D473=E473,"*","") ->  | G473: 97 | I473: =IF(G473>D473,"*","") -> * | J473: =IF(AND(F473="",G473=MIN(E473,H473)),"*","") ->  | K473: =MAX(D473,G473) -> 97 | L473: =MIN(E473,H473) -> 100 | M473: =IF(K473=L473,"*","") -> 
A474: 120 | B474: 48 | C474: 2 | D474: 110 | E474: 113 | F474: =IF(D474=E474,"*","") ->  | G474: 110 | I474: =IF(G474>D474,"*","") ->  | J474: =IF(AND(F474="",G474=MIN(E474,H474)),"*","") ->  | K474: =MAX(D474,G474) -> 110 | L474: =MIN(E474,H474) -> 113 | M474: =IF(K474=L474,"*","") -> 
A475: 120 | B475: 48 | C475: 3 | D475: 104 | E475: 112 | F475: =IF(D475=E475,"*","") ->  | G475: 106 | I475: =IF(G475>D475,"*","") -> * | J475: =IF(AND(F475="",G475=MIN(E475,H475)),"*","") ->  | K475: =MAX(D475,G475) -> 106 | L475: =MIN(E475,H475) -> 112 | M475: =IF(K475=L475,"*","") -> 
A476: 120 | B476: 48 | C476: 4 | D476: 119 | E476: 128 | F476: =IF(D476=E476,"*","") ->  | G476: 120 | I476: =IF(G476>D476,"*","") -> * | J476: =IF(AND(F476="",G476=MIN(E476,H476)),"*","") ->  | K476: =MAX(D476,G476) -> 120 | L476: =MIN(E476,H476) -> 128 | M476: =IF(K476=L476,"*","") -> 
A477: 120 | B477: 48 | C477: 5 | D477: 104 | E477: 111 | F477: =IF(D477=E477,"*","") ->  | G477: 106 | I477: =IF(G477>D477,"*","") -> * | J477: =IF(AND(F477="",G477=MIN(E477,H477)),"*","") ->  | K477: =MAX(D477,G477) -> 106 | L477: =MIN(E477,H477) -> 111 | M477: =IF(K477=L477,"*","") -> 
A478: 120 | B478: 48 | C478: 6 | D478: 97 | E478: 105 | F478: =IF(D478=E478,"*","") ->  | G478: 99 | I478: =IF(G478>D478,"*","") -> * | J478: =IF(AND(F478="",G478=MIN(E478,H478)),"*","") ->  | K478: =MAX(D478,G478) -> 99 | L478: =MIN(E478,H478) -> 105 | M478: =IF(K478=L478,"*","") -> 
A479: 120 | B479: 48 | C479: 7 | D479: 102 | E479: 107 | F479: =IF(D479=E479,"*","") ->  | G479: 102 | I479: =IF(G479>D479,"*","") ->  | J479: =IF(AND(F479="",G479=MIN(E479,H479)),"*","") ->  | K479: =MAX(D479,G479) -> 102 | L479: =MIN(E479,H479) -> 107 | M479: =IF(K479=L479,"*","") -> 
A480: 120 | B480: 48 | C480: 8 | D480: 108 | E480: 116 | F480: =IF(D480=E480,"*","") ->  | G480: 110 | I480: =IF(G480>D480,"*","") -> * | J480: =IF(AND(F480="",G480=MIN(E480,H480)),"*","") ->  | K480: =MAX(D480,G480) -> 110 | L480: =MIN(E480,H480) -> 116 | M480: =IF(K480=L480,"*","") -> 
A481: 120 | B481: 48 | C481: 9 | D481: 109 | E481: 113 | F481: =IF(D481=E481,"*","") ->  | G481: 112 | I481: =IF(G481>D481,"*","") -> * | J481: =IF(AND(F481="",G481=MIN(E481,H481)),"*","") ->  | K481: =MAX(D481,G481) -> 112 | L481: =MIN(E481,H481) -> 113 | M481: =IF(K481=L481,"*","") -> 
A482: 120 | B482: 48 | C482: 10 | D482: 105 | E482: 111 | F482: =IF(D482=E482,"*","") ->  | G482: 108 | I482: =IF(G482>D482,"*","") -> * | J482: =IF(AND(F482="",G482=MIN(E482,H482)),"*","") ->  | K482: =MAX(D482,G482) -> 108 | L482: =MIN(E482,H482) -> 111 | M482: =IF(K482=L482,"*","") -> 
A483: 120 | B483: 49 | C483: 1 | D483: 96 | E483: 96 | F483: =IF(D483=E483,"*","") -> * | G483: 96 | H483: 96 | I483: =IF(G483>D483,"*","") ->  | J483: =IF(AND(F483="",G483=MIN(E483,H483)),"*","") ->  | K483: =MAX(D483,G483) -> 96 | L483: =MIN(E483,H483) -> 96 | M483: =IF(K483=L483,"*","") -> *
A484: 120 | B484: 49 | C484: 2 | D484: 102 | E484: 109 | F484: =IF(D484=E484,"*","") ->  | G484: 106 | I484: =IF(G484>D484,"*","") -> * | J484: =IF(AND(F484="",G484=MIN(E484,H484)),"*","") ->  | K484: =MAX(D484,G484) -> 106 | L484: =MIN(E484,H484) -> 109 | M484: =IF(K484=L484,"*","") -> 
A485: 120 | B485: 49 | C485: 3 | D485: 93 | E485: 96 | F485: =IF(D485=E485,"*","") ->  | G485: 93 | I485: =IF(G485>D485,"*","") ->  | J485: =IF(AND(F485="",G485=MIN(E485,H485)),"*","") ->  | K485: =MAX(D485,G485) -> 93 | L485: =MIN(E485,H485) -> 96 | M485: =IF(K485=L485,"*","") -> 
A486: 120 | B486: 49 | C486: 4 | D486: 91 | E486: 97 | F486: =IF(D486=E486,"*","") ->  | G486: 94 | I486: =IF(G486>D486,"*","") -> * | J486: =IF(AND(F486="",G486=MIN(E486,H486)),"*","") ->  | K486: =MAX(D486,G486) -> 94 | L486: =MIN(E486,H486) -> 97 | M486: =IF(K486=L486,"*","") -> 
A487: 120 | B487: 49 | C487: 5 | D487: 84 | E487: 89 | F487: =IF(D487=E487,"*","") ->  | G487: 88 | I487: =IF(G487>D487,"*","") -> * | J487: =IF(AND(F487="",G487=MIN(E487,H487)),"*","") ->  | K487: =MAX(D487,G487) -> 88 | L487: =MIN(E487,H487) -> 89 | M487: =IF(K487=L487,"*","") -> 
A488: 120 | B488: 49 | C488: 6 | D488: 128 | E488: 128 | F488: =IF(D488=E488,"*","") -> * | G488: 128 | H488: 128 | I488: =IF(G488>D488,"*","") ->  | J488: =IF(AND(F488="",G488=MIN(E488,H488)),"*","") ->  | K488: =MAX(D488,G488) -> 128 | L488: =MIN(E488,H488) -> 128 | M488: =IF(K488=L488,"*","") -> *
A489: 120 | B489: 49 | C489: 7 | D489: 97 | E489: 99 | F489: =IF(D489=E489,"*","") ->  | G489: 98 | I489: =IF(G489>D489,"*","") -> * | J489: =IF(AND(F489="",G489=MIN(E489,H489)),"*","") ->  | K489: =MAX(D489,G489) -> 98 | L489: =MIN(E489,H489) -> 99 | M489: =IF(K489=L489,"*","") -> 
A490: 120 | B490: 49 | C490: 8 | D490: 112 | E490: 113 | F490: =IF(D490=E490,"*","") ->  | G490: 112 | I490: =IF(G490>D490,"*","") ->  | J490: =IF(AND(F490="",G490=MIN(E490,H490)),"*","") ->  | K490: =MAX(D490,G490) -> 112 | L490: =MIN(E490,H490) -> 113 | M490: =IF(K490=L490,"*","") -> 
A491: 120 | B491: 49 | C491: 9 | D491: 97 | E491: 98 | F491: =IF(D491=E491,"*","") ->  | G491: 97 | I491: =IF(G491>D491,"*","") ->  | J491: =IF(AND(F491="",G491=MIN(E491,H491)),"*","") ->  | K491: =MAX(D491,G491) -> 97 | L491: =MIN(E491,H491) -> 98 | M491: =IF(K491=L491,"*","") -> 
A492: 120 | B492: 49 | C492: 10 | D492: 92 | E492: 97 | F492: =IF(D492=E492,"*","") ->  | G492: 94 | I492: =IF(G492>D492,"*","") -> * | J492: =IF(AND(F492="",G492=MIN(E492,H492)),"*","") ->  | K492: =MAX(D492,G492) -> 94 | L492: =MIN(E492,H492) -> 97 | M492: =IF(K492=L492,"*","") -> 
A493: 120 | B493: 50 | C493: 1 | D493: 116 | E493: 116 | F493: =IF(D493=E493,"*","") -> * | G493: 116 | H493: 116 | I493: =IF(G493>D493,"*","") ->  | J493: =IF(AND(F493="",G493=MIN(E493,H493)),"*","") ->  | K493: =MAX(D493,G493) -> 116 | L493: =MIN(E493,H493) -> 116 | M493: =IF(K493=L493,"*","") -> *
A494: 120 | B494: 50 | C494: 2 | D494: 112 | E494: 112 | F494: =IF(D494=E494,"*","") -> * | G494: 112 | I494: =IF(G494>D494,"*","") ->  | J494: =IF(AND(F494="",G494=MIN(E494,H494)),"*","") ->  | K494: =MAX(D494,G494) -> 112 | L494: =MIN(E494,H494) -> 112 | M494: =IF(K494=L494,"*","") -> *
A495: 120 | B495: 50 | C495: 3 | D495: 111 | E495: 111 | F495: =IF(D495=E495,"*","") -> * | G495: 111 | H495: 111 | I495: =IF(G495>D495,"*","") ->  | J495: =IF(AND(F495="",G495=MIN(E495,H495)),"*","") ->  | K495: =MAX(D495,G495) -> 111 | L495: =MIN(E495,H495) -> 111 | M495: =IF(K495=L495,"*","") -> *
A496: 120 | B496: 50 | C496: 4 | D496: 95 | E496: 100 | F496: =IF(D496=E496,"*","") ->  | G496: 98 | I496: =IF(G496>D496,"*","") -> * | J496: =IF(AND(F496="",G496=MIN(E496,H496)),"*","") ->  | K496: =MAX(D496,G496) -> 98 | L496: =MIN(E496,H496) -> 100 | M496: =IF(K496=L496,"*","") -> 
A497: 120 | B497: 50 | C497: 5 | D497: 100 | E497: 100 | F497: =IF(D497=E497,"*","") -> * | G497: 100 | H497: 100 | I497: =IF(G497>D497,"*","") ->  | J497: =IF(AND(F497="",G497=MIN(E497,H497)),"*","") ->  | K497: =MAX(D497,G497) -> 100 | L497: =MIN(E497,H497) -> 100 | M497: =IF(K497=L497,"*","") -> *
A498: 120 | B498: 50 | C498: 6 | D498: 102 | E498: 102 | F498: =IF(D498=E498,"*","") -> * | G498: 102 | H498: 102 | I498: =IF(G498>D498,"*","") ->  | J498: =IF(AND(F498="",G498=MIN(E498,H498)),"*","") ->  | K498: =MAX(D498,G498) -> 102 | L498: =MIN(E498,H498) -> 102 | M498: =IF(K498=L498,"*","") -> *
A499: 120 | B499: 50 | C499: 7 | D499: 137 | E499: 137 | F499: =IF(D499=E499,"*","") -> * | G499: 137 | H499: 137 | I499: =IF(G499>D499,"*","") ->  | J499: =IF(AND(F499="",G499=MIN(E499,H499)),"*","") ->  | K499: =MAX(D499,G499) -> 137 | L499: =MIN(E499,H499) -> 137 | M499: =IF(K499=L499,"*","") -> *
A500: 120 | B500: 50 | C500: 8 | D500: 112 | E500: 112 | F500: =IF(D500=E500,"*","") -> * | G500: 112 | H500: 112 | I500: =IF(G500>D500,"*","") ->  | J500: =IF(AND(F500="",G500=MIN(E500,H500)),"*","") ->  | K500: =MAX(D500,G500) -> 112 | L500: =MIN(E500,H500) -> 112 | M500: =IF(K500=L500,"*","") -> *
A501: 120 | B501: 50 | C501: 9 | D501: 101 | E501: 101 | F501: =IF(D501=E501,"*","") -> * | G501: 101 | H501: 101 | I501: =IF(G501>D501,"*","") ->  | J501: =IF(AND(F501="",G501=MIN(E501,H501)),"*","") ->  | K501: =MAX(D501,G501) -> 101 | L501: =MIN(E501,H501) -> 101 | M501: =IF(K501=L501,"*","") -> *
A502: 120 | B502: 50 | C502: 10 | D502: 103 | E502: 103 | F502: =IF(D502=E502,"*","") -> * | G502: 103 | H502: 103 | I502: =IF(G502>D502,"*","") ->  | J502: =IF(AND(F502="",G502=MIN(E502,H502)),"*","") ->  | K502: =MAX(D502,G502) -> 103 | L502: =MIN(E502,H502) -> 103 | M502: =IF(K502=L502,"*","") -> *
A503: 120 | B503: 51 | C503: 1 | D503: 185 | E503: 207 | F503: =IF(D503=E503,"*","") ->  | G503: 180 | I503: =IF(G503>D503,"*","") ->  | J503: =IF(AND(F503="",G503=MIN(E503,H503)),"*","") ->  | K503: =MAX(D503,G503) -> 185 | L503: =MIN(E503,H503) -> 207 | M503: =IF(K503=L503,"*","") -> 
A504: 120 | B504: 51 | C504: 2 | D504: 199 | E504: 224 | F504: =IF(D504=E504,"*","") ->  | G504: 192 | I504: =IF(G504>D504,"*","") ->  | J504: =IF(AND(F504="",G504=MIN(E504,H504)),"*","") ->  | K504: =MAX(D504,G504) -> 199 | L504: =MIN(E504,H504) -> 224 | M504: =IF(K504=L504,"*","") -> 
A505: 120 | B505: 51 | C505: 3 | D505: 190 | E505: 223 | F505: =IF(D505=E505,"*","") ->  | G505: 187 | I505: =IF(G505>D505,"*","") ->  | J505: =IF(AND(F505="",G505=MIN(E505,H505)),"*","") ->  | K505: =MAX(D505,G505) -> 190 | L505: =MIN(E505,H505) -> 223 | M505: =IF(K505=L505,"*","") -> 
A506: 120 | B506: 51 | C506: 4 | D506: 196 | E506: 215 | F506: =IF(D506=E506,"*","") ->  | G506: 196 | I506: =IF(G506>D506,"*","") ->  | J506: =IF(AND(F506="",G506=MIN(E506,H506)),"*","") ->  | K506: =MAX(D506,G506) -> 196 | L506: =MIN(E506,H506) -> 215 | M506: =IF(K506=L506,"*","") -> 
A507: 120 | B507: 51 | C507: 5 | D507: 205 | E507: 233 | F507: =IF(D507=E507,"*","") ->  | G507: 193 | I507: =IF(G507>D507,"*","") ->  | J507: =IF(AND(F507="",G507=MIN(E507,H507)),"*","") ->  | K507: =MAX(D507,G507) -> 205 | L507: =MIN(E507,H507) -> 233 | M507: =IF(K507=L507,"*","") -> 
A508: 120 | B508: 51 | C508: 6 | D508: 192 | E508: 216 | F508: =IF(D508=E508,"*","") ->  | G508: 189 | I508: =IF(G508>D508,"*","") ->  | J508: =IF(AND(F508="",G508=MIN(E508,H508)),"*","") ->  | K508: =MAX(D508,G508) -> 192 | L508: =MIN(E508,H508) -> 216 | M508: =IF(K508=L508,"*","") -> 
A509: 120 | B509: 51 | C509: 7 | D509: 184 | E509: 215 | F509: =IF(D509=E509,"*","") ->  | G509: 178 | I509: =IF(G509>D509,"*","") ->  | J509: =IF(AND(F509="",G509=MIN(E509,H509)),"*","") ->  | K509: =MAX(D509,G509) -> 184 | L509: =MIN(E509,H509) -> 215 | M509: =IF(K509=L509,"*","") -> 
A510: 120 | B510: 51 | C510: 8 | D510: 185 | E510: 208 | F510: =IF(D510=E510,"*","") ->  | G510: 183 | I510: =IF(G510>D510,"*","") ->  | J510: =IF(AND(F510="",G510=MIN(E510,H510)),"*","") ->  | K510: =MAX(D510,G510) -> 185 | L510: =MIN(E510,H510) -> 208 | M510: =IF(K510=L510,"*","") -> 
A511: 120 | B511: 51 | C511: 9 | D511: 189 | E511: 213 | F511: =IF(D511=E511,"*","") ->  | G511: 187 | I511: =IF(G511>D511,"*","") ->  | J511: =IF(AND(F511="",G511=MIN(E511,H511)),"*","") ->  | K511: =MAX(D511,G511) -> 189 | L511: =MIN(E511,H511) -> 213 | M511: =IF(K511=L511,"*","") -> 
A512: 120 | B512: 51 | C512: 10 | D512: 200 | E512: 230 | F512: =IF(D512=E512,"*","") ->  | G512: 191 | I512: =IF(G512>D512,"*","") ->  | J512: =IF(AND(F512="",G512=MIN(E512,H512)),"*","") ->  | K512: =MAX(D512,G512) -> 200 | L512: =MIN(E512,H512) -> 230 | M512: =IF(K512=L512,"*","") -> 
A513: 120 | B513: 52 | C513: 1 | D513: 160 | E513: 177 | F513: =IF(D513=E513,"*","") ->  | G513: 154 | I513: =IF(G513>D513,"*","") ->  | J513: =IF(AND(F513="",G513=MIN(E513,H513)),"*","") ->  | K513: =MAX(D513,G513) -> 160 | L513: =MIN(E513,H513) -> 177 | M513: =IF(K513=L513,"*","") -> 
A514: 120 | B514: 52 | C514: 2 | D514: 166 | E514: 185 | F514: =IF(D514=E514,"*","") ->  | G514: 166 | I514: =IF(G514>D514,"*","") ->  | J514: =IF(AND(F514="",G514=MIN(E514,H514)),"*","") ->  | K514: =MAX(D514,G514) -> 166 | L514: =MIN(E514,H514) -> 185 | M514: =IF(K514=L514,"*","") -> 
A515: 120 | B515: 52 | C515: 3 | D515: 124 | E515: 136 | F515: =IF(D515=E515,"*","") ->  | G515: 124 | I515: =IF(G515>D515,"*","") ->  | J515: =IF(AND(F515="",G515=MIN(E515,H515)),"*","") ->  | K515: =MAX(D515,G515) -> 124 | L515: =MIN(E515,H515) -> 136 | M515: =IF(K515=L515,"*","") -> 
A516: 120 | B516: 52 | C516: 4 | D516: 155 | E516: 172 | F516: =IF(D516=E516,"*","") ->  | G516: 155 | I516: =IF(G516>D516,"*","") ->  | J516: =IF(AND(F516="",G516=MIN(E516,H516)),"*","") ->  | K516: =MAX(D516,G516) -> 155 | L516: =MIN(E516,H516) -> 172 | M516: =IF(K516=L516,"*","") -> 
A517: 120 | B517: 52 | C517: 5 | D517: 156 | E517: 169 | F517: =IF(D517=E517,"*","") ->  | G517: 156 | I517: =IF(G517>D517,"*","") ->  | J517: =IF(AND(F517="",G517=MIN(E517,H517)),"*","") ->  | K517: =MAX(D517,G517) -> 156 | L517: =MIN(E517,H517) -> 169 | M517: =IF(K517=L517,"*","") -> 
A518: 120 | B518: 52 | C518: 6 | D518: 179 | E518: 199 | F518: =IF(D518=E518,"*","") ->  | G518: 180 | I518: =IF(G518>D518,"*","") -> * | J518: =IF(AND(F518="",G518=MIN(E518,H518)),"*","") ->  | K518: =MAX(D518,G518) -> 180 | L518: =MIN(E518,H518) -> 199 | M518: =IF(K518=L518,"*","") -> 
A519: 120 | B519: 52 | C519: 7 | D519: 140 | E519: 151 | F519: =IF(D519=E519,"*","") ->  | G519: 140 | I519: =IF(G519>D519,"*","") ->  | J519: =IF(AND(F519="",G519=MIN(E519,H519)),"*","") ->  | K519: =MAX(D519,G519) -> 140 | L519: =MIN(E519,H519) -> 151 | M519: =IF(K519=L519,"*","") -> 
A520: 120 | B520: 52 | C520: 8 | D520: 146 | E520: 160 | F520: =IF(D520=E520,"*","") ->  | G520: 146 | I520: =IF(G520>D520,"*","") ->  | J520: =IF(AND(F520="",G520=MIN(E520,H520)),"*","") ->  | K520: =MAX(D520,G520) -> 146 | L520: =MIN(E520,H520) -> 160 | M520: =IF(K520=L520,"*","") -> 
A521: 120 | B521: 52 | C521: 9 | D521: 139 | E521: 151 | F521: =IF(D521=E521,"*","") ->  | G521: 139 | I521: =IF(G521>D521,"*","") ->  | J521: =IF(AND(F521="",G521=MIN(E521,H521)),"*","") ->  | K521: =MAX(D521,G521) -> 139 | L521: =MIN(E521,H521) -> 151 | M521: =IF(K521=L521,"*","") -> 
A522: 120 | B522: 52 | C522: 10 | D522: 130 | E522: 145 | F522: =IF(D522=E522,"*","") ->  | G522: 128 | I522: =IF(G522>D522,"*","") ->  | J522: =IF(AND(F522="",G522=MIN(E522,H522)),"*","") ->  | K522: =MAX(D522,G522) -> 130 | L522: =MIN(E522,H522) -> 145 | M522: =IF(K522=L522,"*","") -> 
A523: 120 | B523: 53 | C523: 1 | D523: 136 | E523: 145 | F523: =IF(D523=E523,"*","") ->  | G523: 137 | I523: =IF(G523>D523,"*","") -> * | J523: =IF(AND(F523="",G523=MIN(E523,H523)),"*","") ->  | K523: =MAX(D523,G523) -> 137 | L523: =MIN(E523,H523) -> 145 | M523: =IF(K523=L523,"*","") -> 
A524: 120 | B524: 53 | C524: 2 | D524: 108 | E524: 115 | F524: =IF(D524=E524,"*","") ->  | G524: 108 | I524: =IF(G524>D524,"*","") ->  | J524: =IF(AND(F524="",G524=MIN(E524,H524)),"*","") ->  | K524: =MAX(D524,G524) -> 108 | L524: =MIN(E524,H524) -> 115 | M524: =IF(K524=L524,"*","") -> 
A525: 120 | B525: 53 | C525: 3 | D525: 104 | E525: 113 | F525: =IF(D525=E525,"*","") ->  | G525: 104 | I525: =IF(G525>D525,"*","") ->  | J525: =IF(AND(F525="",G525=MIN(E525,H525)),"*","") ->  | K525: =MAX(D525,G525) -> 104 | L525: =MIN(E525,H525) -> 113 | M525: =IF(K525=L525,"*","") -> 
A526: 120 | B526: 53 | C526: 4 | D526: 135 | E526: 146 | F526: =IF(D526=E526,"*","") ->  | G526: 134 | I526: =IF(G526>D526,"*","") ->  | J526: =IF(AND(F526="",G526=MIN(E526,H526)),"*","") ->  | K526: =MAX(D526,G526) -> 135 | L526: =MIN(E526,H526) -> 146 | M526: =IF(K526=L526,"*","") -> 
A527: 120 | B527: 53 | C527: 5 | D527: 107 | E527: 113 | F527: =IF(D527=E527,"*","") ->  | G527: 107 | I527: =IF(G527>D527,"*","") ->  | J527: =IF(AND(F527="",G527=MIN(E527,H527)),"*","") ->  | K527: =MAX(D527,G527) -> 107 | L527: =MIN(E527,H527) -> 113 | M527: =IF(K527=L527,"*","") -> 
A528: 120 | B528: 53 | C528: 6 | D528: 100 | E528: 107 | F528: =IF(D528=E528,"*","") ->  | G528: 100 | I528: =IF(G528>D528,"*","") ->  | J528: =IF(AND(F528="",G528=MIN(E528,H528)),"*","") ->  | K528: =MAX(D528,G528) -> 100 | L528: =MIN(E528,H528) -> 107 | M528: =IF(K528=L528,"*","") -> 
A529: 120 | B529: 53 | C529: 7 | D529: 116 | E529: 119 | F529: =IF(D529=E529,"*","") ->  | G529: 116 | I529: =IF(G529>D529,"*","") ->  | J529: =IF(AND(F529="",G529=MIN(E529,H529)),"*","") ->  | K529: =MAX(D529,G529) -> 116 | L529: =MIN(E529,H529) -> 119 | M529: =IF(K529=L529,"*","") -> 
A530: 120 | B530: 53 | C530: 8 | D530: 133 | E530: 139 | F530: =IF(D530=E530,"*","") ->  | G530: 134 | I530: =IF(G530>D530,"*","") -> * | J530: =IF(AND(F530="",G530=MIN(E530,H530)),"*","") ->  | K530: =MAX(D530,G530) -> 134 | L530: =MIN(E530,H530) -> 139 | M530: =IF(K530=L530,"*","") -> 
A531: 120 | B531: 53 | C531: 9 | D531: 152 | E531: 167 | F531: =IF(D531=E531,"*","") ->  | G531: 149 | I531: =IF(G531>D531,"*","") ->  | J531: =IF(AND(F531="",G531=MIN(E531,H531)),"*","") ->  | K531: =MAX(D531,G531) -> 152 | L531: =MIN(E531,H531) -> 167 | M531: =IF(K531=L531,"*","") -> 
A532: 120 | B532: 53 | C532: 10 | D532: 123 | E532: 134 | F532: =IF(D532=E532,"*","") ->  | G532: 123 | I532: =IF(G532>D532,"*","") ->  | J532: =IF(AND(F532="",G532=MIN(E532,H532)),"*","") ->  | K532: =MAX(D532,G532) -> 123 | L532: =MIN(E532,H532) -> 134 | M532: =IF(K532=L532,"*","") -> 
A533: 120 | B533: 54 | C533: 1 | D533: 101 | E533: 105 | F533: =IF(D533=E533,"*","") ->  | G533: 101 | I533: =IF(G533>D533,"*","") ->  | J533: =IF(AND(F533="",G533=MIN(E533,H533)),"*","") ->  | K533: =MAX(D533,G533) -> 101 | L533: =MIN(E533,H533) -> 105 | M533: =IF(K533=L533,"*","") -> 
A534: 120 | B534: 54 | C534: 2 | D534: 134 | E534: 134 | F534: =IF(D534=E534,"*","") -> * | G534: 134 | H534: 134 | I534: =IF(G534>D534,"*","") ->  | J534: =IF(AND(F534="",G534=MIN(E534,H534)),"*","") ->  | K534: =MAX(D534,G534) -> 134 | L534: =MIN(E534,H534) -> 134 | M534: =IF(K534=L534,"*","") -> *
A535: 120 | B535: 54 | C535: 3 | D535: 111 | E535: 111 | F535: =IF(D535=E535,"*","") -> * | G535: 111 | I535: =IF(G535>D535,"*","") ->  | J535: =IF(AND(F535="",G535=MIN(E535,H535)),"*","") ->  | K535: =MAX(D535,G535) -> 111 | L535: =MIN(E535,H535) -> 111 | M535: =IF(K535=L535,"*","") -> *
A536: 120 | B536: 54 | C536: 4 | D536: 119 | E536: 120 | F536: =IF(D536=E536,"*","") ->  | G536: 119 | I536: =IF(G536>D536,"*","") ->  | J536: =IF(AND(F536="",G536=MIN(E536,H536)),"*","") ->  | K536: =MAX(D536,G536) -> 119 | L536: =MIN(E536,H536) -> 120 | M536: =IF(K536=L536,"*","") -> 
A537: 120 | B537: 54 | C537: 5 | D537: 106 | E537: 109 | F537: =IF(D537=E537,"*","") ->  | G537: 106 | I537: =IF(G537>D537,"*","") ->  | J537: =IF(AND(F537="",G537=MIN(E537,H537)),"*","") ->  | K537: =MAX(D537,G537) -> 106 | L537: =MIN(E537,H537) -> 109 | M537: =IF(K537=L537,"*","") -> 
A538: 120 | B538: 54 | C538: 6 | D538: 103 | E538: 109 | F538: =IF(D538=E538,"*","") ->  | G538: 102 | I538: =IF(G538>D538,"*","") ->  | J538: =IF(AND(F538="",G538=MIN(E538,H538)),"*","") ->  | K538: =MAX(D538,G538) -> 103 | L538: =MIN(E538,H538) -> 109 | M538: =IF(K538=L538,"*","") -> 
A539: 120 | B539: 54 | C539: 7 | D539: 103 | E539: 111 | F539: =IF(D539=E539,"*","") ->  | G539: 104 | I539: =IF(G539>D539,"*","") -> * | J539: =IF(AND(F539="",G539=MIN(E539,H539)),"*","") ->  | K539: =MAX(D539,G539) -> 104 | L539: =MIN(E539,H539) -> 111 | M539: =IF(K539=L539,"*","") -> 
A540: 120 | B540: 54 | C540: 8 | D540: 98 | E540: 103 | F540: =IF(D540=E540,"*","") ->  | G540: 98 | I540: =IF(G540>D540,"*","") ->  | J540: =IF(AND(F540="",G540=MIN(E540,H540)),"*","") ->  | K540: =MAX(D540,G540) -> 98 | L540: =MIN(E540,H540) -> 103 | M540: =IF(K540=L540,"*","") -> 
A541: 120 | B541: 54 | C541: 9 | D541: 103 | E541: 108 | F541: =IF(D541=E541,"*","") ->  | G541: 103 | I541: =IF(G541>D541,"*","") ->  | J541: =IF(AND(F541="",G541=MIN(E541,H541)),"*","") ->  | K541: =MAX(D541,G541) -> 103 | L541: =MIN(E541,H541) -> 108 | M541: =IF(K541=L541,"*","") -> 
A542: 120 | B542: 54 | C542: 10 | D542: 103 | E542: 108 | F542: =IF(D542=E542,"*","") ->  | G542: 104 | I542: =IF(G542>D542,"*","") -> * | J542: =IF(AND(F542="",G542=MIN(E542,H542)),"*","") ->  | K542: =MAX(D542,G542) -> 104 | L542: =MIN(E542,H542) -> 108 | M542: =IF(K542=L542,"*","") -> 
A543: 120 | B543: 55 | C543: 1 | D543: 99 | E543: 101 | F543: =IF(D543=E543,"*","") ->  | G543: 99 | I543: =IF(G543>D543,"*","") ->  | J543: =IF(AND(F543="",G543=MIN(E543,H543)),"*","") ->  | K543: =MAX(D543,G543) -> 99 | L543: =MIN(E543,H543) -> 101 | M543: =IF(K543=L543,"*","") -> 
A544: 120 | B544: 55 | C544: 2 | D544: 83 | E544: 83 | F544: =IF(D544=E544,"*","") -> * | G544: 83 | I544: =IF(G544>D544,"*","") ->  | J544: =IF(AND(F544="",G544=MIN(E544,H544)),"*","") ->  | K544: =MAX(D544,G544) -> 83 | L544: =MIN(E544,H544) -> 83 | M544: =IF(K544=L544,"*","") -> *
A545: 120 | B545: 55 | C545: 3 | D545: 126 | E545: 126 | F545: =IF(D545=E545,"*","") -> * | G545: 126 | I545: =IF(G545>D545,"*","") ->  | J545: =IF(AND(F545="",G545=MIN(E545,H545)),"*","") ->  | K545: =MAX(D545,G545) -> 126 | L545: =MIN(E545,H545) -> 126 | M545: =IF(K545=L545,"*","") -> *
A546: 120 | B546: 55 | C546: 4 | D546: 90 | E546: 90 | F546: =IF(D546=E546,"*","") -> * | G546: 90 | H546: 90 | I546: =IF(G546>D546,"*","") ->  | J546: =IF(AND(F546="",G546=MIN(E546,H546)),"*","") ->  | K546: =MAX(D546,G546) -> 90 | L546: =MIN(E546,H546) -> 90 | M546: =IF(K546=L546,"*","") -> *
A547: 120 | B547: 55 | C547: 5 | D547: 106 | E547: 106 | F547: =IF(D547=E547,"*","") -> * | G547: 106 | H547: 106 | I547: =IF(G547>D547,"*","") ->  | J547: =IF(AND(F547="",G547=MIN(E547,H547)),"*","") ->  | K547: =MAX(D547,G547) -> 106 | L547: =MIN(E547,H547) -> 106 | M547: =IF(K547=L547,"*","") -> *
A548: 120 | B548: 55 | C548: 6 | D548: 98 | E548: 101 | F548: =IF(D548=E548,"*","") ->  | G548: 98 | I548: =IF(G548>D548,"*","") ->  | J548: =IF(AND(F548="",G548=MIN(E548,H548)),"*","") ->  | K548: =MAX(D548,G548) -> 98 | L548: =MIN(E548,H548) -> 101 | M548: =IF(K548=L548,"*","") -> 
A549: 120 | B549: 55 | C549: 7 | D549: 105 | E549: 105 | F549: =IF(D549=E549,"*","") -> * | G549: 105 | I549: =IF(G549>D549,"*","") ->  | J549: =IF(AND(F549="",G549=MIN(E549,H549)),"*","") ->  | K549: =MAX(D549,G549) -> 105 | L549: =MIN(E549,H549) -> 105 | M549: =IF(K549=L549,"*","") -> *
A550: 120 | B550: 55 | C550: 8 | D550: 101 | E550: 101 | F550: =IF(D550=E550,"*","") -> * | G550: 101 | I550: =IF(G550>D550,"*","") ->  | J550: =IF(AND(F550="",G550=MIN(E550,H550)),"*","") ->  | K550: =MAX(D550,G550) -> 101 | L550: =MIN(E550,H550) -> 101 | M550: =IF(K550=L550,"*","") -> *
A551: 120 | B551: 55 | C551: 9 | D551: 94 | E551: 94 | F551: =IF(D551=E551,"*","") -> * | G551: 94 | I551: =IF(G551>D551,"*","") ->  | J551: =IF(AND(F551="",G551=MIN(E551,H551)),"*","") ->  | K551: =MAX(D551,G551) -> 94 | L551: =MIN(E551,H551) -> 94 | M551: =IF(K551=L551,"*","") -> *
A552: 120 | B552: 55 | C552: 10 | D552: 100 | E552: 100 | F552: =IF(D552=E552,"*","") -> * | G552: 100 | I552: =IF(G552>D552,"*","") ->  | J552: =IF(AND(F552="",G552=MIN(E552,H552)),"*","") ->  | K552: =MAX(D552,G552) -> 100 | L552: =MIN(E552,H552) -> 100 | M552: =IF(K552=L552,"*","") -> *
A553: 120 | B553: 56 | C553: 1 | D553: 218 | E553: 238 | F553: =IF(D553=E553,"*","") ->  | G553: 215 | I553: =IF(G553>D553,"*","") ->  | J553: =IF(AND(F553="",G553=MIN(E553,H553)),"*","") ->  | K553: =MAX(D553,G553) -> 218 | L553: =MIN(E553,H553) -> 238 | M553: =IF(K553=L553,"*","") -> 
A554: 120 | B554: 56 | C554: 2 | D554: 187 | E554: 207 | F554: =IF(D554=E554,"*","") ->  | G554: 182 | I554: =IF(G554>D554,"*","") ->  | J554: =IF(AND(F554="",G554=MIN(E554,H554)),"*","") ->  | K554: =MAX(D554,G554) -> 187 | L554: =MIN(E554,H554) -> 207 | M554: =IF(K554=L554,"*","") -> 
A555: 120 | B555: 56 | C555: 3 | D555: 220 | E555: 242 | F555: =IF(D555=E555,"*","") ->  | G555: 215 | I555: =IF(G555>D555,"*","") ->  | J555: =IF(AND(F555="",G555=MIN(E555,H555)),"*","") ->  | K555: =MAX(D555,G555) -> 220 | L555: =MIN(E555,H555) -> 242 | M555: =IF(K555=L555,"*","") -> 
A556: 120 | B556: 56 | C556: 4 | D556: 205 | E556: 224 | F556: =IF(D556=E556,"*","") ->  | G556: 200 | I556: =IF(G556>D556,"*","") ->  | J556: =IF(AND(F556="",G556=MIN(E556,H556)),"*","") ->  | K556: =MAX(D556,G556) -> 205 | L556: =MIN(E556,H556) -> 224 | M556: =IF(K556=L556,"*","") -> 
A557: 120 | B557: 56 | C557: 5 | D557: 261 | E557: 282 | F557: =IF(D557=E557,"*","") ->  | G557: 245 | I557: =IF(G557>D557,"*","") ->  | J557: =IF(AND(F557="",G557=MIN(E557,H557)),"*","") ->  | K557: =MAX(D557,G557) -> 261 | L557: =MIN(E557,H557) -> 282 | M557: =IF(K557=L557,"*","") -> 
A558: 120 | B558: 56 | C558: 6 | D558: 199 | E558: 215 | F558: =IF(D558=E558,"*","") ->  | G558: 193 | I558: =IF(G558>D558,"*","") ->  | J558: =IF(AND(F558="",G558=MIN(E558,H558)),"*","") ->  | K558: =MAX(D558,G558) -> 199 | L558: =MIN(E558,H558) -> 215 | M558: =IF(K558=L558,"*","") -> 
A559: 120 | B559: 56 | C559: 7 | D559: 260 | E559: 287 | F559: =IF(D559=E559,"*","") ->  | G559: 241 | I559: =IF(G559>D559,"*","") ->  | J559: =IF(AND(F559="",G559=MIN(E559,H559)),"*","") ->  | K559: =MAX(D559,G559) -> 260 | L559: =MIN(E559,H559) -> 287 | M559: =IF(K559=L559,"*","") -> 
A560: 120 | B560: 56 | C560: 8 | D560: 265 | E560: 292 | F560: =IF(D560=E560,"*","") ->  | G560: 246 | I560: =IF(G560>D560,"*","") ->  | J560: =IF(AND(F560="",G560=MIN(E560,H560)),"*","") ->  | K560: =MAX(D560,G560) -> 265 | L560: =MIN(E560,H560) -> 292 | M560: =IF(K560=L560,"*","") -> 
A561: 120 | B561: 56 | C561: 9 | D561: 264 | E561: 291 | F561: =IF(D561=E561,"*","") ->  | G561: 255 | I561: =IF(G561>D561,"*","") ->  | J561: =IF(AND(F561="",G561=MIN(E561,H561)),"*","") ->  | K561: =MAX(D561,G561) -> 264 | L561: =MIN(E561,H561) -> 291 | M561: =IF(K561=L561,"*","") -> 
A562: 120 | B562: 56 | C562: 10 | D562: 237 | E562: 262 | F562: =IF(D562=E562,"*","") ->  | G562: 229 | I562: =IF(G562>D562,"*","") ->  | J562: =IF(AND(F562="",G562=MIN(E562,H562)),"*","") ->  | K562: =MAX(D562,G562) -> 237 | L562: =MIN(E562,H562) -> 262 | M562: =IF(K562=L562,"*","") -> 
A563: 120 | B563: 57 | C563: 1 | D563: 172 | E563: 186 | F563: =IF(D563=E563,"*","") ->  | G563: 170 | I563: =IF(G563>D563,"*","") ->  | J563: =IF(AND(F563="",G563=MIN(E563,H563)),"*","") ->  | K563: =MAX(D563,G563) -> 172 | L563: =MIN(E563,H563) -> 186 | M563: =IF(K563=L563,"*","") -> 
A564: 120 | B564: 57 | C564: 2 | D564: 150 | E564: 164 | F564: =IF(D564=E564,"*","") ->  | G564: 148 | I564: =IF(G564>D564,"*","") ->  | J564: =IF(AND(F564="",G564=MIN(E564,H564)),"*","") ->  | K564: =MAX(D564,G564) -> 150 | L564: =MIN(E564,H564) -> 164 | M564: =IF(K564=L564,"*","") -> 
A565: 120 | B565: 57 | C565: 3 | D565: 173 | E565: 187 | F565: =IF(D565=E565,"*","") ->  | G565: 173 | I565: =IF(G565>D565,"*","") ->  | J565: =IF(AND(F565="",G565=MIN(E565,H565)),"*","") ->  | K565: =MAX(D565,G565) -> 173 | L565: =MIN(E565,H565) -> 187 | M565: =IF(K565=L565,"*","") -> 
A566: 120 | B566: 57 | C566: 4 | D566: 185 | E566: 202 | F566: =IF(D566=E566,"*","") ->  | G566: 184 | I566: =IF(G566>D566,"*","") ->  | J566: =IF(AND(F566="",G566=MIN(E566,H566)),"*","") ->  | K566: =MAX(D566,G566) -> 185 | L566: =MIN(E566,H566) -> 202 | M566: =IF(K566=L566,"*","") -> 
A567: 120 | B567: 57 | C567: 5 | D567: 167 | E567: 181 | F567: =IF(D567=E567,"*","") ->  | G567: 167 | I567: =IF(G567>D567,"*","") ->  | J567: =IF(AND(F567="",G567=MIN(E567,H567)),"*","") ->  | K567: =MAX(D567,G567) -> 167 | L567: =MIN(E567,H567) -> 181 | M567: =IF(K567=L567,"*","") -> 
A568: 120 | B568: 57 | C568: 6 | D568: 175 | E568: 191 | F568: =IF(D568=E568,"*","") ->  | G568: 174 | I568: =IF(G568>D568,"*","") ->  | J568: =IF(AND(F568="",G568=MIN(E568,H568)),"*","") ->  | K568: =MAX(D568,G568) -> 175 | L568: =MIN(E568,H568) -> 191 | M568: =IF(K568=L568,"*","") -> 
A569: 120 | B569: 57 | C569: 7 | D569: 154 | E569: 169 | F569: =IF(D569=E569,"*","") ->  | G569: 154 | I569: =IF(G569>D569,"*","") ->  | J569: =IF(AND(F569="",G569=MIN(E569,H569)),"*","") ->  | K569: =MAX(D569,G569) -> 154 | L569: =MIN(E569,H569) -> 169 | M569: =IF(K569=L569,"*","") -> 
A570: 120 | B570: 57 | C570: 8 | D570: 154 | E570: 165 | F570: =IF(D570=E570,"*","") ->  | G570: 154 | I570: =IF(G570>D570,"*","") ->  | J570: =IF(AND(F570="",G570=MIN(E570,H570)),"*","") ->  | K570: =MAX(D570,G570) -> 154 | L570: =MIN(E570,H570) -> 165 | M570: =IF(K570=L570,"*","") -> 
A571: 120 | B571: 57 | C571: 9 | D571: 155 | E571: 170 | F571: =IF(D571=E571,"*","") ->  | G571: 154 | I571: =IF(G571>D571,"*","") ->  | J571: =IF(AND(F571="",G571=MIN(E571,H571)),"*","") ->  | K571: =MAX(D571,G571) -> 155 | L571: =MIN(E571,H571) -> 170 | M571: =IF(K571=L571,"*","") -> 
A572: 120 | B572: 57 | C572: 10 | D572: 155 | E572: 170 | F572: =IF(D572=E572,"*","") ->  | G572: 155 | I572: =IF(G572>D572,"*","") ->  | J572: =IF(AND(F572="",G572=MIN(E572,H572)),"*","") ->  | K572: =MAX(D572,G572) -> 155 | L572: =MIN(E572,H572) -> 170 | M572: =IF(K572=L572,"*","") -> 
A573: 120 | B573: 58 | C573: 1 | D573: 133 | E573: 142 | F573: =IF(D573=E573,"*","") ->  | G573: 130 | I573: =IF(G573>D573,"*","") ->  | J573: =IF(AND(F573="",G573=MIN(E573,H573)),"*","") ->  | K573: =MAX(D573,G573) -> 133 | L573: =MIN(E573,H573) -> 142 | M573: =IF(K573=L573,"*","") -> 
A574: 120 | B574: 58 | C574: 2 | D574: 121 | E574: 127 | F574: =IF(D574=E574,"*","") ->  | G574: 121 | I574: =IF(G574>D574,"*","") ->  | J574: =IF(AND(F574="",G574=MIN(E574,H574)),"*","") ->  | K574: =MAX(D574,G574) -> 121 | L574: =MIN(E574,H574) -> 127 | M574: =IF(K574=L574,"*","") -> 
A575: 120 | B575: 58 | C575: 3 | D575: 116 | E575: 122 | F575: =IF(D575=E575,"*","") ->  | G575: 116 | I575: =IF(G575>D575,"*","") ->  | J575: =IF(AND(F575="",G575=MIN(E575,H575)),"*","") ->  | K575: =MAX(D575,G575) -> 116 | L575: =MIN(E575,H575) -> 122 | M575: =IF(K575=L575,"*","") -> 
A576: 120 | B576: 58 | C576: 4 | D576: 137 | E576: 147 | F576: =IF(D576=E576,"*","") ->  | G576: 136 | I576: =IF(G576>D576,"*","") ->  | J576: =IF(AND(F576="",G576=MIN(E576,H576)),"*","") ->  | K576: =MAX(D576,G576) -> 137 | L576: =MIN(E576,H576) -> 147 | M576: =IF(K576=L576,"*","") -> 
A577: 120 | B577: 58 | C577: 5 | D577: 115 | E577: 121 | F577: =IF(D577=E577,"*","") ->  | G577: 114 | I577: =IF(G577>D577,"*","") ->  | J577: =IF(AND(F577="",G577=MIN(E577,H577)),"*","") ->  | K577: =MAX(D577,G577) -> 115 | L577: =MIN(E577,H577) -> 121 | M577: =IF(K577=L577,"*","") -> 
A578: 120 | B578: 58 | C578: 6 | D578: 134 | E578: 142 | F578: =IF(D578=E578,"*","") ->  | G578: 134 | I578: =IF(G578>D578,"*","") ->  | J578: =IF(AND(F578="",G578=MIN(E578,H578)),"*","") ->  | K578: =MAX(D578,G578) -> 134 | L578: =MIN(E578,H578) -> 142 | M578: =IF(K578=L578,"*","") -> 
A579: 120 | B579: 58 | C579: 7 | D579: 141 | E579: 148 | F579: =IF(D579=E579,"*","") ->  | G579: 141 | I579: =IF(G579>D579,"*","") ->  | J579: =IF(AND(F579="",G579=MIN(E579,H579)),"*","") ->  | K579: =MAX(D579,G579) -> 141 | L579: =MIN(E579,H579) -> 148 | M579: =IF(K579=L579,"*","") -> 
A580: 120 | B580: 58 | C580: 8 | D580: 125 | E580: 134 | F580: =IF(D580=E580,"*","") ->  | G580: 125 | I580: =IF(G580>D580,"*","") ->  | J580: =IF(AND(F580="",G580=MIN(E580,H580)),"*","") ->  | K580: =MAX(D580,G580) -> 125 | L580: =MIN(E580,H580) -> 134 | M580: =IF(K580=L580,"*","") -> 
A581: 120 | B581: 58 | C581: 9 | D581: 125 | E581: 132 | F581: =IF(D581=E581,"*","") ->  | G581: 125 | I581: =IF(G581>D581,"*","") ->  | J581: =IF(AND(F581="",G581=MIN(E581,H581)),"*","") ->  | K581: =MAX(D581,G581) -> 125 | L581: =MIN(E581,H581) -> 132 | M581: =IF(K581=L581,"*","") -> 
A582: 120 | B582: 58 | C582: 10 | D582: 124 | E582: 134 | F582: =IF(D582=E582,"*","") ->  | G582: 124 | I582: =IF(G582>D582,"*","") ->  | J582: =IF(AND(F582="",G582=MIN(E582,H582)),"*","") ->  | K582: =MAX(D582,G582) -> 124 | L582: =MIN(E582,H582) -> 134 | M582: =IF(K582=L582,"*","") -> 
A583: 120 | B583: 59 | C583: 1 | D583: 112 | E583: 114 | F583: =IF(D583=E583,"*","") ->  | G583: 112 | I583: =IF(G583>D583,"*","") ->  | J583: =IF(AND(F583="",G583=MIN(E583,H583)),"*","") ->  | K583: =MAX(D583,G583) -> 112 | L583: =MIN(E583,H583) -> 114 | M583: =IF(K583=L583,"*","") -> 
A584: 120 | B584: 59 | C584: 2 | D584: 103 | E584: 106 | F584: =IF(D584=E584,"*","") ->  | G584: 103 | I584: =IF(G584>D584,"*","") ->  | J584: =IF(AND(F584="",G584=MIN(E584,H584)),"*","") ->  | K584: =MAX(D584,G584) -> 103 | L584: =MIN(E584,H584) -> 106 | M584: =IF(K584=L584,"*","") -> 
A585: 120 | B585: 59 | C585: 3 | D585: 108 | E585: 109 | F585: =IF(D585=E585,"*","") ->  | G585: 108 | I585: =IF(G585>D585,"*","") ->  | J585: =IF(AND(F585="",G585=MIN(E585,H585)),"*","") ->  | K585: =MAX(D585,G585) -> 108 | L585: =MIN(E585,H585) -> 109 | M585: =IF(K585=L585,"*","") -> 
A586: 120 | B586: 59 | C586: 4 | D586: 107 | E586: 109 | F586: =IF(D586=E586,"*","") ->  | G586: 107 | I586: =IF(G586>D586,"*","") ->  | J586: =IF(AND(F586="",G586=MIN(E586,H586)),"*","") ->  | K586: =MAX(D586,G586) -> 107 | L586: =MIN(E586,H586) -> 109 | M586: =IF(K586=L586,"*","") -> 
A587: 120 | B587: 59 | C587: 5 | D587: 103 | E587: 106 | F587: =IF(D587=E587,"*","") ->  | G587: 103 | I587: =IF(G587>D587,"*","") ->  | J587: =IF(AND(F587="",G587=MIN(E587,H587)),"*","") ->  | K587: =MAX(D587,G587) -> 103 | L587: =MIN(E587,H587) -> 106 | M587: =IF(K587=L587,"*","") -> 
A588: 120 | B588: 59 | C588: 6 | D588: 111 | E588: 115 | F588: =IF(D588=E588,"*","") ->  | G588: 111 | I588: =IF(G588>D588,"*","") ->  | J588: =IF(AND(F588="",G588=MIN(E588,H588)),"*","") ->  | K588: =MAX(D588,G588) -> 111 | L588: =MIN(E588,H588) -> 115 | M588: =IF(K588=L588,"*","") -> 
A589: 120 | B589: 59 | C589: 7 | D589: 108 | E589: 113 | F589: =IF(D589=E589,"*","") ->  | G589: 108 | I589: =IF(G589>D589,"*","") ->  | J589: =IF(AND(F589="",G589=MIN(E589,H589)),"*","") ->  | K589: =MAX(D589,G589) -> 108 | L589: =MIN(E589,H589) -> 113 | M589: =IF(K589=L589,"*","") -> 
A590: 120 | B590: 59 | C590: 8 | D590: 105 | E590: 111 | F590: =IF(D590=E590,"*","") ->  | G590: 105 | I590: =IF(G590>D590,"*","") ->  | J590: =IF(AND(F590="",G590=MIN(E590,H590)),"*","") ->  | K590: =MAX(D590,G590) -> 105 | L590: =MIN(E590,H590) -> 111 | M590: =IF(K590=L590,"*","") -> 
A591: 120 | B591: 59 | C591: 9 | D591: 116 | E591: 119 | F591: =IF(D591=E591,"*","") ->  | G591: 116 | I591: =IF(G591>D591,"*","") ->  | J591: =IF(AND(F591="",G591=MIN(E591,H591)),"*","") ->  | K591: =MAX(D591,G591) -> 116 | L591: =MIN(E591,H591) -> 119 | M591: =IF(K591=L591,"*","") -> 
A592: 120 | B592: 59 | C592: 10 | D592: 126 | E592: 133 | F592: =IF(D592=E592,"*","") ->  | G592: 126 | I592: =IF(G592>D592,"*","") ->  | J592: =IF(AND(F592="",G592=MIN(E592,H592)),"*","") ->  | K592: =MAX(D592,G592) -> 126 | L592: =MIN(E592,H592) -> 133 | M592: =IF(K592=L592,"*","") -> 
A593: 120 | B593: 60 | C593: 1 | D593: 101 | E593: 101 | F593: =IF(D593=E593,"*","") -> * | G593: 101 | I593: =IF(G593>D593,"*","") ->  | J593: =IF(AND(F593="",G593=MIN(E593,H593)),"*","") ->  | K593: =MAX(D593,G593) -> 101 | L593: =MIN(E593,H593) -> 101 | M593: =IF(K593=L593,"*","") -> *
A594: 120 | B594: 60 | C594: 2 | D594: 81 | E594: 83 | F594: =IF(D594=E594,"*","") ->  | G594: 81 | I594: =IF(G594>D594,"*","") ->  | J594: =IF(AND(F594="",G594=MIN(E594,H594)),"*","") ->  | K594: =MAX(D594,G594) -> 81 | L594: =MIN(E594,H594) -> 83 | M594: =IF(K594=L594,"*","") -> 
A595: 120 | B595: 60 | C595: 3 | D595: 87 | E595: 90 | F595: =IF(D595=E595,"*","") ->  | G595: 87 | I595: =IF(G595>D595,"*","") ->  | J595: =IF(AND(F595="",G595=MIN(E595,H595)),"*","") ->  | K595: =MAX(D595,G595) -> 87 | L595: =MIN(E595,H595) -> 90 | M595: =IF(K595=L595,"*","") -> 
A596: 120 | B596: 60 | C596: 4 | D596: 101 | E596: 104 | F596: =IF(D596=E596,"*","") ->  | G596: 101 | I596: =IF(G596>D596,"*","") ->  | J596: =IF(AND(F596="",G596=MIN(E596,H596)),"*","") ->  | K596: =MAX(D596,G596) -> 101 | L596: =MIN(E596,H596) -> 104 | M596: =IF(K596=L596,"*","") -> 
A597: 120 | B597: 60 | C597: 5 | D597: 103 | E597: 105 | F597: =IF(D597=E597,"*","") ->  | G597: 103 | I597: =IF(G597>D597,"*","") ->  | J597: =IF(AND(F597="",G597=MIN(E597,H597)),"*","") ->  | K597: =MAX(D597,G597) -> 103 | L597: =MIN(E597,H597) -> 105 | M597: =IF(K597=L597,"*","") -> 
A598: 120 | B598: 60 | C598: 6 | D598: 110 | E598: 110 | F598: =IF(D598=E598,"*","") -> * | G598: 110 | I598: =IF(G598>D598,"*","") ->  | J598: =IF(AND(F598="",G598=MIN(E598,H598)),"*","") ->  | K598: =MAX(D598,G598) -> 110 | L598: =MIN(E598,H598) -> 110 | M598: =IF(K598=L598,"*","") -> *
A599: 120 | B599: 60 | C599: 7 | D599: 90 | E599: 95 | F599: =IF(D599=E599,"*","") ->  | G599: 90 | I599: =IF(G599>D599,"*","") ->  | J599: =IF(AND(F599="",G599=MIN(E599,H599)),"*","") ->  | K599: =MAX(D599,G599) -> 90 | L599: =MIN(E599,H599) -> 95 | M599: =IF(K599=L599,"*","") -> 
A600: 120 | B600: 60 | C600: 8 | D600: 101 | E600: 101 | F600: =IF(D600=E600,"*","") -> * | G600: 101 | I600: =IF(G600>D600,"*","") ->  | J600: =IF(AND(F600="",G600=MIN(E600,H600)),"*","") ->  | K600: =MAX(D600,G600) -> 101 | L600: =MIN(E600,H600) -> 101 | M600: =IF(K600=L600,"*","") -> *
A601: 120 | B601: 60 | C601: 9 | D601: 101 | E601: 101 | F601: =IF(D601=E601,"*","") -> * | G601: 101 | I601: =IF(G601>D601,"*","") ->  | J601: =IF(AND(F601="",G601=MIN(E601,H601)),"*","") ->  | K601: =MAX(D601,G601) -> 101 | L601: =MIN(E601,H601) -> 101 | M601: =IF(K601=L601,"*","") -> *
A602: 120 | B602: 60 | C602: 10 | D602: 87 | E602: 89 | F602: =IF(D602=E602,"*","") ->  | G602: 87 | I602: =IF(G602>D602,"*","") ->  | J602: =IF(AND(F602="",G602=MIN(E602,H602)),"*","") ->  | K602: =MAX(D602,G602) -> 87 | L602: =MIN(E602,H602) -> 89 | M602: =IF(K602=L602,"*","") -> 