A1: INSTANCES | D1: PREV. RESULTS | G1: MCS SEARCH | K1: NEW RESULTS
D2: LB | E2: UB | F2: OPT | G2: LB | H2: UB | I2: IMP | J2: NCL | K2: LB | L2: UB | M2: OPT
A3: 90 | B3: 1 | C3: 1 | D3: 72 | E3: 73 | F3: =IF(D3=E3,"*","") ->  | G3: 73 | H3: 73 | I3: =IF(G3>D3,"*","") -> * | J3: =IF(AND(F3="",G3=MIN(E3,H3)),"*","") -> * | K3: =MAX(D3,G3) -> 73 | L3: =MIN(E3,H3) -> 73 | M3: =IF(K3=L3,"*","") -> *
A4: 90 | B4: 1 | C4: 2 | D4: 92 | E4: 92 | F4: =IF(D4=E4,"*","") -> * | G4: 92 | H4: 92 | I4: =IF(G4>D4,"*","") ->  | J4: =IF(AND(F4="",G4=MIN(E4,H4)),"*","") ->  | K4: =MAX(D4,G4) -> 92 | L4: =MIN(E4,H4) -> 92 | M4: =IF(K4=L4,"*","") -> *
A5: 90 | B5: 1 | C5: 3 | D5: 64 | E5: 66 | F5: =IF(D5=E5,"*","") ->  | G5: 66 | H5: 66 | I5: =IF(G5>D5,"*","") -> * | J5: =IF(AND(F5="",G5=MIN(E5,H5)),"*","") -> * | K5: =MAX(D5,G5) -> 66 | L5: =MIN(E5,H5) -> 66 | M5: =IF(K5=L5,"*","") -> *
A6: 90 | B6: 1 | C6: 4 | D6: 85 | E6: 86 | F6: =IF(D6=E6,"*","") ->  | G6: 86 | H6: 86 | I6: =IF(G6>D6,"*","") -> * | J6: =IF(AND(F6="",G6=MIN(E6,H6)),"*","") -> * | K6: =MAX(D6,G6) -> 86 | L6: =MIN(E6,H6) -> 86 | M6: =IF(K6=L6,"*","") -> *
A7: 90 | B7: 1 | C7: 5 | D7: 87 | E7: 87 | F7: =IF(D7=E7,"*","") -> * | G7: 87 | H7: 87 | I7: =IF(G7>D7,"*","") ->  | J7: =IF(AND(F7="",G7=MIN(E7,H7)),"*","") ->  | K7: =MAX(D7,G7) -> 87 | L7: =MIN(E7,H7) -> 87 | M7: =IF(K7=L7,"*","") -> *
A8: 90 | B8: 1 | C8: 6 | D8: 70 | E8: 74 | F8: =IF(D8=E8,"*","") ->  | G8: 74 | H8: 74 | I8: =IF(G8>D8,"*","") -> * | J8: =IF(AND(F8="",G8=MIN(E8,H8)),"*","") -> * | K8: =MAX(D8,G8) -> 74 | L8: =MIN(E8,H8) -> 74 | M8: =IF(K8=L8,"*","") -> *
A9: 90 | B9: 1 | C9: 7 | D9: 90 | E9: 91 | F9: =IF(D9=E9,"*","") ->  | G9: 91 | H9: 91 | I9: =IF(G9>D9,"*","") -> * | J9: =IF(AND(F9="",G9=MIN(E9,H9)),"*","") -> * | K9: =MAX(D9,G9) -> 91 | L9: =MIN(E9,H9) -> 91 | M9: =IF(K9=L9,"*","") -> *
A10: 90 | B10: 1 | C10: 8 | D10: 93 | E10: 95 | F10: =IF(D10=E10,"*","") ->  | G10: 95 | H10: 95 | I10: =IF(G10>D10,"*","") -> * | J10: =IF(AND(F10="",G10=MIN(E10,H10)),"*","") -> * | K10: =MAX(D10,G10) -> 95 | L10: =MIN(E10,H10) -> 95 | M10: =IF(K10=L10,"*","") -> *
A11: 90 | B11: 1 | C11: 9 | D11: 70 | E11: 72 | F11: =IF(D11=E11,"*","") ->  | G11: 72 | H11: 72 | I11: =IF(G11>D11,"*","") -> * | J11: =IF(AND(F11="",G11=MIN(E11,H11)),"*","") -> * | K11: =MAX(D11,G11) -> 72 | L11: =MIN(E11,H11) -> 72 | M11: =IF(K11=L11,"*","") -> *
A12: 90 | B12: 1 | C12: 10 | D12: 89 | E12: 90 | F12: =IF(D12=E12,"*","") ->  | G12: 90 | H12: 90 | I12: =IF(G12>D12,"*","") -> * | J12: =IF(AND(F12="",G12=MIN(E12,H12)),"*","") -> * | K12: =MAX(D12,G12) -> 90 | L12: =MIN(E12,H12) -> 90 | M12: =IF(K12=L12,"*","") -> *
A13: 90 | B13: 2 | C13: 1 | D13: 96 | E13: 96 | F13: =IF(D13=E13,"*","") -> * | G13: 96 | H13: 96 | I13: =IF(G13>D13,"*","") ->  | J13: =IF(AND(F13="",G13=MIN(E13,H13)),"*","") ->  | K13: =MAX(D13,G13) -> 96 | L13: =MIN(E13,H13) -> 96 | M13: =IF(K13=L13,"*","") -> *
A14: 90 | B14: 2 | C14: 2 | D14: 114 | E14: 114 | F14: =IF(D14=E14,"*","") -> * | G14: 114 | H14: 114 | I14: =IF(G14>D14,"*","") ->  | J14: =IF(AND(F14="",G14=MIN(E14,H14)),"*","") ->  | K14: =MAX(D14,G14) -> 114 | L14: =MIN(E14,H14) -> 114 | M14: =IF(K14=L14,"*","") -> *
A15: 90 | B15: 2 | C15: 3 | D15: 75 | E15: 75 | F15: =IF(D15=E15,"*","") -> * | G15: 75 | H15: 75 | I15: =IF(G15>D15,"*","") ->  | J15: =IF(AND(F15="",G15=MIN(E15,H15)),"*","") ->  | K15: =MAX(D15,G15) -> 75 | L15: =MIN(E15,H15) -> 75 | M15: =IF(K15=L15,"*","") -> *
A16: 90 | B16: 2 | C16: 4 | D16: 70 | E16: 70 | F16: =IF(D16=E16,"*","") -> * | G16: 70 | H16: 70 | I16: =IF(G16>D16,"*","") ->  | J16: =IF(AND(F16="",G16=MIN(E16,H16)),"*","") ->  | K16: =MAX(D16,G16) -> 70 | L16: =MIN(E16,H16) -> 70 | M16: =IF(K16=L16,"*","") -> *
A17: 90 | B17: 2 | C17: 5 | D17: 100 | E17: 100 | F17: =IF(D17=E17,"*","") -> * | G17: 100 | H17: 100 | I17: =IF(G17>D17,"*","") ->  | J17: =IF(AND(F17="",G17=MIN(E17,H17)),"*","") ->  | K17: =MAX(D17,G17) -> 100 | L17: =MIN(E17,H17) -> 100 | M17: =IF(K17=L17,"*","") -> *
A18: 90 | B18: 2 | C18: 6 | D18: 67 | E18: 67 | F18: =IF(D18=E18,"*","") -> * | G18: 67 | H18: 67 | I18: =IF(G18>D18,"*","") ->  | J18: =IF(AND(F18="",G18=MIN(E18,H18)),"*","") ->  | K18: =MAX(D18,G18) -> 67 | L18: =MIN(E18,H18) -> 67 | M18: =IF(K18=L18,"*","") -> *
A19: 90 | B19: 2 | C19: 7 | D19: 92 | E19: 92 | F19: =IF(D19=E19,"*","") -> * | G19: 92 | H19: 92 | I19: =IF(G19>D19,"*","") ->  | J19: =IF(AND(F19="",G19=MIN(E19,H19)),"*","") ->  | K19: =MAX(D19,G19) -> 92 | L19: =MIN(E19,H19) -> 92 | M19: =IF(K19=L19,"*","") -> *
A20: 90 | B20: 2 | C20: 8 | D20: 82 | E20: 82 | F20: =IF(D20=E20,"*","") -> * | G20: 82 | H20: 82 | I20: =IF(G20>D20,"*","") ->  | J20: =IF(AND(F20="",G20=MIN(E20,H20)),"*","") ->  | K20: =MAX(D20,G20) -> 82 | L20: =MIN(E20,H20) -> 82 | M20: =IF(K20=L20,"*","") -> *
A21: 90 | B21: 2 | C21: 9 | D21: 79 | E21: 79 | F21: =IF(D21=E21,"*","") -> * | G21: 79 | H21: 79 | I21: =IF(G21>D21,"*","") ->  | J21: =IF(AND(F21="",G21=MIN(E21,H21)),"*","") ->  | K21: =MAX(D21,G21) -> 79 | L21: =MIN(E21,H21) -> 79 | M21: =IF(K21=L21,"*","") -> *
A22: 90 | B22: 2 | C22: 10 | D22: 80 | E22: 80 | F22: =IF(D22=E22,"*","") -> * | G22: 80 | H22: 80 | I22: =IF(G22>D22,"*","") ->  | J22: =IF(AND(F22="",G22=MIN(E22,H22)),"*","") ->  | K22: =MAX(D22,G22) -> 80 | L22: =MIN(E22,H22) -> 80 | M22: =IF(K22=L22,"*","") -> *
A23: 90 | B23: 3 | C23: 1 | D23: 81 | E23: 81 | F23: =IF(D23=E23,"*","") -> * | G23: 81 | H23: 81 | I23: =IF(G23>D23,"*","") ->  | J23: =IF(AND(F23="",G23=MIN(E23,H23)),"*","") ->  | K23: =MAX(D23,G23) -> 81 | L23: =MIN(E23,H23) -> 81 | M23: =IF(K23=L23,"*","") -> *
A24: 90 | B24: 3 | C24: 2 | D24: 84 | E24: 84 | F24: =IF(D24=E24,"*","") -> * | G24: 84 | H24: 84 | I24: =IF(G24>D24,"*","") ->  | J24: =IF(AND(F24="",G24=MIN(E24,H24)),"*","") ->  | K24: =MAX(D24,G24) -> 84 | L24: =MIN(E24,H24) -> 84 | M24: =IF(K24=L24,"*","") -> *
A25: 90 | B25: 3 | C25: 3 | D25: 71 | E25: 71 | F25: =IF(D25=E25,"*","") -> * | G25: 71 | H25: 71 | I25: =IF(G25>D25,"*","") ->  | J25: =IF(AND(F25="",G25=MIN(E25,H25)),"*","") ->  | K25: =MAX(D25,G25) -> 71 | L25: =MIN(E25,H25) -> 71 | M25: =IF(K25=L25,"*","") -> *
A26: 90 | B26: 3 | C26: 4 | D26: 104 | E26: 104 | F26: =IF(D26=E26,"*","") -> * | G26: 104 | H26: 104 | I26: =IF(G26>D26,"*","") ->  | J26: =IF(AND(F26="",G26=MIN(E26,H26)),"*","") ->  | K26: =MAX(D26,G26) -> 104 | L26: =MIN(E26,H26) -> 104 | M26: =IF(K26=L26,"*","") -> *
A27: 90 | B27: 3 | C27: 5 | D27: 75 | E27: 75 | F27: =IF(D27=E27,"*","") -> * | G27: 75 | H27: 75 | I27: =IF(G27>D27,"*","") ->  | J27: =IF(AND(F27="",G27=MIN(E27,H27)),"*","") ->  | K27: =MAX(D27,G27) -> 75 | L27: =MIN(E27,H27) -> 75 | M27: =IF(K27=L27,"*","") -> *
A28: 90 | B28: 3 | C28: 6 | D28: 68 | E28: 68 | F28: =IF(D28=E28,"*","") -> * | G28: 68 | H28: 68 | I28: =IF(G28>D28,"*","") ->  | J28: =IF(AND(F28="",G28=MIN(E28,H28)),"*","") ->  | K28: =MAX(D28,G28) -> 68 | L28: =MIN(E28,H28) -> 68 | M28: =IF(K28=L28,"*","") -> *
A29: 90 | B29: 3 | C29: 7 | D29: 87 | E29: 87 | F29: =IF(D29=E29,"*","") -> * | G29: 87 | H29: 87 | I29: =IF(G29>D29,"*","") ->  | J29: =IF(AND(F29="",G29=MIN(E29,H29)),"*","") ->  | K29: =MAX(D29,G29) -> 87 | L29: =MIN(E29,H29) -> 87 | M29: =IF(K29=L29,"*","") -> *
A30: 90 | B30: 3 | C30: 8 | D30: 86 | E30: 86 | F30: =IF(D30=E30,"*","") -> * | G30: 86 | H30: 86 | I30: =IF(G30>D30,"*","") ->  | J30: =IF(AND(F30="",G30=MIN(E30,H30)),"*","") ->  | K30: =MAX(D30,G30) -> 86 | L30: =MIN(E30,H30) -> 86 | M30: =IF(K30=L30,"*","") -> *
A31: 90 | B31: 3 | C31: 9 | D31: 61 | E31: 61 | F31: =IF(D31=E31,"*","") -> * | G31: 61 | H31: 61 | I31: =IF(G31>D31,"*","") ->  | J31: =IF(AND(F31="",G31=MIN(E31,H31)),"*","") ->  | K31: =MAX(D31,G31) -> 61 | L31: =MIN(E31,H31) -> 61 | M31: =IF(K31=L31,"*","") -> *
A32: 90 | B32: 3 | C32: 10 | D32: 65 | E32: 65 | F32: =IF(D32=E32,"*","") -> * | G32: 65 | H32: 65 | I32: =IF(G32>D32,"*","") ->  | J32: =IF(AND(F32="",G32=MIN(E32,H32)),"*","") ->  | K32: =MAX(D32,G32) -> 65 | L32: =MIN(E32,H32) -> 65 | M32: =IF(K32=L32,"*","") -> *
A33: 90 | B33: 4 | C33: 1 | D33: 93 | E33: 93 | F33: =IF(D33=E33,"*","") -> * | G33: 93 | H33: 93 | I33: =IF(G33>D33,"*","") ->  | J33: =IF(AND(F33="",G33=MIN(E33,H33)),"*","") ->  | K33: =MAX(D33,G33) -> 93 | L33: =MIN(E33,H33) -> 93 | M33: =IF(K33=L33,"*","") -> *
A34: 90 | B34: 4 | C34: 2 | D34: 89 | E34: 89 | F34: =IF(D34=E34,"*","") -> * | G34: 89 | H34: 89 | I34: =IF(G34>D34,"*","") ->  | J34: =IF(AND(F34="",G34=MIN(E34,H34)),"*","") ->  | K34: =MAX(D34,G34) -> 89 | L34: =MIN(E34,H34) -> 89 | M34: =IF(K34=L34,"*","") -> *
A35: 90 | B35: 4 | C35: 3 | D35: 67 | E35: 67 | F35: =IF(D35=E35,"*","") -> * | G35: 67 | H35: 67 | I35: =IF(G35>D35,"*","") ->  | J35: =IF(AND(F35="",G35=MIN(E35,H35)),"*","") ->  | K35: =MAX(D35,G35) -> 67 | L35: =MIN(E35,H35) -> 67 | M35: =IF(K35=L35,"*","") -> *
A36: 90 | B36: 4 | C36: 4 | D36: 92 | E36: 92 | F36: =IF(D36=E36,"*","") -> * | G36: 92 | H36: 92 | I36: =IF(G36>D36,"*","") ->  | J36: =IF(AND(F36="",G36=MIN(E36,H36)),"*","") ->  | K36: =MAX(D36,G36) -> 92 | L36: =MIN(E36,H36) -> 92 | M36: =IF(K36=L36,"*","") -> *
A37: 90 | B37: 4 | C37: 5 | D37: 88 | E37: 88 | F37: =IF(D37=E37,"*","") -> * | G37: 88 | H37: 88 | I37: =IF(G37>D37,"*","") ->  | J37: =IF(AND(F37="",G37=MIN(E37,H37)),"*","") ->  | K37: =MAX(D37,G37) -> 88 | L37: =MIN(E37,H37) -> 88 | M37: =IF(K37=L37,"*","") -> *
A38: 90 | B38: 4 | C38: 6 | D38: 78 | E38: 78 | F38: =IF(D38=E38,"*","") -> * | G38: 78 | H38: 78 | I38: =IF(G38>D38,"*","") ->  | J38: =IF(AND(F38="",G38=MIN(E38,H38)),"*","") ->  | K38: =MAX(D38,G38) -> 78 | L38: =MIN(E38,H38) -> 78 | M38: =IF(K38=L38,"*","") -> *
A39: 90 | B39: 4 | C39: 7 | D39: 80 | E39: 80 | F39: =IF(D39=E39,"*","") -> * | G39: 80 | H39: 80 | I39: =IF(G39>D39,"*","") ->  | J39: =IF(AND(F39="",G39=MIN(E39,H39)),"*","") ->  | K39: =MAX(D39,G39) -> 80 | L39: =MIN(E39,H39) -> 80 | M39: =IF(K39=L39,"*","") -> *
A40: 90 | B40: 4 | C40: 8 | D40: 69 | E40: 69 | F40: =IF(D40=E40,"*","") -> * | G40: 69 | H40: 69 | I40: =IF(G40>D40,"*","") ->  | J40: =IF(AND(F40="",G40=MIN(E40,H40)),"*","") ->  | K40: =MAX(D40,G40) -> 69 | L40: =MIN(E40,H40) -> 69 | M40: =IF(K40=L40,"*","") -> *
A41: 90 | B41: 4 | C41: 9 | D41: 79 | E41: 79 | F41: =IF(D41=E41,"*","") -> * | G41: 79 | H41: 79 | I41: =IF(G41>D41,"*","") ->  | J41: =IF(AND(F41="",G41=MIN(E41,H41)),"*","") ->  | K41: =MAX(D41,G41) -> 79 | L41: =MIN(E41,H41) -> 79 | M41: =IF(K41=L41,"*","") -> *
A42: 90 | B42: 4 | C42: 10 | D42: 68 | E42: 68 | F42: =IF(D42=E42,"*","") -> * | G42: 68 | H42: 68 | I42: =IF(G42>D42,"*","") ->  | J42: =IF(AND(F42="",G42=MIN(E42,H42)),"*","") ->  | K42: =MAX(D42,G42) -> 68 | L42: =MIN(E42,H42) -> 68 | M42: =IF(K42=L42,"*","") -> *
A43: 90 | B43: 5 | C43: 1 | D43: 73 | E43: 78 | F43: =IF(D43=E43,"*","") ->  | G43: 76 | I43: =IF(G43>D43,"*","") -> * | J43: =IF(AND(F43="",G43=MIN(E43,H43)),"*","") ->  | K43: =MAX(D43,G43) -> 76 | L43: =MIN(E43,H43) -> 78 | M43: =IF(K43=L43,"*","") -> 
A44: 90 | B44: 5 | C44: 2 | D44: 90 | E44: 93 | F44: =IF(D44=E44,"*","") ->  | G44: 90 | I44: =IF(G44>D44,"*","") ->  | J44: =IF(AND(F44="",G44=MIN(E44,H44)),"*","") ->  | K44: =MAX(D44,G44) -> 90 | L44: =MIN(E44,H44) -> 93 | M44: =IF(K44=L44,"*","") -> 
A45: 90 | B45: 5 | C45: 3 | D45: 82 | E45: 89 | F45: =IF(D45=E45,"*","") ->  | G45: 83 | I45: =IF(G45>D45,"*","") -> * | J45: =IF(AND(F45="",G45=MIN(E45,H45)),"*","") ->  | K45: =MAX(D45,G45) -> 83 | L45: =MIN(E45,H45) -> 89 | M45: =IF(K45=L45,"*","") -> 
A46: 90 | B46: 5 | C46: 4 | D46: 95 | E46: 103 | F46: =IF(D46=E46,"*","") ->  | G46: 97 | I46: =IF(G46>D46,"*","") -> * | J46: =IF(AND(F46="",G46=MIN(E46,H46)),"*","") ->  | K46: =MAX(D46,G46) -> 97 | L46: =MIN(E46,H46) -> 103 | M46: =IF(K46=L46,"*","") -> 
A47: 90 | B47: 5 | C47: 5 | D47: 107 | E47: 112 | F47: =IF(D47=E47,"*","") ->  | G47: 108 | I47: =IF(G47>D47,"*","") -> * | J47: =IF(AND(F47="",G47=MIN(E47,H47)),"*","") ->  | K47: =MAX(D47,G47) -> 108 | L47: =MIN(E47,H47) -> 112 | M47: =IF(K47=L47,"*","") -> 
A48: 90 | B48: 5 | C48: 6 | D48: 82 | E48: 87 | F48: =IF(D48=E48,"*","") ->  | G48: 83 | I48: =IF(G48>D48,"*","") -> * | J48: =IF(AND(F48="",G48=MIN(E48,H48)),"*","") ->  | K48: =MAX(D48,G48) -> 83 | L48: =MIN(E48,H48) -> 87 | M48: =IF(K48=L48,"*","") -> 
A49: 90 | B49: 5 | C49: 7 | D49: 105 | E49: 108 | F49: =IF(D49=E49,"*","") ->  | G49: 105 | I49: =IF(G49>D49,"*","") ->  | J49: =IF(AND(F49="",G49=MIN(E49,H49)),"*","") ->  | K49: =MAX(D49,G49) -> 105 | L49: =MIN(E49,H49) -> 108 | M49: =IF(K49=L49,"*","") -> 
A50: 90 | B50: 5 | C50: 8 | D50: 93 | E50: 103 | F50: =IF(D50=E50,"*","") ->  | G50: 94 | I50: =IF(G50>D50,"*","") -> * | J50: =IF(AND(F50="",G50=MIN(E50,H50)),"*","") ->  | K50: =MAX(D50,G50) -> 94 | L50: =MIN(E50,H50) -> 103 | M50: =IF(K50=L50,"*","") -> 
A51: 90 | B51: 5 | C51: 9 | D51: 104 | E51: 117 | F51: =IF(D51=E51,"*","") ->  | G51: 109 | I51: =IF(G51>D51,"*","") -> * | J51: =IF(AND(F51="",G51=MIN(E51,H51)),"*","") ->  | K51: =MAX(D51,G51) -> 109 | L51: =MIN(E51,H51) -> 117 | M51: =IF(K51=L51,"*","") -> 
A52: 90 | B52: 5 | C52: 10 | D52: 94 | E52: 97 | F52: =IF(D52=E52,"*","") ->  | G52: 94 | I52: =IF(G52>D52,"*","") ->  | J52: =IF(AND(F52="",G52=MIN(E52,H52)),"*","") ->  | K52: =MAX(D52,G52) -> 94 | L52: =MIN(E52,H52) -> 97 | M52: =IF(K52=L52,"*","") -> 
A53: 90 | B53: 6 | C53: 1 | D53: 82 | E53: 82 | F53: =IF(D53=E53,"*","") -> * | G53: 82 | H53: 82 | I53: =IF(G53>D53,"*","") ->  | J53: =IF(AND(F53="",G53=MIN(E53,H53)),"*","") ->  | K53: =MAX(D53,G53) -> 82 | L53: =MIN(E53,H53) -> 82 | M53: =IF(K53=L53,"*","") -> *
A54: 90 | B54: 6 | C54: 2 | D54: 86 | E54: 86 | F54: =IF(D54=E54,"*","") -> * | G54: 86 | H54: 86 | I54: =IF(G54>D54,"*","") ->  | J54: =IF(AND(F54="",G54=MIN(E54,H54)),"*","") ->  | K54: =MAX(D54,G54) -> 86 | L54: =MIN(E54,H54) -> 86 | M54: =IF(K54=L54,"*","") -> *
A55: 90 | B55: 6 | C55: 3 | D55: 75 | E55: 77 | F55: =IF(D55=E55,"*","") ->  | G55: 77 | I55: =IF(G55>D55,"*","") -> * | J55: =IF(AND(F55="",G55=MIN(E55,H55)),"*","") -> * | K55: =MAX(D55,G55) -> 77 | L55: =MIN(E55,H55) -> 77 | M55: =IF(K55=L55,"*","") -> *
A56: 90 | B56: 6 | C56: 4 | D56: 80 | E56: 80 | F56: =IF(D56=E56,"*","") -> * | G56: 80 | H56: 80 | I56: =IF(G56>D56,"*","") ->  | J56: =IF(AND(F56="",G56=MIN(E56,H56)),"*","") ->  | K56: =MAX(D56,G56) -> 80 | L56: =MIN(E56,H56) -> 80 | M56: =IF(K56=L56,"*","") -> *
A57: 90 | B57: 6 | C57: 5 | D57: 71 | E57: 71 | F57: =IF(D57=E57,"*","") -> * | G57: 71 | H57: 71 | I57: =IF(G57>D57,"*","") ->  | J57: =IF(AND(F57="",G57=MIN(E57,H57)),"*","") ->  | K57: =MAX(D57,G57) -> 71 | L57: =MIN(E57,H57) -> 71 | M57: =IF(K57=L57,"*","") -> *
A58: 90 | B58: 6 | C58: 6 | D58: 98 | E58: 98 | F58: =IF(D58=E58,"*","") -> * | G58: 98 | H58: 98 | I58: =IF(G58>D58,"*","") ->  | J58: =IF(AND(F58="",G58=MIN(E58,H58)),"*","") ->  | K58: =MAX(D58,G58) -> 98 | L58: =MIN(E58,H58) -> 98 | M58: =IF(K58=L58,"*","") -> *
A59: 90 | B59: 6 | C59: 7 | D59: 71 | E59: 71 | F59: =IF(D59=E59,"*","") -> * | G59: 71 | I59: =IF(G59>D59,"*","") ->  | J59: =IF(AND(F59="",G59=MIN(E59,H59)),"*","") ->  | K59: =MAX(D59,G59) -> 71 | L59: =MIN(E59,H59) -> 71 | M59: =IF(K59=L59,"*","") -> *
A60: 90 | B60: 6 | C60: 8 | D60: 67 | E60: 68 | F60: =IF(D60=E60,"*","") ->  | G60: 67 | I60: =IF(G60>D60,"*","") ->  | J60: =IF(AND(F60="",G60=MIN(E60,H60)),"*","") ->  | K60: =MAX(D60,G60) -> 67 | L60: =MIN(E60,H60) -> 68 | M60: =IF(K60=L60,"*","") -> 
A61: 90 | B61: 6 | C61: 9 | D61: 68 | E61: 68 | F61: =IF(D61=E61,"*","") -> * | G61: 68 | H61: 68 | I61: =IF(G61>D61,"*","") ->  | J61: =IF(AND(F61="",G61=MIN(E61,H61)),"*","") ->  | K61: =MAX(D61,G61) -> 68 | L61: =MIN(E61,H61) -> 68 | M61: =IF(K61=L61,"*","") -> *
A62: 90 | B62: 6 | C62: 10 | D62: 94 | E62: 94 | F62: =IF(D62=E62,"*","") -> * | G62: 94 | H62: 94 | I62: =IF(G62>D62,"*","") ->  | J62: =IF(AND(F62="",G62=MIN(E62,H62)),"*","") ->  | K62: =MAX(D62,G62) -> 94 | L62: =MIN(E62,H62) -> 94 | M62: =IF(K62=L62,"*","") -> *
A63: 90 | B63: 7 | C63: 1 | D63: 88 | E63: 88 | F63: =IF(D63=E63,"*","") -> * | G63: 88 | I63: =IF(G63>D63,"*","") ->  | J63: =IF(AND(F63="",G63=MIN(E63,H63)),"*","") ->  | K63: =MAX(D63,G63) -> 88 | L63: =MIN(E63,H63) -> 88 | M63: =IF(K63=L63,"*","") -> *
A64: 90 | B64: 7 | C64: 2 | D64: 77 | E64: 77 | F64: =IF(D64=E64,"*","") -> * | G64: 77 | I64: =IF(G64>D64,"*","") ->  | J64: =IF(AND(F64="",G64=MIN(E64,H64)),"*","") ->  | K64: =MAX(D64,G64) -> 77 | L64: =MIN(E64,H64) -> 77 | M64: =IF(K64=L64,"*","") -> *
A65: 90 | B65: 7 | C65: 3 | D65: 80 | E65: 80 | F65: =IF(D65=E65,"*","") -> * | G65: 80 | H65: 80 | I65: =IF(G65>D65,"*","") ->  | J65: =IF(AND(F65="",G65=MIN(E65,H65)),"*","") ->  | K65: =MAX(D65,G65) -> 80 | L65: =MIN(E65,H65) -> 80 | M65: =IF(K65=L65,"*","") -> *
A66: 90 | B66: 7 | C66: 4 | D66: 86 | E66: 86 | F66: =IF(D66=E66,"*","") -> * | G66: 86 | H66: 86 | I66: =IF(G66>D66,"*","") ->  | J66: =IF(AND(F66="",G66=MIN(E66,H66)),"*","") ->  | K66: =MAX(D66,G66) -> 86 | L66: =MIN(E66,H66) -> 86 | M66: =IF(K66=L66,"*","") -> *
A67: 90 | B67: 7 | C67: 5 | D67: 79 | E67: 79 | F67: =IF(D67=E67,"*","") -> * | G67: 79 | H67: 79 | I67: =IF(G67>D67,"*","") ->  | J67: =IF(AND(F67="",G67=MIN(E67,H67)),"*","") ->  | K67: =MAX(D67,G67) -> 79 | L67: =MIN(E67,H67) -> 79 | M67: =IF(K67=L67,"*","") -> *
A68: 90 | B68: 7 | C68: 6 | D68: 90 | E68: 90 | F68: =IF(D68=E68,"*","") -> * | G68: 90 | I68: =IF(G68>D68,"*","") ->  | J68: =IF(AND(F68="",G68=MIN(E68,H68)),"*","") ->  | K68: =MAX(D68,G68) -> 90 | L68: =MIN(E68,H68) -> 90 | M68: =IF(K68=L68,"*","") -> *
A69: 90 | B69: 7 | C69: 7 | D69: 90 | E69: 90 | F69: =IF(D69=E69,"*","") -> * | G69: 90 | I69: =IF(G69>D69,"*","") ->  | J69: =IF(AND(F69="",G69=MIN(E69,H69)),"*","") ->  | K69: =MAX(D69,G69) -> 90 | L69: =MIN(E69,H69) -> 90 | M69: =IF(K69=L69,"*","") -> *
A70: 90 | B70: 7 | C70: 8 | D70: 60 | E70: 60 | F70: =IF(D70=E70,"*","") -> * | G70: 60 | I70: =IF(G70>D70,"*","") ->  | J70: =IF(AND(F70="",G70=MIN(E70,H70)),"*","") ->  | K70: =MAX(D70,G70) -> 60 | L70: =MIN(E70,H70) -> 60 | M70: =IF(K70=L70,"*","") -> *
A71: 90 | B71: 7 | C71: 9 | D71: 83 | E71: 83 | F71: =IF(D71=E71,"*","") -> * | G71: 83 | H71: 83 | I71: =IF(G71>D71,"*","") ->  | J71: =IF(AND(F71="",G71=MIN(E71,H71)),"*","") ->  | K71: =MAX(D71,G71) -> 83 | L71: =MIN(E71,H71) -> 83 | M71: =IF(K71=L71,"*","") -> *
A72: 90 | B72: 7 | C72: 10 | D72: 98 | E72: 98 | F72: =IF(D72=E72,"*","") -> * | G72: 98 | I72: =IF(G72>D72,"*","") ->  | J72: =IF(AND(F72="",G72=MIN(E72,H72)),"*","") ->  | K72: =MAX(D72,G72) -> 98 | L72: =MIN(E72,H72) -> 98 | M72: =IF(K72=L72,"*","") -> *
A73: 90 | B73: 8 | C73: 1 | D73: 96 | E73: 96 | F73: =IF(D73=E73,"*","") -> * | G73: 96 | I73: =IF(G73>D73,"*","") ->  | J73: =IF(AND(F73="",G73=MIN(E73,H73)),"*","") ->  | K73: =MAX(D73,G73) -> 96 | L73: =MIN(E73,H73) -> 96 | M73: =IF(K73=L73,"*","") -> *
A74: 90 | B74: 8 | C74: 2 | D74: 78 | E74: 78 | F74: =IF(D74=E74,"*","") -> * | G74: 78 | I74: =IF(G74>D74,"*","") ->  | J74: =IF(AND(F74="",G74=MIN(E74,H74)),"*","") ->  | K74: =MAX(D74,G74) -> 78 | L74: =MIN(E74,H74) -> 78 | M74: =IF(K74=L74,"*","") -> *
A75: 90 | B75: 8 | C75: 3 | D75: 70 | E75: 70 | F75: =IF(D75=E75,"*","") -> * | G75: 70 | I75: =IF(G75>D75,"*","") ->  | J75: =IF(AND(F75="",G75=MIN(E75,H75)),"*","") ->  | K75: =MAX(D75,G75) -> 70 | L75: =MIN(E75,H75) -> 70 | M75: =IF(K75=L75,"*","") -> *
A76: 90 | B76: 8 | C76: 4 | D76: 77 | E76: 77 | F76: =IF(D76=E76,"*","") -> * | G76: 77 | I76: =IF(G76>D76,"*","") ->  | J76: =IF(AND(F76="",G76=MIN(E76,H76)),"*","") ->  | K76: =MAX(D76,G76) -> 77 | L76: =MIN(E76,H76) -> 77 | M76: =IF(K76=L76,"*","") -> *
A77: 90 | B77: 8 | C77: 5 | D77: 63 | E77: 63 | F77: =IF(D77=E77,"*","") -> * | G77: 63 | I77: =IF(G77>D77,"*","") ->  | J77: =IF(AND(F77="",G77=MIN(E77,H77)),"*","") ->  | K77: =MAX(D77,G77) -> 63 | L77: =MIN(E77,H77) -> 63 | M77: =IF(K77=L77,"*","") -> *
A78: 90 | B78: 8 | C78: 6 | D78: 70 | E78: 70 | F78: =IF(D78=E78,"*","") -> * | G78: 70 | I78: =IF(G78>D78,"*","") ->  | J78: =IF(AND(F78="",G78=MIN(E78,H78)),"*","") ->  | K78: =MAX(D78,G78) -> 70 | L78: =MIN(E78,H78) -> 70 | M78: =IF(K78=L78,"*","") -> *
A79: 90 | B79: 8 | C79: 7 | D79: 77 | E79: 77 | F79: =IF(D79=E79,"*","") -> * | G79: 77 | I79: =IF(G79>D79,"*","") ->  | J79: =IF(AND(F79="",G79=MIN(E79,H79)),"*","") ->  | K79: =MAX(D79,G79) -> 77 | L79: =MIN(E79,H79) -> 77 | M79: =IF(K79=L79,"*","") -> *
A80: 90 | B80: 8 | C80: 8 | D80: 68 | E80: 68 | F80: =IF(D80=E80,"*","") -> * | G80: 68 | I80: =IF(G80>D80,"*","") ->  | J80: =IF(AND(F80="",G80=MIN(E80,H80)),"*","") ->  | K80: =MAX(D80,G80) -> 68 | L80: =MIN(E80,H80) -> 68 | M80: =IF(K80=L80,"*","") -> *
A81: 90 | B81: 8 | C81: 9 | D81: 97 | E81: 97 | F81: =IF(D81=E81,"*","") -> * | G81: 97 | I81: =IF(G81>D81,"*","") ->  | J81: =IF(AND(F81="",G81=MIN(E81,H81)),"*","") ->  | K81: =MAX(D81,G81) -> 97 | L81: =MIN(E81,H81) -> 97 | M81: =IF(K81=L81,"*","") -> *
A82: 90 | B82: 8 | C82: 10 | D82: 88 | E82: 88 | F82: =IF(D82=E82,"*","") -> * | G82: 88 | I82: =IF(G82>D82,"*","") ->  | J82: =IF(AND(F82="",G82=MIN(E82,H82)),"*","") ->  | K82: =MAX(D82,G82) -> 88 | L82: =MIN(E82,H82) -> 88 | M82: =IF(K82=L82,"*","") -> *
A83: 90 | B83: 9 | C83: 1 | D83: 98 | E83: 106 | F83: =IF(D83=E83,"*","") ->  | G83: 97 | I83: =IF(G83>D83,"*","") ->  | J83: =IF(AND(F83="",G83=MIN(E83,H83)),"*","") ->  | K83: =MAX(D83,G83) -> 98 | L83: =MIN(E83,H83) -> 106 | M83: =IF(K83=L83,"*","") -> 
A84: 90 | B84: 9 | C84: 2 | D84: 119 | E84: 128 | F84: =IF(D84=E84,"*","") ->  | G84: 119 | I84: =IF(G84>D84,"*","") ->  | J84: =IF(AND(F84="",G84=MIN(E84,H84)),"*","") ->  | K84: =MAX(D84,G84) -> 119 | L84: =MIN(E84,H84) -> 128 | M84: =IF(K84=L84,"*","") -> 
A85: 90 | B85: 9 | C85: 3 | D85: 97 | E85: 103 | F85: =IF(D85=E85,"*","") ->  | G85: 97 | I85: =IF(G85>D85,"*","") ->  | J85: =IF(AND(F85="",G85=MIN(E85,H85)),"*","") ->  | K85: =MAX(D85,G85) -> 97 | L85: =MIN(E85,H85) -> 103 | M85: =IF(K85=L85,"*","") -> 
A86: 90 | B86: 9 | C86: 4 | D86: 117 | E86: 129 | F86: =IF(D86=E86,"*","") ->  | G86: 116 | I86: =IF(G86>D86,"*","") ->  | J86: =IF(AND(F86="",G86=MIN(E86,H86)),"*","") ->  | K86: =MAX(D86,G86) -> 117 | L86: =MIN(E86,H86) -> 129 | M86: =IF(K86=L86,"*","") -> 
A87: 90 | B87: 9 | C87: 5 | D87: 125 | E87: 140 | F87: =IF(D87=E87,"*","") ->  | G87: 123 | I87: =IF(G87>D87,"*","") ->  | J87: =IF(AND(F87="",G87=MIN(E87,H87)),"*","") ->  | K87: =MAX(D87,G87) -> 125 | L87: =MIN(E87,H87) -> 140 | M87: =IF(K87=L87,"*","") -> 
A88: 90 | B88: 9 | C88: 6 | D88: 110 | E88: 119 | F88: =IF(D88=E88,"*","") ->  | G88: 110 | I88: =IF(G88>D88,"*","") ->  | J88: =IF(AND(F88="",G88=MIN(E88,H88)),"*","") ->  | K88: =MAX(D88,G88) -> 110 | L88: =MIN(E88,H88) -> 119 | M88: =IF(K88=L88,"*","") -> 
A89: 90 | B89: 9 | C89: 7 | D89: 102 | E89: 110 | F89: =IF(D89=E89,"*","") ->  | G89: 102 | I89: =IF(G89>D89,"*","") ->  | J89: =IF(AND(F89="",G89=MIN(E89,H89)),"*","") ->  | K89: =MAX(D89,G89) -> 102 | L89: =MIN(E89,H89) -> 110 | M89: =IF(K89=L89,"*","") -> 
A90: 90 | B90: 9 | C90: 8 | D90: 109 | E90: 118 | F90: =IF(D90=E90,"*","") ->  | G90: 110 | I90: =IF(G90>D90,"*","") -> * | J90: =IF(AND(F90="",G90=MIN(E90,H90)),"*","") ->  | K90: =MAX(D90,G90) -> 110 | L90: =MIN(E90,H90) -> 118 | M90: =IF(K90=L90,"*","") -> 
A91: 90 | B91: 9 | C91: 9 | D91: 105 | E91: 117 | F91: =IF(D91=E91,"*","") ->  | G91: 104 | I91: =IF(G91>D91,"*","") ->  | J91: =IF(AND(F91="",G91=MIN(E91,H91)),"*","") ->  | K91: =MAX(D91,G91) -> 105 | L91: =MIN(E91,H91) -> 117 | M91: =IF(K91=L91,"*","") -> 
A92: 90 | B92: 9 | C92: 10 | D92: 102 | E92: 112 | F92: =IF(D92=E92,"*","") ->  | G92: 103 | I92: =IF(G92>D92,"*","") -> * | J92: =IF(AND(F92="",G92=MIN(E92,H92)),"*","") ->  | K92: =MAX(D92,G92) -> 103 | L92: =MIN(E92,H92) -> 112 | M92: =IF(K92=L92,"*","") -> 
A93: 90 | B93: 10 | C93: 1 | D93: 77 | E93: 77 | F93: =IF(D93=E93,"*","") -> * | G93: 77 | H93: 77 | I93: =IF(G93>D93,"*","") ->  | J93: =IF(AND(F93="",G93=MIN(E93,H93)),"*","") ->  | K93: =MAX(D93,G93) -> 77 | L93: =MIN(E93,H93) -> 77 | M93: =IF(K93=L93,"*","") -> *
A94: 90 | B94: 10 | C94: 2 | D94: 95 | E94: 95 | F94: =IF(D94=E94,"*","") -> * | G94: 95 | H94: 95 | I94: =IF(G94>D94,"*","") ->  | J94: =IF(AND(F94="",G94=MIN(E94,H94)),"*","") ->  | K94: =MAX(D94,G94) -> 95 | L94: =MIN(E94,H94) -> 95 | M94: =IF(K94=L94,"*","") -> *
A95: 90 | B95: 10 | C95: 3 | D95: 112 | E95: 112 | F95: =IF(D95=E95,"*","") -> * | G95: 112 | I95: =IF(G95>D95,"*","") ->  | J95: =IF(AND(F95="",G95=MIN(E95,H95)),"*","") ->  | K95: =MAX(D95,G95) -> 112 | L95: =MIN(E95,H95) -> 112 | M95: =IF(K95=L95,"*","") -> *
A96: 90 | B96: 10 | C96: 4 | D96: 94 | E96: 94 | F96: =IF(D96=E96,"*","") -> * | G96: 94 | I96: =IF(G96>D96,"*","") ->  | J96: =IF(AND(F96="",G96=MIN(E96,H96)),"*","") ->  | K96: =MAX(D96,G96) -> 94 | L96: =MIN(E96,H96) -> 94 | M96: =IF(K96=L96,"*","") -> *
A97: 90 | B97: 10 | C97: 5 | D97: 78 | E97: 78 | F97: =IF(D97=E97,"*","") -> * | G97: 78 | I97: =IF(G97>D97,"*","") ->  | J97: =IF(AND(F97="",G97=MIN(E97,H97)),"*","") ->  | K97: =MAX(D97,G97) -> 78 | L97: =MIN(E97,H97) -> 78 | M97: =IF(K97=L97,"*","") -> *
A98: 90 | B98: 10 | C98: 6 | D98: 92 | E98: 92 | F98: =IF(D98=E98,"*","") -> * | G98: 92 | I98: =IF(G98>D98,"*","") ->  | J98: =IF(AND(F98="",G98=MIN(E98,H98)),"*","") ->  | K98: =MAX(D98,G98) -> 92 | L98: =MIN(E98,H98) -> 92 | M98: =IF(K98=L98,"*","") -> *
A99: 90 | B99: 10 | C99: 7 | D99: 83 | E99: 83 | F99: =IF(D99=E99,"*","") -> * | G99: 83 | I99: =IF(G99>D99,"*","") ->  | J99: =IF(AND(F99="",G99=MIN(E99,H99)),"*","") ->  | K99: =MAX(D99,G99) -> 83 | L99: =MIN(E99,H99) -> 83 | M99: =IF(K99=L99,"*","") -> *
A100: 90 | B100: 10 | C100: 8 | D100: 81 | E100: 81 | F100: =IF(D100=E100,"*","") -> * | G100: 81 | H100: 81 | I100: =IF(G100>D100,"*","") ->  | J100: =IF(AND(F100="",G100=MIN(E100,H100)),"*","") ->  | K100: =MAX(D100,G100) -> 81 | L100: =MIN(E100,H100) -> 81 | M100: =IF(K100=L100,"*","") -> *
A101: 90 | B101: 10 | C101: 9 | D101: 88 | E101: 88 | F101: =IF(D101=E101,"*","") -> * | G101: 88 | I101: =IF(G101>D101,"*","") ->  | J101: =IF(AND(F101="",G101=MIN(E101,H101)),"*","") ->  | K101: =MAX(D101,G101) -> 88 | L101: =MIN(E101,H101) -> 88 | M101: =IF(K101=L101,"*","") -> *
A102: 90 | B102: 10 | C102: 10 | D102: 75 | E102: 75 | F102: =IF(D102=E102,"*","") -> * | G102: 75 | H102: 75 | I102: =IF(G102>D102,"*","") ->  | J102: =IF(AND(F102="",G102=MIN(E102,H102)),"*","") ->  | K102: =MAX(D102,G102) -> 75 | L102: =MIN(E102,H102) -> 75 | M102: =IF(K102=L102,"*","") -> *
A103: 90 | B103: 11 | C103: 1 | D103: 86 | E103: 86 | F103: =IF(D103=E103,"*","") -> * | G103: 86 | I103: =IF(G103>D103,"*","") ->  | J103: =IF(AND(F103="",G103=MIN(E103,H103)),"*","") ->  | K103: =MAX(D103,G103) -> 86 | L103: =MIN(E103,H103) -> 86 | M103: =IF(K103=L103,"*","") -> *
A104: 90 | B104: 11 | C104: 2 | D104: 99 | E104: 99 | F104: =IF(D104=E104,"*","") -> * | G104: 99 | H104: 99 | I104: =IF(G104>D104,"*","") ->  | J104: =IF(AND(F104="",G104=MIN(E104,H104)),"*","") ->  | K104: =MAX(D104,G104) -> 99 | L104: =MIN(E104,H104) -> 99 | M104: =IF(K104=L104,"*","") -> *
A105: 90 | B105: 11 | C105: 3 | D105: 69 | E105: 69 | F105: =IF(D105=E105,"*","") -> * | G105: 69 | I105: =IF(G105>D105,"*","") ->  | J105: =IF(AND(F105="",G105=MIN(E105,H105)),"*","") ->  | K105: =MAX(D105,G105) -> 69 | L105: =MIN(E105,H105) -> 69 | M105: =IF(K105=L105,"*","") -> *
A106: 90 | B106: 11 | C106: 4 | D106: 64 | E106: 64 | F106: =IF(D106=E106,"*","") -> * | G106: 64 | I106: =IF(G106>D106,"*","") ->  | J106: =IF(AND(F106="",G106=MIN(E106,H106)),"*","") ->  | K106: =MAX(D106,G106) -> 64 | L106: =MIN(E106,H106) -> 64 | M106: =IF(K106=L106,"*","") -> *
A107: 90 | B107: 11 | C107: 5 | D107: 81 | E107: 81 | F107: =IF(D107=E107,"*","") -> * | G107: 81 | I107: =IF(G107>D107,"*","") ->  | J107: =IF(AND(F107="",G107=MIN(E107,H107)),"*","") ->  | K107: =MAX(D107,G107) -> 81 | L107: =MIN(E107,H107) -> 81 | M107: =IF(K107=L107,"*","") -> *
A108: 90 | B108: 11 | C108: 6 | D108: 78 | E108: 78 | F108: =IF(D108=E108,"*","") -> * | G108: 78 | I108: =IF(G108>D108,"*","") ->  | J108: =IF(AND(F108="",G108=MIN(E108,H108)),"*","") ->  | K108: =MAX(D108,G108) -> 78 | L108: =MIN(E108,H108) -> 78 | M108: =IF(K108=L108,"*","") -> *
A109: 90 | B109: 11 | C109: 7 | D109: 95 | E109: 95 | F109: =IF(D109=E109,"*","") -> * | G109: 95 | I109: =IF(G109>D109,"*","") ->  | J109: =IF(AND(F109="",G109=MIN(E109,H109)),"*","") ->  | K109: =MAX(D109,G109) -> 95 | L109: =MIN(E109,H109) -> 95 | M109: =IF(K109=L109,"*","") -> *
A110: 90 | B110: 11 | C110: 8 | D110: 82 | E110: 82 | F110: =IF(D110=E110,"*","") -> * | G110: 82 | I110: =IF(G110>D110,"*","") ->  | J110: =IF(AND(F110="",G110=MIN(E110,H110)),"*","") ->  | K110: =MAX(D110,G110) -> 82 | L110: =MIN(E110,H110) -> 82 | M110: =IF(K110=L110,"*","") -> *
A111: 90 | B111: 11 | C111: 9 | D111: 81 | E111: 81 | F111: =IF(D111=E111,"*","") -> * | G111: 81 | I111: =IF(G111>D111,"*","") ->  | J111: =IF(AND(F111="",G111=MIN(E111,H111)),"*","") ->  | K111: =MAX(D111,G111) -> 81 | L111: =MIN(E111,H111) -> 81 | M111: =IF(K111=L111,"*","") -> *
A112: 90 | B112: 11 | C112: 10 | D112: 81 | E112: 81 | F112: =IF(D112=E112,"*","") -> * | G112: 81 | I112: =IF(G112>D112,"*","") ->  | J112: =IF(AND(F112="",G112=MIN(E112,H112)),"*","") ->  | K112: =MAX(D112,G112) -> 81 | L112: =MIN(E112,H112) -> 81 | M112: =IF(K112=L112,"*","") -> *
A113: 90 | B113: 12 | C113: 1 | D113: 71 | E113: 71 | F113: =IF(D113=E113,"*","") -> * | G113: 71 | I113: =IF(G113>D113,"*","") ->  | J113: =IF(AND(F113="",G113=MIN(E113,H113)),"*","") ->  | K113: =MAX(D113,G113) -> 71 | L113: =MIN(E113,H113) -> 71 | M113: =IF(K113=L113,"*","") -> *
A114: 90 | B114: 12 | C114: 2 | D114: 71 | E114: 71 | F114: =IF(D114=E114,"*","") -> * | G114: 71 | I114: =IF(G114>D114,"*","") ->  | J114: =IF(AND(F114="",G114=MIN(E114,H114)),"*","") ->  | K114: =MAX(D114,G114) -> 71 | L114: =MIN(E114,H114) -> 71 | M114: =IF(K114=L114,"*","") -> *
A115: 90 | B115: 12 | C115: 3 | D115: 93 | E115: 93 | F115: =IF(D115=E115,"*","") -> * | G115: 93 | I115: =IF(G115>D115,"*","") ->  | J115: =IF(AND(F115="",G115=MIN(E115,H115)),"*","") ->  | K115: =MAX(D115,G115) -> 93 | L115: =MIN(E115,H115) -> 93 | M115: =IF(K115=L115,"*","") -> *
A116: 90 | B116: 12 | C116: 4 | D116: 73 | E116: 73 | F116: =IF(D116=E116,"*","") -> * | G116: 73 | I116: =IF(G116>D116,"*","") ->  | J116: =IF(AND(F116="",G116=MIN(E116,H116)),"*","") ->  | K116: =MAX(D116,G116) -> 73 | L116: =MIN(E116,H116) -> 73 | M116: =IF(K116=L116,"*","") -> *
A117: 90 | B117: 12 | C117: 5 | D117: 83 | E117: 83 | F117: =IF(D117=E117,"*","") -> * | G117: 83 | I117: =IF(G117>D117,"*","") ->  | J117: =IF(AND(F117="",G117=MIN(E117,H117)),"*","") ->  | K117: =MAX(D117,G117) -> 83 | L117: =MIN(E117,H117) -> 83 | M117: =IF(K117=L117,"*","") -> *
A118: 90 | B118: 12 | C118: 6 | D118: 81 | E118: 81 | F118: =IF(D118=E118,"*","") -> * | G118: 81 | I118: =IF(G118>D118,"*","") ->  | J118: =IF(AND(F118="",G118=MIN(E118,H118)),"*","") ->  | K118: =MAX(D118,G118) -> 81 | L118: =MIN(E118,H118) -> 81 | M118: =IF(K118=L118,"*","") -> *
A119: 90 | B119: 12 | C119: 7 | D119: 77 | E119: 77 | F119: =IF(D119=E119,"*","") -> * | G119: 77 | I119: =IF(G119>D119,"*","") ->  | J119: =IF(AND(F119="",G119=MIN(E119,H119)),"*","") ->  | K119: =MAX(D119,G119) -> 77 | L119: =MIN(E119,H119) -> 77 | M119: =IF(K119=L119,"*","") -> *
A120: 90 | B120: 12 | C120: 8 | D120: 83 | E120: 83 | F120: =IF(D120=E120,"*","") -> * | G120: 83 | I120: =IF(G120>D120,"*","") ->  | J120: =IF(AND(F120="",G120=MIN(E120,H120)),"*","") ->  | K120: =MAX(D120,G120) -> 83 | L120: =MIN(E120,H120) -> 83 | M120: =IF(K120=L120,"*","") -> *
A121: 90 | B121: 12 | C121: 9 | D121: 77 | E121: 77 | F121: =IF(D121=E121,"*","") -> * | G121: 77 | I121: =IF(G121>D121,"*","") ->  | J121: =IF(AND(F121="",G121=MIN(E121,H121)),"*","") ->  | K121: =MAX(D121,G121) -> 77 | L121: =MIN(E121,H121) -> 77 | M121: =IF(K121=L121,"*","") -> *
A122: 90 | B122: 12 | C122: 10 | D122: 86 | E122: 86 | F122: =IF(D122=E122,"*","") -> * | G122: 86 | I122: =IF(G122>D122,"*","") ->  | J122: =IF(AND(F122="",G122=MIN(E122,H122)),"*","") ->  | K122: =MAX(D122,G122) -> 86 | L122: =MIN(E122,H122) -> 86 | M122: =IF(K122=L122,"*","") -> *
A123: 90 | B123: 13 | C123: 1 | D123: 127 | E123: 139 | F123: =IF(D123=E123,"*","") ->  | G123: 126 | I123: =IF(G123>D123,"*","") ->  | J123: =IF(AND(F123="",G123=MIN(E123,H123)),"*","") ->  | K123: =MAX(D123,G123) -> 127 | L123: =MIN(E123,H123) -> 139 | M123: =IF(K123=L123,"*","") -> 
A124: 90 | B124: 13 | C124: 2 | D124: 118 | E124: 129 | F124: =IF(D124=E124,"*","") ->  | G124: 116 | I124: =IF(G124>D124,"*","") ->  | J124: =IF(AND(F124="",G124=MIN(E124,H124)),"*","") ->  | K124: =MAX(D124,G124) -> 118 | L124: =MIN(E124,H124) -> 129 | M124: =IF(K124=L124,"*","") -> 
A125: 90 | B125: 13 | C125: 3 | D125: 104 | E125: 109 | F125: =IF(D125=E125,"*","") ->  | G125: 104 | I125: =IF(G125>D125,"*","") ->  | J125: =IF(AND(F125="",G125=MIN(E125,H125)),"*","") ->  | K125: =MAX(D125,G125) -> 104 | L125: =MIN(E125,H125) -> 109 | M125: =IF(K125=L125,"*","") -> 
A126: 90 | B126: 13 | C126: 4 | D126: 108 | E126: 113 | F126: =IF(D126=E126,"*","") ->  | G126: 108 | I126: =IF(G126>D126,"*","") ->  | J126: =IF(AND(F126="",G126=MIN(E126,H126)),"*","") ->  | K126: =MAX(D126,G126) -> 108 | L126: =MIN(E126,H126) -> 113 | M126: =IF(K126=L126,"*","") -> 
A127: 90 | B127: 13 | C127: 5 | D127: 108 | E127: 116 | F127: =IF(D127=E127,"*","") ->  | G127: 108 | I127: =IF(G127>D127,"*","") ->  | J127: =IF(AND(F127="",G127=MIN(E127,H127)),"*","") ->  | K127: =MAX(D127,G127) -> 108 | L127: =MIN(E127,H127) -> 116 | M127: =IF(K127=L127,"*","") -> 
A128: 90 | B128: 13 | C128: 6 | D128: 116 | E128: 125 | F128: =IF(D128=E128,"*","") ->  | G128: 115 | I128: =IF(G128>D128,"*","") ->  | J128: =IF(AND(F128="",G128=MIN(E128,H128)),"*","") ->  | K128: =MAX(D128,G128) -> 116 | L128: =MIN(E128,H128) -> 125 | M128: =IF(K128=L128,"*","") -> 
A129: 90 | B129: 13 | C129: 7 | D129: 115 | E129: 124 | F129: =IF(D129=E129,"*","") ->  | G129: 114 | I129: =IF(G129>D129,"*","") ->  | J129: =IF(AND(F129="",G129=MIN(E129,H129)),"*","") ->  | K129: =MAX(D129,G129) -> 115 | L129: =MIN(E129,H129) -> 124 | M129: =IF(K129=L129,"*","") -> 
A130: 90 | B130: 13 | C130: 8 | D130: 112 | E130: 118 | F130: =IF(D130=E130,"*","") ->  | G130: 112 | I130: =IF(G130>D130,"*","") ->  | J130: =IF(AND(F130="",G130=MIN(E130,H130)),"*","") ->  | K130: =MAX(D130,G130) -> 112 | L130: =MIN(E130,H130) -> 118 | M130: =IF(K130=L130,"*","") -> 
A131: 90 | B131: 13 | C131: 9 | D131: 116 | E131: 125 | F131: =IF(D131=E131,"*","") ->  | G131: 115 | I131: =IF(G131>D131,"*","") ->  | J131: =IF(AND(F131="",G131=MIN(E131,H131)),"*","") ->  | K131: =MAX(D131,G131) -> 116 | L131: =MIN(E131,H131) -> 125 | M131: =IF(K131=L131,"*","") -> 
A132: 90 | B132: 13 | C132: 10 | D132: 112 | E132: 121 | F132: =IF(D132=E132,"*","") ->  | G132: 112 | I132: =IF(G132>D132,"*","") ->  | J132: =IF(AND(F132="",G132=MIN(E132,H132)),"*","") ->  | K132: =MAX(D132,G132) -> 112 | L132: =MIN(E132,H132) -> 121 | M132: =IF(K132=L132,"*","") -> 
A133: 90 | B133: 14 | C133: 1 | D133: 89 | E133: 89 | F133: =IF(D133=E133,"*","") -> * | G133: 89 | I133: =IF(G133>D133,"*","") ->  | J133: =IF(AND(F133="",G133=MIN(E133,H133)),"*","") ->  | K133: =MAX(D133,G133) -> 89 | L133: =MIN(E133,H133) -> 89 | M133: =IF(K133=L133,"*","") -> *
A134: 90 | B134: 14 | C134: 2 | D134: 79 | E134: 79 | F134: =IF(D134=E134,"*","") -> * | G134: 79 | I134: =IF(G134>D134,"*","") ->  | J134: =IF(AND(F134="",G134=MIN(E134,H134)),"*","") ->  | K134: =MAX(D134,G134) -> 79 | L134: =MIN(E134,H134) -> 79 | M134: =IF(K134=L134,"*","") -> *
A135: 90 | B135: 14 | C135: 3 | D135: 94 | E135: 94 | F135: =IF(D135=E135,"*","") -> * | G135: 94 | I135: =IF(G135>D135,"*","") ->  | J135: =IF(AND(F135="",G135=MIN(E135,H135)),"*","") ->  | K135: =MAX(D135,G135) -> 94 | L135: =MIN(E135,H135) -> 94 | M135: =IF(K135=L135,"*","") -> *
A136: 90 | B136: 14 | C136: 4 | D136: 88 | E136: 88 | F136: =IF(D136=E136,"*","") -> * | G136: 88 | I136: =IF(G136>D136,"*","") ->  | J136: =IF(AND(F136="",G136=MIN(E136,H136)),"*","") ->  | K136: =MAX(D136,G136) -> 88 | L136: =MIN(E136,H136) -> 88 | M136: =IF(K136=L136,"*","") -> *
A137: 90 | B137: 14 | C137: 5 | D137: 84 | E137: 84 | F137: =IF(D137=E137,"*","") -> * | G137: 84 | I137: =IF(G137>D137,"*","") ->  | J137: =IF(AND(F137="",G137=MIN(E137,H137)),"*","") ->  | K137: =MAX(D137,G137) -> 84 | L137: =MIN(E137,H137) -> 84 | M137: =IF(K137=L137,"*","") -> *
A138: 90 | B138: 14 | C138: 6 | D138: 76 | E138: 76 | F138: =IF(D138=E138,"*","") -> * | G138: 76 | I138: =IF(G138>D138,"*","") ->  | J138: =IF(AND(F138="",G138=MIN(E138,H138)),"*","") ->  | K138: =MAX(D138,G138) -> 76 | L138: =MIN(E138,H138) -> 76 | M138: =IF(K138=L138,"*","") -> *
A139: 90 | B139: 14 | C139: 7 | D139: 86 | E139: 86 | F139: =IF(D139=E139,"*","") -> * | G139: 86 | I139: =IF(G139>D139,"*","") ->  | J139: =IF(AND(F139="",G139=MIN(E139,H139)),"*","") ->  | K139: =MAX(D139,G139) -> 86 | L139: =MIN(E139,H139) -> 86 | M139: =IF(K139=L139,"*","") -> *
A140: 90 | B140: 14 | C140: 8 | D140: 80 | E140: 80 | F140: =IF(D140=E140,"*","") -> * | G140: 80 | I140: =IF(G140>D140,"*","") ->  | J140: =IF(AND(F140="",G140=MIN(E140,H140)),"*","") ->  | K140: =MAX(D140,G140) -> 80 | L140: =MIN(E140,H140) -> 80 | M140: =IF(K140=L140,"*","") -> *
A141: 90 | B141: 14 | C141: 9 | D141: 112 | E141: 112 | F141: =IF(D141=E141,"*","") -> * | G141: 112 | I141: =IF(G141>D141,"*","") ->  | J141: =IF(AND(F141="",G141=MIN(E141,H141)),"*","") ->  | K141: =MAX(D141,G141) -> 112 | L141: =MIN(E141,H141) -> 112 | M141: =IF(K141=L141,"*","") -> *
A142: 90 | B142: 14 | C142: 10 | D142: 85 | E142: 85 | F142: =IF(D142=E142,"*","") -> * | G142: 85 | I142: =IF(G142>D142,"*","") ->  | J142: =IF(AND(F142="",G142=MIN(E142,H142)),"*","") ->  | K142: =MAX(D142,G142) -> 85 | L142: =MIN(E142,H142) -> 85 | M142: =IF(K142=L142,"*","") -> *
A143: 90 | B143: 15 | C143: 1 | D143: 76 | E143: 76 | F143: =IF(D143=E143,"*","") -> * | G143: 76 | I143: =IF(G143>D143,"*","") ->  | J143: =IF(AND(F143="",G143=MIN(E143,H143)),"*","") ->  | K143: =MAX(D143,G143) -> 76 | L143: =MIN(E143,H143) -> 76 | M143: =IF(K143=L143,"*","") -> *
A144: 90 | B144: 15 | C144: 2 | D144: 71 | E144: 71 | F144: =IF(D144=E144,"*","") -> * | G144: 71 | I144: =IF(G144>D144,"*","") ->  | J144: =IF(AND(F144="",G144=MIN(E144,H144)),"*","") ->  | K144: =MAX(D144,G144) -> 71 | L144: =MIN(E144,H144) -> 71 | M144: =IF(K144=L144,"*","") -> *
A145: 90 | B145: 15 | C145: 3 | D145: 82 | E145: 82 | F145: =IF(D145=E145,"*","") -> * | G145: 82 | I145: =IF(G145>D145,"*","") ->  | J145: =IF(AND(F145="",G145=MIN(E145,H145)),"*","") ->  | K145: =MAX(D145,G145) -> 82 | L145: =MIN(E145,H145) -> 82 | M145: =IF(K145=L145,"*","") -> *
A146: 90 | B146: 15 | C146: 4 | D146: 92 | E146: 92 | F146: =IF(D146=E146,"*","") -> * | G146: 92 | I146: =IF(G146>D146,"*","") ->  | J146: =IF(AND(F146="",G146=MIN(E146,H146)),"*","") ->  | K146: =MAX(D146,G146) -> 92 | L146: =MIN(E146,H146) -> 92 | M146: =IF(K146=L146,"*","") -> *
A147: 90 | B147: 15 | C147: 5 | D147: 93 | E147: 93 | F147: =IF(D147=E147,"*","") -> * | G147: 93 | I147: =IF(G147>D147,"*","") ->  | J147: =IF(AND(F147="",G147=MIN(E147,H147)),"*","") ->  | K147: =MAX(D147,G147) -> 93 | L147: =MIN(E147,H147) -> 93 | M147: =IF(K147=L147,"*","") -> *
A148: 90 | B148: 15 | C148: 6 | D148: 61 | E148: 61 | F148: =IF(D148=E148,"*","") -> * | G148: 61 | I148: =IF(G148>D148,"*","") ->  | J148: =IF(AND(F148="",G148=MIN(E148,H148)),"*","") ->  | K148: =MAX(D148,G148) -> 61 | L148: =MIN(E148,H148) -> 61 | M148: =IF(K148=L148,"*","") -> *
A149: 90 | B149: 15 | C149: 7 | D149: 82 | E149: 82 | F149: =IF(D149=E149,"*","") -> * | G149: 82 | I149: =IF(G149>D149,"*","") ->  | J149: =IF(AND(F149="",G149=MIN(E149,H149)),"*","") ->  | K149: =MAX(D149,G149) -> 82 | L149: =MIN(E149,H149) -> 82 | M149: =IF(K149=L149,"*","") -> *
A150: 90 | B150: 15 | C150: 8 | D150: 82 | E150: 82 | F150: =IF(D150=E150,"*","") -> * | G150: 82 | I150: =IF(G150>D150,"*","") ->  | J150: =IF(AND(F150="",G150=MIN(E150,H150)),"*","") ->  | K150: =MAX(D150,G150) -> 82 | L150: =MIN(E150,H150) -> 82 | M150: =IF(K150=L150,"*","") -> *
A151: 90 | B151: 15 | C151: 9 | D151: 83 | E151: 83 | F151: =IF(D151=E151,"*","") -> * | G151: 83 | I151: =IF(G151>D151,"*","") ->  | J151: =IF(AND(F151="",G151=MIN(E151,H151)),"*","") ->  | K151: =MAX(D151,G151) -> 83 | L151: =MIN(E151,H151) -> 83 | M151: =IF(K151=L151,"*","") -> *
A152: 90 | B152: 15 | C152: 10 | D152: 78 | E152: 78 | F152: =IF(D152=E152,"*","") -> * | G152: 78 | I152: =IF(G152>D152,"*","") ->  | J152: =IF(AND(F152="",G152=MIN(E152,H152)),"*","") ->  | K152: =MAX(D152,G152) -> 78 | L152: =MIN(E152,H152) -> 78 | M152: =IF(K152=L152,"*","") -> *
A153: 90 | B153: 16 | C153: 1 | D153: 85 | E153: 85 | F153: =IF(D153=E153,"*","") -> * | G153: 85 | I153: =IF(G153>D153,"*","") ->  | J153: =IF(AND(F153="",G153=MIN(E153,H153)),"*","") ->  | K153: =MAX(D153,G153) -> 85 | L153: =MIN(E153,H153) -> 85 | M153: =IF(K153=L153,"*","") -> *
A154: 90 | B154: 16 | C154: 2 | D154: 71 | E154: 71 | F154: =IF(D154=E154,"*","") -> * | G154: 71 | I154: =IF(G154>D154,"*","") ->  | J154: =IF(AND(F154="",G154=MIN(E154,H154)),"*","") ->  | K154: =MAX(D154,G154) -> 71 | L154: =MIN(E154,H154) -> 71 | M154: =IF(K154=L154,"*","") -> *
A155: 90 | B155: 16 | C155: 3 | D155: 73 | E155: 73 | F155: =IF(D155=E155,"*","") -> * | G155: 73 | I155: =IF(G155>D155,"*","") ->  | J155: =IF(AND(F155="",G155=MIN(E155,H155)),"*","") ->  | K155: =MAX(D155,G155) -> 73 | L155: =MIN(E155,H155) -> 73 | M155: =IF(K155=L155,"*","") -> *
A156: 90 | B156: 16 | C156: 4 | D156: 69 | E156: 69 | F156: =IF(D156=E156,"*","") -> * | G156: 69 | I156: =IF(G156>D156,"*","") ->  | J156: =IF(AND(F156="",G156=MIN(E156,H156)),"*","") ->  | K156: =MAX(D156,G156) -> 69 | L156: =MIN(E156,H156) -> 69 | M156: =IF(K156=L156,"*","") -> *
A157: 90 | B157: 16 | C157: 5 | D157: 71 | E157: 71 | F157: =IF(D157=E157,"*","") -> * | G157: 71 | I157: =IF(G157>D157,"*","") ->  | J157: =IF(AND(F157="",G157=MIN(E157,H157)),"*","") ->  | K157: =MAX(D157,G157) -> 71 | L157: =MIN(E157,H157) -> 71 | M157: =IF(K157=L157,"*","") -> *
A158: 90 | B158: 16 | C158: 6 | D158: 74 | E158: 74 | F158: =IF(D158=E158,"*","") -> * | G158: 74 | I158: =IF(G158>D158,"*","") ->  | J158: =IF(AND(F158="",G158=MIN(E158,H158)),"*","") ->  | K158: =MAX(D158,G158) -> 74 | L158: =MIN(E158,H158) -> 74 | M158: =IF(K158=L158,"*","") -> *
A159: 90 | B159: 16 | C159: 7 | D159: 65 | E159: 65 | F159: =IF(D159=E159,"*","") -> * | G159: 65 | I159: =IF(G159>D159,"*","") ->  | J159: =IF(AND(F159="",G159=MIN(E159,H159)),"*","") ->  | K159: =MAX(D159,G159) -> 65 | L159: =MIN(E159,H159) -> 65 | M159: =IF(K159=L159,"*","") -> *
A160: 90 | B160: 16 | C160: 8 | D160: 71 | E160: 71 | F160: =IF(D160=E160,"*","") -> * | G160: 71 | I160: =IF(G160>D160,"*","") ->  | J160: =IF(AND(F160="",G160=MIN(E160,H160)),"*","") ->  | K160: =MAX(D160,G160) -> 71 | L160: =MIN(E160,H160) -> 71 | M160: =IF(K160=L160,"*","") -> *
A161: 90 | B161: 16 | C161: 9 | D161: 66 | E161: 66 | F161: =IF(D161=E161,"*","") -> * | G161: 66 | I161: =IF(G161>D161,"*","") ->  | J161: =IF(AND(F161="",G161=MIN(E161,H161)),"*","") ->  | K161: =MAX(D161,G161) -> 66 | L161: =MIN(E161,H161) -> 66 | M161: =IF(K161=L161,"*","") -> *
A162: 90 | B162: 16 | C162: 10 | D162: 71 | E162: 71 | F162: =IF(D162=E162,"*","") -> * | G162: 71 | I162: =IF(G162>D162,"*","") ->  | J162: =IF(AND(F162="",G162=MIN(E162,H162)),"*","") ->  | K162: =MAX(D162,G162) -> 71 | L162: =MIN(E162,H162) -> 71 | M162: =IF(K162=L162,"*","") -> *
A163: 90 | B163: 17 | C163: 1 | D163: 90 | E163: 92 | F163: =IF(D163=E163,"*","") ->  | G163: 92 | H163: 92 | I163: =IF(G163>D163,"*","") -> * | J163: =IF(AND(F163="",G163=MIN(E163,H163)),"*","") -> * | K163: =MAX(D163,G163) -> 92 | L163: =MIN(E163,H163) -> 92 | M163: =IF(K163=L163,"*","") -> *
A164: 90 | B164: 17 | C164: 2 | D164: 94 | E164: 100 | F164: =IF(D164=E164,"*","") ->  | G164: 100 | I164: =IF(G164>D164,"*","") -> * | J164: =IF(AND(F164="",G164=MIN(E164,H164)),"*","") -> * | K164: =MAX(D164,G164) -> 100 | L164: =MIN(E164,H164) -> 100 | M164: =IF(K164=L164,"*","") -> *
A165: 90 | B165: 17 | C165: 3 | D165: 88 | E165: 89 | F165: =IF(D165=E165,"*","") ->  | G165: 89 | H165: 89 | I165: =IF(G165>D165,"*","") -> * | J165: =IF(AND(F165="",G165=MIN(E165,H165)),"*","") -> * | K165: =MAX(D165,G165) -> 89 | L165: =MIN(E165,H165) -> 89 | M165: =IF(K165=L165,"*","") -> *
A166: 90 | B166: 17 | C166: 4 | D166: 94 | E166: 94 | F166: =IF(D166=E166,"*","") -> * | G166: 94 | H166: 94 | I166: =IF(G166>D166,"*","") ->  | J166: =IF(AND(F166="",G166=MIN(E166,H166)),"*","") ->  | K166: =MAX(D166,G166) -> 94 | L166: =MIN(E166,H166) -> 94 | M166: =IF(K166=L166,"*","") -> *
A167: 90 | B167: 17 | C167: 5 | D167: 113 | E167: 113 | F167: =IF(D167=E167,"*","") -> * | G167: 113 | H167: 113 | I167: =IF(G167>D167,"*","") ->  | J167: =IF(AND(F167="",G167=MIN(E167,H167)),"*","") ->  | K167: =MAX(D167,G167) -> 113 | L167: =MIN(E167,H167) -> 113 | M167: =IF(K167=L167,"*","") -> *
A168: 90 | B168: 17 | C168: 6 | D168: 94 | E168: 94 | F168: =IF(D168=E168,"*","") -> * | G168: 94 | H168: 94 | I168: =IF(G168>D168,"*","") ->  | J168: =IF(AND(F168="",G168=MIN(E168,H168)),"*","") ->  | K168: =MAX(D168,G168) -> 94 | L168: =MIN(E168,H168) -> 94 | M168: =IF(K168=L168,"*","") -> *
A169: 90 | B169: 17 | C169: 7 | D169: 80 | E169: 80 | F169: =IF(D169=E169,"*","") -> * | G169: 80 | H169: 80 | I169: =IF(G169>D169,"*","") ->  | J169: =IF(AND(F169="",G169=MIN(E169,H169)),"*","") ->  | K169: =MAX(D169,G169) -> 80 | L169: =MIN(E169,H169) -> 80 | M169: =IF(K169=L169,"*","") -> *
A170: 90 | B170: 17 | C170: 8 | D170: 113 | E170: 113 | F170: =IF(D170=E170,"*","") -> * | G170: 113 | H170: 113 | I170: =IF(G170>D170,"*","") ->  | J170: =IF(AND(F170="",G170=MIN(E170,H170)),"*","") ->  | K170: =MAX(D170,G170) -> 113 | L170: =MIN(E170,H170) -> 113 | M170: =IF(K170=L170,"*","") -> *
A171: 90 | B171: 17 | C171: 9 | D171: 93 | E171: 96 | F171: =IF(D171=E171,"*","") ->  | G171: 96 | H171: 96 | I171: =IF(G171>D171,"*","") -> * | J171: =IF(AND(F171="",G171=MIN(E171,H171)),"*","") -> * | K171: =MAX(D171,G171) -> 96 | L171: =MIN(E171,H171) -> 96 | M171: =IF(K171=L171,"*","") -> *
A172: 90 | B172: 17 | C172: 10 | D172: 85 | E172: 89 | F172: =IF(D172=E172,"*","") ->  | G172: 89 | H172: 89 | I172: =IF(G172>D172,"*","") -> * | J172: =IF(AND(F172="",G172=MIN(E172,H172)),"*","") -> * | K172: =MAX(D172,G172) -> 89 | L172: =MIN(E172,H172) -> 89 | M172: =IF(K172=L172,"*","") -> *
A173: 90 | B173: 18 | C173: 1 | D173: 101 | E173: 101 | F173: =IF(D173=E173,"*","") -> * | G173: 101 | H173: 101 | I173: =IF(G173>D173,"*","") ->  | J173: =IF(AND(F173="",G173=MIN(E173,H173)),"*","") ->  | K173: =MAX(D173,G173) -> 101 | L173: =MIN(E173,H173) -> 101 | M173: =IF(K173=L173,"*","") -> *
A174: 90 | B174: 18 | C174: 2 | D174: 94 | E174: 94 | F174: =IF(D174=E174,"*","") -> * | G174: 94 | H174: 94 | I174: =IF(G174>D174,"*","") ->  | J174: =IF(AND(F174="",G174=MIN(E174,H174)),"*","") ->  | K174: =MAX(D174,G174) -> 94 | L174: =MIN(E174,H174) -> 94 | M174: =IF(K174=L174,"*","") -> *
A175: 90 | B175: 18 | C175: 3 | D175: 83 | E175: 83 | F175: =IF(D175=E175,"*","") -> * | G175: 83 | H175: 83 | I175: =IF(G175>D175,"*","") ->  | J175: =IF(AND(F175="",G175=MIN(E175,H175)),"*","") ->  | K175: =MAX(D175,G175) -> 83 | L175: =MIN(E175,H175) -> 83 | M175: =IF(K175=L175,"*","") -> *
A176: 90 | B176: 18 | C176: 4 | D176: 98 | E176: 98 | F176: =IF(D176=E176,"*","") -> * | G176: 98 | H176: 98 | I176: =IF(G176>D176,"*","") ->  | J176: =IF(AND(F176="",G176=MIN(E176,H176)),"*","") ->  | K176: =MAX(D176,G176) -> 98 | L176: =MIN(E176,H176) -> 98 | M176: =IF(K176=L176,"*","") -> *
A177: 90 | B177: 18 | C177: 5 | D177: 90 | E177: 90 | F177: =IF(D177=E177,"*","") -> * | G177: 90 | H177: 90 | I177: =IF(G177>D177,"*","") ->  | J177: =IF(AND(F177="",G177=MIN(E177,H177)),"*","") ->  | K177: =MAX(D177,G177) -> 90 | L177: =MIN(E177,H177) -> 90 | M177: =IF(K177=L177,"*","") -> *
A178: 90 | B178: 18 | C178: 6 | D178: 83 | E178: 83 | F178: =IF(D178=E178,"*","") -> * | G178: 83 | H178: 83 | I178: =IF(G178>D178,"*","") ->  | J178: =IF(AND(F178="",G178=MIN(E178,H178)),"*","") ->  | K178: =MAX(D178,G178) -> 83 | L178: =MIN(E178,H178) -> 83 | M178: =IF(K178=L178,"*","") -> *
A179: 90 | B179: 18 | C179: 7 | D179: 73 | E179: 73 | F179: =IF(D179=E179,"*","") -> * | G179: 73 | H179: 73 | I179: =IF(G179>D179,"*","") ->  | J179: =IF(AND(F179="",G179=MIN(E179,H179)),"*","") ->  | K179: =MAX(D179,G179) -> 73 | L179: =MIN(E179,H179) -> 73 | M179: =IF(K179=L179,"*","") -> *
A180: 90 | B180: 18 | C180: 8 | D180: 92 | E180: 92 | F180: =IF(D180=E180,"*","") -> * | G180: 92 | H180: 92 | I180: =IF(G180>D180,"*","") ->  | J180: =IF(AND(F180="",G180=MIN(E180,H180)),"*","") ->  | K180: =MAX(D180,G180) -> 92 | L180: =MIN(E180,H180) -> 92 | M180: =IF(K180=L180,"*","") -> *
A181: 90 | B181: 18 | C181: 9 | D181: 79 | E181: 79 | F181: =IF(D181=E181,"*","") -> * | G181: 79 | H181: 79 | I181: =IF(G181>D181,"*","") ->  | J181: =IF(AND(F181="",G181=MIN(E181,H181)),"*","") ->  | K181: =MAX(D181,G181) -> 79 | L181: =MIN(E181,H181) -> 79 | M181: =IF(K181=L181,"*","") -> *
A182: 90 | B182: 18 | C182: 10 | D182: 94 | E182: 94 | F182: =IF(D182=E182,"*","") -> * | G182: 94 | H182: 94 | I182: =IF(G182>D182,"*","") ->  | J182: =IF(AND(F182="",G182=MIN(E182,H182)),"*","") ->  | K182: =MAX(D182,G182) -> 94 | L182: =MIN(E182,H182) -> 94 | M182: =IF(K182=L182,"*","") -> *
A183: 90 | B183: 19 | C183: 1 | D183: 98 | E183: 98 | F183: =IF(D183=E183,"*","") -> * | G183: 98 | H183: 98 | I183: =IF(G183>D183,"*","") ->  | J183: =IF(AND(F183="",G183=MIN(E183,H183)),"*","") ->  | K183: =MAX(D183,G183) -> 98 | L183: =MIN(E183,H183) -> 98 | M183: =IF(K183=L183,"*","") -> *
A184: 90 | B184: 19 | C184: 2 | D184: 83 | E184: 83 | F184: =IF(D184=E184,"*","") -> * | G184: 83 | H184: 83 | I184: =IF(G184>D184,"*","") ->  | J184: =IF(AND(F184="",G184=MIN(E184,H184)),"*","") ->  | K184: =MAX(D184,G184) -> 83 | L184: =MIN(E184,H184) -> 83 | M184: =IF(K184=L184,"*","") -> *
A185: 90 | B185: 19 | C185: 3 | D185: 89 | E185: 89 | F185: =IF(D185=E185,"*","") -> * | G185: 89 | H185: 89 | I185: =IF(G185>D185,"*","") ->  | J185: =IF(AND(F185="",G185=MIN(E185,H185)),"*","") ->  | K185: =MAX(D185,G185) -> 89 | L185: =MIN(E185,H185) -> 89 | M185: =IF(K185=L185,"*","") -> *
A186: 90 | B186: 19 | C186: 4 | D186: 77 | E186: 77 | F186: =IF(D186=E186,"*","") -> * | G186: 77 | H186: 77 | I186: =IF(G186>D186,"*","") ->  | J186: =IF(AND(F186="",G186=MIN(E186,H186)),"*","") ->  | K186: =MAX(D186,G186) -> 77 | L186: =MIN(E186,H186) -> 77 | M186: =IF(K186=L186,"*","") -> *
A187: 90 | B187: 19 | C187: 5 | D187: 66 | E187: 66 | F187: =IF(D187=E187,"*","") -> * | G187: 66 | H187: 66 | I187: =IF(G187>D187,"*","") ->  | J187: =IF(AND(F187="",G187=MIN(E187,H187)),"*","") ->  | K187: =MAX(D187,G187) -> 66 | L187: =MIN(E187,H187) -> 66 | M187: =IF(K187=L187,"*","") -> *
A188: 90 | B188: 19 | C188: 6 | D188: 136 | E188: 136 | F188: =IF(D188=E188,"*","") -> * | G188: 136 | H188: 136 | I188: =IF(G188>D188,"*","") ->  | J188: =IF(AND(F188="",G188=MIN(E188,H188)),"*","") ->  | K188: =MAX(D188,G188) -> 136 | L188: =MIN(E188,H188) -> 136 | M188: =IF(K188=L188,"*","") -> *
A189: 90 | B189: 19 | C189: 7 | D189: 66 | E189: 66 | F189: =IF(D189=E189,"*","") -> * | G189: 66 | H189: 66 | I189: =IF(G189>D189,"*","") ->  | J189: =IF(AND(F189="",G189=MIN(E189,H189)),"*","") ->  | K189: =MAX(D189,G189) -> 66 | L189: =MIN(E189,H189) -> 66 | M189: =IF(K189=L189,"*","") -> *
A190: 90 | B190: 19 | C190: 8 | D190: 91 | E190: 91 | F190: =IF(D190=E190,"*","") -> * | G190: 91 | H190: 91 | I190: =IF(G190>D190,"*","") ->  | J190: =IF(AND(F190="",G190=MIN(E190,H190)),"*","") ->  | K190: =MAX(D190,G190) -> 91 | L190: =MIN(E190,H190) -> 91 | M190: =IF(K190=L190,"*","") -> *
A191: 90 | B191: 19 | C191: 9 | D191: 121 | E191: 121 | F191: =IF(D191=E191,"*","") -> * | G191: 121 | H191: 121 | I191: =IF(G191>D191,"*","") ->  | J191: =IF(AND(F191="",G191=MIN(E191,H191)),"*","") ->  | K191: =MAX(D191,G191) -> 121 | L191: =MIN(E191,H191) -> 121 | M191: =IF(K191=L191,"*","") -> *
A192: 90 | B192: 19 | C192: 10 | D192: 85 | E192: 85 | F192: =IF(D192=E192,"*","") -> * | G192: 85 | H192: 85 | I192: =IF(G192>D192,"*","") ->  | J192: =IF(AND(F192="",G192=MIN(E192,H192)),"*","") ->  | K192: =MAX(D192,G192) -> 85 | L192: =MIN(E192,H192) -> 85 | M192: =IF(K192=L192,"*","") -> *
A193: 90 | B193: 20 | C193: 1 | D193: 85 | E193: 85 | F193: =IF(D193=E193,"*","") -> * | G193: 85 | H193: 85 | I193: =IF(G193>D193,"*","") ->  | J193: =IF(AND(F193="",G193=MIN(E193,H193)),"*","") ->  | K193: =MAX(D193,G193) -> 85 | L193: =MIN(E193,H193) -> 85 | M193: =IF(K193=L193,"*","") -> *
A194: 90 | B194: 20 | C194: 2 | D194: 76 | E194: 76 | F194: =IF(D194=E194,"*","") -> * | G194: 76 | H194: 76 | I194: =IF(G194>D194,"*","") ->  | J194: =IF(AND(F194="",G194=MIN(E194,H194)),"*","") ->  | K194: =MAX(D194,G194) -> 76 | L194: =MIN(E194,H194) -> 76 | M194: =IF(K194=L194,"*","") -> *
A195: 90 | B195: 20 | C195: 3 | D195: 86 | E195: 86 | F195: =IF(D195=E195,"*","") -> * | G195: 86 | H195: 86 | I195: =IF(G195>D195,"*","") ->  | J195: =IF(AND(F195="",G195=MIN(E195,H195)),"*","") ->  | K195: =MAX(D195,G195) -> 86 | L195: =MIN(E195,H195) -> 86 | M195: =IF(K195=L195,"*","") -> *
A196: 90 | B196: 20 | C196: 4 | D196: 86 | E196: 86 | F196: =IF(D196=E196,"*","") -> * | G196: 86 | H196: 86 | I196: =IF(G196>D196,"*","") ->  | J196: =IF(AND(F196="",G196=MIN(E196,H196)),"*","") ->  | K196: =MAX(D196,G196) -> 86 | L196: =MIN(E196,H196) -> 86 | M196: =IF(K196=L196,"*","") -> *
A197: 90 | B197: 20 | C197: 5 | D197: 88 | E197: 88 | F197: =IF(D197=E197,"*","") -> * | G197: 88 | H197: 88 | I197: =IF(G197>D197,"*","") ->  | J197: =IF(AND(F197="",G197=MIN(E197,H197)),"*","") ->  | K197: =MAX(D197,G197) -> 88 | L197: =MIN(E197,H197) -> 88 | M197: =IF(K197=L197,"*","") -> *
A198: 90 | B198: 20 | C198: 6 | D198: 83 | E198: 83 | F198: =IF(D198=E198,"*","") -> * | G198: 83 | H198: 83 | I198: =IF(G198>D198,"*","") ->  | J198: =IF(AND(F198="",G198=MIN(E198,H198)),"*","") ->  | K198: =MAX(D198,G198) -> 83 | L198: =MIN(E198,H198) -> 83 | M198: =IF(K198=L198,"*","") -> *
A199: 90 | B199: 20 | C199: 7 | D199: 82 | E199: 82 | F199: =IF(D199=E199,"*","") -> * | G199: 82 | H199: 82 | I199: =IF(G199>D199,"*","") ->  | J199: =IF(AND(F199="",G199=MIN(E199,H199)),"*","") ->  | K199: =MAX(D199,G199) -> 82 | L199: =MIN(E199,H199) -> 82 | M199: =IF(K199=L199,"*","") -> *
A200: 90 | B200: 20 | C200: 8 | D200: 85 | E200: 85 | F200: =IF(D200=E200,"*","") -> * | G200: 85 | H200: 85 | I200: =IF(G200>D200,"*","") ->  | J200: =IF(AND(F200="",G200=MIN(E200,H200)),"*","") ->  | K200: =MAX(D200,G200) -> 85 | L200: =MIN(E200,H200) -> 85 | M200: =IF(K200=L200,"*","") -> *
A201: 90 | B201: 20 | C201: 9 | D201: 76 | E201: 76 | F201: =IF(D201=E201,"*","") -> * | G201: 76 | H201: 76 | I201: =IF(G201>D201,"*","") ->  | J201: =IF(AND(F201="",G201=MIN(E201,H201)),"*","") ->  | K201: =MAX(D201,G201) -> 76 | L201: =MIN(E201,H201) -> 76 | M201: =IF(K201=L201,"*","") -> *
A202: 90 | B202: 20 | C202: 10 | D202: 89 | E202: 89 | F202: =IF(D202=E202,"*","") -> * | G202: 89 | H202: 89 | I202: =IF(G202>D202,"*","") ->  | J202: =IF(AND(F202="",G202=MIN(E202,H202)),"*","") ->  | K202: =MAX(D202,G202) -> 89 | L202: =MIN(E202,H202) -> 89 | M202: =IF(K202=L202,"*","") -> *
A203: 90 | B203: 21 | C203: 1 | D203: 101 | E203: 111 | F203: =IF(D203=E203,"*","") ->  | G203: 102 | I203: =IF(G203>D203,"*","") -> * | J203: =IF(AND(F203="",G203=MIN(E203,H203)),"*","") ->  | K203: =MAX(D203,G203) -> 102 | L203: =MIN(E203,H203) -> 111 | M203: =IF(K203=L203,"*","") -> 
A204: 90 | B204: 21 | C204: 2 | D204: 106 | E204: 116 | F204: =IF(D204=E204,"*","") ->  | G204: 111 | I204: =IF(G204>D204,"*","") -> * | J204: =IF(AND(F204="",G204=MIN(E204,H204)),"*","") ->  | K204: =MAX(D204,G204) -> 111 | L204: =MIN(E204,H204) -> 116 | M204: =IF(K204=L204,"*","") -> 
A205: 90 | B205: 21 | C205: 3 | D205: 110 | E205: 125 | F205: =IF(D205=E205,"*","") ->  | G205: 123 | I205: =IF(G205>D205,"*","") -> * | J205: =IF(AND(F205="",G205=MIN(E205,H205)),"*","") ->  | K205: =MAX(D205,G205) -> 123 | L205: =MIN(E205,H205) -> 125 | M205: =IF(K205=L205,"*","") -> 
A206: 90 | B206: 21 | C206: 4 | D206: 101 | E206: 106 | F206: =IF(D206=E206,"*","") ->  | G206: 105 | I206: =IF(G206>D206,"*","") -> * | J206: =IF(AND(F206="",G206=MIN(E206,H206)),"*","") ->  | K206: =MAX(D206,G206) -> 105 | L206: =MIN(E206,H206) -> 106 | M206: =IF(K206=L206,"*","") -> 
A207: 90 | B207: 21 | C207: 5 | D207: 99 | E207: 112 | F207: =IF(D207=E207,"*","") ->  | G207: 107 | I207: =IF(G207>D207,"*","") -> * | J207: =IF(AND(F207="",G207=MIN(E207,H207)),"*","") ->  | K207: =MAX(D207,G207) -> 107 | L207: =MIN(E207,H207) -> 112 | M207: =IF(K207=L207,"*","") -> 
A208: 90 | B208: 21 | C208: 6 | D208: 95 | E208: 107 | F208: =IF(D208=E208,"*","") ->  | G208: 102 | I208: =IF(G208>D208,"*","") -> * | J208: =IF(AND(F208="",G208=MIN(E208,H208)),"*","") ->  | K208: =MAX(D208,G208) -> 102 | L208: =MIN(E208,H208) -> 107 | M208: =IF(K208=L208,"*","") -> 
A209: 90 | B209: 21 | C209: 7 | D209: 99 | E209: 109 | F209: =IF(D209=E209,"*","") ->  | G209: 101 | I209: =IF(G209>D209,"*","") -> * | J209: =IF(AND(F209="",G209=MIN(E209,H209)),"*","") ->  | K209: =MAX(D209,G209) -> 101 | L209: =MIN(E209,H209) -> 109 | M209: =IF(K209=L209,"*","") -> 
A210: 90 | B210: 21 | C210: 8 | D210: 100 | E210: 112 | F210: =IF(D210=E210,"*","") ->  | G210: 103 | I210: =IF(G210>D210,"*","") -> * | J210: =IF(AND(F210="",G210=MIN(E210,H210)),"*","") ->  | K210: =MAX(D210,G210) -> 103 | L210: =MIN(E210,H210) -> 112 | M210: =IF(K210=L210,"*","") -> 
A211: 90 | B211: 21 | C211: 9 | D211: 108 | E211: 121 | F211: =IF(D211=E211,"*","") ->  | G211: 117 | I211: =IF(G211>D211,"*","") -> * | J211: =IF(AND(F211="",G211=MIN(E211,H211)),"*","") ->  | K211: =MAX(D211,G211) -> 117 | L211: =MIN(E211,H211) -> 121 | M211: =IF(K211=L211,"*","") -> 
A212: 90 | B212: 21 | C212: 10 | D212: 101 | E212: 109 | F212: =IF(D212=E212,"*","") ->  | G212: 106 | I212: =IF(G212>D212,"*","") -> * | J212: =IF(AND(F212="",G212=MIN(E212,H212)),"*","") ->  | K212: =MAX(D212,G212) -> 106 | L212: =MIN(E212,H212) -> 109 | M212: =IF(K212=L212,"*","") -> 
A213: 90 | B213: 22 | C213: 1 | D213: 108 | E213: 108 | F213: =IF(D213=E213,"*","") -> * | G213: 108 | H213: 108 | I213: =IF(G213>D213,"*","") ->  | J213: =IF(AND(F213="",G213=MIN(E213,H213)),"*","") ->  | K213: =MAX(D213,G213) -> 108 | L213: =MIN(E213,H213) -> 108 | M213: =IF(K213=L213,"*","") -> *
A214: 90 | B214: 22 | C214: 2 | D214: 85 | E214: 85 | F214: =IF(D214=E214,"*","") -> * | G214: 85 | H214: 85 | I214: =IF(G214>D214,"*","") ->  | J214: =IF(AND(F214="",G214=MIN(E214,H214)),"*","") ->  | K214: =MAX(D214,G214) -> 85 | L214: =MIN(E214,H214) -> 85 | M214: =IF(K214=L214,"*","") -> *
A215: 90 | B215: 22 | C215: 3 | D215: 83 | E215: 83 | F215: =IF(D215=E215,"*","") -> * | G215: 83 | I215: =IF(G215>D215,"*","") ->  | J215: =IF(AND(F215="",G215=MIN(E215,H215)),"*","") ->  | K215: =MAX(D215,G215) -> 83 | L215: =MIN(E215,H215) -> 83 | M215: =IF(K215=L215,"*","") -> *
A216: 90 | B216: 22 | C216: 4 | D216: 96 | E216: 96 | F216: =IF(D216=E216,"*","") -> * | G216: 96 | H216: 96 | I216: =IF(G216>D216,"*","") ->  | J216: =IF(AND(F216="",G216=MIN(E216,H216)),"*","") ->  | K216: =MAX(D216,G216) -> 96 | L216: =MIN(E216,H216) -> 96 | M216: =IF(K216=L216,"*","") -> *
A217: 90 | B217: 22 | C217: 5 | D217: 96 | E217: 96 | F217: =IF(D217=E217,"*","") -> * | G217: 96 | H217: 96 | I217: =IF(G217>D217,"*","") ->  | J217: =IF(AND(F217="",G217=MIN(E217,H217)),"*","") ->  | K217: =MAX(D217,G217) -> 96 | L217: =MIN(E217,H217) -> 96 | M217: =IF(K217=L217,"*","") -> *
A218: 90 | B218: 22 | C218: 6 | D218: 71 | E218: 71 | F218: =IF(D218=E218,"*","") -> * | G218: 71 | H218: 71 | I218: =IF(G218>D218,"*","") ->  | J218: =IF(AND(F218="",G218=MIN(E218,H218)),"*","") ->  | K218: =MAX(D218,G218) -> 71 | L218: =MIN(E218,H218) -> 71 | M218: =IF(K218=L218,"*","") -> *
A219: 90 | B219: 22 | C219: 7 | D219: 90 | E219: 90 | F219: =IF(D219=E219,"*","") -> * | G219: 90 | H219: 90 | I219: =IF(G219>D219,"*","") ->  | J219: =IF(AND(F219="",G219=MIN(E219,H219)),"*","") ->  | K219: =MAX(D219,G219) -> 90 | L219: =MIN(E219,H219) -> 90 | M219: =IF(K219=L219,"*","") -> *
A220: 90 | B220: 22 | C220: 8 | D220: 97 | E220: 97 | F220: =IF(D220=E220,"*","") -> * | G220: 97 | I220: =IF(G220>D220,"*","") ->  | J220: =IF(AND(F220="",G220=MIN(E220,H220)),"*","") ->  | K220: =MAX(D220,G220) -> 97 | L220: =MIN(E220,H220) -> 97 | M220: =IF(K220=L220,"*","") -> *
A221: 90 | B221: 22 | C221: 9 | D221: 101 | E221: 101 | F221: =IF(D221=E221,"*","") -> * | G221: 101 | H221: 101 | I221: =IF(G221>D221,"*","") ->  | J221: =IF(AND(F221="",G221=MIN(E221,H221)),"*","") ->  | K221: =MAX(D221,G221) -> 101 | L221: =MIN(E221,H221) -> 101 | M221: =IF(K221=L221,"*","") -> *
A222: 90 | B222: 22 | C222: 10 | D222: 75 | E222: 75 | F222: =IF(D222=E222,"*","") -> * | G222: 75 | H222: 75 | I222: =IF(G222>D222,"*","") ->  | J222: =IF(AND(F222="",G222=MIN(E222,H222)),"*","") ->  | K222: =MAX(D222,G222) -> 75 | L222: =MIN(E222,H222) -> 75 | M222: =IF(K222=L222,"*","") -> *
A223: 90 | B223: 23 | C223: 1 | D223: 90 | E223: 90 | F223: =IF(D223=E223,"*","") -> * | G223: 90 | H223: 90 | I223: =IF(G223>D223,"*","") ->  | J223: =IF(AND(F223="",G223=MIN(E223,H223)),"*","") ->  | K223: =MAX(D223,G223) -> 90 | L223: =MIN(E223,H223) -> 90 | M223: =IF(K223=L223,"*","") -> *
A224: 90 | B224: 23 | C224: 2 | D224: 84 | E224: 84 | F224: =IF(D224=E224,"*","") -> * | G224: 84 | H224: 84 | I224: =IF(G224>D224,"*","") ->  | J224: =IF(AND(F224="",G224=MIN(E224,H224)),"*","") ->  | K224: =MAX(D224,G224) -> 84 | L224: =MIN(E224,H224) -> 84 | M224: =IF(K224=L224,"*","") -> *
A225: 90 | B225: 23 | C225: 3 | D225: 116 | E225: 116 | F225: =IF(D225=E225,"*","") -> * | G225: 116 | H225: 116 | I225: =IF(G225>D225,"*","") ->  | J225: =IF(AND(F225="",G225=MIN(E225,H225)),"*","") ->  | K225: =MAX(D225,G225) -> 116 | L225: =MIN(E225,H225) -> 116 | M225: =IF(K225=L225,"*","") -> *
A226: 90 | B226: 23 | C226: 4 | D226: 85 | E226: 85 | F226: =IF(D226=E226,"*","") -> * | G226: 85 | H226: 85 | I226: =IF(G226>D226,"*","") ->  | J226: =IF(AND(F226="",G226=MIN(E226,H226)),"*","") ->  | K226: =MAX(D226,G226) -> 85 | L226: =MIN(E226,H226) -> 85 | M226: =IF(K226=L226,"*","") -> *
A227: 90 | B227: 23 | C227: 5 | D227: 95 | E227: 95 | F227: =IF(D227=E227,"*","") -> * | G227: 95 | H227: 95 | I227: =IF(G227>D227,"*","") ->  | J227: =IF(AND(F227="",G227=MIN(E227,H227)),"*","") ->  | K227: =MAX(D227,G227) -> 95 | L227: =MIN(E227,H227) -> 95 | M227: =IF(K227=L227,"*","") -> *
A228: 90 | B228: 23 | C228: 6 | D228: 87 | E228: 87 | F228: =IF(D228=E228,"*","") -> * | G228: 87 | H228: 87 | I228: =IF(G228>D228,"*","") ->  | J228: =IF(AND(F228="",G228=MIN(E228,H228)),"*","") ->  | K228: =MAX(D228,G228) -> 87 | L228: =MIN(E228,H228) -> 87 | M228: =IF(K228=L228,"*","") -> *
A229: 90 | B229: 23 | C229: 7 | D229: 77 | E229: 77 | F229: =IF(D229=E229,"*","") -> * | G229: 77 | H229: 77 | I229: =IF(G229>D229,"*","") ->  | J229: =IF(AND(F229="",G229=MIN(E229,H229)),"*","") ->  | K229: =MAX(D229,G229) -> 77 | L229: =MIN(E229,H229) -> 77 | M229: =IF(K229=L229,"*","") -> *
A230: 90 | B230: 23 | C230: 8 | D230: 92 | E230: 92 | F230: =IF(D230=E230,"*","") -> * | G230: 92 | H230: 92 | I230: =IF(G230>D230,"*","") ->  | J230: =IF(AND(F230="",G230=MIN(E230,H230)),"*","") ->  | K230: =MAX(D230,G230) -> 92 | L230: =MIN(E230,H230) -> 92 | M230: =IF(K230=L230,"*","") -> *
A231: 90 | B231: 23 | C231: 9 | D231: 126 | E231: 126 | F231: =IF(D231=E231,"*","") -> * | G231: 126 | H231: 126 | I231: =IF(G231>D231,"*","") ->  | J231: =IF(AND(F231="",G231=MIN(E231,H231)),"*","") ->  | K231: =MAX(D231,G231) -> 126 | L231: =MIN(E231,H231) -> 126 | M231: =IF(K231=L231,"*","") -> *
A232: 90 | B232: 23 | C232: 10 | D232: 87 | E232: 87 | F232: =IF(D232=E232,"*","") -> * | G232: 87 | H232: 87 | I232: =IF(G232>D232,"*","") ->  | J232: =IF(AND(F232="",G232=MIN(E232,H232)),"*","") ->  | K232: =MAX(D232,G232) -> 87 | L232: =MIN(E232,H232) -> 87 | M232: =IF(K232=L232,"*","") -> *
A233: 90 | B233: 24 | C233: 1 | D233: 84 | E233: 84 | F233: =IF(D233=E233,"*","") -> * | G233: 84 | I233: =IF(G233>D233,"*","") ->  | J233: =IF(AND(F233="",G233=MIN(E233,H233)),"*","") ->  | K233: =MAX(D233,G233) -> 84 | L233: =MIN(E233,H233) -> 84 | M233: =IF(K233=L233,"*","") -> *
A234: 90 | B234: 24 | C234: 2 | D234: 92 | E234: 92 | F234: =IF(D234=E234,"*","") -> * | G234: 92 | H234: 92 | I234: =IF(G234>D234,"*","") ->  | J234: =IF(AND(F234="",G234=MIN(E234,H234)),"*","") ->  | K234: =MAX(D234,G234) -> 92 | L234: =MIN(E234,H234) -> 92 | M234: =IF(K234=L234,"*","") -> *
A235: 90 | B235: 24 | C235: 3 | D235: 69 | E235: 69 | F235: =IF(D235=E235,"*","") -> * | G235: 69 | I235: =IF(G235>D235,"*","") ->  | J235: =IF(AND(F235="",G235=MIN(E235,H235)),"*","") ->  | K235: =MAX(D235,G235) -> 69 | L235: =MIN(E235,H235) -> 69 | M235: =IF(K235=L235,"*","") -> *
A236: 90 | B236: 24 | C236: 4 | D236: 81 | E236: 81 | F236: =IF(D236=E236,"*","") -> * | G236: 81 | H236: 81 | I236: =IF(G236>D236,"*","") ->  | J236: =IF(AND(F236="",G236=MIN(E236,H236)),"*","") ->  | K236: =MAX(D236,G236) -> 81 | L236: =MIN(E236,H236) -> 81 | M236: =IF(K236=L236,"*","") -> *
A237: 90 | B237: 24 | C237: 5 | D237: 85 | E237: 85 | F237: =IF(D237=E237,"*","") -> * | G237: 85 | I237: =IF(G237>D237,"*","") ->  | J237: =IF(AND(F237="",G237=MIN(E237,H237)),"*","") ->  | K237: =MAX(D237,G237) -> 85 | L237: =MIN(E237,H237) -> 85 | M237: =IF(K237=L237,"*","") -> *
A238: 90 | B238: 24 | C238: 6 | D238: 79 | E238: 79 | F238: =IF(D238=E238,"*","") -> * | G238: 79 | I238: =IF(G238>D238,"*","") ->  | J238: =IF(AND(F238="",G238=MIN(E238,H238)),"*","") ->  | K238: =MAX(D238,G238) -> 79 | L238: =MIN(E238,H238) -> 79 | M238: =IF(K238=L238,"*","") -> *
A239: 90 | B239: 24 | C239: 7 | D239: 87 | E239: 87 | F239: =IF(D239=E239,"*","") -> * | G239: 87 | I239: =IF(G239>D239,"*","") ->  | J239: =IF(AND(F239="",G239=MIN(E239,H239)),"*","") ->  | K239: =MAX(D239,G239) -> 87 | L239: =MIN(E239,H239) -> 87 | M239: =IF(K239=L239,"*","") -> *
A240: 90 | B240: 24 | C240: 8 | D240: 88 | E240: 88 | F240: =IF(D240=E240,"*","") -> * | G240: 88 | I240: =IF(G240>D240,"*","") ->  | J240: =IF(AND(F240="",G240=MIN(E240,H240)),"*","") ->  | K240: =MAX(D240,G240) -> 88 | L240: =MIN(E240,H240) -> 88 | M240: =IF(K240=L240,"*","") -> *
A241: 90 | B241: 24 | C241: 9 | D241: 80 | E241: 80 | F241: =IF(D241=E241,"*","") -> * | G241: 80 | H241: 80 | I241: =IF(G241>D241,"*","") ->  | J241: =IF(AND(F241="",G241=MIN(E241,H241)),"*","") ->  | K241: =MAX(D241,G241) -> 80 | L241: =MIN(E241,H241) -> 80 | M241: =IF(K241=L241,"*","") -> *
A242: 90 | B242: 24 | C242: 10 | D242: 89 | E242: 89 | F242: =IF(D242=E242,"*","") -> * | G242: 89 | I242: =IF(G242>D242,"*","") ->  | J242: =IF(AND(F242="",G242=MIN(E242,H242)),"*","") ->  | K242: =MAX(D242,G242) -> 89 | L242: =MIN(E242,H242) -> 89 | M242: =IF(K242=L242,"*","") -> *
A243: 90 | B243: 25 | C243: 1 | D243: 114 | E243: 125 | F243: =IF(D243=E243,"*","") ->  | G243: 114 | I243: =IF(G243>D243,"*","") ->  | J243: =IF(AND(F243="",G243=MIN(E243,H243)),"*","") ->  | K243: =MAX(D243,G243) -> 114 | L243: =MIN(E243,H243) -> 125 | M243: =IF(K243=L243,"*","") -> 
A244: 90 | B244: 25 | C244: 2 | D244: 120 | E244: 131 | F244: =IF(D244=E244,"*","") ->  | G244: 120 | I244: =IF(G244>D244,"*","") ->  | J244: =IF(AND(F244="",G244=MIN(E244,H244)),"*","") ->  | K244: =MAX(D244,G244) -> 120 | L244: =MIN(E244,H244) -> 131 | M244: =IF(K244=L244,"*","") -> 
A245: 90 | B245: 25 | C245: 3 | D245: 111 | E245: 124 | F245: =IF(D245=E245,"*","") ->  | G245: 109 | I245: =IF(G245>D245,"*","") ->  | J245: =IF(AND(F245="",G245=MIN(E245,H245)),"*","") ->  | K245: =MAX(D245,G245) -> 111 | L245: =MIN(E245,H245) -> 124 | M245: =IF(K245=L245,"*","") -> 
A246: 90 | B246: 25 | C246: 4 | D246: 127 | E246: 139 | F246: =IF(D246=E246,"*","") ->  | G246: 127 | I246: =IF(G246>D246,"*","") ->  | J246: =IF(AND(F246="",G246=MIN(E246,H246)),"*","") ->  | K246: =MAX(D246,G246) -> 127 | L246: =MIN(E246,H246) -> 139 | M246: =IF(K246=L246,"*","") -> 
A247: 90 | B247: 25 | C247: 5 | D247: 109 | E247: 116 | F247: =IF(D247=E247,"*","") ->  | G247: 109 | I247: =IF(G247>D247,"*","") ->  | J247: =IF(AND(F247="",G247=MIN(E247,H247)),"*","") ->  | K247: =MAX(D247,G247) -> 109 | L247: =MIN(E247,H247) -> 116 | M247: =IF(K247=L247,"*","") -> 
A248: 90 | B248: 25 | C248: 6 | D248: 112 | E248: 122 | F248: =IF(D248=E248,"*","") ->  | G248: 112 | I248: =IF(G248>D248,"*","") ->  | J248: =IF(AND(F248="",G248=MIN(E248,H248)),"*","") ->  | K248: =MAX(D248,G248) -> 112 | L248: =MIN(E248,H248) -> 122 | M248: =IF(K248=L248,"*","") -> 
A249: 90 | B249: 25 | C249: 7 | D249: 120 | E249: 130 | F249: =IF(D249=E249,"*","") ->  | G249: 119 | I249: =IF(G249>D249,"*","") ->  | J249: =IF(AND(F249="",G249=MIN(E249,H249)),"*","") ->  | K249: =MAX(D249,G249) -> 120 | L249: =MIN(E249,H249) -> 130 | M249: =IF(K249=L249,"*","") -> 
A250: 90 | B250: 25 | C250: 8 | D250: 129 | E250: 140 | F250: =IF(D250=E250,"*","") ->  | G250: 129 | I250: =IF(G250>D250,"*","") ->  | J250: =IF(AND(F250="",G250=MIN(E250,H250)),"*","") ->  | K250: =MAX(D250,G250) -> 129 | L250: =MIN(E250,H250) -> 140 | M250: =IF(K250=L250,"*","") -> 
A251: 90 | B251: 25 | C251: 9 | D251: 97 | E251: 106 | F251: =IF(D251=E251,"*","") ->  | G251: 95 | I251: =IF(G251>D251,"*","") ->  | J251: =IF(AND(F251="",G251=MIN(E251,H251)),"*","") ->  | K251: =MAX(D251,G251) -> 97 | L251: =MIN(E251,H251) -> 106 | M251: =IF(K251=L251,"*","") -> 
A252: 90 | B252: 25 | C252: 10 | D252: 118 | E252: 131 | F252: =IF(D252=E252,"*","") ->  | G252: 116 | I252: =IF(G252>D252,"*","") ->  | J252: =IF(AND(F252="",G252=MIN(E252,H252)),"*","") ->  | K252: =MAX(D252,G252) -> 118 | L252: =MIN(E252,H252) -> 131 | M252: =IF(K252=L252,"*","") -> 
A253: 90 | B253: 26 | C253: 1 | D253: 90 | E253: 90 | F253: =IF(D253=E253,"*","") -> * | G253: 90 | I253: =IF(G253>D253,"*","") ->  | J253: =IF(AND(F253="",G253=MIN(E253,H253)),"*","") ->  | K253: =MAX(D253,G253) -> 90 | L253: =MIN(E253,H253) -> 90 | M253: =IF(K253=L253,"*","") -> *
A254: 90 | B254: 26 | C254: 2 | D254: 85 | E254: 85 | F254: =IF(D254=E254,"*","") -> * | G254: 85 | I254: =IF(G254>D254,"*","") ->  | J254: =IF(AND(F254="",G254=MIN(E254,H254)),"*","") ->  | K254: =MAX(D254,G254) -> 85 | L254: =MIN(E254,H254) -> 85 | M254: =IF(K254=L254,"*","") -> *
A255: 90 | B255: 26 | C255: 3 | D255: 80 | E255: 80 | F255: =IF(D255=E255,"*","") -> * | G255: 80 | H255: 80 | I255: =IF(G255>D255,"*","") ->  | J255: =IF(AND(F255="",G255=MIN(E255,H255)),"*","") ->  | K255: =MAX(D255,G255) -> 80 | L255: =MIN(E255,H255) -> 80 | M255: =IF(K255=L255,"*","") -> *
A256: 90 | B256: 26 | C256: 4 | D256: 96 | E256: 97 | F256: =IF(D256=E256,"*","") ->  | G256: 96 | I256: =IF(G256>D256,"*","") ->  | J256: =IF(AND(F256="",G256=MIN(E256,H256)),"*","") ->  | K256: =MAX(D256,G256) -> 96 | L256: =MIN(E256,H256) -> 97 | M256: =IF(K256=L256,"*","") -> 
A257: 90 | B257: 26 | C257: 5 | D257: 82 | E257: 86 | F257: =IF(D257=E257,"*","") ->  | G257: 83 | I257: =IF(G257>D257,"*","") -> * | J257: =IF(AND(F257="",G257=MIN(E257,H257)),"*","") ->  | K257: =MAX(D257,G257) -> 83 | L257: =MIN(E257,H257) -> 86 | M257: =IF(K257=L257,"*","") -> 
A258: 90 | B258: 26 | C258: 6 | D258: 108 | E258: 108 | F258: =IF(D258=E258,"*","") -> * | G258: 108 | I258: =IF(G258>D258,"*","") ->  | J258: =IF(AND(F258="",G258=MIN(E258,H258)),"*","") ->  | K258: =MAX(D258,G258) -> 108 | L258: =MIN(E258,H258) -> 108 | M258: =IF(K258=L258,"*","") -> *
A259: 90 | B259: 26 | C259: 7 | D259: 82 | E259: 82 | F259: =IF(D259=E259,"*","") -> * | G259: 82 | H259: 82 | I259: =IF(G259>D259,"*","") ->  | J259: =IF(AND(F259="",G259=MIN(E259,H259)),"*","") ->  | K259: =MAX(D259,G259) -> 82 | L259: =MIN(E259,H259) -> 82 | M259: =IF(K259=L259,"*","") -> *
A260: 90 | B260: 26 | C260: 8 | D260: 82 | E260: 83 | F260: =IF(D260=E260,"*","") ->  | G260: 82 | I260: =IF(G260>D260,"*","") ->  | J260: =IF(AND(F260="",G260=MIN(E260,H260)),"*","") ->  | K260: =MAX(D260,G260) -> 82 | L260: =MIN(E260,H260) -> 83 | M260: =IF(K260=L260,"*","") -> 
A261: 90 | B261: 26 | C261: 9 | D261: 87 | E261: 87 | F261: =IF(D261=E261,"*","") -> * | G261: 87 | H261: 87 | I261: =IF(G261>D261,"*","") ->  | J261: =IF(AND(F261="",G261=MIN(E261,H261)),"*","") ->  | K261: =MAX(D261,G261) -> 87 | L261: =MIN(E261,H261) -> 87 | M261: =IF(K261=L261,"*","") -> *
A262: 90 | B262: 26 | C262: 10 | D262: 92 | E262: 92 | F262: =IF(D262=E262,"*","") -> * | G262: 92 | I262: =IF(G262>D262,"*","") ->  | J262: =IF(AND(F262="",G262=MIN(E262,H262)),"*","") ->  | K262: =MAX(D262,G262) -> 92 | L262: =MIN(E262,H262) -> 92 | M262: =IF(K262=L262,"*","") -> *
A263: 90 | B263: 27 | C263: 1 | D263: 96 | E263: 96 | F263: =IF(D263=E263,"*","") -> * | G263: 96 | H263: 96 | I263: =IF(G263>D263,"*","") ->  | J263: =IF(AND(F263="",G263=MIN(E263,H263)),"*","") ->  | K263: =MAX(D263,G263) -> 96 | L263: =MIN(E263,H263) -> 96 | M263: =IF(K263=L263,"*","") -> *
A264: 90 | B264: 27 | C264: 2 | D264: 81 | E264: 81 | F264: =IF(D264=E264,"*","") -> * | G264: 81 | I264: =IF(G264>D264,"*","") ->  | J264: =IF(AND(F264="",G264=MIN(E264,H264)),"*","") ->  | K264: =MAX(D264,G264) -> 81 | L264: =MIN(E264,H264) -> 81 | M264: =IF(K264=L264,"*","") -> *
A265: 90 | B265: 27 | C265: 3 | D265: 91 | E265: 91 | F265: =IF(D265=E265,"*","") -> * | G265: 91 | I265: =IF(G265>D265,"*","") ->  | J265: =IF(AND(F265="",G265=MIN(E265,H265)),"*","") ->  | K265: =MAX(D265,G265) -> 91 | L265: =MIN(E265,H265) -> 91 | M265: =IF(K265=L265,"*","") -> *
A266: 90 | B266: 27 | C266: 4 | D266: 79 | E266: 79 | F266: =IF(D266=E266,"*","") -> * | G266: 79 | I266: =IF(G266>D266,"*","") ->  | J266: =IF(AND(F266="",G266=MIN(E266,H266)),"*","") ->  | K266: =MAX(D266,G266) -> 79 | L266: =MIN(E266,H266) -> 79 | M266: =IF(K266=L266,"*","") -> *
A267: 90 | B267: 27 | C267: 5 | D267: 99 | E267: 99 | F267: =IF(D267=E267,"*","") -> * | G267: 99 | I267: =IF(G267>D267,"*","") ->  | J267: =IF(AND(F267="",G267=MIN(E267,H267)),"*","") ->  | K267: =MAX(D267,G267) -> 99 | L267: =MIN(E267,H267) -> 99 | M267: =IF(K267=L267,"*","") -> *
A268: 90 | B268: 27 | C268: 6 | D268: 87 | E268: 87 | F268: =IF(D268=E268,"*","") -> * | G268: 87 | I268: =IF(G268>D268,"*","") ->  | J268: =IF(AND(F268="",G268=MIN(E268,H268)),"*","") ->  | K268: =MAX(D268,G268) -> 87 | L268: =MIN(E268,H268) -> 87 | M268: =IF(K268=L268,"*","") -> *
A269: 90 | B269: 27 | C269: 7 | D269: 73 | E269: 73 | F269: =IF(D269=E269,"*","") -> * | G269: 73 | H269: 73 | I269: =IF(G269>D269,"*","") ->  | J269: =IF(AND(F269="",G269=MIN(E269,H269)),"*","") ->  | K269: =MAX(D269,G269) -> 73 | L269: =MIN(E269,H269) -> 73 | M269: =IF(K269=L269,"*","") -> *
A270: 90 | B270: 27 | C270: 8 | D270: 72 | E270: 72 | F270: =IF(D270=E270,"*","") -> * | G270: 72 | I270: =IF(G270>D270,"*","") ->  | J270: =IF(AND(F270="",G270=MIN(E270,H270)),"*","") ->  | K270: =MAX(D270,G270) -> 72 | L270: =MIN(E270,H270) -> 72 | M270: =IF(K270=L270,"*","") -> *
A271: 90 | B271: 27 | C271: 9 | D271: 84 | E271: 84 | F271: =IF(D271=E271,"*","") -> * | G271: 84 | I271: =IF(G271>D271,"*","") ->  | J271: =IF(AND(F271="",G271=MIN(E271,H271)),"*","") ->  | K271: =MAX(D271,G271) -> 84 | L271: =MIN(E271,H271) -> 84 | M271: =IF(K271=L271,"*","") -> *
A272: 90 | B272: 27 | C272: 10 | D272: 97 | E272: 97 | F272: =IF(D272=E272,"*","") -> * | G272: 97 | I272: =IF(G272>D272,"*","") ->  | J272: =IF(AND(F272="",G272=MIN(E272,H272)),"*","") ->  | K272: =MAX(D272,G272) -> 97 | L272: =MIN(E272,H272) -> 97 | M272: =IF(K272=L272,"*","") -> *
A273: 90 | B273: 28 | C273: 1 | D273: 80 | E273: 80 | F273: =IF(D273=E273,"*","") -> * | G273: 80 | I273: =IF(G273>D273,"*","") ->  | J273: =IF(AND(F273="",G273=MIN(E273,H273)),"*","") ->  | K273: =MAX(D273,G273) -> 80 | L273: =MIN(E273,H273) -> 80 | M273: =IF(K273=L273,"*","") -> *
A274: 90 | B274: 28 | C274: 2 | D274: 76 | E274: 76 | F274: =IF(D274=E274,"*","") -> * | G274: 76 | I274: =IF(G274>D274,"*","") ->  | J274: =IF(AND(F274="",G274=MIN(E274,H274)),"*","") ->  | K274: =MAX(D274,G274) -> 76 | L274: =MIN(E274,H274) -> 76 | M274: =IF(K274=L274,"*","") -> *
A275: 90 | B275: 28 | C275: 3 | D275: 86 | E275: 86 | F275: =IF(D275=E275,"*","") -> * | G275: 86 | I275: =IF(G275>D275,"*","") ->  | J275: =IF(AND(F275="",G275=MIN(E275,H275)),"*","") ->  | K275: =MAX(D275,G275) -> 86 | L275: =MIN(E275,H275) -> 86 | M275: =IF(K275=L275,"*","") -> *
A276: 90 | B276: 28 | C276: 4 | D276: 78 | E276: 78 | F276: =IF(D276=E276,"*","") -> * | G276: 78 | I276: =IF(G276>D276,"*","") ->  | J276: =IF(AND(F276="",G276=MIN(E276,H276)),"*","") ->  | K276: =MAX(D276,G276) -> 78 | L276: =MIN(E276,H276) -> 78 | M276: =IF(K276=L276,"*","") -> *
A277: 90 | B277: 28 | C277: 5 | D277: 88 | E277: 88 | F277: =IF(D277=E277,"*","") -> * | G277: 88 | I277: =IF(G277>D277,"*","") ->  | J277: =IF(AND(F277="",G277=MIN(E277,H277)),"*","") ->  | K277: =MAX(D277,G277) -> 88 | L277: =MIN(E277,H277) -> 88 | M277: =IF(K277=L277,"*","") -> *
A278: 90 | B278: 28 | C278: 6 | D278: 102 | E278: 102 | F278: =IF(D278=E278,"*","") -> * | G278: 102 | I278: =IF(G278>D278,"*","") ->  | J278: =IF(AND(F278="",G278=MIN(E278,H278)),"*","") ->  | K278: =MAX(D278,G278) -> 102 | L278: =MIN(E278,H278) -> 102 | M278: =IF(K278=L278,"*","") -> *
A279: 90 | B279: 28 | C279: 7 | D279: 97 | E279: 97 | F279: =IF(D279=E279,"*","") -> * | G279: 97 | I279: =IF(G279>D279,"*","") ->  | J279: =IF(AND(F279="",G279=MIN(E279,H279)),"*","") ->  | K279: =MAX(D279,G279) -> 97 | L279: =MIN(E279,H279) -> 97 | M279: =IF(K279=L279,"*","") -> *
A280: 90 | B280: 28 | C280: 8 | D280: 110 | E280: 110 | F280: =IF(D280=E280,"*","") -> * | G280: 110 | I280: =IF(G280>D280,"*","") ->  | J280: =IF(AND(F280="",G280=MIN(E280,H280)),"*","") ->  | K280: =MAX(D280,G280) -> 110 | L280: =MIN(E280,H280) -> 110 | M280: =IF(K280=L280,"*","") -> *
A281: 90 | B281: 28 | C281: 9 | D281: 120 | E281: 120 | F281: =IF(D281=E281,"*","") -> * | G281: 120 | I281: =IF(G281>D281,"*","") ->  | J281: =IF(AND(F281="",G281=MIN(E281,H281)),"*","") ->  | K281: =MAX(D281,G281) -> 120 | L281: =MIN(E281,H281) -> 120 | M281: =IF(K281=L281,"*","") -> *
A282: 90 | B282: 28 | C282: 10 | D282: 68 | E282: 68 | F282: =IF(D282=E282,"*","") -> * | G282: 68 | I282: =IF(G282>D282,"*","") ->  | J282: =IF(AND(F282="",G282=MIN(E282,H282)),"*","") ->  | K282: =MAX(D282,G282) -> 68 | L282: =MIN(E282,H282) -> 68 | M282: =IF(K282=L282,"*","") -> *
A283: 90 | B283: 29 | C283: 1 | D283: 125 | E283: 135 | F283: =IF(D283=E283,"*","") ->  | G283: 123 | I283: =IF(G283>D283,"*","") ->  | J283: =IF(AND(F283="",G283=MIN(E283,H283)),"*","") ->  | K283: =MAX(D283,G283) -> 125 | L283: =MIN(E283,H283) -> 135 | M283: =IF(K283=L283,"*","") -> 
A284: 90 | B284: 29 | C284: 2 | D284: 120 | E284: 127 | F284: =IF(D284=E284,"*","") ->  | G284: 120 | I284: =IF(G284>D284,"*","") ->  | J284: =IF(AND(F284="",G284=MIN(E284,H284)),"*","") ->  | K284: =MAX(D284,G284) -> 120 | L284: =MIN(E284,H284) -> 127 | M284: =IF(K284=L284,"*","") -> 
A285: 90 | B285: 29 | C285: 3 | D285: 135 | E285: 146 | F285: =IF(D285=E285,"*","") ->  | G285: 133 | I285: =IF(G285>D285,"*","") ->  | J285: =IF(AND(F285="",G285=MIN(E285,H285)),"*","") ->  | K285: =MAX(D285,G285) -> 135 | L285: =MIN(E285,H285) -> 146 | M285: =IF(K285=L285,"*","") -> 
A286: 90 | B286: 29 | C286: 4 | D286: 138 | E286: 151 | F286: =IF(D286=E286,"*","") ->  | G286: 137 | I286: =IF(G286>D286,"*","") ->  | J286: =IF(AND(F286="",G286=MIN(E286,H286)),"*","") ->  | K286: =MAX(D286,G286) -> 138 | L286: =MIN(E286,H286) -> 151 | M286: =IF(K286=L286,"*","") -> 
A287: 90 | B287: 29 | C287: 5 | D287: 114 | E287: 123 | F287: =IF(D287=E287,"*","") ->  | G287: 114 | I287: =IF(G287>D287,"*","") ->  | J287: =IF(AND(F287="",G287=MIN(E287,H287)),"*","") ->  | K287: =MAX(D287,G287) -> 114 | L287: =MIN(E287,H287) -> 123 | M287: =IF(K287=L287,"*","") -> 
A288: 90 | B288: 29 | C288: 6 | D288: 116 | E288: 125 | F288: =IF(D288=E288,"*","") ->  | G288: 116 | I288: =IF(G288>D288,"*","") ->  | J288: =IF(AND(F288="",G288=MIN(E288,H288)),"*","") ->  | K288: =MAX(D288,G288) -> 116 | L288: =MIN(E288,H288) -> 125 | M288: =IF(K288=L288,"*","") -> 
A289: 90 | B289: 29 | C289: 7 | D289: 158 | E289: 171 | F289: =IF(D289=E289,"*","") ->  | G289: 157 | I289: =IF(G289>D289,"*","") ->  | J289: =IF(AND(F289="",G289=MIN(E289,H289)),"*","") ->  | K289: =MAX(D289,G289) -> 158 | L289: =MIN(E289,H289) -> 171 | M289: =IF(K289=L289,"*","") -> 
A290: 90 | B290: 29 | C290: 8 | D290: 145 | E290: 155 | F290: =IF(D290=E290,"*","") ->  | G290: 145 | I290: =IF(G290>D290,"*","") ->  | J290: =IF(AND(F290="",G290=MIN(E290,H290)),"*","") ->  | K290: =MAX(D290,G290) -> 145 | L290: =MIN(E290,H290) -> 155 | M290: =IF(K290=L290,"*","") -> 
A291: 90 | B291: 29 | C291: 9 | D291: 118 | E291: 128 | F291: =IF(D291=E291,"*","") ->  | G291: 118 | I291: =IF(G291>D291,"*","") ->  | J291: =IF(AND(F291="",G291=MIN(E291,H291)),"*","") ->  | K291: =MAX(D291,G291) -> 118 | L291: =MIN(E291,H291) -> 128 | M291: =IF(K291=L291,"*","") -> 
A292: 90 | B292: 29 | C292: 10 | D292: 117 | E292: 126 | F292: =IF(D292=E292,"*","") ->  | G292: 116 | I292: =IF(G292>D292,"*","") ->  | J292: =IF(AND(F292="",G292=MIN(E292,H292)),"*","") ->  | K292: =MAX(D292,G292) -> 117 | L292: =MIN(E292,H292) -> 126 | M292: =IF(K292=L292,"*","") -> 
A293: 90 | B293: 30 | C293: 1 | D293: 102 | E293: 102 | F293: =IF(D293=E293,"*","") -> * | G293: 102 | I293: =IF(G293>D293,"*","") ->  | J293: =IF(AND(F293="",G293=MIN(E293,H293)),"*","") ->  | K293: =MAX(D293,G293) -> 102 | L293: =MIN(E293,H293) -> 102 | M293: =IF(K293=L293,"*","") -> *
A294: 90 | B294: 30 | C294: 2 | D294: 76 | E294: 76 | F294: =IF(D294=E294,"*","") -> * | G294: 76 | I294: =IF(G294>D294,"*","") ->  | J294: =IF(AND(F294="",G294=MIN(E294,H294)),"*","") ->  | K294: =MAX(D294,G294) -> 76 | L294: =MIN(E294,H294) -> 76 | M294: =IF(K294=L294,"*","") -> *
A295: 90 | B295: 30 | C295: 3 | D295: 102 | E295: 102 | F295: =IF(D295=E295,"*","") -> * | G295: 102 | H295: 102 | I295: =IF(G295>D295,"*","") ->  | J295: =IF(AND(F295="",G295=MIN(E295,H295)),"*","") ->  | K295: =MAX(D295,G295) -> 102 | L295: =MIN(E295,H295) -> 102 | M295: =IF(K295=L295,"*","") -> *
A296: 90 | B296: 30 | C296: 4 | D296: 104 | E296: 104 | F296: =IF(D296=E296,"*","") -> * | G296: 104 | I296: =IF(G296>D296,"*","") ->  | J296: =IF(AND(F296="",G296=MIN(E296,H296)),"*","") ->  | K296: =MAX(D296,G296) -> 104 | L296: =MIN(E296,H296) -> 104 | M296: =IF(K296=L296,"*","") -> *
A297: 90 | B297: 30 | C297: 5 | D297: 83 | E297: 84 | F297: =IF(D297=E297,"*","") ->  | G297: 83 | I297: =IF(G297>D297,"*","") ->  | J297: =IF(AND(F297="",G297=MIN(E297,H297)),"*","") ->  | K297: =MAX(D297,G297) -> 83 | L297: =MIN(E297,H297) -> 84 | M297: =IF(K297=L297,"*","") -> 
A298: 90 | B298: 30 | C298: 6 | D298: 90 | E298: 90 | F298: =IF(D298=E298,"*","") -> * | G298: 90 | I298: =IF(G298>D298,"*","") ->  | J298: =IF(AND(F298="",G298=MIN(E298,H298)),"*","") ->  | K298: =MAX(D298,G298) -> 90 | L298: =MIN(E298,H298) -> 90 | M298: =IF(K298=L298,"*","") -> *
A299: 90 | B299: 30 | C299: 7 | D299: 84 | E299: 85 | F299: =IF(D299=E299,"*","") ->  | G299: 84 | I299: =IF(G299>D299,"*","") ->  | J299: =IF(AND(F299="",G299=MIN(E299,H299)),"*","") ->  | K299: =MAX(D299,G299) -> 84 | L299: =MIN(E299,H299) -> 85 | M299: =IF(K299=L299,"*","") -> 
A300: 90 | B300: 30 | C300: 8 | D300: 82 | E300: 82 | F300: =IF(D300=E300,"*","") -> * | G300: 82 | I300: =IF(G300>D300,"*","") ->  | J300: =IF(AND(F300="",G300=MIN(E300,H300)),"*","") ->  | K300: =MAX(D300,G300) -> 82 | L300: =MIN(E300,H300) -> 82 | M300: =IF(K300=L300,"*","") -> *
A301: 90 | B301: 30 | C301: 9 | D301: 90 | E301: 95 | F301: =IF(D301=E301,"*","") ->  | G301: 90 | I301: =IF(G301>D301,"*","") ->  | J301: =IF(AND(F301="",G301=MIN(E301,H301)),"*","") ->  | K301: =MAX(D301,G301) -> 90 | L301: =MIN(E301,H301) -> 95 | M301: =IF(K301=L301,"*","") -> 
A302: 90 | B302: 30 | C302: 10 | D302: 90 | E302: 90 | F302: =IF(D302=E302,"*","") -> * | G302: 90 | I302: =IF(G302>D302,"*","") ->  | J302: =IF(AND(F302="",G302=MIN(E302,H302)),"*","") ->  | K302: =MAX(D302,G302) -> 90 | L302: =MIN(E302,H302) -> 90 | M302: =IF(K302=L302,"*","") -> *
A303: 90 | B303: 31 | C303: 1 | D303: 79 | E303: 79 | F303: =IF(D303=E303,"*","") -> * | G303: 79 | I303: =IF(G303>D303,"*","") ->  | J303: =IF(AND(F303="",G303=MIN(E303,H303)),"*","") ->  | K303: =MAX(D303,G303) -> 79 | L303: =MIN(E303,H303) -> 79 | M303: =IF(K303=L303,"*","") -> *
A304: 90 | B304: 31 | C304: 2 | D304: 69 | E304: 69 | F304: =IF(D304=E304,"*","") -> * | G304: 69 | I304: =IF(G304>D304,"*","") ->  | J304: =IF(AND(F304="",G304=MIN(E304,H304)),"*","") ->  | K304: =MAX(D304,G304) -> 69 | L304: =MIN(E304,H304) -> 69 | M304: =IF(K304=L304,"*","") -> *
A305: 90 | B305: 31 | C305: 3 | D305: 106 | E305: 106 | F305: =IF(D305=E305,"*","") -> * | G305: 106 | I305: =IF(G305>D305,"*","") ->  | J305: =IF(AND(F305="",G305=MIN(E305,H305)),"*","") ->  | K305: =MAX(D305,G305) -> 106 | L305: =MIN(E305,H305) -> 106 | M305: =IF(K305=L305,"*","") -> *
A306: 90 | B306: 31 | C306: 4 | D306: 79 | E306: 79 | F306: =IF(D306=E306,"*","") -> * | G306: 79 | I306: =IF(G306>D306,"*","") ->  | J306: =IF(AND(F306="",G306=MIN(E306,H306)),"*","") ->  | K306: =MAX(D306,G306) -> 79 | L306: =MIN(E306,H306) -> 79 | M306: =IF(K306=L306,"*","") -> *
A307: 90 | B307: 31 | C307: 5 | D307: 79 | E307: 79 | F307: =IF(D307=E307,"*","") -> * | G307: 79 | I307: =IF(G307>D307,"*","") ->  | J307: =IF(AND(F307="",G307=MIN(E307,H307)),"*","") ->  | K307: =MAX(D307,G307) -> 79 | L307: =MIN(E307,H307) -> 79 | M307: =IF(K307=L307,"*","") -> *
A308: 90 | B308: 31 | C308: 6 | D308: 80 | E308: 80 | F308: =IF(D308=E308,"*","") -> * | G308: 80 | I308: =IF(G308>D308,"*","") ->  | J308: =IF(AND(F308="",G308=MIN(E308,H308)),"*","") ->  | K308: =MAX(D308,G308) -> 80 | L308: =MIN(E308,H308) -> 80 | M308: =IF(K308=L308,"*","") -> *
A309: 90 | B309: 31 | C309: 7 | D309: 97 | E309: 97 | F309: =IF(D309=E309,"*","") -> * | G309: 97 | I309: =IF(G309>D309,"*","") ->  | J309: =IF(AND(F309="",G309=MIN(E309,H309)),"*","") ->  | K309: =MAX(D309,G309) -> 97 | L309: =MIN(E309,H309) -> 97 | M309: =IF(K309=L309,"*","") -> *
A310: 90 | B310: 31 | C310: 8 | D310: 83 | E310: 83 | F310: =IF(D310=E310,"*","") -> * | G310: 83 | I310: =IF(G310>D310,"*","") ->  | J310: =IF(AND(F310="",G310=MIN(E310,H310)),"*","") ->  | K310: =MAX(D310,G310) -> 83 | L310: =MIN(E310,H310) -> 83 | M310: =IF(K310=L310,"*","") -> *
A311: 90 | B311: 31 | C311: 9 | D311: 72 | E311: 72 | F311: =IF(D311=E311,"*","") -> * | G311: 72 | I311: =IF(G311>D311,"*","") ->  | J311: =IF(AND(F311="",G311=MIN(E311,H311)),"*","") ->  | K311: =MAX(D311,G311) -> 72 | L311: =MIN(E311,H311) -> 72 | M311: =IF(K311=L311,"*","") -> *
A312: 90 | B312: 31 | C312: 10 | D312: 99 | E312: 99 | F312: =IF(D312=E312,"*","") -> * | G312: 99 | I312: =IF(G312>D312,"*","") ->  | J312: =IF(AND(F312="",G312=MIN(E312,H312)),"*","") ->  | K312: =MAX(D312,G312) -> 99 | L312: =MIN(E312,H312) -> 99 | M312: =IF(K312=L312,"*","") -> *
A313: 90 | B313: 32 | C313: 1 | D313: 78 | E313: 78 | F313: =IF(D313=E313,"*","") -> * | G313: 78 | I313: =IF(G313>D313,"*","") ->  | J313: =IF(AND(F313="",G313=MIN(E313,H313)),"*","") ->  | K313: =MAX(D313,G313) -> 78 | L313: =MIN(E313,H313) -> 78 | M313: =IF(K313=L313,"*","") -> *
A314: 90 | B314: 32 | C314: 2 | D314: 78 | E314: 78 | F314: =IF(D314=E314,"*","") -> * | G314: 78 | I314: =IF(G314>D314,"*","") ->  | J314: =IF(AND(F314="",G314=MIN(E314,H314)),"*","") ->  | K314: =MAX(D314,G314) -> 78 | L314: =MIN(E314,H314) -> 78 | M314: =IF(K314=L314,"*","") -> *
A315: 90 | B315: 32 | C315: 3 | D315: 89 | E315: 89 | F315: =IF(D315=E315,"*","") -> * | G315: 89 | I315: =IF(G315>D315,"*","") ->  | J315: =IF(AND(F315="",G315=MIN(E315,H315)),"*","") ->  | K315: =MAX(D315,G315) -> 89 | L315: =MIN(E315,H315) -> 89 | M315: =IF(K315=L315,"*","") -> *
A316: 90 | B316: 32 | C316: 4 | D316: 104 | E316: 104 | F316: =IF(D316=E316,"*","") -> * | G316: 104 | I316: =IF(G316>D316,"*","") ->  | J316: =IF(AND(F316="",G316=MIN(E316,H316)),"*","") ->  | K316: =MAX(D316,G316) -> 104 | L316: =MIN(E316,H316) -> 104 | M316: =IF(K316=L316,"*","") -> *
A317: 90 | B317: 32 | C317: 5 | D317: 93 | E317: 93 | F317: =IF(D317=E317,"*","") -> * | G317: 93 | I317: =IF(G317>D317,"*","") ->  | J317: =IF(AND(F317="",G317=MIN(E317,H317)),"*","") ->  | K317: =MAX(D317,G317) -> 93 | L317: =MIN(E317,H317) -> 93 | M317: =IF(K317=L317,"*","") -> *
A318: 90 | B318: 32 | C318: 6 | D318: 86 | E318: 86 | F318: =IF(D318=E318,"*","") -> * | G318: 86 | I318: =IF(G318>D318,"*","") ->  | J318: =IF(AND(F318="",G318=MIN(E318,H318)),"*","") ->  | K318: =MAX(D318,G318) -> 86 | L318: =MIN(E318,H318) -> 86 | M318: =IF(K318=L318,"*","") -> *
A319: 90 | B319: 32 | C319: 7 | D319: 87 | E319: 87 | F319: =IF(D319=E319,"*","") -> * | G319: 87 | I319: =IF(G319>D319,"*","") ->  | J319: =IF(AND(F319="",G319=MIN(E319,H319)),"*","") ->  | K319: =MAX(D319,G319) -> 87 | L319: =MIN(E319,H319) -> 87 | M319: =IF(K319=L319,"*","") -> *
A320: 90 | B320: 32 | C320: 8 | D320: 79 | E320: 79 | F320: =IF(D320=E320,"*","") -> * | G320: 79 | I320: =IF(G320>D320,"*","") ->  | J320: =IF(AND(F320="",G320=MIN(E320,H320)),"*","") ->  | K320: =MAX(D320,G320) -> 79 | L320: =MIN(E320,H320) -> 79 | M320: =IF(K320=L320,"*","") -> *
A321: 90 | B321: 32 | C321: 9 | D321: 95 | E321: 95 | F321: =IF(D321=E321,"*","") -> * | G321: 95 | I321: =IF(G321>D321,"*","") ->  | J321: =IF(AND(F321="",G321=MIN(E321,H321)),"*","") ->  | K321: =MAX(D321,G321) -> 95 | L321: =MIN(E321,H321) -> 95 | M321: =IF(K321=L321,"*","") -> *
A322: 90 | B322: 32 | C322: 10 | D322: 91 | E322: 91 | F322: =IF(D322=E322,"*","") -> * | G322: 91 | I322: =IF(G322>D322,"*","") ->  | J322: =IF(AND(F322="",G322=MIN(E322,H322)),"*","") ->  | K322: =MAX(D322,G322) -> 91 | L322: =MIN(E322,H322) -> 91 | M322: =IF(K322=L322,"*","") -> *
A323: 90 | B323: 33 | C323: 1 | D323: 94 | E323: 99 | F323: =IF(D323=E323,"*","") ->  | G323: 99 | H323: 99 | I323: =IF(G323>D323,"*","") -> * | J323: =IF(AND(F323="",G323=MIN(E323,H323)),"*","") -> * | K323: =MAX(D323,G323) -> 99 | L323: =MIN(E323,H323) -> 99 | M323: =IF(K323=L323,"*","") -> *
A324: 90 | B324: 33 | C324: 2 | D324: 112 | E324: 112 | F324: =IF(D324=E324,"*","") -> * | G324: 112 | H324: 112 | I324: =IF(G324>D324,"*","") ->  | J324: =IF(AND(F324="",G324=MIN(E324,H324)),"*","") ->  | K324: =MAX(D324,G324) -> 112 | L324: =MIN(E324,H324) -> 112 | M324: =IF(K324=L324,"*","") -> *
A325: 90 | B325: 33 | C325: 3 | D325: 108 | E325: 108 | F325: =IF(D325=E325,"*","") -> * | G325: 108 | H325: 108 | I325: =IF(G325>D325,"*","") ->  | J325: =IF(AND(F325="",G325=MIN(E325,H325)),"*","") ->  | K325: =MAX(D325,G325) -> 108 | L325: =MIN(E325,H325) -> 108 | M325: =IF(K325=L325,"*","") -> *
A326: 90 | B326: 33 | C326: 4 | D326: 91 | E326: 92 | F326: =IF(D326=E326,"*","") ->  | G326: 92 | H326: 92 | I326: =IF(G326>D326,"*","") -> * | J326: =IF(AND(F326="",G326=MIN(E326,H326)),"*","") -> * | K326: =MAX(D326,G326) -> 92 | L326: =MIN(E326,H326) -> 92 | M326: =IF(K326=L326,"*","") -> *
A327: 90 | B327: 33 | C327: 5 | D327: 109 | E327: 109 | F327: =IF(D327=E327,"*","") -> * | G327: 109 | H327: 109 | I327: =IF(G327>D327,"*","") ->  | J327: =IF(AND(F327="",G327=MIN(E327,H327)),"*","") ->  | K327: =MAX(D327,G327) -> 109 | L327: =MIN(E327,H327) -> 109 | M327: =IF(K327=L327,"*","") -> *
A328: 90 | B328: 33 | C328: 6 | D328: 88 | E328: 88 | F328: =IF(D328=E328,"*","") -> * | G328: 88 | H328: 88 | I328: =IF(G328>D328,"*","") ->  | J328: =IF(AND(F328="",G328=MIN(E328,H328)),"*","") ->  | K328: =MAX(D328,G328) -> 88 | L328: =MIN(E328,H328) -> 88 | M328: =IF(K328=L328,"*","") -> *
A329: 90 | B329: 33 | C329: 7 | D329: 105 | E329: 109 | F329: =IF(D329=E329,"*","") ->  | G329: 109 | H329: 109 | I329: =IF(G329>D329,"*","") -> * | J329: =IF(AND(F329="",G329=MIN(E329,H329)),"*","") -> * | K329: =MAX(D329,G329) -> 109 | L329: =MIN(E329,H329) -> 109 | M329: =IF(K329=L329,"*","") -> *
A330: 90 | B330: 33 | C330: 8 | D330: 107 | E330: 110 | F330: =IF(D330=E330,"*","") ->  | G330: 110 | H330: 110 | I330: =IF(G330>D330,"*","") -> * | J330: =IF(AND(F330="",G330=MIN(E330,H330)),"*","") -> * | K330: =MAX(D330,G330) -> 110 | L330: =MIN(E330,H330) -> 110 | M330: =IF(K330=L330,"*","") -> *
A331: 90 | B331: 33 | C331: 9 | D331: 93 | E331: 95 | F331: =IF(D331=E331,"*","") ->  | G331: 95 | H331: 95 | I331: =IF(G331>D331,"*","") -> * | J331: =IF(AND(F331="",G331=MIN(E331,H331)),"*","") -> * | K331: =MAX(D331,G331) -> 95 | L331: =MIN(E331,H331) -> 95 | M331: =IF(K331=L331,"*","") -> *
A332: 90 | B332: 33 | C332: 10 | D332: 114 | E332: 114 | F332: =IF(D332=E332,"*","") -> * | G332: 114 | H332: 114 | I332: =IF(G332>D332,"*","") ->  | J332: =IF(AND(F332="",G332=MIN(E332,H332)),"*","") ->  | K332: =MAX(D332,G332) -> 114 | L332: =MIN(E332,H332) -> 114 | M332: =IF(K332=L332,"*","") -> *
A333: 90 | B333: 34 | C333: 1 | D333: 83 | E333: 83 | F333: =IF(D333=E333,"*","") -> * | G333: 83 | H333: 83 | I333: =IF(G333>D333,"*","") ->  | J333: =IF(AND(F333="",G333=MIN(E333,H333)),"*","") ->  | K333: =MAX(D333,G333) -> 83 | L333: =MIN(E333,H333) -> 83 | M333: =IF(K333=L333,"*","") -> *
A334: 90 | B334: 34 | C334: 2 | D334: 89 | E334: 89 | F334: =IF(D334=E334,"*","") -> * | G334: 89 | H334: 89 | I334: =IF(G334>D334,"*","") ->  | J334: =IF(AND(F334="",G334=MIN(E334,H334)),"*","") ->  | K334: =MAX(D334,G334) -> 89 | L334: =MIN(E334,H334) -> 89 | M334: =IF(K334=L334,"*","") -> *
A335: 90 | B335: 34 | C335: 3 | D335: 82 | E335: 82 | F335: =IF(D335=E335,"*","") -> * | G335: 82 | H335: 82 | I335: =IF(G335>D335,"*","") ->  | J335: =IF(AND(F335="",G335=MIN(E335,H335)),"*","") ->  | K335: =MAX(D335,G335) -> 82 | L335: =MIN(E335,H335) -> 82 | M335: =IF(K335=L335,"*","") -> *
A336: 90 | B336: 34 | C336: 4 | D336: 81 | E336: 81 | F336: =IF(D336=E336,"*","") -> * | G336: 81 | H336: 81 | I336: =IF(G336>D336,"*","") ->  | J336: =IF(AND(F336="",G336=MIN(E336,H336)),"*","") ->  | K336: =MAX(D336,G336) -> 81 | L336: =MIN(E336,H336) -> 81 | M336: =IF(K336=L336,"*","") -> *
A337: 90 | B337: 34 | C337: 5 | D337: 81 | E337: 83 | F337: =IF(D337=E337,"*","") ->  | G337: 83 | H337: 83 | I337: =IF(G337>D337,"*","") -> * | J337: =IF(AND(F337="",G337=MIN(E337,H337)),"*","") -> * | K337: =MAX(D337,G337) -> 83 | L337: =MIN(E337,H337) -> 83 | M337: =IF(K337=L337,"*","") -> *
A338: 90 | B338: 34 | C338: 6 | D338: 89 | E338: 89 | F338: =IF(D338=E338,"*","") -> * | G338: 89 | H338: 89 | I338: =IF(G338>D338,"*","") ->  | J338: =IF(AND(F338="",G338=MIN(E338,H338)),"*","") ->  | K338: =MAX(D338,G338) -> 89 | L338: =MIN(E338,H338) -> 89 | M338: =IF(K338=L338,"*","") -> *
A339: 90 | B339: 34 | C339: 7 | D339: 92 | E339: 92 | F339: =IF(D339=E339,"*","") -> * | G339: 92 | H339: 92 | I339: =IF(G339>D339,"*","") ->  | J339: =IF(AND(F339="",G339=MIN(E339,H339)),"*","") ->  | K339: =MAX(D339,G339) -> 92 | L339: =MIN(E339,H339) -> 92 | M339: =IF(K339=L339,"*","") -> *
A340: 90 | B340: 34 | C340: 8 | D340: 81 | E340: 81 | F340: =IF(D340=E340,"*","") -> * | G340: 81 | H340: 81 | I340: =IF(G340>D340,"*","") ->  | J340: =IF(AND(F340="",G340=MIN(E340,H340)),"*","") ->  | K340: =MAX(D340,G340) -> 81 | L340: =MIN(E340,H340) -> 81 | M340: =IF(K340=L340,"*","") -> *
A341: 90 | B341: 34 | C341: 9 | D341: 109 | E341: 109 | F341: =IF(D341=E341,"*","") -> * | G341: 109 | H341: 109 | I341: =IF(G341>D341,"*","") ->  | J341: =IF(AND(F341="",G341=MIN(E341,H341)),"*","") ->  | K341: =MAX(D341,G341) -> 109 | L341: =MIN(E341,H341) -> 109 | M341: =IF(K341=L341,"*","") -> *
A342: 90 | B342: 34 | C342: 10 | D342: 101 | E342: 101 | F342: =IF(D342=E342,"*","") -> * | G342: 101 | H342: 101 | I342: =IF(G342>D342,"*","") ->  | J342: =IF(AND(F342="",G342=MIN(E342,H342)),"*","") ->  | K342: =MAX(D342,G342) -> 101 | L342: =MIN(E342,H342) -> 101 | M342: =IF(K342=L342,"*","") -> *
A343: 90 | B343: 35 | C343: 1 | D343: 98 | E343: 98 | F343: =IF(D343=E343,"*","") -> * | G343: 98 | H343: 98 | I343: =IF(G343>D343,"*","") ->  | J343: =IF(AND(F343="",G343=MIN(E343,H343)),"*","") ->  | K343: =MAX(D343,G343) -> 98 | L343: =MIN(E343,H343) -> 98 | M343: =IF(K343=L343,"*","") -> *
A344: 90 | B344: 35 | C344: 2 | D344: 92 | E344: 92 | F344: =IF(D344=E344,"*","") -> * | G344: 92 | H344: 92 | I344: =IF(G344>D344,"*","") ->  | J344: =IF(AND(F344="",G344=MIN(E344,H344)),"*","") ->  | K344: =MAX(D344,G344) -> 92 | L344: =MIN(E344,H344) -> 92 | M344: =IF(K344=L344,"*","") -> *
A345: 90 | B345: 35 | C345: 3 | D345: 96 | E345: 96 | F345: =IF(D345=E345,"*","") -> * | G345: 96 | H345: 96 | I345: =IF(G345>D345,"*","") ->  | J345: =IF(AND(F345="",G345=MIN(E345,H345)),"*","") ->  | K345: =MAX(D345,G345) -> 96 | L345: =MIN(E345,H345) -> 96 | M345: =IF(K345=L345,"*","") -> *
A346: 90 | B346: 35 | C346: 4 | D346: 86 | E346: 86 | F346: =IF(D346=E346,"*","") -> * | G346: 86 | H346: 86 | I346: =IF(G346>D346,"*","") ->  | J346: =IF(AND(F346="",G346=MIN(E346,H346)),"*","") ->  | K346: =MAX(D346,G346) -> 86 | L346: =MIN(E346,H346) -> 86 | M346: =IF(K346=L346,"*","") -> *
A347: 90 | B347: 35 | C347: 5 | D347: 103 | E347: 103 | F347: =IF(D347=E347,"*","") -> * | G347: 103 | H347: 103 | I347: =IF(G347>D347,"*","") ->  | J347: =IF(AND(F347="",G347=MIN(E347,H347)),"*","") ->  | K347: =MAX(D347,G347) -> 103 | L347: =MIN(E347,H347) -> 103 | M347: =IF(K347=L347,"*","") -> *
A348: 90 | B348: 35 | C348: 6 | D348: 72 | E348: 72 | F348: =IF(D348=E348,"*","") -> * | G348: 72 | H348: 72 | I348: =IF(G348>D348,"*","") ->  | J348: =IF(AND(F348="",G348=MIN(E348,H348)),"*","") ->  | K348: =MAX(D348,G348) -> 72 | L348: =MIN(E348,H348) -> 72 | M348: =IF(K348=L348,"*","") -> *
A349: 90 | B349: 35 | C349: 7 | D349: 78 | E349: 78 | F349: =IF(D349=E349,"*","") -> * | G349: 78 | H349: 78 | I349: =IF(G349>D349,"*","") ->  | J349: =IF(AND(F349="",G349=MIN(E349,H349)),"*","") ->  | K349: =MAX(D349,G349) -> 78 | L349: =MIN(E349,H349) -> 78 | M349: =IF(K349=L349,"*","") -> *
A350: 90 | B350: 35 | C350: 8 | D350: 85 | E350: 85 | F350: =IF(D350=E350,"*","") -> * | G350: 85 | H350: 85 | I350: =IF(G350>D350,"*","") ->  | J350: =IF(AND(F350="",G350=MIN(E350,H350)),"*","") ->  | K350: =MAX(D350,G350) -> 85 | L350: =MIN(E350,H350) -> 85 | M350: =IF(K350=L350,"*","") -> *
A351: 90 | B351: 35 | C351: 9 | D351: 76 | E351: 76 | F351: =IF(D351=E351,"*","") -> * | G351: 76 | H351: 76 | I351: =IF(G351>D351,"*","") ->  | J351: =IF(AND(F351="",G351=MIN(E351,H351)),"*","") ->  | K351: =MAX(D351,G351) -> 76 | L351: =MIN(E351,H351) -> 76 | M351: =IF(K351=L351,"*","") -> *
A352: 90 | B352: 35 | C352: 10 | D352: 82 | E352: 82 | F352: =IF(D352=E352,"*","") -> * | G352: 82 | H352: 82 | I352: =IF(G352>D352,"*","") ->  | J352: =IF(AND(F352="",G352=MIN(E352,H352)),"*","") ->  | K352: =MAX(D352,G352) -> 82 | L352: =MIN(E352,H352) -> 82 | M352: =IF(K352=L352,"*","") -> *
A353: 90 | B353: 36 | C353: 1 | D353: 97 | E353: 97 | F353: =IF(D353=E353,"*","") -> * | G353: 97 | H353: 97 | I353: =IF(G353>D353,"*","") ->  | J353: =IF(AND(F353="",G353=MIN(E353,H353)),"*","") ->  | K353: =MAX(D353,G353) -> 97 | L353: =MIN(E353,H353) -> 97 | M353: =IF(K353=L353,"*","") -> *
A354: 90 | B354: 36 | C354: 2 | D354: 114 | E354: 114 | F354: =IF(D354=E354,"*","") -> * | G354: 114 | H354: 114 | I354: =IF(G354>D354,"*","") ->  | J354: =IF(AND(F354="",G354=MIN(E354,H354)),"*","") ->  | K354: =MAX(D354,G354) -> 114 | L354: =MIN(E354,H354) -> 114 | M354: =IF(K354=L354,"*","") -> *
A355: 90 | B355: 36 | C355: 3 | D355: 84 | E355: 84 | F355: =IF(D355=E355,"*","") -> * | G355: 84 | H355: 84 | I355: =IF(G355>D355,"*","") ->  | J355: =IF(AND(F355="",G355=MIN(E355,H355)),"*","") ->  | K355: =MAX(D355,G355) -> 84 | L355: =MIN(E355,H355) -> 84 | M355: =IF(K355=L355,"*","") -> *
A356: 90 | B356: 36 | C356: 4 | D356: 79 | E356: 79 | F356: =IF(D356=E356,"*","") -> * | G356: 79 | H356: 79 | I356: =IF(G356>D356,"*","") ->  | J356: =IF(AND(F356="",G356=MIN(E356,H356)),"*","") ->  | K356: =MAX(D356,G356) -> 79 | L356: =MIN(E356,H356) -> 79 | M356: =IF(K356=L356,"*","") -> *
A357: 90 | B357: 36 | C357: 5 | D357: 98 | E357: 98 | F357: =IF(D357=E357,"*","") -> * | G357: 98 | H357: 98 | I357: =IF(G357>D357,"*","") ->  | J357: =IF(AND(F357="",G357=MIN(E357,H357)),"*","") ->  | K357: =MAX(D357,G357) -> 98 | L357: =MIN(E357,H357) -> 98 | M357: =IF(K357=L357,"*","") -> *
A358: 90 | B358: 36 | C358: 6 | D358: 99 | E358: 99 | F358: =IF(D358=E358,"*","") -> * | G358: 99 | H358: 99 | I358: =IF(G358>D358,"*","") ->  | J358: =IF(AND(F358="",G358=MIN(E358,H358)),"*","") ->  | K358: =MAX(D358,G358) -> 99 | L358: =MIN(E358,H358) -> 99 | M358: =IF(K358=L358,"*","") -> *
A359: 90 | B359: 36 | C359: 7 | D359: 89 | E359: 89 | F359: =IF(D359=E359,"*","") -> * | G359: 89 | H359: 89 | I359: =IF(G359>D359,"*","") ->  | J359: =IF(AND(F359="",G359=MIN(E359,H359)),"*","") ->  | K359: =MAX(D359,G359) -> 89 | L359: =MIN(E359,H359) -> 89 | M359: =IF(K359=L359,"*","") -> *
A360: 90 | B360: 36 | C360: 8 | D360: 84 | E360: 84 | F360: =IF(D360=E360,"*","") -> * | G360: 84 | H360: 84 | I360: =IF(G360>D360,"*","") ->  | J360: =IF(AND(F360="",G360=MIN(E360,H360)),"*","") ->  | K360: =MAX(D360,G360) -> 84 | L360: =MIN(E360,H360) -> 84 | M360: =IF(K360=L360,"*","") -> *
A361: 90 | B361: 36 | C361: 9 | D361: 102 | E361: 102 | F361: =IF(D361=E361,"*","") -> * | G361: 102 | H361: 102 | I361: =IF(G361>D361,"*","") ->  | J361: =IF(AND(F361="",G361=MIN(E361,H361)),"*","") ->  | K361: =MAX(D361,G361) -> 102 | L361: =MIN(E361,H361) -> 102 | M361: =IF(K361=L361,"*","") -> *
A362: 90 | B362: 36 | C362: 10 | D362: 109 | E362: 109 | F362: =IF(D362=E362,"*","") -> * | G362: 109 | H362: 109 | I362: =IF(G362>D362,"*","") ->  | J362: =IF(AND(F362="",G362=MIN(E362,H362)),"*","") ->  | K362: =MAX(D362,G362) -> 109 | L362: =MIN(E362,H362) -> 109 | M362: =IF(K362=L362,"*","") -> *
A363: 90 | B363: 37 | C363: 1 | D363: 99 | E363: 110 | F363: =IF(D363=E363,"*","") ->  | G363: 105 | I363: =IF(G363>D363,"*","") -> * | J363: =IF(AND(F363="",G363=MIN(E363,H363)),"*","") ->  | K363: =MAX(D363,G363) -> 105 | L363: =MIN(E363,H363) -> 110 | M363: =IF(K363=L363,"*","") -> 
A364: 90 | B364: 37 | C364: 2 | D364: 103 | E364: 115 | F364: =IF(D364=E364,"*","") ->  | G364: 109 | I364: =IF(G364>D364,"*","") -> * | J364: =IF(AND(F364="",G364=MIN(E364,H364)),"*","") ->  | K364: =MAX(D364,G364) -> 109 | L364: =MIN(E364,H364) -> 115 | M364: =IF(K364=L364,"*","") -> 
A365: 90 | B365: 37 | C365: 3 | D365: 123 | E365: 132 | F365: =IF(D365=E365,"*","") ->  | G365: 132 | I365: =IF(G365>D365,"*","") -> * | J365: =IF(AND(F365="",G365=MIN(E365,H365)),"*","") -> * | K365: =MAX(D365,G365) -> 132 | L365: =MIN(E365,H365) -> 132 | M365: =IF(K365=L365,"*","") -> *
A366: 90 | B366: 37 | C366: 4 | D366: 111 | E366: 123 | F366: =IF(D366=E366,"*","") ->  | G366: 120 | I366: =IF(G366>D366,"*","") -> * | J366: =IF(AND(F366="",G366=MIN(E366,H366)),"*","") ->  | K366: =MAX(D366,G366) -> 120 | L366: =MIN(E366,H366) -> 123 | M366: =IF(K366=L366,"*","") -> 
A367: 90 | B367: 37 | C367: 5 | D367: 110 | E367: 126 | F367: =IF(D367=E367,"*","") ->  | G367: 121 | I367: =IF(G367>D367,"*","") -> * | J367: =IF(AND(F367="",G367=MIN(E367,H367)),"*","") ->  | K367: =MAX(D367,G367) -> 121 | L367: =MIN(E367,H367) -> 126 | M367: =IF(K367=L367,"*","") -> 
A368: 90 | B368: 37 | C368: 6 | D368: 117 | E368: 131 | F368: =IF(D368=E368,"*","") ->  | G368: 124 | I368: =IF(G368>D368,"*","") -> * | J368: =IF(AND(F368="",G368=MIN(E368,H368)),"*","") ->  | K368: =MAX(D368,G368) -> 124 | L368: =MIN(E368,H368) -> 131 | M368: =IF(K368=L368,"*","") -> 
A369: 90 | B369: 37 | C369: 7 | D369: 112 | E369: 123 | F369: =IF(D369=E369,"*","") ->  | G369: 123 | H369: 123 | I369: =IF(G369>D369,"*","") -> * | J369: =IF(AND(F369="",G369=MIN(E369,H369)),"*","") -> * | K369: =MAX(D369,G369) -> 123 | L369: =MIN(E369,H369) -> 123 | M369: =IF(K369=L369,"*","") -> *
A370: 90 | B370: 37 | C370: 8 | D370: 106 | E370: 119 | F370: =IF(D370=E370,"*","") ->  | G370: 115 | I370: =IF(G370>D370,"*","") -> * | J370: =IF(AND(F370="",G370=MIN(E370,H370)),"*","") ->  | K370: =MAX(D370,G370) -> 115 | L370: =MIN(E370,H370) -> 119 | M370: =IF(K370=L370,"*","") -> 
A371: 90 | B371: 37 | C371: 9 | D371: 115 | E371: 123 | F371: =IF(D371=E371,"*","") ->  | G371: 122 | I371: =IF(G371>D371,"*","") -> * | J371: =IF(AND(F371="",G371=MIN(E371,H371)),"*","") ->  | K371: =MAX(D371,G371) -> 122 | L371: =MIN(E371,H371) -> 123 | M371: =IF(K371=L371,"*","") -> 
A372: 90 | B372: 37 | C372: 10 | D372: 111 | E372: 125 | F372: =IF(D372=E372,"*","") ->  | G372: 117 | I372: =IF(G372>D372,"*","") -> * | J372: =IF(AND(F372="",G372=MIN(E372,H372)),"*","") ->  | K372: =MAX(D372,G372) -> 117 | L372: =MIN(E372,H372) -> 125 | M372: =IF(K372=L372,"*","") -> 
A373: 90 | B373: 38 | C373: 1 | D373: 84 | E373: 85 | F373: =IF(D373=E373,"*","") ->  | G373: 85 | H373: 85 | I373: =IF(G373>D373,"*","") -> * | J373: =IF(AND(F373="",G373=MIN(E373,H373)),"*","") -> * | K373: =MAX(D373,G373) -> 85 | L373: =MIN(E373,H373) -> 85 | M373: =IF(K373=L373,"*","") -> *
A374: 90 | B374: 38 | C374: 2 | D374: 78 | E374: 78 | F374: =IF(D374=E374,"*","") -> * | G374: 78 | H374: 78 | I374: =IF(G374>D374,"*","") ->  | J374: =IF(AND(F374="",G374=MIN(E374,H374)),"*","") ->  | K374: =MAX(D374,G374) -> 78 | L374: =MIN(E374,H374) -> 78 | M374: =IF(K374=L374,"*","") -> *
A375: 90 | B375: 38 | C375: 3 | D375: 88 | E375: 89 | F375: =IF(D375=E375,"*","") ->  | G375: 89 | H375: 89 | I375: =IF(G375>D375,"*","") -> * | J375: =IF(AND(F375="",G375=MIN(E375,H375)),"*","") -> * | K375: =MAX(D375,G375) -> 89 | L375: =MIN(E375,H375) -> 89 | M375: =IF(K375=L375,"*","") -> *
A376: 90 | B376: 38 | C376: 4 | D376: 89 | E376: 89 | F376: =IF(D376=E376,"*","") -> * | G376: 89 | H376: 89 | I376: =IF(G376>D376,"*","") ->  | J376: =IF(AND(F376="",G376=MIN(E376,H376)),"*","") ->  | K376: =MAX(D376,G376) -> 89 | L376: =MIN(E376,H376) -> 89 | M376: =IF(K376=L376,"*","") -> *
A377: 90 | B377: 38 | C377: 5 | D377: 84 | E377: 86 | F377: =IF(D377=E377,"*","") ->  | G377: 86 | H377: 86 | I377: =IF(G377>D377,"*","") -> * | J377: =IF(AND(F377="",G377=MIN(E377,H377)),"*","") -> * | K377: =MAX(D377,G377) -> 86 | L377: =MIN(E377,H377) -> 86 | M377: =IF(K377=L377,"*","") -> *
A378: 90 | B378: 38 | C378: 6 | D378: 88 | E378: 88 | F378: =IF(D378=E378,"*","") -> * | G378: 88 | H378: 88 | I378: =IF(G378>D378,"*","") ->  | J378: =IF(AND(F378="",G378=MIN(E378,H378)),"*","") ->  | K378: =MAX(D378,G378) -> 88 | L378: =MIN(E378,H378) -> 88 | M378: =IF(K378=L378,"*","") -> *
A379: 90 | B379: 38 | C379: 7 | D379: 85 | E379: 85 | F379: =IF(D379=E379,"*","") -> * | G379: 85 | H379: 85 | I379: =IF(G379>D379,"*","") ->  | J379: =IF(AND(F379="",G379=MIN(E379,H379)),"*","") ->  | K379: =MAX(D379,G379) -> 85 | L379: =MIN(E379,H379) -> 85 | M379: =IF(K379=L379,"*","") -> *
A380: 90 | B380: 38 | C380: 8 | D380: 91 | E380: 91 | F380: =IF(D380=E380,"*","") -> * | G380: 91 | H380: 91 | I380: =IF(G380>D380,"*","") ->  | J380: =IF(AND(F380="",G380=MIN(E380,H380)),"*","") ->  | K380: =MAX(D380,G380) -> 91 | L380: =MIN(E380,H380) -> 91 | M380: =IF(K380=L380,"*","") -> *
A381: 90 | B381: 38 | C381: 9 | D381: 95 | E381: 95 | F381: =IF(D381=E381,"*","") -> * | G381: 95 | H381: 95 | I381: =IF(G381>D381,"*","") ->  | J381: =IF(AND(F381="",G381=MIN(E381,H381)),"*","") ->  | K381: =MAX(D381,G381) -> 95 | L381: =MIN(E381,H381) -> 95 | M381: =IF(K381=L381,"*","") -> *
A382: 90 | B382: 38 | C382: 10 | D382: 108 | E382: 108 | F382: =IF(D382=E382,"*","") -> * | G382: 108 | H382: 108 | I382: =IF(G382>D382,"*","") ->  | J382: =IF(AND(F382="",G382=MIN(E382,H382)),"*","") ->  | K382: =MAX(D382,G382) -> 108 | L382: =MIN(E382,H382) -> 108 | M382: =IF(K382=L382,"*","") -> *
A383: 90 | B383: 39 | C383: 1 | D383: 106 | E383: 106 | F383: =IF(D383=E383,"*","") -> * | G383: 106 | H383: 106 | I383: =IF(G383>D383,"*","") ->  | J383: =IF(AND(F383="",G383=MIN(E383,H383)),"*","") ->  | K383: =MAX(D383,G383) -> 106 | L383: =MIN(E383,H383) -> 106 | M383: =IF(K383=L383,"*","") -> *
A384: 90 | B384: 39 | C384: 2 | D384: 119 | E384: 119 | F384: =IF(D384=E384,"*","") -> * | G384: 119 | H384: 119 | I384: =IF(G384>D384,"*","") ->  | J384: =IF(AND(F384="",G384=MIN(E384,H384)),"*","") ->  | K384: =MAX(D384,G384) -> 119 | L384: =MIN(E384,H384) -> 119 | M384: =IF(K384=L384,"*","") -> *
A385: 90 | B385: 39 | C385: 3 | D385: 83 | E385: 83 | F385: =IF(D385=E385,"*","") -> * | G385: 83 | H385: 83 | I385: =IF(G385>D385,"*","") ->  | J385: =IF(AND(F385="",G385=MIN(E385,H385)),"*","") ->  | K385: =MAX(D385,G385) -> 83 | L385: =MIN(E385,H385) -> 83 | M385: =IF(K385=L385,"*","") -> *
A386: 90 | B386: 39 | C386: 4 | D386: 81 | E386: 81 | F386: =IF(D386=E386,"*","") -> * | G386: 81 | H386: 81 | I386: =IF(G386>D386,"*","") ->  | J386: =IF(AND(F386="",G386=MIN(E386,H386)),"*","") ->  | K386: =MAX(D386,G386) -> 81 | L386: =MIN(E386,H386) -> 81 | M386: =IF(K386=L386,"*","") -> *
A387: 90 | B387: 39 | C387: 5 | D387: 85 | E387: 85 | F387: =IF(D387=E387,"*","") -> * | G387: 85 | H387: 85 | I387: =IF(G387>D387,"*","") ->  | J387: =IF(AND(F387="",G387=MIN(E387,H387)),"*","") ->  | K387: =MAX(D387,G387) -> 85 | L387: =MIN(E387,H387) -> 85 | M387: =IF(K387=L387,"*","") -> *
A388: 90 | B388: 39 | C388: 6 | D388: 102 | E388: 102 | F388: =IF(D388=E388,"*","") -> * | G388: 102 | H388: 102 | I388: =IF(G388>D388,"*","") ->  | J388: =IF(AND(F388="",G388=MIN(E388,H388)),"*","") ->  | K388: =MAX(D388,G388) -> 102 | L388: =MIN(E388,H388) -> 102 | M388: =IF(K388=L388,"*","") -> *
A389: 90 | B389: 39 | C389: 7 | D389: 85 | E389: 85 | F389: =IF(D389=E389,"*","") -> * | G389: 85 | H389: 85 | I389: =IF(G389>D389,"*","") ->  | J389: =IF(AND(F389="",G389=MIN(E389,H389)),"*","") ->  | K389: =MAX(D389,G389) -> 85 | L389: =MIN(E389,H389) -> 85 | M389: =IF(K389=L389,"*","") -> *
A390: 90 | B390: 39 | C390: 8 | D390: 81 | E390: 81 | F390: =IF(D390=E390,"*","") -> * | G390: 81 | H390: 81 | I390: =IF(G390>D390,"*","") ->  | J390: =IF(AND(F390="",G390=MIN(E390,H390)),"*","") ->  | K390: =MAX(D390,G390) -> 81 | L390: =MIN(E390,H390) -> 81 | M390: =IF(K390=L390,"*","") -> *
A391: 90 | B391: 39 | C391: 9 | D391: 79 | E391: 79 | F391: =IF(D391=E391,"*","") -> * | G391: 79 | H391: 79 | I391: =IF(G391>D391,"*","") ->  | J391: =IF(AND(F391="",G391=MIN(E391,H391)),"*","") ->  | K391: =MAX(D391,G391) -> 79 | L391: =MIN(E391,H391) -> 79 | M391: =IF(K391=L391,"*","") -> *
A392: 90 | B392: 39 | C392: 10 | D392: 100 | E392: 100 | F392: =IF(D392=E392,"*","") -> * | G392: 100 | H392: 100 | I392: =IF(G392>D392,"*","") ->  | J392: =IF(AND(F392="",G392=MIN(E392,H392)),"*","") ->  | K392: =MAX(D392,G392) -> 100 | L392: =MIN(E392,H392) -> 100 | M392: =IF(K392=L392,"*","") -> *
A393: 90 | B393: 40 | C393: 1 | D393: 95 | E393: 95 | F393: =IF(D393=E393,"*","") -> * | G393: 95 | H393: 95 | I393: =IF(G393>D393,"*","") ->  | J393: =IF(AND(F393="",G393=MIN(E393,H393)),"*","") ->  | K393: =MAX(D393,G393) -> 95 | L393: =MIN(E393,H393) -> 95 | M393: =IF(K393=L393,"*","") -> *
A394: 90 | B394: 40 | C394: 2 | D394: 91 | E394: 91 | F394: =IF(D394=E394,"*","") -> * | G394: 91 | H394: 91 | I394: =IF(G394>D394,"*","") ->  | J394: =IF(AND(F394="",G394=MIN(E394,H394)),"*","") ->  | K394: =MAX(D394,G394) -> 91 | L394: =MIN(E394,H394) -> 91 | M394: =IF(K394=L394,"*","") -> *
A395: 90 | B395: 40 | C395: 3 | D395: 77 | E395: 77 | F395: =IF(D395=E395,"*","") -> * | G395: 77 | H395: 77 | I395: =IF(G395>D395,"*","") ->  | J395: =IF(AND(F395="",G395=MIN(E395,H395)),"*","") ->  | K395: =MAX(D395,G395) -> 77 | L395: =MIN(E395,H395) -> 77 | M395: =IF(K395=L395,"*","") -> *
A396: 90 | B396: 40 | C396: 4 | D396: 106 | E396: 106 | F396: =IF(D396=E396,"*","") -> * | G396: 106 | H396: 106 | I396: =IF(G396>D396,"*","") ->  | J396: =IF(AND(F396="",G396=MIN(E396,H396)),"*","") ->  | K396: =MAX(D396,G396) -> 106 | L396: =MIN(E396,H396) -> 106 | M396: =IF(K396=L396,"*","") -> *
A397: 90 | B397: 40 | C397: 5 | D397: 92 | E397: 92 | F397: =IF(D397=E397,"*","") -> * | G397: 92 | H397: 92 | I397: =IF(G397>D397,"*","") ->  | J397: =IF(AND(F397="",G397=MIN(E397,H397)),"*","") ->  | K397: =MAX(D397,G397) -> 92 | L397: =MIN(E397,H397) -> 92 | M397: =IF(K397=L397,"*","") -> *
A398: 90 | B398: 40 | C398: 6 | D398: 86 | E398: 86 | F398: =IF(D398=E398,"*","") -> * | G398: 86 | H398: 86 | I398: =IF(G398>D398,"*","") ->  | J398: =IF(AND(F398="",G398=MIN(E398,H398)),"*","") ->  | K398: =MAX(D398,G398) -> 86 | L398: =MIN(E398,H398) -> 86 | M398: =IF(K398=L398,"*","") -> *
A399: 90 | B399: 40 | C399: 7 | D399: 87 | E399: 87 | F399: =IF(D399=E399,"*","") -> * | G399: 87 | H399: 87 | I399: =IF(G399>D399,"*","") ->  | J399: =IF(AND(F399="",G399=MIN(E399,H399)),"*","") ->  | K399: =MAX(D399,G399) -> 87 | L399: =MIN(E399,H399) -> 87 | M399: =IF(K399=L399,"*","") -> *
A400: 90 | B400: 40 | C400: 8 | D400: 79 | E400: 79 | F400: =IF(D400=E400,"*","") -> * | G400: 79 | I400: =IF(G400>D400,"*","") ->  | J400: =IF(AND(F400="",G400=MIN(E400,H400)),"*","") ->  | K400: =MAX(D400,G400) -> 79 | L400: =MIN(E400,H400) -> 79 | M400: =IF(K400=L400,"*","") -> *
A401: 90 | B401: 40 | C401: 9 | D401: 98 | E401: 98 | F401: =IF(D401=E401,"*","") -> * | G401: 98 | H401: 98 | I401: =IF(G401>D401,"*","") ->  | J401: =IF(AND(F401="",G401=MIN(E401,H401)),"*","") ->  | K401: =MAX(D401,G401) -> 98 | L401: =MIN(E401,H401) -> 98 | M401: =IF(K401=L401,"*","") -> *
A402: 90 | B402: 40 | C402: 10 | D402: 86 | E402: 86 | F402: =IF(D402=E402,"*","") -> * | G402: 86 | H402: 86 | I402: =IF(G402>D402,"*","") ->  | J402: =IF(AND(F402="",G402=MIN(E402,H402)),"*","") ->  | K402: =MAX(D402,G402) -> 86 | L402: =MIN(E402,H402) -> 86 | M402: =IF(K402=L402,"*","") -> *
A403: 90 | B403: 41 | C403: 1 | D403: 128 | E403: 143 | F403: =IF(D403=E403,"*","") ->  | G403: 126 | I403: =IF(G403>D403,"*","") ->  | J403: =IF(AND(F403="",G403=MIN(E403,H403)),"*","") ->  | K403: =MAX(D403,G403) -> 128 | L403: =MIN(E403,H403) -> 143 | M403: =IF(K403=L403,"*","") -> 
A404: 90 | B404: 41 | C404: 2 | D404: 151 | E404: 170 | F404: =IF(D404=E404,"*","") ->  | G404: 150 | I404: =IF(G404>D404,"*","") ->  | J404: =IF(AND(F404="",G404=MIN(E404,H404)),"*","") ->  | K404: =MAX(D404,G404) -> 151 | L404: =MIN(E404,H404) -> 170 | M404: =IF(K404=L404,"*","") -> 
A405: 90 | B405: 41 | C405: 3 | D405: 146 | E405: 163 | F405: =IF(D405=E405,"*","") ->  | G405: 143 | I405: =IF(G405>D405,"*","") ->  | J405: =IF(AND(F405="",G405=MIN(E405,H405)),"*","") ->  | K405: =MAX(D405,G405) -> 146 | L405: =MIN(E405,H405) -> 163 | M405: =IF(K405=L405,"*","") -> 
A406: 90 | B406: 41 | C406: 4 | D406: 140 | E406: 155 | F406: =IF(D406=E406,"*","") ->  | G406: 138 | I406: =IF(G406>D406,"*","") ->  | J406: =IF(AND(F406="",G406=MIN(E406,H406)),"*","") ->  | K406: =MAX(D406,G406) -> 140 | L406: =MIN(E406,H406) -> 155 | M406: =IF(K406=L406,"*","") -> 
A407: 90 | B407: 41 | C407: 5 | D407: 115 | E407: 128 | F407: =IF(D407=E407,"*","") ->  | G407: 113 | I407: =IF(G407>D407,"*","") ->  | J407: =IF(AND(F407="",G407=MIN(E407,H407)),"*","") ->  | K407: =MAX(D407,G407) -> 115 | L407: =MIN(E407,H407) -> 128 | M407: =IF(K407=L407,"*","") -> 
A408: 90 | B408: 41 | C408: 6 | D408: 123 | E408: 137 | F408: =IF(D408=E408,"*","") ->  | G408: 122 | I408: =IF(G408>D408,"*","") ->  | J408: =IF(AND(F408="",G408=MIN(E408,H408)),"*","") ->  | K408: =MAX(D408,G408) -> 123 | L408: =MIN(E408,H408) -> 137 | M408: =IF(K408=L408,"*","") -> 
A409: 90 | B409: 41 | C409: 7 | D409: 143 | E409: 158 | F409: =IF(D409=E409,"*","") ->  | G409: 141 | I409: =IF(G409>D409,"*","") ->  | J409: =IF(AND(F409="",G409=MIN(E409,H409)),"*","") ->  | K409: =MAX(D409,G409) -> 143 | L409: =MIN(E409,H409) -> 158 | M409: =IF(K409=L409,"*","") -> 
A410: 90 | B410: 41 | C410: 8 | D410: 147 | E410: 163 | F410: =IF(D410=E410,"*","") ->  | G410: 143 | I410: =IF(G410>D410,"*","") ->  | J410: =IF(AND(F410="",G410=MIN(E410,H410)),"*","") ->  | K410: =MAX(D410,G410) -> 147 | L410: =MIN(E410,H410) -> 163 | M410: =IF(K410=L410,"*","") -> 
A411: 90 | B411: 41 | C411: 9 | D411: 109 | E411: 120 | F411: =IF(D411=E411,"*","") ->  | G411: 107 | I411: =IF(G411>D411,"*","") ->  | J411: =IF(AND(F411="",G411=MIN(E411,H411)),"*","") ->  | K411: =MAX(D411,G411) -> 109 | L411: =MIN(E411,H411) -> 120 | M411: =IF(K411=L411,"*","") -> 
A412: 90 | B412: 41 | C412: 10 | D412: 141 | E412: 152 | F412: =IF(D412=E412,"*","") ->  | G412: 142 | I412: =IF(G412>D412,"*","") -> * | J412: =IF(AND(F412="",G412=MIN(E412,H412)),"*","") ->  | K412: =MAX(D412,G412) -> 142 | L412: =MIN(E412,H412) -> 152 | M412: =IF(K412=L412,"*","") -> 
A413: 90 | B413: 42 | C413: 1 | D413: 106 | E413: 106 | F413: =IF(D413=E413,"*","") -> * | G413: 106 | H413: 106 | I413: =IF(G413>D413,"*","") ->  | J413: =IF(AND(F413="",G413=MIN(E413,H413)),"*","") ->  | K413: =MAX(D413,G413) -> 106 | L413: =MIN(E413,H413) -> 106 | M413: =IF(K413=L413,"*","") -> *
A414: 90 | B414: 42 | C414: 2 | D414: 97 | E414: 102 | F414: =IF(D414=E414,"*","") ->  | G414: 100 | I414: =IF(G414>D414,"*","") -> * | J414: =IF(AND(F414="",G414=MIN(E414,H414)),"*","") ->  | K414: =MAX(D414,G414) -> 100 | L414: =MIN(E414,H414) -> 102 | M414: =IF(K414=L414,"*","") -> 
A415: 90 | B415: 42 | C415: 3 | D415: 94 | E415: 94 | F415: =IF(D415=E415,"*","") -> * | G415: 94 | I415: =IF(G415>D415,"*","") ->  | J415: =IF(AND(F415="",G415=MIN(E415,H415)),"*","") ->  | K415: =MAX(D415,G415) -> 94 | L415: =MIN(E415,H415) -> 94 | M415: =IF(K415=L415,"*","") -> *
A416: 90 | B416: 42 | C416: 4 | D416: 102 | E416: 102 | F416: =IF(D416=E416,"*","") -> * | G416: 102 | H416: 102 | I416: =IF(G416>D416,"*","") ->  | J416: =IF(AND(F416="",G416=MIN(E416,H416)),"*","") ->  | K416: =MAX(D416,G416) -> 102 | L416: =MIN(E416,H416) -> 102 | M416: =IF(K416=L416,"*","") -> *
A417: 90 | B417: 42 | C417: 5 | D417: 105 | E417: 105 | F417: =IF(D417=E417,"*","") -> * | G417: 105 | H417: 105 | I417: =IF(G417>D417,"*","") ->  | J417: =IF(AND(F417="",G417=MIN(E417,H417)),"*","") ->  | K417: =MAX(D417,G417) -> 105 | L417: =MIN(E417,H417) -> 105 | M417: =IF(K417=L417,"*","") -> *
A418: 90 | B418: 42 | C418: 6 | D418: 89 | E418: 89 | F418: =IF(D418=E418,"*","") -> * | G418: 89 | H418: 89 | I418: =IF(G418>D418,"*","") ->  | J418: =IF(AND(F418="",G418=MIN(E418,H418)),"*","") ->  | K418: =MAX(D418,G418) -> 89 | L418: =MIN(E418,H418) -> 89 | M418: =IF(K418=L418,"*","") -> *
A419: 90 | B419: 42 | C419: 7 | D419: 83 | E419: 87 | F419: =IF(D419=E419,"*","") ->  | G419: 85 | I419: =IF(G419>D419,"*","") -> * | J419: =IF(AND(F419="",G419=MIN(E419,H419)),"*","") ->  | K419: =MAX(D419,G419) -> 85 | L419: =MIN(E419,H419) -> 87 | M419: =IF(K419=L419,"*","") -> 
A420: 90 | B420: 42 | C420: 8 | D420: 105 | E420: 105 | F420: =IF(D420=E420,"*","") -> * | G420: 105 | I420: =IF(G420>D420,"*","") ->  | J420: =IF(AND(F420="",G420=MIN(E420,H420)),"*","") ->  | K420: =MAX(D420,G420) -> 105 | L420: =MIN(E420,H420) -> 105 | M420: =IF(K420=L420,"*","") -> *
A421: 90 | B421: 42 | C421: 9 | D421: 82 | E421: 83 | F421: =IF(D421=E421,"*","") ->  | G421: 83 | I421: =IF(G421>D421,"*","") -> * | J421: =IF(AND(F421="",G421=MIN(E421,H421)),"*","") -> * | K421: =MAX(D421,G421) -> 83 | L421: =MIN(E421,H421) -> 83 | M421: =IF(K421=L421,"*","") -> *
A422: 90 | B422: 42 | C422: 10 | D422: 86 | E422: 90 | F422: =IF(D422=E422,"*","") ->  | G422: 88 | I422: =IF(G422>D422,"*","") -> * | J422: =IF(AND(F422="",G422=MIN(E422,H422)),"*","") ->  | K422: =MAX(D422,G422) -> 88 | L422: =MIN(E422,H422) -> 90 | M422: =IF(K422=L422,"*","") -> 
A423: 90 | B423: 43 | C423: 1 | D423: 99 | E423: 99 | F423: =IF(D423=E423,"*","") -> * | G423: 99 | H423: 99 | I423: =IF(G423>D423,"*","") ->  | J423: =IF(AND(F423="",G423=MIN(E423,H423)),"*","") ->  | K423: =MAX(D423,G423) -> 99 | L423: =MIN(E423,H423) -> 99 | M423: =IF(K423=L423,"*","") -> *
A424: 90 | B424: 43 | C424: 2 | D424: 91 | E424: 91 | F424: =IF(D424=E424,"*","") -> * | G424: 91 | H424: 91 | I424: =IF(G424>D424,"*","") ->  | J424: =IF(AND(F424="",G424=MIN(E424,H424)),"*","") ->  | K424: =MAX(D424,G424) -> 91 | L424: =MIN(E424,H424) -> 91 | M424: =IF(K424=L424,"*","") -> *
A425: 90 | B425: 43 | C425: 3 | D425: 102 | E425: 102 | F425: =IF(D425=E425,"*","") -> * | G425: 102 | I425: =IF(G425>D425,"*","") ->  | J425: =IF(AND(F425="",G425=MIN(E425,H425)),"*","") ->  | K425: =MAX(D425,G425) -> 102 | L425: =MIN(E425,H425) -> 102 | M425: =IF(K425=L425,"*","") -> *
A426: 90 | B426: 43 | C426: 4 | D426: 94 | E426: 94 | F426: =IF(D426=E426,"*","") -> * | G426: 94 | H426: 94 | I426: =IF(G426>D426,"*","") ->  | J426: =IF(AND(F426="",G426=MIN(E426,H426)),"*","") ->  | K426: =MAX(D426,G426) -> 94 | L426: =MIN(E426,H426) -> 94 | M426: =IF(K426=L426,"*","") -> *
A427: 90 | B427: 43 | C427: 5 | D427: 98 | E427: 98 | F427: =IF(D427=E427,"*","") -> * | G427: 98 | I427: =IF(G427>D427,"*","") ->  | J427: =IF(AND(F427="",G427=MIN(E427,H427)),"*","") ->  | K427: =MAX(D427,G427) -> 98 | L427: =MIN(E427,H427) -> 98 | M427: =IF(K427=L427,"*","") -> *
A428: 90 | B428: 43 | C428: 6 | D428: 114 | E428: 114 | F428: =IF(D428=E428,"*","") -> * | G428: 114 | H428: 114 | I428: =IF(G428>D428,"*","") ->  | J428: =IF(AND(F428="",G428=MIN(E428,H428)),"*","") ->  | K428: =MAX(D428,G428) -> 114 | L428: =MIN(E428,H428) -> 114 | M428: =IF(K428=L428,"*","") -> *
A429: 90 | B429: 43 | C429: 7 | D429: 88 | E429: 88 | F429: =IF(D429=E429,"*","") -> * | G429: 88 | H429: 88 | I429: =IF(G429>D429,"*","") ->  | J429: =IF(AND(F429="",G429=MIN(E429,H429)),"*","") ->  | K429: =MAX(D429,G429) -> 88 | L429: =MIN(E429,H429) -> 88 | M429: =IF(K429=L429,"*","") -> *
A430: 90 | B430: 43 | C430: 8 | D430: 100 | E430: 100 | F430: =IF(D430=E430,"*","") -> * | G430: 100 | H430: 100 | I430: =IF(G430>D430,"*","") ->  | J430: =IF(AND(F430="",G430=MIN(E430,H430)),"*","") ->  | K430: =MAX(D430,G430) -> 100 | L430: =MIN(E430,H430) -> 100 | M430: =IF(K430=L430,"*","") -> *
A431: 90 | B431: 43 | C431: 9 | D431: 88 | E431: 88 | F431: =IF(D431=E431,"*","") -> * | G431: 88 | H431: 88 | I431: =IF(G431>D431,"*","") ->  | J431: =IF(AND(F431="",G431=MIN(E431,H431)),"*","") ->  | K431: =MAX(D431,G431) -> 88 | L431: =MIN(E431,H431) -> 88 | M431: =IF(K431=L431,"*","") -> *
A432: 90 | B432: 43 | C432: 10 | D432: 92 | E432: 92 | F432: =IF(D432=E432,"*","") -> * | G432: 92 | H432: 92 | I432: =IF(G432>D432,"*","") ->  | J432: =IF(AND(F432="",G432=MIN(E432,H432)),"*","") ->  | K432: =MAX(D432,G432) -> 92 | L432: =MIN(E432,H432) -> 92 | M432: =IF(K432=L432,"*","") -> *
A433: 90 | B433: 44 | C433: 1 | D433: 100 | E433: 100 | F433: =IF(D433=E433,"*","") -> * | G433: 100 | I433: =IF(G433>D433,"*","") ->  | J433: =IF(AND(F433="",G433=MIN(E433,H433)),"*","") ->  | K433: =MAX(D433,G433) -> 100 | L433: =MIN(E433,H433) -> 100 | M433: =IF(K433=L433,"*","") -> *
A434: 90 | B434: 44 | C434: 2 | D434: 92 | E434: 92 | F434: =IF(D434=E434,"*","") -> * | G434: 92 | H434: 92 | I434: =IF(G434>D434,"*","") ->  | J434: =IF(AND(F434="",G434=MIN(E434,H434)),"*","") ->  | K434: =MAX(D434,G434) -> 92 | L434: =MIN(E434,H434) -> 92 | M434: =IF(K434=L434,"*","") -> *
A435: 90 | B435: 44 | C435: 3 | D435: 110 | E435: 110 | F435: =IF(D435=E435,"*","") -> * | G435: 110 | I435: =IF(G435>D435,"*","") ->  | J435: =IF(AND(F435="",G435=MIN(E435,H435)),"*","") ->  | K435: =MAX(D435,G435) -> 110 | L435: =MIN(E435,H435) -> 110 | M435: =IF(K435=L435,"*","") -> *
A436: 90 | B436: 44 | C436: 4 | D436: 89 | E436: 89 | F436: =IF(D436=E436,"*","") -> * | G436: 89 | I436: =IF(G436>D436,"*","") ->  | J436: =IF(AND(F436="",G436=MIN(E436,H436)),"*","") ->  | K436: =MAX(D436,G436) -> 89 | L436: =MIN(E436,H436) -> 89 | M436: =IF(K436=L436,"*","") -> *
A437: 90 | B437: 44 | C437: 5 | D437: 84 | E437: 84 | F437: =IF(D437=E437,"*","") -> * | G437: 84 | I437: =IF(G437>D437,"*","") ->  | J437: =IF(AND(F437="",G437=MIN(E437,H437)),"*","") ->  | K437: =MAX(D437,G437) -> 84 | L437: =MIN(E437,H437) -> 84 | M437: =IF(K437=L437,"*","") -> *
A438: 90 | B438: 44 | C438: 6 | D438: 96 | E438: 96 | F438: =IF(D438=E438,"*","") -> * | G438: 96 | I438: =IF(G438>D438,"*","") ->  | J438: =IF(AND(F438="",G438=MIN(E438,H438)),"*","") ->  | K438: =MAX(D438,G438) -> 96 | L438: =MIN(E438,H438) -> 96 | M438: =IF(K438=L438,"*","") -> *
A439: 90 | B439: 44 | C439: 7 | D439: 93 | E439: 93 | F439: =IF(D439=E439,"*","") -> * | G439: 93 | I439: =IF(G439>D439,"*","") ->  | J439: =IF(AND(F439="",G439=MIN(E439,H439)),"*","") ->  | K439: =MAX(D439,G439) -> 93 | L439: =MIN(E439,H439) -> 93 | M439: =IF(K439=L439,"*","") -> *
A440: 90 | B440: 44 | C440: 8 | D440: 99 | E440: 99 | F440: =IF(D440=E440,"*","") -> * | G440: 99 | I440: =IF(G440>D440,"*","") ->  | J440: =IF(AND(F440="",G440=MIN(E440,H440)),"*","") ->  | K440: =MAX(D440,G440) -> 99 | L440: =MIN(E440,H440) -> 99 | M440: =IF(K440=L440,"*","") -> *
A441: 90 | B441: 44 | C441: 9 | D441: 96 | E441: 96 | F441: =IF(D441=E441,"*","") -> * | G441: 96 | I441: =IF(G441>D441,"*","") ->  | J441: =IF(AND(F441="",G441=MIN(E441,H441)),"*","") ->  | K441: =MAX(D441,G441) -> 96 | L441: =MIN(E441,H441) -> 96 | M441: =IF(K441=L441,"*","") -> *
A442: 90 | B442: 44 | C442: 10 | D442: 86 | E442: 86 | F442: =IF(D442=E442,"*","") -> * | G442: 86 | I442: =IF(G442>D442,"*","") ->  | J442: =IF(AND(F442="",G442=MIN(E442,H442)),"*","") ->  | K442: =MAX(D442,G442) -> 86 | L442: =MIN(E442,H442) -> 86 | M442: =IF(K442=L442,"*","") -> *
A443: 90 | B443: 45 | C443: 1 | D443: 142 | E443: 148 | F443: =IF(D443=E443,"*","") ->  | G443: 142 | I443: =IF(G443>D443,"*","") ->  | J443: =IF(AND(F443="",G443=MIN(E443,H443)),"*","") ->  | K443: =MAX(D443,G443) -> 142 | L443: =MIN(E443,H443) -> 148 | M443: =IF(K443=L443,"*","") -> 
A444: 90 | B444: 45 | C444: 2 | D444: 136 | E444: 149 | F444: =IF(D444=E444,"*","") ->  | G444: 135 | I444: =IF(G444>D444,"*","") ->  | J444: =IF(AND(F444="",G444=MIN(E444,H444)),"*","") ->  | K444: =MAX(D444,G444) -> 136 | L444: =MIN(E444,H444) -> 149 | M444: =IF(K444=L444,"*","") -> 
A445: 90 | B445: 45 | C445: 3 | D445: 143 | E445: 155 | F445: =IF(D445=E445,"*","") ->  | G445: 138 | I445: =IF(G445>D445,"*","") ->  | J445: =IF(AND(F445="",G445=MIN(E445,H445)),"*","") ->  | K445: =MAX(D445,G445) -> 143 | L445: =MIN(E445,H445) -> 155 | M445: =IF(K445=L445,"*","") -> 
A446: 90 | B446: 45 | C446: 4 | D446: 125 | E446: 136 | F446: =IF(D446=E446,"*","") ->  | G446: 122 | I446: =IF(G446>D446,"*","") ->  | J446: =IF(AND(F446="",G446=MIN(E446,H446)),"*","") ->  | K446: =MAX(D446,G446) -> 125 | L446: =MIN(E446,H446) -> 136 | M446: =IF(K446=L446,"*","") -> 
A447: 90 | B447: 45 | C447: 5 | D447: 162 | E447: 174 | F447: =IF(D447=E447,"*","") ->  | G447: 162 | I447: =IF(G447>D447,"*","") ->  | J447: =IF(AND(F447="",G447=MIN(E447,H447)),"*","") ->  | K447: =MAX(D447,G447) -> 162 | L447: =MIN(E447,H447) -> 174 | M447: =IF(K447=L447,"*","") -> 
A448: 90 | B448: 45 | C448: 6 | D448: 162 | E448: 177 | F448: =IF(D448=E448,"*","") ->  | G448: 157 | I448: =IF(G448>D448,"*","") ->  | J448: =IF(AND(F448="",G448=MIN(E448,H448)),"*","") ->  | K448: =MAX(D448,G448) -> 162 | L448: =MIN(E448,H448) -> 177 | M448: =IF(K448=L448,"*","") -> 
A449: 90 | B449: 45 | C449: 7 | D449: 127 | E449: 137 | F449: =IF(D449=E449,"*","") ->  | G449: 127 | I449: =IF(G449>D449,"*","") ->  | J449: =IF(AND(F449="",G449=MIN(E449,H449)),"*","") ->  | K449: =MAX(D449,G449) -> 127 | L449: =MIN(E449,H449) -> 137 | M449: =IF(K449=L449,"*","") -> 
A450: 90 | B450: 45 | C450: 8 | D450: 149 | E450: 161 | F450: =IF(D450=E450,"*","") ->  | G450: 146 | I450: =IF(G450>D450,"*","") ->  | J450: =IF(AND(F450="",G450=MIN(E450,H450)),"*","") ->  | K450: =MAX(D450,G450) -> 149 | L450: =MIN(E450,H450) -> 161 | M450: =IF(K450=L450,"*","") -> 
A451: 90 | B451: 45 | C451: 9 | D451: 144 | E451: 159 | F451: =IF(D451=E451,"*","") ->  | G451: 140 | I451: =IF(G451>D451,"*","") ->  | J451: =IF(AND(F451="",G451=MIN(E451,H451)),"*","") ->  | K451: =MAX(D451,G451) -> 144 | L451: =MIN(E451,H451) -> 159 | M451: =IF(K451=L451,"*","") -> 
A452: 90 | B452: 45 | C452: 10 | D452: 154 | E452: 165 | F452: =IF(D452=E452,"*","") ->  | G452: 154 | I452: =IF(G452>D452,"*","") ->  | J452: =IF(AND(F452="",G452=MIN(E452,H452)),"*","") ->  | K452: =MAX(D452,G452) -> 154 | L452: =MIN(E452,H452) -> 165 | M452: =IF(K452=L452,"*","") -> 
A453: 90 | B453: 46 | C453: 1 | D453: 103 | E453: 104 | F453: =IF(D453=E453,"*","") ->  | G453: 104 | I453: =IF(G453>D453,"*","") -> * | J453: =IF(AND(F453="",G453=MIN(E453,H453)),"*","") -> * | K453: =MAX(D453,G453) -> 104 | L453: =MIN(E453,H453) -> 104 | M453: =IF(K453=L453,"*","") -> *
A454: 90 | B454: 46 | C454: 2 | D454: 98 | E454: 98 | F454: =IF(D454=E454,"*","") -> * | G454: 98 | H454: 98 | I454: =IF(G454>D454,"*","") ->  | J454: =IF(AND(F454="",G454=MIN(E454,H454)),"*","") ->  | K454: =MAX(D454,G454) -> 98 | L454: =MIN(E454,H454) -> 98 | M454: =IF(K454=L454,"*","") -> *
A455: 90 | B455: 46 | C455: 3 | D455: 112 | E455: 113 | F455: =IF(D455=E455,"*","") ->  | G455: 113 | H455: 113 | I455: =IF(G455>D455,"*","") -> * | J455: =IF(AND(F455="",G455=MIN(E455,H455)),"*","") -> * | K455: =MAX(D455,G455) -> 113 | L455: =MIN(E455,H455) -> 113 | M455: =IF(K455=L455,"*","") -> *
A456: 90 | B456: 46 | C456: 4 | D456: 90 | E456: 93 | F456: =IF(D456=E456,"*","") ->  | G456: 90 | I456: =IF(G456>D456,"*","") ->  | J456: =IF(AND(F456="",G456=MIN(E456,H456)),"*","") ->  | K456: =MAX(D456,G456) -> 90 | L456: =MIN(E456,H456) -> 93 | M456: =IF(K456=L456,"*","") -> 
A457: 90 | B457: 46 | C457: 5 | D457: 91 | E457: 91 | F457: =IF(D457=E457,"*","") -> * | G457: 91 | I457: =IF(G457>D457,"*","") ->  | J457: =IF(AND(F457="",G457=MIN(E457,H457)),"*","") ->  | K457: =MAX(D457,G457) -> 91 | L457: =MIN(E457,H457) -> 91 | M457: =IF(K457=L457,"*","") -> *
A458: 90 | B458: 46 | C458: 6 | D458: 83 | E458: 83 | F458: =IF(D458=E458,"*","") -> * | G458: 83 | I458: =IF(G458>D458,"*","") ->  | J458: =IF(AND(F458="",G458=MIN(E458,H458)),"*","") ->  | K458: =MAX(D458,G458) -> 83 | L458: =MIN(E458,H458) -> 83 | M458: =IF(K458=L458,"*","") -> *
A459: 90 | B459: 46 | C459: 7 | D459: 89 | E459: 89 | F459: =IF(D459=E459,"*","") -> * | G459: 89 | I459: =IF(G459>D459,"*","") ->  | J459: =IF(AND(F459="",G459=MIN(E459,H459)),"*","") ->  | K459: =MAX(D459,G459) -> 89 | L459: =MIN(E459,H459) -> 89 | M459: =IF(K459=L459,"*","") -> *
A460: 90 | B460: 46 | C460: 8 | D460: 93 | E460: 97 | F460: =IF(D460=E460,"*","") ->  | G460: 93 | I460: =IF(G460>D460,"*","") ->  | J460: =IF(AND(F460="",G460=MIN(E460,H460)),"*","") ->  | K460: =MAX(D460,G460) -> 93 | L460: =MIN(E460,H460) -> 97 | M460: =IF(K460=L460,"*","") -> 
A461: 90 | B461: 46 | C461: 9 | D461: 85 | E461: 89 | F461: =IF(D461=E461,"*","") ->  | G461: 85 | I461: =IF(G461>D461,"*","") ->  | J461: =IF(AND(F461="",G461=MIN(E461,H461)),"*","") ->  | K461: =MAX(D461,G461) -> 85 | L461: =MIN(E461,H461) -> 89 | M461: =IF(K461=L461,"*","") -> 
A462: 90 | B462: 46 | C462: 10 | D462: 114 | E462: 114 | F462: =IF(D462=E462,"*","") -> * | G462: 114 | H462: 114 | I462: =IF(G462>D462,"*","") ->  | J462: =IF(AND(F462="",G462=MIN(E462,H462)),"*","") ->  | K462: =MAX(D462,G462) -> 114 | L462: =MIN(E462,H462) -> 114 | M462: =IF(K462=L462,"*","") -> *
A463: 90 | B463: 47 | C463: 1 | D463: 82 | E463: 82 | F463: =IF(D463=E463,"*","") -> * | G463: 82 | I463: =IF(G463>D463,"*","") ->  | J463: =IF(AND(F463="",G463=MIN(E463,H463)),"*","") ->  | K463: =MAX(D463,G463) -> 82 | L463: =MIN(E463,H463) -> 82 | M463: =IF(K463=L463,"*","") -> *
A464: 90 | B464: 47 | C464: 2 | D464: 90 | E464: 90 | F464: =IF(D464=E464,"*","") -> * | G464: 90 | I464: =IF(G464>D464,"*","") ->  | J464: =IF(AND(F464="",G464=MIN(E464,H464)),"*","") ->  | K464: =MAX(D464,G464) -> 90 | L464: =MIN(E464,H464) -> 90 | M464: =IF(K464=L464,"*","") -> *
A465: 90 | B465: 47 | C465: 3 | D465: 102 | E465: 102 | F465: =IF(D465=E465,"*","") -> * | G465: 102 | I465: =IF(G465>D465,"*","") ->  | J465: =IF(AND(F465="",G465=MIN(E465,H465)),"*","") ->  | K465: =MAX(D465,G465) -> 102 | L465: =MIN(E465,H465) -> 102 | M465: =IF(K465=L465,"*","") -> *
A466: 90 | B466: 47 | C466: 4 | D466: 93 | E466: 93 | F466: =IF(D466=E466,"*","") -> * | G466: 93 | I466: =IF(G466>D466,"*","") ->  | J466: =IF(AND(F466="",G466=MIN(E466,H466)),"*","") ->  | K466: =MAX(D466,G466) -> 93 | L466: =MIN(E466,H466) -> 93 | M466: =IF(K466=L466,"*","") -> *
A467: 90 | B467: 47 | C467: 5 | D467: 93 | E467: 93 | F467: =IF(D467=E467,"*","") -> * | G467: 93 | I467: =IF(G467>D467,"*","") ->  | J467: =IF(AND(F467="",G467=MIN(E467,H467)),"*","") ->  | K467: =MAX(D467,G467) -> 93 | L467: =MIN(E467,H467) -> 93 | M467: =IF(K467=L467,"*","") -> *
A468: 90 | B468: 47 | C468: 6 | D468: 98 | E468: 98 | F468: =IF(D468=E468,"*","") -> * | G468: 98 | I468: =IF(G468>D468,"*","") ->  | J468: =IF(AND(F468="",G468=MIN(E468,H468)),"*","") ->  | K468: =MAX(D468,G468) -> 98 | L468: =MIN(E468,H468) -> 98 | M468: =IF(K468=L468,"*","") -> *
A469: 90 | B469: 47 | C469: 7 | D469: 94 | E469: 94 | F469: =IF(D469=E469,"*","") -> * | G469: 94 | I469: =IF(G469>D469,"*","") ->  | J469: =IF(AND(F469="",G469=MIN(E469,H469)),"*","") ->  | K469: =MAX(D469,G469) -> 94 | L469: =MIN(E469,H469) -> 94 | M469: =IF(K469=L469,"*","") -> *
A470: 90 | B470: 47 | C470: 8 | D470: 98 | E470: 98 | F470: =IF(D470=E470,"*","") -> * | G470: 98 | I470: =IF(G470>D470,"*","") ->  | J470: =IF(AND(F470="",G470=MIN(E470,H470)),"*","") ->  | K470: =MAX(D470,G470) -> 98 | L470: =MIN(E470,H470) -> 98 | M470: =IF(K470=L470,"*","") -> *
A471: 90 | B471: 47 | C471: 9 | D471: 86 | E471: 86 | F471: =IF(D471=E471,"*","") -> * | G471: 86 | I471: =IF(G471>D471,"*","") ->  | J471: =IF(AND(F471="",G471=MIN(E471,H471)),"*","") ->  | K471: =MAX(D471,G471) -> 86 | L471: =MIN(E471,H471) -> 86 | M471: =IF(K471=L471,"*","") -> *
A472: 90 | B472: 47 | C472: 10 | D472: 65 | E472: 65 | F472: =IF(D472=E472,"*","") -> * | G472: 65 | I472: =IF(G472>D472,"*","") ->  | J472: =IF(AND(F472="",G472=MIN(E472,H472)),"*","") ->  | K472: =MAX(D472,G472) -> 65 | L472: =MIN(E472,H472) -> 65 | M472: =IF(K472=L472,"*","") -> *
A473: 90 | B473: 48 | C473: 1 | D473: 83 | E473: 83 | F473: =IF(D473=E473,"*","") -> * | G473: 83 | I473: =IF(G473>D473,"*","") ->  | J473: =IF(AND(F473="",G473=MIN(E473,H473)),"*","") ->  | K473: =MAX(D473,G473) -> 83 | L473: =MIN(E473,H473) -> 83 | M473: =IF(K473=L473,"*","") -> *
A474: 90 | B474: 48 | C474: 2 | D474: 89 | E474: 89 | F474: =IF(D474=E474,"*","") -> * | G474: 89 | I474: =IF(G474>D474,"*","") ->  | J474: =IF(AND(F474="",G474=MIN(E474,H474)),"*","") ->  | K474: =MAX(D474,G474) -> 89 | L474: =MIN(E474,H474) -> 89 | M474: =IF(K474=L474,"*","") -> *
A475: 90 | B475: 48 | C475: 3 | D475: 86 | E475: 86 | F475: =IF(D475=E475,"*","") -> * | G475: 86 | I475: =IF(G475>D475,"*","") ->  | J475: =IF(AND(F475="",G475=MIN(E475,H475)),"*","") ->  | K475: =MAX(D475,G475) -> 86 | L475: =MIN(E475,H475) -> 86 | M475: =IF(K475=L475,"*","") -> *
A476: 90 | B476: 48 | C476: 4 | D476: 91 | E476: 91 | F476: =IF(D476=E476,"*","") -> * | G476: 91 | I476: =IF(G476>D476,"*","") ->  | J476: =IF(AND(F476="",G476=MIN(E476,H476)),"*","") ->  | K476: =MAX(D476,G476) -> 91 | L476: =MIN(E476,H476) -> 91 | M476: =IF(K476=L476,"*","") -> *
A477: 90 | B477: 48 | C477: 5 | D477: 75 | E477: 75 | F477: =IF(D477=E477,"*","") -> * | G477: 75 | I477: =IF(G477>D477,"*","") ->  | J477: =IF(AND(F477="",G477=MIN(E477,H477)),"*","") ->  | K477: =MAX(D477,G477) -> 75 | L477: =MIN(E477,H477) -> 75 | M477: =IF(K477=L477,"*","") -> *
A478: 90 | B478: 48 | C478: 6 | D478: 114 | E478: 114 | F478: =IF(D478=E478,"*","") -> * | G478: 114 | I478: =IF(G478>D478,"*","") ->  | J478: =IF(AND(F478="",G478=MIN(E478,H478)),"*","") ->  | K478: =MAX(D478,G478) -> 114 | L478: =MIN(E478,H478) -> 114 | M478: =IF(K478=L478,"*","") -> *
A479: 90 | B479: 48 | C479: 7 | D479: 103 | E479: 103 | F479: =IF(D479=E479,"*","") -> * | G479: 103 | I479: =IF(G479>D479,"*","") ->  | J479: =IF(AND(F479="",G479=MIN(E479,H479)),"*","") ->  | K479: =MAX(D479,G479) -> 103 | L479: =MIN(E479,H479) -> 103 | M479: =IF(K479=L479,"*","") -> *
A480: 90 | B480: 48 | C480: 8 | D480: 74 | E480: 74 | F480: =IF(D480=E480,"*","") -> * | G480: 74 | I480: =IF(G480>D480,"*","") ->  | J480: =IF(AND(F480="",G480=MIN(E480,H480)),"*","") ->  | K480: =MAX(D480,G480) -> 74 | L480: =MIN(E480,H480) -> 74 | M480: =IF(K480=L480,"*","") -> *
A481: 90 | B481: 48 | C481: 9 | D481: 89 | E481: 89 | F481: =IF(D481=E481,"*","") -> * | G481: 89 | I481: =IF(G481>D481,"*","") ->  | J481: =IF(AND(F481="",G481=MIN(E481,H481)),"*","") ->  | K481: =MAX(D481,G481) -> 89 | L481: =MIN(E481,H481) -> 89 | M481: =IF(K481=L481,"*","") -> *
A482: 90 | B482: 48 | C482: 10 | D482: 93 | E482: 93 | F482: =IF(D482=E482,"*","") -> * | G482: 93 | I482: =IF(G482>D482,"*","") ->  | J482: =IF(AND(F482="",G482=MIN(E482,H482)),"*","") ->  | K482: =MAX(D482,G482) -> 93 | L482: =MIN(E482,H482) -> 93 | M482: =IF(K482=L482,"*","") -> *